statement ok
create table OrderConnectorMetrics (
  toplevelorderid bigint not null,
  businessdate date,
  connector varchar(256),
  filledValue real,
  filledQty real,
  numberOfFills int,
  chargeUsd real,
  unique (toplevelorderid, connector)
)

statement ok
insert into OrderConnectorMetrics values (5508, '2013-02-01', 'C1', 3000000, 3000000, 4, null)

statement ok
insert into OrderConnectorMetrics values (5508, '2013-02-01', 'C2', 2000000, 2000000, 2, null)

statement ok
create table t2 as select * from orderconnectormetrics where
toplevelorderid = 5508 with data

query ITTTTIT rowsort
select * from t2
----
5508
2013-02-01
C1
3000000.0
3000000.0
4
NULL
5508
2013-02-01
C2
2000000.0
2000000.0
2
NULL

query III rowsort
select toplevelorderid, count(*), cast( sum(numberoffills) as bigint) from t2 group by toplevelorderid
----
5508
2
6

query III rowsort
select toplevelorderid, count(*), cast( sum(numberoffills) as bigint) from t2 where
toplevelorderid = 5508 group by toplevelorderid
----
5508
2
6

query III rowsort
select toplevelorderid, count(*), cast( sum(numberoffills) as bigint) from t2 group by toplevelorderid
----
5508
2
6

query III rowsort
select toplevelorderid, count(*), cast( sum(numberoffills) as bigint) from t2 where
toplevelorderid = 5508 group by toplevelorderid
----
5508
2
6

query III rowsort
select toplevelorderid, count(*), cast( sum(numberoffills) as bigint) from
orderconnectormetrics where toplevelorderid = 5508 group by toplevelorderid
----
5508
2
6

statement ok
delete from t2

statement ok
insert into t2 select * from orderconnectormetrics where toplevelorderid = 5508

statement ok
insert into t2 values (5508, '2013-02-01', 'C1', 3000000, 3000000, 4, null)

statement ok
insert into t2 values (5508, '2013-02-01', 'C2', 2000000, 2000000, 2, null)

query III rowsort
select toplevelorderid, count(*), cast( sum(numberoffills) as bigint) from t2 where
toplevelorderid = 5508 group by toplevelorderid
----
5508
4
12

statement ok
drop table t2

statement ok
drop table OrderConnectorMetrics

