statement ok
start transaction

statement ok
create temp table foo (f1 string, f2 text, f3 varchar(12345678))

statement ok
insert into foo values('aa1','bb1','cc1')

query TTT rowsort
select * from foo
----
aa1
bb1
cc1

statement ok
insert into foo values('aa2','bb2','cc2')

query TTT rowsort
select * from foo
----
aa1
bb1
cc1
aa2
bb2
cc2

statement ok
insert into foo values('aa3','bb3','cc3')

query TTT rowsort
select * from foo
----
aa1
bb1
cc1
aa2
bb2
cc2
aa3
bb3
cc3

statement ok
update foo set f1 = 'abc'

query TTT rowsort
select * from foo
----
abc
bb1
cc1
abc
bb2
cc2
abc
bb3
cc3

statement ok
delete from foo where f2 = 'bb2'

query TTT rowsort
select * from foo
----
abc
bb1
cc1
abc
bb3
cc3

statement ok
insert into foo values('aa4','bb4','cc4')

query TTT rowsort
select * from foo
----
aa4
bb4
cc4
abc
bb1
cc1
abc
bb3
cc3

statement ok
drop table foo

statement ok
commit

