statement ok
create table t3446(a int)

statement ok
insert into t3446 values (1),(3),(2),(3),(3),(3)

query I rowsort
select * from t3446
----
1
2
3
3
3
3

statement ok
delete from t3446 where a = 3

query I rowsort
select * from t3446
----
1
2

statement ok
alter table t3446 set read only

query I rowsort
select * from t3446
----
1
2

statement ok
alter table t3446 set read write

query I rowsort
select * from t3446
----
1
2

statement ok
drop table t3446

