statement ok
create table sys.t7282 ("nr" INTEGER  PRIMARY KEY, "val1" INTEGER)

statement ok rowcount 3
insert into sys.t7282 values (1, 23), (2, 45), (3, 67)

query II nosort
select * from sys.t7282
----
1
23
2
45
3
67

statement ok
create schema test

statement ok
create table test.t7282 ("mk" VARCHAR(3) PRIMARY KEY, "val2" INTEGER)

statement ok rowcount 2
insert into test.t7282 values ('a', 23), ('b', 45)

query TI nosort
select * from test.t7282
----
a
23
b
45

statement ok
delete from dump_statements

statement ok
call sys.dump_table_data()

query IT nosort
select * from dump_statements
----
1
COPY 3 RECORDS INTO "sys"."t7282"("nr", "val1") FROM STDIN USING DELIMITERS '|',E'\n','"';
2
1|23
2
2|45
2
3|67
5
COPY 2 RECORDS INTO "test"."t7282"("mk", "val2") FROM STDIN USING DELIMITERS '|',E'\n','"';
6
"a"|23
6
"b"|45

# remove one of the tables with the same name
statement ok
drop table sys.t7282

statement ok
delete from dump_statements

statement ok
call sys.dump_table_data()

query IT nosort
select * from dump_statements
----
1
COPY 2 RECORDS INTO "test"."t7282"("mk", "val2") FROM STDIN USING DELIMITERS '|',E'\n','"';
2
"a"|23
2
"b"|45

# cleanup
statement ok
drop table test.t7282

statement ok
drop schema test

