statement ok
create table t1096337(i int)

statement ok
insert into t1096337 values(123456789)

query I rowsort
select * from t1096337
----
123456789

statement ok
delete from t1096337

query I rowsort
select * from t1096337
----

statement ok
start transaction

statement ok
create table u1096337 (id int)

statement ok
commit

statement ok
insert into u1096337 values (123456789)

query I rowsort
select * from u1096337
----
123456789

statement ok
delete from u1096337

query I rowsort
select * from u1096337
----

