statement ok
create table t_0_1(id int, name varchar(1024), age int)

statement ok
create table t_0_2(id int, age int)

statement ok
create trigger test_0 after insert on t_0_1
	insert into t_0_2 select t_0_1.id,t_0_1.age from t_0_1

statement ok
insert into t_0_1 values(1, 'mo', 25)

query ITI rowsort
select * from t_0_1
----
1
mo
25

query II rowsort
select * from t_0_2
----
1
25

statement ok
create trigger test_1 after delete on t_0_1
	insert into t_0_1 values(3, 'mo', 27)

statement ok
delete from t_0_1 where id = 1

query ITI rowsort
select * from t_0_1
----
3
mo
27

query II rowsort
select * from t_0_2
----
1
25
3
27

statement ok
create trigger test_2 after update on t_0_1
	delete from t_0_2

statement ok
create trigger test_3 after delete on t_0_2
	insert into t_0_1 values(1, 'mo', 25)

statement ok
update t_0_1 set name = 'monet' where id = 2

query ITI rowsort
select * from t_0_1
----
1
mo
25
3
mo
27

query II rowsort
select * from t_0_2
----
1
25
3
27

statement ok
drop trigger test_0

statement ok
drop trigger test_1

statement ok
drop trigger test_2

statement ok
drop trigger test_3

statement ok
drop table t_0_1

statement ok
drop table t_0_2

