statement ok
create table t_2_1 (id int, name varchar(1024))

statement ok
create table t_2_2 (id int, name varchar(1024))

statement ok
insert into t_2_1 values(10, 'monetdb')

statement ok
insert into t_2_1 values(20, 'monet')

statement ok
create trigger test_2_1
	after update on t_2_1 referencing new row as new_row
	for each row insert into t_2_2 values(0, 'update_new_row')

statement ok
create trigger test_2_2
	after update on t_2_1 referencing new row new_row
	for each row insert into t_2_2 values(1, 'update_new_row')

statement ok
create trigger test_2_3
	after update on t_2_1 referencing new as new_row
	for each row insert into t_2_2 values(2, 'update_new_row')

statement ok
create trigger test_2_4
	after update on t_2_1 referencing new new_row
	for each row insert into t_2_2 values(3, 'update_new_row')

statement ok
update t_2_1 set name = 'mo' where id = 10

query IT rowsort
select * from t_2_1
----
10
mo
20
monet

query IT rowsort
select * from t_2_2
----
0
update_new_row
1
update_new_row
2
update_new_row
3
update_new_row

statement ok
delete from t_2_1 where id > -1

statement ok
delete from t_2_2 where id > -1

statement ok
drop trigger test_2_1

statement ok
drop trigger test_2_2

statement ok
drop trigger test_2_3

statement ok
drop trigger test_2_4

statement ok
insert into t_2_1 values(10, 'monetdb')

statement ok
insert into t_2_1 values(20, 'monet')

statement ok
create trigger test_2_1
	after delete on t_2_1
	for each row insert into t_2_2 values(0, 'delete_new_row')

statement ok
create trigger test_2_2
	after delete on t_2_1
	for each row insert into t_2_2 values(1, 'delete_new_row')

statement ok
create trigger test_2_3
	after delete on t_2_1
	for each row insert into t_2_2 values(2, 'delete_new_row')

statement ok
create trigger test_2_4
	after delete on t_2_1
	for each row insert into t_2_2 values(3, 'delete_new_row')

statement ok
delete from t_2_1 where id >-1

query IT rowsort
select * from t_2_1
----

query IT rowsort
select * from t_2_2
----
0
delete_new_row
1
delete_new_row
2
delete_new_row
3
delete_new_row

statement ok
drop trigger test_2_1

statement ok
drop trigger test_2_2

statement ok
drop trigger test_2_3

statement ok
drop trigger test_2_4

statement ok
delete from t_2_2 where id >-1

statement ok
insert into t_2_1 values(10, 'monetdb')

statement ok
create trigger test_2_1
	after insert on t_2_1 referencing new row as new_row
	for each row insert into t_2_2 values(0, 'insert_new_row')

statement ok
create trigger test_2_2
	after insert on t_2_1 referencing new row new_row
	for each row insert into t_2_2 values(1, 'insert_new_row')

statement ok
create trigger test_2_3
	after insert on t_2_1 referencing new as new_row
	for each row insert into t_2_2 values(2, 'insert_new_row')

statement ok
create trigger test_2_4
	after insert on t_2_1 referencing new new_row
	for each row insert into t_2_2 values(3, 'insert_new_row')

statement ok
insert into t_2_1 values(20, 'monet')

query IT rowsort
select * from t_2_1
----
10
monetdb
20
monet

query IT rowsort
select * from t_2_2
----
0
insert_new_row
1
insert_new_row
2
insert_new_row
3
insert_new_row

statement ok
delete from t_2_1 where id >-1

statement ok
delete from t_2_2 where id >-1

statement ok
drop trigger test_2_1

statement ok
drop trigger test_2_2

statement ok
drop trigger test_2_3

statement ok
drop trigger test_2_4

statement ok
insert into t_2_1 values(10, 'monetdb')

statement ok
insert into t_2_1 values(20, 'monet')

statement ok
create trigger test_2_1
	after update on t_2_1 referencing new row as new_row new table as new_table
	for each row insert into t_2_2 values(0, 'insert_new_row_table')

statement ok
create trigger test_2_2
	after update on t_2_1 referencing new row new_row new row as new_row
	for each row insert into t_2_2 values(1, 'insert_new_new_row')

statement ok
create trigger test_2_3
	after update on t_2_1 referencing new table as new_table new table as new_table
	for each row insert into t_2_2 values(2, 'insert_new__new_table')

statement ok
create trigger test_2_4
	after update on t_2_1 referencing new row as new_row new table as new_table
	for each row insert into t_2_2 values(3, 'insert_new_row_new_table')

statement ok
create trigger test_2_5
	after update on t_2_1 referencing new table as new_table new row as new_row
	for each row insert into t_2_2 values(4, 'insert_new_table_new_row')

statement ok
update t_2_1 set name = 'mo' where id = 10

query IT rowsort
select * from t_2_1
----
10
mo
20
monet

query IT rowsort
select * from t_2_2
----
0
insert_new_row_table
1
insert_new_new_row
2
insert_new__new_table
3
insert_new_row_new_table
4
insert_new_table_new_row

statement ok
delete from t_2_1 where id >-1

statement ok
delete from t_2_2 where id >-1

statement ok
drop trigger test_2_1

statement ok
drop trigger test_2_2

statement ok
drop trigger test_2_3

statement ok
drop trigger test_2_4

statement ok
drop trigger test_2_5

statement ok
insert into t_2_1 values(10, 'monetdb')

statement ok
create trigger test_2_1
	after update on t_2_1 referencing new row as new_row new table as new_table
	for each row insert into t_2_2 values(0, 'update_new_row_new_table')

statement ok
create trigger test_2_2
	after insert on t_2_1 referencing new row new_row new row as new_row
	for each row insert into t_2_2 values(1, 'insert_new_new_row')

statement ok
create trigger test_2_3
	after delete on t_2_1
	for each row insert into t_2_2 values(2, 'delete_new_new_row')

statement ok
create trigger test_2_4
	after delete on t_2_1
	for each row insert into t_2_2 values(3, 'delete_new_row_new_table')

statement ok
create trigger test_2_5
	after insert on t_2_1 referencing new table as new_table new row as new_row
	for each row insert into t_2_2 values(4, 'insert_new_table_new_row')

statement ok
insert into t_2_1 values(20, 'monet')

query IT rowsort
select * from t_2_1
----
10
monetdb
20
monet

query IT rowsort
select * from t_2_2
----
1
insert_new_new_row
4
insert_new_table_new_row

statement ok
update t_2_1 set name = 'mo' where id = 10

query IT rowsort
select * from t_2_1
----
10
mo
20
monet

query IT rowsort
select * from t_2_2
----
0
update_new_row_new_table
1
insert_new_new_row
4
insert_new_table_new_row

statement ok
delete from t_2_1 where id >5

query IT rowsort
select * from t_2_1
----

query IT rowsort
select * from t_2_2
----
0
update_new_row_new_table
1
insert_new_new_row
2
delete_new_new_row
3
delete_new_row_new_table
4
insert_new_table_new_row

statement ok
drop trigger test_2_1

statement ok
drop trigger test_2_2

statement ok
drop trigger test_2_3

statement ok
drop trigger test_2_4

statement ok
drop trigger test_2_5

statement ok
delete from t_2_1 where id >-1

statement ok
delete from t_2_2 where id >-1

statement ok
drop table t_2_1

statement ok
drop table t_2_2

