statement ok
create table t_4_1 ("id" int, "name" varchar(1024))

statement ok
insert into t_4_1 values(10, 'monetdb')

statement ok
insert into t_4_1 values(20, 'monet')

statement ok
create trigger test_4_1
	after update on t_4_1 referencing old row as old_row
	for each statement insert into t_4_1 values(0, 'update_old_row_statement')

statement ok
create trigger test_4_2
	after update on t_4_1 referencing new row new_row
	for each statement insert into t_4_1 values(1, 'update_new_row_statement')

statement ok
create trigger test_4_3
	after update on t_4_1
	for each statement insert into t_4_1 values(2, 'update_statement')

statement ok
create trigger test_4_4
	after update on t_4_1 referencing new row as new_row
	for each row insert into t_4_1 values(3, 'update_row')

statement error
--error, id variable unknown
create trigger test_4_5
	after update on t_4_1
	for each statement
	when ("id">0) insert into t_4_1 values(4, 'update_when_statement_true')

statement ok
create trigger test_4_6
	after update on t_4_1 referencing new row as new_row
	for each row
	when (new_row."id">0) insert into t_4_1 values(5, 'update_when_row_true')

statement error
--error, id variable unknown
create trigger test_4_7
	after update on t_4_1
	for each statement
	when ("id" >1000) insert into t_4_1 values(6, 'update_when_statement_false')

statement ok
create trigger test_4_8
	after update on t_4_1 referencing new row as new_row
	for each row
	when (new_row."id">1000) insert into t_4_1 values(7, 'update_when_row_false')

statement ok
update t_4_1 set "name" = 'mo' where "id" = 10

query IT rowsort
select * from t_4_1
----
10
mo
20
monet
0
update_old_row_statement
1
update_new_row_statement
2
update_statement
3
update_row
5
update_when_row_true
7
update_when_row_false

statement ok
delete from t_4_1 where "id" >-1

statement ok
drop trigger test_4_1

statement ok
drop trigger test_4_2

statement ok
drop trigger test_4_3

statement ok
drop trigger test_4_4

statement ok
drop trigger test_4_6

statement ok
drop trigger test_4_8

statement ok
insert into t_4_1 values(10, 'monetdb')

statement ok
insert into t_4_1 values(20, 'monet')

statement ok
create trigger test_4_1
	after update on t_4_1
	BEGIN ATOMIC
		insert into t_4_1 values(1,'first_insertion');
		insert into t_4_1 values(2,'second_insertion');
	END

statement ok
create trigger test_4_2
	after update on t_4_1
	BEGIN ATOMIC
		insert into t_4_1 values(3,'third_insertion');
	END

statement ok
create trigger test_4_3
	after update on t_4_1
	BEGIN ATOMIC
		insert into t_4_1 values(4,'fourth_insertion');
		insert into t_4_1 values(5,'fifth_insertion');
	END

statement ok
update t_4_1 set "name" = 'mo' where "id" = 10

query IT rowsort
select * from t_4_1
----
1
first_insertion
10
mo
2
second_insertion
20
monet
3
third_insertion
4
fourth_insertion
5
fifth_insertion

statement ok
drop trigger test_4_1

statement ok
drop trigger test_4_2

statement ok
drop trigger test_4_3

statement ok
drop table t_4_1


