statement ok
start transaction

statement ok
create table number (value integer primary key)

statement ok
insert into number (value) select 1

query T rowsort
select 'the following query causes the message "missing head type 2: var" in the server. i don''t know if that matters.'
----
the following query causes the message "missing head type 2: var" in the server. i don't know if that matters.

statement ok
insert into number (value) select 1+value from number

statement ok
insert into number (value) select 2+value from number

statement ok
insert into number (value) select 4+value from number

statement ok
insert into number (value) select 8+value from number

statement ok
insert into number (value) select 16+value from number

statement ok
insert into number (value) select 32+value from number

statement ok
insert into number (value) select 64+value from number

statement ok
delete from number where value=1

query T rowsort
select 'the following query causes the server to crash printing "sql_optimize.mx:1011: set2pivot: Assertion `n'' failed."'
----
the following query causes the server to crash printing "sql_optimize.mx:1011: set2pivot: Assertion `n' failed."

statement ok
delete from number where exists (select true from number as factor1,number as factor2 where number.value=factor1.value*factor2.value)

query I rowsort
select count(*) from number
----
31

statement ok
drop table number

statement ok
commit

