statement ok
CREATE TABLE TABLE_A (
    COLUMN_1 INTEGER,
    COLUMN_2 INTEGER,
    COLUMN_3 INTEGER,
    COLUMN_4 INTEGER,
    COLUMN_5 INTEGER
)

statement ok
INSERT INTO TABLE_A (
    COLUMN_1,
    COLUMN_2,
    COLUMN_3,
    COLUMN_4,
    COLUMN_5 )
VALUES (
    1,
    NULL,
    NULL,
    NULL,
    NULL
)

query IIIII rowsort
SELECT * FROM TABLE_A
----
1
NULL
NULL
NULL
NULL

statement ok
UPDATE TABLE_A
  SET COLUMN_2 = 1

query IIIII rowsort
SELECT * FROM TABLE_A
----
1
1
NULL
NULL
NULL

query IIIII rowsort
SELECT *
FROM   TABLE_A
WHERE  COLUMN_2 IS NULL
----

query IIIII rowsort
SELECT *
FROM TABLE_A
WHERE COLUMN_2 IS NOT NULL
----
1
1
NULL
NULL
NULL

query IIIII rowsort
SELECT *
FROM    TABLE_A
WHERE COLUMN_2 IS NOT NULL
AND   COLUMN_3 IS NULL
----
1
1
NULL
NULL
NULL

statement ok
UPDATE TABLE_A
  SET COLUMN_3 = 1

query IIIII rowsort
SELECT *
FROM TABLE_A
----
1
1
1
NULL
NULL

query IIIII rowsort
SELECT *
FROM TABLE_A
WHERE COLUMN_2 IS NOT NULL
----
1
1
1
NULL
NULL

query IIIII rowsort
SELECT *
FROM TABLE_A
WHERE COLUMN_3 IS NOT NULL
----
1
1
1
NULL
NULL

query IIIII rowsort
SELECT *
FROM   TABLE_A
WHERE COLUMN_2 IS NOT NULL
AND   COLUMN_3 IS NOT NULL
----
1
1
1
NULL
NULL

query IIIII rowsort
SELECT *
FROM   TABLE_A
WHERE COLUMN_2 IS NOT NULL
AND   COLUMN_3 IS NOT NULL
AND   COLUMN_4 IS NULL
----
1
1
1
NULL
NULL

query IIIII rowsort
SELECT *
FROM   TABLE_A
WHERE COLUMN_2 IS NOT NULL
AND   COLUMN_4 IS NULL
AND   COLUMN_3 IS NOT NULL
----
1
1
1
NULL
NULL

statement ok
UPDATE TABLE_A
  SET COLUMN_4 = 1

query IIIII rowsort
SELECT *
FROM TABLE_A
----
1
1
1
1
NULL

query IIIII rowsort
SELECT *
FROM TABLE_A
WHERE COLUMN_2 IS NOT NULL
----
1
1
1
1
NULL

query IIIII rowsort
SELECT *
FROM TABLE_A
WHERE COLUMN_3 IS NOT NULL
----
1
1
1
1
NULL

query IIIII rowsort
SELECT *
FROM   TABLE_A
WHERE COLUMN_2 IS NOT NULL
AND   COLUMN_3 IS NOT NULL
----
1
1
1
1
NULL

query IIIII rowsort
SELECT *
FROM   TABLE_A
WHERE COLUMN_2 IS NOT NULL
AND   COLUMN_3 IS NOT NULL
AND   COLUMN_4 IS NULL
----

query IIIII rowsort
SELECT *
FROM   TABLE_A
WHERE COLUMN_2 IS NOT NULL
AND   COLUMN_4 IS NULL
AND   COLUMN_3 IS NOT NULL
----

