statement ok
START TRANSACTION

statement ok
create table click_(
		cl_time time,
		url_id integer NOT NULL,
		primary key (cl_time)
		)

statement ok
INSERT INTO click_
values ('00:02:54.458',1)

statement ok
create table statistics_(
		url_id integer ,
		hour1 integer,
		primary key (url_id)
		)

statement ok
INSERT INTO statistics_ values (1,0)

statement ok
CREATE TABLE temp_table_(
		url_id integer,
		counter1 integer
		)

statement ok
INSERT INTO temp_table_
SELECT DISTINCT url_id,0
FROM click_

statement ok
UPDATE temp_table_
SET counter1 = (SELECT count(*)
		FROM click_
		WHERE extract(hour from
			cl_time)=0
		GROUP BY
		url_id)
WHERE url_id IN (SELECT url_id FROM click_
		WHERE extract(hour from cl_time)=0
		)

query II rowsort
select * from statistics_
----
1
0

statement ok
UPDATE statistics_
SET hour1 = hour1 + (SELECT counter1 FROM temp_table_
		WHERE
		temp_table_.url_id = statistics_.url_id
		)
WHERE url_id IN (SELECT url_id FROM click_
		WHERE extract(hour from
			cl_time)=0
		)

query II rowsort
select * from statistics_
----
1
1

statement ok
drop table click_

statement ok
drop table statistics_

statement ok
drop table temp_table_

statement ok
rollback

