statement ok
create table bigtable2882 (i int)

statement ok
insert into bigtable2882 values (1)

query I rowsort
select count(*) from bigtable2882
----
1

statement ok
insert into bigtable2882 (select * from bigtable2882)

query I rowsort
select count(*) from bigtable2882
----
2

statement ok
insert into bigtable2882 (select * from bigtable2882)

query I rowsort
select count(*) from bigtable2882
----
4

statement ok
insert into bigtable2882 (select * from bigtable2882)

query I rowsort
select count(*) from bigtable2882
----
8

statement ok
insert into bigtable2882 (select * from bigtable2882)

query I rowsort
select count(*) from bigtable2882
----
16

statement ok
insert into bigtable2882 (select * from bigtable2882)

query I rowsort
select count(*) from bigtable2882
----
32

statement ok
insert into bigtable2882 (select * from bigtable2882)

query I rowsort
select count(*) from bigtable2882
----
64

statement ok
insert into bigtable2882 (select * from bigtable2882)

query I rowsort
select count(*) from bigtable2882
----
128

statement ok
insert into bigtable2882 (select * from bigtable2882)

query I rowsort
select count(*) from bigtable2882
----
256

statement ok
insert into bigtable2882 (select * from bigtable2882)

query I rowsort
select count(*) from bigtable2882
----
512

statement ok
insert into bigtable2882 (select * from bigtable2882)

query I rowsort
select count(*) from bigtable2882
----
1024

statement ok
insert into bigtable2882 (select * from bigtable2882)

query I rowsort
select count(*) from bigtable2882
----
2048

statement ok
insert into bigtable2882 (select * from bigtable2882)

query I rowsort
select count(*) from bigtable2882
----
4096

statement ok
insert into bigtable2882 (select * from bigtable2882)

query I rowsort
select count(*) from bigtable2882
----
8192

statement ok
insert into bigtable2882 (select * from bigtable2882)

query I rowsort
select count(*) from bigtable2882
----
16384

statement ok
insert into bigtable2882 (select * from bigtable2882)

query I rowsort
select count(*) from bigtable2882
----
32768

statement ok
insert into bigtable2882 (select * from bigtable2882)

query I rowsort
select count(*) from bigtable2882
----
65536

statement ok
insert into bigtable2882 (select * from bigtable2882)

query I rowsort
select count(*) from bigtable2882
----
131072

statement ok
insert into bigtable2882 (select * from bigtable2882)

query I rowsort
select count(*) from bigtable2882
----
262144

statement ok
insert into bigtable2882 (select * from bigtable2882)

query I rowsort
select count(*) from bigtable2882
----
524288

statement ok
insert into bigtable2882 (select * from bigtable2882)

query I rowsort
select count(*) from bigtable2882
----
1048576

statement ok
insert into bigtable2882 (select * from bigtable2882)

query I rowsort
select count(*) from bigtable2882
----
2097152

statement ok
insert into bigtable2882 (select * from bigtable2882)

query I rowsort
select count(*) from bigtable2882
----
4194304

statement ok
insert into bigtable2882 (select * from bigtable2882)

query I rowsort
select count(*) from bigtable2882
----
8388608

statement ok
insert into bigtable2882 (select * from bigtable2882)

query I rowsort
select count(*) from bigtable2882
----
16777216

statement ok
insert into bigtable2882 (select * from bigtable2882)

query I rowsort
select count(*) from bigtable2882
----
33554432

statement ok
create table test2882(id bigint)

statement ok
insert into test2882(id) SELECT ROW_NUMBER () OVER () FROM bigtable2882 limit 20000000

query I rowsort
select count(*) from test2882
----
20000000

query I rowsort
select * from test2882 where id = 1
----
1

query I rowsort
select * from test2882 where id = 20000000
----
20000000

query I rowsort
select * from test2882 where id in (1, 20000000)
----
1
20000000

statement ok
delete from test2882 where id = 1

statement ok
delete from test2882 where id = 20000000

query I rowsort
select count(*) from test2882
----
19999998

query I rowsort
select * from test2882 where id = 1
----

query I rowsort
select * from test2882 where id = 20000000
----

query I rowsort
select * from test2882 where id in (1, 20000000)
----

statement ok
drop table bigtable2882

statement ok
drop table test2882

