statement ok
create table f2774 (i int, f float)

statement ok
create table d2774 (i int, d double)

query IR rowsort
select * from f2774
----

query IR rowsort
select * from d2774
----

statement ok
insert into f2774 values (300,1e-300)

statement ok
insert into d2774 values (300,1e-300)

statement ok
insert into f2774 values (302,1e-302)

statement ok
insert into d2774 values (302,1e-302)

statement ok
insert into f2774 values (304,1e-304)

statement ok
insert into d2774 values (304,1e-304)

statement ok
insert into f2774 values (306,1e-306)

statement ok
insert into d2774 values (306,1e-306)

statement ok
insert into f2774 values (307,1e-307)

statement ok
insert into d2774 values (307,1e-307)

statement ok
insert into f2774 values (308,1e-308)

statement ok
insert into d2774 values (308,1e-308)

statement ok
insert into f2774 values (310,1e-310)

statement ok
insert into d2774 values (310,1e-310)

statement ok
insert into f2774 values (312,1e-312)

statement ok
insert into d2774 values (312,1e-312)

statement ok
insert into f2774 values (314,1e-314)

statement ok
insert into d2774 values (314,1e-314)

statement ok
insert into f2774 values (316,1e-316)

statement ok
insert into d2774 values (316,1e-316)

statement ok
insert into f2774 values (318,1e-318)

statement ok
insert into d2774 values (318,1e-318)

statement ok
insert into f2774 values (320,1e-320)

statement ok
insert into d2774 values (320,1e-320)

statement ok
insert into f2774 values (322,1e-322)

statement ok
insert into d2774 values (322,1e-322)

statement ok
insert into f2774 values (323,1e-323)

statement ok
insert into d2774 values (323,1e-323)

statement ok
insert into f2774 values (324,1e-324)

statement ok
insert into d2774 values (324,1e-324)

statement ok
insert into f2774 values (326,1e-326)

statement ok
insert into d2774 values (326,1e-326)

statement ok
insert into f2774 values (328,1e-328)

statement ok
insert into d2774 values (328,1e-328)

statement ok
insert into f2774 values (330,1e-330)

statement ok
insert into d2774 values (330,1e-330)

query IR rowsort
select * from f2774
----
300
0.000
302
0.000
304
0.000
306
0.000
307
0.000
308
0.000
310
0.000
312
0.000
314
0.000
316
0.000
318
0.000
320
0.000
322
0.000
323
0.000
324
0.000
326
0.000
328
0.000
330
0.000

query IR rowsort
select * from d2774
----
300
0.000
302
0.000
304
0.000
306
0.000
307
0.000
308
0.000
310
0.000
312
0.000
314
0.000
316
0.000
318
0.000
320
0.000
322
0.000
323
0.000
324
0.000
326
0.000
328
0.000
330
0.000

statement ok
delete from f2774

statement ok
delete from d2774

query IR rowsort
select * from f2774
----

query IR rowsort
select * from d2774
----

statement ok
copy 18 records into f2774 from stdin using delimiters ',',E'\n'
<COPY_INTO_DATA>
300,1e-300
302,1e-302
304,1e-304
306,1e-306
307,1e-307
308,1e-308
310,1e-310
312,1e-312
314,1e-314
316,1e-316
318,1e-318
320,1e-320
322,1e-322
323,1e-323
324,1e-324
326,1e-326
328,1e-328
330,1e-330

statement ok
copy 18 records into d2774 from stdin using delimiters ',',E'\n'
<COPY_INTO_DATA>
300,1e-300
302,1e-302
304,1e-304
306,1e-306
307,1e-307
308,1e-308
310,1e-310
312,1e-312
314,1e-314
316,1e-316
318,1e-318
320,1e-320
322,1e-322
323,1e-323
324,1e-324
326,1e-326
328,1e-328
330,1e-330

query IR rowsort
select * from f2774
----
300
0.000
302
0.000
304
0.000
306
0.000
307
0.000
308
0.000
310
0.000
312
0.000
314
0.000
316
0.000
318
0.000
320
0.000
322
0.000
323
0.000
324
0.000
326
0.000
328
0.000
330
0.000

query IR rowsort
select * from d2774
----
300
0.000
302
0.000
304
0.000
306
0.000
307
0.000
308
0.000
310
0.000
312
0.000
314
0.000
316
0.000
318
0.000
320
0.000
322
0.000
323
0.000
324
0.000
326
0.000
328
0.000
330
0.000

statement ok
delete from f2774

statement ok
delete from d2774

query IR rowsort
select * from f2774
----

query IR rowsort
select * from d2774
----

statement ok
copy 9 records into f2774 from stdin using delimiters ',',E'\n'
<COPY_INTO_DATA>
300,1e-300
302,1e-302
304,1e-304
306,1e-306
307,1e-307
324,1e-324
326,1e-326
328,1e-328
330,1e-330

statement ok
copy 9 records into d2774 from stdin using delimiters ',',E'\n'
<COPY_INTO_DATA>
300,1e-300
302,1e-302
304,1e-304
306,1e-306
307,1e-307
324,1e-324
326,1e-326
328,1e-328
330,1e-330

query IR rowsort
select * from f2774
----
300
0.000
302
0.000
304
0.000
306
0.000
307
0.000
324
0.000
326
0.000
328
0.000
330
0.000

query IR rowsort
select * from d2774
----
300
0.000
302
0.000
304
0.000
306
0.000
307
0.000
324
0.000
326
0.000
328
0.000
330
0.000

statement ok
drop table f2774

statement ok
drop table d2774

