statement ok
CREATE TABLE A
(a varchar(10),
b varchar(10))

statement ok
CREATE TABLE B
(a varchar(10),
b varchar(10))

statement ok
insert into a values('1','2')

statement ok
insert into a values('2','2')

statement ok
insert into b values('1','2')

statement ok
insert into b values('3','2')

query T rowsort
select a from a where A.a not in (select B.a from B where A.b=B.b)
----
2

statement ok
update A set a='a' where A.a not in (select B.a from B where A.b=B.b)

query TT rowsort
select * from a
----
1
2
a
2

statement ok
drop table B

statement ok
drop table A

