statement ok
create table table1 (col1 int,col2 int)

statement ok
create table table2 (col1 int,col2 int)

statement ok
insert into table1 (col1,col2) values (1,10),(2,20),(3,30)

statement ok
insert into table2 (col1,col2) values (1,100),(2,200)

query II rowsort
select * from table1
----
1
10
2
20
3
30

query II rowsort
select * from table2
----
1
100
2
200

statement ok
update table1 set col2=(select table2.col2 from table2 where table2.col1=table1.col1) where exists (select * from table2 where table1.col1=table2.col1)

query II rowsort
select * from table1
----
1
100
2
200
3
30

statement ok
drop table table1

statement ok
drop table table2

