statement ok
CREATE TABLE A (
GRADE decimal(4,0) DEFAULT NULL
)

statement ok
INSERT INTO A VALUES (10)

statement ok
INSERT INTO A VALUES (12)

query D rowsort
select * from A
----
10
12

statement ok
UPDATE A SET GRADE = -GRADE

query D rowsort
select * from A
----
-10
-12

statement ok
drop table A

