statement ok
CREATE TABLE geom (id INTEGER, g GEOMETRY, b MBR)

statement ok
INSERT INTO geom values (5, NULL, NULL)

statement ok
INSERT INTO geom values (1, 'POLYGON((1 2, 3 2, 3 4, 1 4, 1 2))', NULL)

statement ok
INSERT INTO geom values (2, 'POLYGON((1 2, 3 2, 3 4, 1 4, 1 2))', 'MBR(1 2,3 4)')

statement ok
INSERT INTO geom values (3, 'POLYGON((1 2, 3 2, 3 4, 1 4, 1 2))', 'MBR (1 2,3 4)')

statement ok
INSERT INTO geom values (4, NULL, NULL)

query ITT nosort
SELECT * FROM geom ORDER BY id
----
1
POLYGON ((1 2, 3 2, 3 4, 1 4, 1 2))
NULL
2
POLYGON ((1 2, 3 2, 3 4, 1 4, 1 2))
BOX (1.000000 2.000000, 3.000000 4.000000)
3
POLYGON ((1 2, 3 2, 3 4, 1 4, 1 2))
BOX (1.000000 2.000000, 3.000000 4.000000)
4
NULL
NULL
5
NULL
NULL

statement ok
UPDATE geom SET b = MBR(g)

query ITT nosort
SELECT * FROM geom ORDER BY id
----
1
POLYGON ((1 2, 3 2, 3 4, 1 4, 1 2))
BOX (1.000000 2.000000, 3.000000 4.000000)
2
POLYGON ((1 2, 3 2, 3 4, 1 4, 1 2))
BOX (1.000000 2.000000, 3.000000 4.000000)
3
POLYGON ((1 2, 3 2, 3 4, 1 4, 1 2))
BOX (1.000000 2.000000, 3.000000 4.000000)
4
NULL
NULL
5
NULL
NULL

statement ok
CREATE TABLE newgeom (id INTEGER, g GEOMETRY, b MBR)

statement ok
INSERT INTO newgeom SELECT * FROM geom ORDER BY id

query ITT nosort
SELECT * FROM newgeom ORDER BY id
----
1
POLYGON ((1 2, 3 2, 3 4, 1 4, 1 2))
BOX (1.000000 2.000000, 3.000000 4.000000)
2
POLYGON ((1 2, 3 2, 3 4, 1 4, 1 2))
BOX (1.000000 2.000000, 3.000000 4.000000)
3
POLYGON ((1 2, 3 2, 3 4, 1 4, 1 2))
BOX (1.000000 2.000000, 3.000000 4.000000)
4
NULL
NULL
5
NULL
NULL

