statement ok
create table t_int(i int)

statement ok
copy 1 records into t_int from stdin USING DELIMITERS ',',E'\n','"' NULL AS ''
<COPY_INTO_DATA>
""

query I rowsort
select * from t_int
----
NULL

statement ok
delete from t_int

statement ok
copy 2 records into t_int from stdin USING DELIMITERS ',',E'\n','"' NULL AS ''
<COPY_INTO_DATA>
3.00
-4.0000

query I rowsort
select * from t_int
----
-4
3

statement ok
delete from t_int

statement error
copy 3 records into t_int from stdin USING DELIMITERS ',',E'\n','"' NULL AS ''
<COPY_INTO_DATA>
0
5.1
9

query I rowsort
select * from t_int
----

statement ok
delete from t_int

statement error
copy 5 records into t_int from stdin DELIMITERS ',',E'\n','"' NULL as ''
<COPY_INTO_DATA>
1
nil
""
null
abc

query I rowsort
select * from t_int
----

statement ok
delete from t_int

statement ok
drop table t_int

