statement ok
start transaction

statement ok
create table t_int(_ int, i int)

statement ok
copy 1 records into t_int from stdin USING DELIMITERS ',',E'\n','"' NULL AS '' best effort
<COPY_INTO_DATA>
0,

query I rowsort
select i from t_int
----
NULL

query IITT rowsort
select * from sys.rejects
----

statement ok
call sys.clearrejects()

statement ok
delete from t_int

statement ok
copy 2 records into t_int from stdin USING DELIMITERS ',',E'\n','"' NULL AS '' best effort
<COPY_INTO_DATA>
0,3.00
0,-4.0000

query I nosort
select i from t_int
----
3
-4

query IITT rowsort
select * from sys.rejects
----

statement ok
call sys.clearrejects()

statement ok
delete from t_int

statement ok
copy 3 records into t_int from stdin USING DELIMITERS ',',E'\n','"' NULL AS '' best effort
<COPY_INTO_DATA>
0,0
0,5.1
0,9

query I nosort
select i from t_int
----
0
9

query IITT rowsort
select * from sys.rejects
----
2
2
line 2 field i 'int' expected in '5.1'
0,5.1@

statement ok
call sys.clearrejects()

statement ok
delete from t_int

statement ok
copy 5 records into t_int from stdin delimiters ',',E'\n' NULL as '' best effort
<COPY_INTO_DATA>
0,1
0,nil
0,
0,null
0,abc

query I rowsort
select i from t_int
----
1
NULL

query IITT rowsort
select * from sys.rejects
----
2
2
line 2 field i 'int' expected in 'nil'
0,nil@
4
2
line 4 field i 'int' expected in 'null'
0,null@
5
2
line 5 field i 'int' expected in 'abc'
0,abc@

statement ok
call sys.clearrejects()

statement ok
delete from t_int

statement ok
drop table t_int

statement ok
rollback

