statement ok
start transaction

statement ok
create table null_as_string (i int, s string, d decimal(5,2))

statement ok
copy 4 records into null_as_string from stdin delimiters ',',E'\n' NULL as ''
<COPY_INTO_DATA>
,,
,zero,0
1,,1
2,two,

query ITR rowsort
Select * from null_as_string
----
1
NULL
1.000
2
two
NULL
NULL
NULL
NULL
NULL
zero
0.000

statement ok
delete from null_as_string

statement ok
copy 4 records into null_as_string from stdin delimiters ',',E'\n'
<COPY_INTO_DATA>
NULL,NULL,NULL
NULL,zero,0
1,NULL,1
2,two,NULL

query ITR rowsort
Select * from null_as_string
----
1
NULL
1.000
2
two
NULL
NULL
NULL
NULL
NULL
zero
0.000

statement ok
delete from null_as_string

statement ok
copy 4 records into null_as_string from stdin delimiters ',',E'\n' NULL as E'\\N'
<COPY_INTO_DATA>
\N,\N,\N
\N,zero,0
1,\N,1
2,two,\N

query ITR rowsort
Select * from null_as_string
----
1
NULL
1.000
2
two
NULL
NULL
NULL
NULL
NULL
zero
0.000

statement ok
delete from null_as_string

statement ok
drop table null_as_string

statement ok
rollback

