statement ok
create table bug3923(i integer)

query TTTTTIITI rowsort
select "schema", "table", "column", "type", "mode", case when typewidth < 14 then typewidth else 99 end as typewidth, hashes, phash, imprints from storage('sys','_tables')
----
sys
_tables
access
smallint
writable
2
0
False
0
sys
_tables
commit_action
smallint
writable
2
0
False
0
sys
_tables
id
int
writable
4
0
False
0
sys
_tables
name
varchar
writable
99
0
False
0
sys
_tables
query
varchar
writable
99
0
False
0
sys
_tables
schema_id
int
writable
4
0
False
0
sys
_tables
system
boolean
writable
1
0
False
0
sys
_tables
type
smallint
writable
2
0
False
0

statement ok
call storagemodelinit()

statement ok
update storagemodelinput set "count" =10000 where "table" ='bug3923'

statement ok
update storagemodelinput set "distinct" =10 where "table" ='bug3923' and "column" ='i'

query TTTTIIIIIITTT rowsort
select * from storagemodel where "table" = 'bug3923'
----
sys
bug3923
i
int
10000
10000
8312
0
2000
0
True
True
True

statement ok
drop table bug3923

statement ok
create schema bug3923schema

statement ok
set schema bug3923schema

statement ok
create table bug3923(i integer)

query TTTTTIITI rowsort
select "schema", "table", "column", "type", "mode", case when typewidth < 14 then typewidth else 99 end as typewidth, hashes, phash, imprints from sys.storage('sys','_tables')
----
sys
_tables
access
smallint
writable
2
0
False
0
sys
_tables
commit_action
smallint
writable
2
0
False
0
sys
_tables
id
int
writable
4
0
False
0
sys
_tables
name
varchar
writable
99
0
False
0
sys
_tables
query
varchar
writable
99
0
False
0
sys
_tables
schema_id
int
writable
4
0
False
0
sys
_tables
system
boolean
writable
1
0
False
0
sys
_tables
type
smallint
writable
2
0
False
0

statement ok
call sys.storagemodelinit()

statement ok
update sys.storagemodelinput set "count" =10000 where "table" ='bug3923'

statement ok
update sys.storagemodelinput set "distinct" =10 where "table" ='bug3923' and "column" ='i'

query TTTTIIIIIITTT rowsort
select * from sys.storagemodel where "table" = 'bug3923'
----
bug3923schema
bug3923
i
int
10000
10000
8312
0
2000
0
True
True
True

statement ok
drop table bug3923


