statement ok
create table bug3923(i integer)

query TTTTTIII rowsort
select "schema", "table", "column", "type", "mode", typewidth, phash, imprints > 0 as imprints from storage('sys','_tables')
----
sys
_tables
access
smallint
writable
2
0
0
sys
_tables
commit_action
smallint
writable
2
0
0
sys
_tables
id
int
writable
4
0
0
sys
_tables
name
varchar
writable
2
0
0
sys
_tables
query
varchar
writable
2
0
0
sys
_tables
schema_id
int
writable
4
0
0
sys
_tables
system
boolean
writable
1
0
0
sys
_tables
type
smallint
writable
2
0
0

statement ok
call storagemodelinit()

statement ok rowcount 1
update storagemodelinput set "count" =10000 where "table" ='bug3923'

statement ok rowcount 1
update storagemodelinput set "distinct" =10 where "table" ='bug3923' and "column" ='i'

query TTTTIIIIIIIII rowsort
select * from storagemodel where "table" = 'bug3923'
----
sys
bug3923
i
int
10000
40000
0
0
8000
0
1
NULL
1

statement ok
drop table bug3923

statement ok
create schema bug3923schema

statement ok
set schema bug3923schema

statement ok
create table bug3923(i integer)

query TTTTTIII rowsort
select "schema", "table", "column", "type", "mode", typewidth, phash, imprints > 0 as imprints from sys.storage('sys','_tables')
----
sys
_tables
access
smallint
writable
2
0
0
sys
_tables
commit_action
smallint
writable
2
0
0
sys
_tables
id
int
writable
4
0
0
sys
_tables
name
varchar
writable
2
0
0
sys
_tables
query
varchar
writable
2
0
0
sys
_tables
schema_id
int
writable
4
0
0
sys
_tables
system
boolean
writable
1
0
0
sys
_tables
type
smallint
writable
2
0
0

statement ok
call sys.storagemodelinit()

statement ok rowcount 1
update sys.storagemodelinput set "count" =10000 where "table" ='bug3923'

statement ok rowcount 1
update sys.storagemodelinput set "distinct" =10 where "table" ='bug3923' and "column" ='i'

query TTTTIIIIIIIII rowsort
select * from sys.storagemodel where "table" = 'bug3923'
----
bug3923schema
bug3923
i
int
10000
40000
0
0
8000
0
1
NULL
1

statement ok
drop table bug3923

