query I rowsort
SELECT length('123 ') as "four"
----
4

query I rowsort
SELECT length('123       ') as "ten"
----
10

query I rowsort
SELECT length('1234567890') as "ten"
----
10

query I rowsort
SELECT length('     67890') as "ten"
----
10

query I rowsort
SELECT length(reverse('     67890')) as "ten"
----
10

query I rowsort
SELECT sys.length('123 ') as "four"
----
4

query I rowsort
SELECT sys.length('123       ') as "ten"
----
10

query I rowsort
SELECT sys.length('1234567890') as "ten"
----
10

query I rowsort
SELECT sys.length('     67890') as "ten"
----
10

query I rowsort
SELECT sys.length(reverse('     67890')) as "ten"
----
10

statement ok
CREATE TABLE tvarchar (val VARCHAR(9) NOT NULL)

statement ok
INSERT INTO tvarchar VALUES ('A'), (' BC ')

query TI rowsort
SELECT val, length(val) FROM tvarchar
----
 BC 
4
A
1

statement ok
UPDATE tvarchar SET val = val || '    '

query TI rowsort
SELECT val, length(val) FROM tvarchar
----
 BC     
8
A    
5

statement ok
UPDATE tvarchar SET val = (val || 'x')

query TI rowsort
SELECT val, length(val) FROM tvarchar
----
 BC     x
9
A    x
6

statement ok
DROP TABLE tvarchar

statement ok
CREATE TABLE tchar (val CHAR(9) NOT NULL)

statement ok
INSERT INTO tchar VALUES ('A'), (' BC ')

query TI rowsort
SELECT val, length(val) FROM tchar
----
 BC 
4
A
1

statement ok
UPDATE tchar SET val = val || '    '

query TI rowsort
SELECT val, length(val) FROM tchar
----
 BC     
8
A    
5

statement ok
UPDATE tchar SET val = (val || 'x')

query TI rowsort
SELECT val, length(val) FROM tchar
----
 BC     x
9
A    x
6

statement ok
DROP TABLE tchar

