statement ok
create table rowsvsrangevsgroups (aa int, bb int, cc real)

statement ok
start transaction

statement ok
insert into rowsvsrangevsgroups values (1,1,1), (2,1,2), (3,1,3), (1,2,1), (1,3,1), (1,4,1), (2,2,2), (3,2,3), (4,2,4), (2,3,2)

query IIIIIIII nosort
select aa, bb, 
       cast(sum(aa) over (order by aa, bb rows unbounded preceding) as bigint),
       cast(sum(aa) over (order by aa, bb range unbounded preceding) as bigint),
       cast(sum(aa) over (order by aa, bb groups unbounded preceding) as bigint),
       cast(sum(aa) over (partition by bb order by bb, aa rows unbounded preceding) as bigint),
       cast(sum(aa) over (partition by bb order by bb, aa range unbounded preceding) as bigint),
       cast(sum(aa) over (partition by bb order by bb, aa groups unbounded preceding) as bigint) from rowsvsrangevsgroups
order by 1, 2
----
1
1
1
1
1
1
1
1
1
2
2
2
2
1
1
1
1
3
3
3
3
1
1
1
1
4
4
4
4
1
1
1
2
1
6
6
6
3
3
3
2
2
8
8
8
3
3
3
2
3
10
10
10
3
3
3
3
1
13
13
13
6
6
6
3
2
16
16
16
6
6
6
4
2
20
20
20
10
10
10

query IIIIIIIIRR nosort
select aa, bb,
       cast(sum(aa) over (order by aa, bb range between unbounded preceding and current row) as bigint),
       cast(sum(cc) over (order by aa, bb range between unbounded preceding and current row) as bigint),
       count(*) over (order by aa, bb range between unbounded preceding and current row),
       count(aa) over (order by aa, bb range between unbounded preceding and current row),
       min(aa) over (order by aa, bb range between unbounded preceding and current row),
       max(aa) over (order by aa, bb range between unbounded preceding and current row),
       avg(aa) over (order by aa, bb range between unbounded preceding and current row),
       avg(cc) over (order by aa, bb range between unbounded preceding and current row) from rowsvsrangevsgroups order by 1, 2
----
1
1
1
1
1
1
1
1
1.000
1.000
1
2
2
2
2
2
1
1
1.000
1.000
1
3
3
3
3
3
1
1
1.000
1.000
1
4
4
4
4
4
1
1
1.000
1.000
2
1
6
6
5
5
1
2
1.200
1.200
2
2
8
8
6
6
1
2
1.333
1.333
2
3
10
10
7
7
1
2
1.429
1.429
3
1
13
13
8
8
1
3
1.625
1.625
3
2
16
16
9
9
1
3
1.778
1.778
4
2
20
20
10
10
1
4
2.000
2.000

query IR nosort
select cast(sum(aa) over (order by aa, bb groups between 1 preceding and current row) as bigint),
       avg(cc) over (order by aa, bb groups between 1 preceding and current row) from rowsvsrangevsgroups order by 1, 2
----
1
1.000
2
1.000
2
1.000
2
1.000
3
1.500
4
2.000
4
2.000
5
2.500
6
3.000
7
3.500

statement ok
delete from rowsvsrangevsgroups where aa = 2

query IIIIIIRR nosort
select cast(sum(aa) over (order by aa, bb range between unbounded preceding and current row) as bigint),
       cast(sum(cc) over (order by aa, bb range between unbounded preceding and current row) as bigint),
       count(*) over (order by aa, bb range between unbounded preceding and current row),
       count(aa) over (order by aa, bb range between unbounded preceding and current row),
       min(aa) over (order by aa, bb range between unbounded preceding and current row),
       max(aa) over (order by aa, bb range between unbounded preceding and current row),
       avg(aa) over (order by aa, bb range between unbounded preceding and current row),
       avg(cc) over (order by aa, bb range between unbounded preceding and current row) from rowsvsrangevsgroups
order by 1, 2, 3, 4, 5, 6, 7, 8
----
1
1
1
1
1
1
1.000
1.000
2
2
2
2
1
1
1.000
1.000
3
3
3
3
1
1
1.000
1.000
4
4
4
4
1
1
1.000
1.000
7
7
5
5
1
3
1.400
1.400
10
10
6
6
1
3
1.667
1.667
14
14
7
7
1
4
2.000
2.000

statement ok
create table stressme (aa varchar(64), bb int)

statement ok
insert into stressme values ('one', 1), ('another', 1), ('stress', 1), (NULL, 2), ('ok', 2), ('check', 3), ('me', 3), ('please', 3), (NULL, 4)

query IIIIIIII nosort
select count(aa) over (order by aa nulls last, bb rows between current row and unbounded following),
       count(aa) over (order by aa nulls last, bb range between current row and unbounded following),
       count(aa) over (order by bb, aa nulls last rows between current row and unbounded following),
       count(aa) over (order by bb, aa nulls last range between current row and unbounded following),
       count(aa) over (order by bb, aa nulls last groups between current row and unbounded following),
       count(aa) over (partition by bb order by bb, aa nulls last rows unbounded preceding),
       count(aa) over (partition by bb order by bb, aa nulls last range unbounded preceding),
       count(aa) over (partition by bb order by bb, aa nulls last groups unbounded preceding) from stressme order by 1,2,3,4,5,6,7,8
----
0
0
0
0
0
0
0
0
0
0
3
3
3
1
1
1
1
1
5
5
5
3
3
3
2
2
1
1
1
3
3
3
3
3
6
6
6
2
2
2
4
4
4
4
4
1
1
1
5
5
2
2
2
2
2
2
6
6
3
3
3
1
1
1
7
7
7
7
7
1
1
1

query TTTTTTTT nosort
select min(aa) over (order by aa nulls last, bb rows between current row and unbounded following),
       min(aa) over (order by aa nulls last, bb range between current row and unbounded following),
       min(aa) over (order by bb, aa nulls last rows between current row and unbounded following),
       min(aa) over (order by bb, aa nulls last range between current row and unbounded following),
       min(aa) over (order by bb, aa nulls last groups between current row and unbounded following),
       min(aa) over (partition by bb order by bb, aa nulls last rows unbounded preceding),
       min(aa) over (partition by bb order by bb, aa nulls last range unbounded preceding),
       min(aa) over (partition by bb order by bb, aa nulls last groups unbounded preceding) from stressme order by 1,2,3,4,5,6,7,8
----
NULL
NULL
NULL
NULL
NULL
NULL
NULL
NULL
NULL
NULL
check
check
check
ok
ok
ok
another
another
another
another
another
another
another
another
check
check
check
check
check
check
check
check
me
me
me
me
me
check
check
check
ok
ok
check
check
check
ok
ok
ok
one
one
check
check
check
another
another
another
please
please
please
please
please
check
check
check
stress
stress
check
check
check
another
another
another

query TTTTTTTT nosort
select max(aa) over (order by aa nulls last, bb rows between current row and unbounded following),
       max(aa) over (order by aa nulls last, bb range between current row and unbounded following),
       max(aa) over (order by bb, aa nulls last rows between current row and unbounded following),
       max(aa) over (order by bb, aa nulls last range between current row and unbounded following),
       max(aa) over (order by bb, aa nulls last groups between current row and unbounded following),
       max(aa) over (partition by bb order by bb, aa nulls last rows unbounded preceding),
       max(aa) over (partition by bb order by bb, aa nulls last range unbounded preceding),
       max(aa) over (partition by bb order by bb, aa nulls last groups unbounded preceding) from stressme order by 1,2,3,4,5,6,7,8
----
NULL
NULL
NULL
NULL
NULL
NULL
NULL
NULL
NULL
NULL
please
please
please
ok
ok
ok
stress
stress
please
please
please
check
check
check
stress
stress
please
please
please
me
me
me
stress
stress
please
please
please
ok
ok
ok
stress
stress
please
please
please
please
please
please
stress
stress
stress
stress
stress
another
another
another
stress
stress
stress
stress
stress
one
one
one
stress
stress
stress
stress
stress
stress
stress
stress

query TI nosort
select max(aa) over (order by bb, aa nulls first groups between 1 preceding and current row),
       count(aa) over (order by bb, aa nulls first groups between 1 preceding and current row) from stressme order by 1,2
----
another
1
me
2
ok
1
ok
2
one
2
please
1
please
2
stress
1
stress
2

statement ok
delete from stressme where bb = 2

query TI nosort
select max(aa) over (order by bb, aa nulls first groups between 1 preceding and current row),
       count(aa) over (order by bb, aa nulls first groups between 1 preceding and current row) from stressme order by 1,2
----
another
1
me
2
one
2
please
1
please
2
stress
2
stress
2

statement ok
create table overflowme (aa int, bb int)

statement ok
insert into overflowme values (2147483644, 1), (2147483645, 2), (2147483646, 1), (2147483644, 2), (2147483645, 1), (2147483646, 2)

query RRRRRR nosort
select floor(avg(aa) over (order by aa rows between current row and unbounded following)),
       floor(avg(aa) over (order by aa range between current row and unbounded following)),
       floor(avg(aa) over (order by bb, aa rows between current row and unbounded following)),
       floor(avg(aa) over (order by bb, aa range between current row and unbounded following)),
       floor(avg(aa) over (partition by bb order by bb, aa rows unbounded preceding)),
       floor(avg(aa) over (partition by bb order by bb, aa range unbounded preceding)) from overflowme order by  1, 2, 3, 4, 5, 6
----
2147483645.000
2147483645.000
2147483645.000
2147483645.000
2147483644.000
2147483644.000
2147483645.000
2147483645.000
2147483645.000
2147483645.000
2147483644.000
2147483644.000
2147483645.000
2147483645.000
2147483645.000
2147483645.000
2147483644.000
2147483644.000
2147483645.000
2147483645.000
2147483645.000
2147483645.000
2147483644.000
2147483644.000
2147483646.000
2147483646.000
2147483645.000
2147483645.000
2147483645.000
2147483645.000
2147483646.000
2147483646.000
2147483646.000
2147483646.000
2147483645.000
2147483645.000

statement ok
rollback

statement error
select count(*) over (rows between NULL preceding and unbounded following) from rowsvsrangevsgroups

statement error
select count(*) over (rows between unbounded preceding and -1 following) from rowsvsrangevsgroups

statement error
select count(*) over (range between 1 preceding and unbounded following) from rowsvsrangevsgroups

statement error
select count(*) over (range between unbounded preceding and 1 following) from rowsvsrangevsgroups

statement error
select count(*) over (groups between 1 preceding and 1 following) from rowsvsrangevsgroups

statement error
select count(*) over (groups between current row and unbounded following) from rowsvsrangevsgroups

query I nosort
select min(1) over (partition by 1 order by 1 range between 1 preceding and 1 following)
----
1

query T nosort
select min('a') over (partition by 1 order by 1 range between 1 preceding and 1 following)
----
a

query T nosort
select min(time '10:10:00') over (partition by 1 order by 1 range between 1 preceding and 1 following)
----
10:10:00

statement ok
drop table rowsvsrangevsgroups

