statement ok
create table vac1(i int, s string)

statement ok
insert into vac1 values(1,'the'), (2,'quick'),(3,'brown'),(5,'runs'),(4,'fox'),(6,'over'),(7,'the'),(8,'lazy'),(9,'dog')

query IT rowsort
select * from vac1 order by i
----
1
the
2
quick
3
brown
4
fox
5
runs
6
over
7
the
8
lazy
9
dog

query IT rowsort
select * from vac1
----
1
the
2
quick
3
brown
4
fox
5
runs
6
over
7
the
8
lazy
9
dog

statement ok
call shrink('sys','vac1')

query IT rowsort
select * from vac1
----
1
the
2
quick
3
brown
4
fox
5
runs
6
over
7
the
8
lazy
9
dog

statement ok
delete from vac1 where i = 8

statement ok
call shrink('sys','vac1')

query IT rowsort
select * from vac1
----
1
the
2
quick
3
brown
4
fox
5
runs
6
over
7
the
9
dog

statement ok
delete from vac1 where i = 2

statement ok
call shrink('sys','vac1')

query IT rowsort
select * from vac1
----
1
the
3
brown
4
fox
5
runs
6
over
7
the
9
dog

statement ok
delete from vac1 where i > 6

statement ok
call vacuum('sys','vac1')

query IT rowsort
select * from vac1
----
1
the
3
brown
4
fox
5
runs
6
over

statement ok
drop table vac1

