statement ok
start transaction

statement ok
create table updating (a int)

statement ok
insert into updating values (1), (2)

statement ok
update updating set a = 3 where a = 2

query I rowsort
select a from updating where a = 3
----
3

statement ok
rollback

statement ok
create table updating (a int)

statement ok
insert into updating values (2)

statement ok
start transaction

statement ok
update updating set a = 3 where a = 2

query I rowsort
select a from updating where a = 3
----
3

statement ok
rollback

statement ok
truncate updating

statement ok
insert into updating values (1), (1)

statement ok
start transaction

statement ok
update updating set a = 3 where a = 2

query I rowsort
select a from updating where a = 3
----

statement ok
rollback

statement ok
truncate updating

statement ok
insert into updating values (1), (2)

statement ok
start transaction

statement ok
update updating set a = 3 where a = 2

query I rowsort
select a from updating where a = 3
----
3

statement ok
rollback

statement ok
drop table updating

