statement ok
create table up ( att int )

statement ok
insert into up values (1)

query I rowsort
select * from up
----
1

statement ok
update up set att = null

query I rowsort
select * from up
----
NULL

statement ok
drop table up

