statement ok
create schema pub

statement ok
create role bartender

statement ok
create table pub.beers(name VARCHAR(20))

statement ok
grant all on pub.beers to bartender

statement ok
create user foo with password 'foo' name 'foo' schema pub default role bartender

@connection(id=tc, username=foo, password=foo)
query T nosort
select current_user
----
foo

@connection(id=tc)
query T nosort
select current_role
----
bartender

@connection(id=tc)
statement ok
insert into pub.beers values ('Amstel'), ('Grolsch'), ('Brand')

@connection(id=tc)
statement ok
delete from pub.beers

statement ok
alter user foo default role foo

@connection(id=foo, username=foo, password=foo)
query T nosort
select current_user
----
foo

@connection(id=foo)
query T nosort
select current_role
----
foo

-- Check if the default role was actually granted to the user
@connection(id=foo)
statement ok
set role bartender

-- test if a sysadmin can do the same
statement ok
create user andy with password 'andy' name 'andy' default role sysadmin

@connection(id=andy, username=andy, password=andy)
statement ok
create user bob with password 'bob' name 'bob' default role bartender

@connection(id=bob, username=bob, password=bob)
query T nosort
select current_role
----
bartender

-- check if the new user has granted the roles
@connection(id=bob)
statement ok
set role bob

@connection(id=bob)
statement ok
set role bartender

