statement ok
create table nosql(j json)

statement ok
insert into  nosql values
	('{}'),
	('{"f1":1}'),
	('{"f1":1,"f2":2}'),
	('{"f1":1,"f2":2,"f1":3}'),
	('{"f1":{"f12":3},"f2":[2,3,4]}')

query T rowsort
select * from nosql
----
{"f1":1,"f2":2,"f1":3}
{"f1":1,"f2":2}
{"f1":1}
{"f1":{"f12":3},"f2":[2,3,4]}
{}

query T rowsort
select json.filter(j,'f1') from nosql
----
[1,3]
[1]
[1]
[]
[{"f12":3}]

query T rowsort
select json.filter(j,'f2') from nosql
----
[2]
[2]
[[2,3,4]]
[]
[]

query T rowsort
select json.filter(j,'..f12') from nosql
----
[3]
[]
[]
[]
[]

statement ok
delete from nosql

query T rowsort
select * from nosql
----

statement ok
insert into nosql values('[1,"f2", 2]')

query T rowsort
select * from nosql
----
[1,"f2", 2]

query T rowsort
select json.filter(j,0) from nosql
----
[1]

query T rowsort
select json.filter(j,1) from nosql
----
["f2"]

query T rowsort
select json.filter(j,2) from nosql
----
[2]

query T rowsort
select json.filter(j,3) from nosql
----
[]

statement ok
drop table nosql

