statement ok
start transaction

statement ok
create table uniques(k integer  not null, i integer  not null, si integer , f float not null, d double not null, decim integer  not null, date date  not null, code char(10)  not null, name char(20)  not null, address string not null, fill char(6)  not null)

statement ok
create table hundred(k integer  not null, i integer  not null, si integer , f float  not null, d double  not null, decim integer  not null, date date  not null, code char(10)  not null, name char(20)  not null, address string not null, fill char(6)  not null)

statement ok
create table tenpct(k integer  not null, i integer  not null, si integer , f float  not null, d double  not null, decim integer  not null, date date  not null, code char(10)  not null, name char(20)  not null, address string not null, fill char(6)  not null)

statement ok
create table updates(k integer  not null, i integer  not null, si integer , f float  not null, d double  not null, decim integer  not null, date date  not null, code char(10)  not null, name char(20)  not null, address string not null, fill char(6)  not null)

statement ok
create table tiny(k integer  not null)

statement ok
create view _AS3AP_o_mode_tiny as select * from tiny

query I rowsort
select * from _AS3AP_o_mode_tiny
----

statement ok
create view _AS3AP_sel_1_cl as select k, i, si, code, d, name from updates where k=1000

query IIITRT rowsort
select * from _AS3AP_sel_1_cl
----

statement ok
create view _AS3AP_o_mode_1k as select * from updates where k<=10

query IIIRRITTTTT rowsort
select * from _AS3AP_o_mode_1k
----

statement ok
create view _AS3AP_o_mode_10k as select * from hundred where k<=100

query IIIRRITTTTT rowsort
select * from _AS3AP_o_mode_10k
----

statement ok
create view _AS3AP_o_mode_100k as select * from hundred where k<=1000

query IIIRRITTTTT rowsort
select * from _AS3AP_o_mode_100k
----

statement ok
create table _AS3AP_join_3_cl(us integer , ud date , hs integer , hd date , ts integer , td date )

statement ok
insert into _AS3AP_join_3_cl select uniques.si, uniques.date, hundred.si, hundred.date, tenpct.si, tenpct.date from uniques, hundred, tenpct where uniques.k=hundred.k and uniques.k=tenpct.k and uniques.k=1000

statement ok
create view _AS3AP_sel_100_ncl as select k, i, si, code, d, name from updates where k<=100

query IIITRT rowsort
select * from _AS3AP_sel_100_ncl
----

statement ok
create view _AS3AP_table_scan as select * from uniques where i=1

query IIIRRITTTTT rowsort
select * from _AS3AP_table_scan
----

statement ok
create view _AS3AP_sel_100_cl as select k, i, si, code, d, name from updates where k<=100

query IIITRT rowsort
select * from _AS3AP_sel_100_cl
----

statement ok
create table _AS3AP_join_3_ncl(us integer , ud date , hs integer , hd date , ts integer , td date )

statement ok
insert into _AS3AP_join_3_ncl select uniques.si, uniques.date, hundred.si, hundred.date, tenpct.si, tenpct.date from uniques, hundred, tenpct where uniques.code=hundred.code and uniques.code=tenpct.code and uniques.code='BENCHMARKS'

statement ok
create view _AS3AP_sel_10pct_ncl as select k, i, si, code, d, name from tenpct where name='THE+ASAP+BENCHMARKS+'

query IIITRT rowsort
select * from _AS3AP_sel_10pct_ncl
----

statement ok
create view _AS3AP_sel_10pct_cl as select k, i, si, code, d, name from uniques where k<=100000000

query IIITRT rowsort
select * from _AS3AP_sel_10pct_cl
----

statement ok
create view _AS3AP_report as select avg(updates.decim) from updates where updates.decim in( select updates.decim from updates, hundred where hundred.k=updates.k and updates.decim>980000000)

query R rowsort
select * from _AS3AP_report
----
NULL

statement ok
create view _AS3AP_info_retrieval as select count(k)from tenpct where name='THE+ASAP+BENCHMARKS+' and i<=100000000 and si>0 and si<100000000 and(f< -450000000 or f>450000000)and d>600000000 and decim< -600000000

query I rowsort
select * from _AS3AP_info_retrieval
----
0

statement ok
create view reportview(k, si, date, decim, name, code, i) as select updates.k, updates.si, updates.date, updates.decim, hundred.name, hundred.code, hundred.i from updates, hundred where updates.k=hundred.k

query IITITTI rowsort
select * from reportview
----

statement ok
create view _AS3AP_total_report as select avg(si), min(si), max(si), max(date), min(date), count(distinct name), count(name), count(code), count(i)from reportview where decim>980000000

query RIITTIIII rowsort
select * from _AS3AP_total_report
----
NULL
NULL
NULL
NULL
NULL
0
0
0
0

statement ok
create table _AS3AP_join_1_10(uk integer , un char(20) , tn char(20) , ts integer )

statement ok
insert into _AS3AP_join_1_10 select uniques.k, uniques.name, tenpct.name, tenpct.si from uniques, tenpct where uniques.k=tenpct.si and(uniques.k=500000000 or uniques.k=600000000 or uniques.k=700000000 or uniques.k=800000000 or uniques.k=900000000)

statement ok
create table _AS3AP_join_2_cl(us integer , un char(20) , hs integer , hn char(20) )

statement ok
insert into _AS3AP_join_2_cl select uniques.si, uniques.name, hundred.si, hundred.name from uniques, hundred where uniques.k=hundred.k and uniques.k=1000

statement ok
create table _AS3AP_join_2(us integer , un char(20) , hs integer , hn char(20) )

statement ok
insert into _AS3AP_join_2 select uniques.si, uniques.name, hundred.si, hundred.name from uniques, hundred where uniques.address=hundred.address and uniques.address='SILICON VALLEY'

statement ok
create view _AS3AP_varselectlow as select k, i, si, code, d, name from tenpct where si<40

query IIITRT rowsort
select * from _AS3AP_varselectlow
----

statement ok
create view _AS3AP_varselecthigh as select k, i, si, code, d, name from tenpct where si<40

query IIITRT rowsort
select * from _AS3AP_varselecthigh
----

statement ok
create table _AS3AP_join_4_cl(ud date, hd date , td date , upd date )

statement ok
insert into _AS3AP_join_4_cl select uniques.date, hundred.date, tenpct.date, updates.date from uniques, hundred, tenpct, updates where uniques.k=hundred.k and uniques.k=tenpct.k and uniques.k=updates.k and uniques.k=1000

statement ok
create view _AS3AP_proj_100 as select distinct address, si from hundred

query TI rowsort
select * from _AS3AP_proj_100
----

statement ok
create table _AS3AP_join_4_ncl(ud date, hd date , td date , upd date )

statement ok
insert into _AS3AP_join_4_ncl select uniques.date, hundred.date, tenpct.date, updates.date from uniques, hundred, tenpct, updates where uniques.code=hundred.code and uniques.code=tenpct.code and uniques.code=updates.code and uniques.code='BENCHMARKS'

statement ok
create view _AS3AP_proj_10pct as select distinct si from tenpct

query I rowsort
select * from _AS3AP_proj_10pct
----

statement ok
create view _AS3AP_sel_1_ncl as select k, i, si, code, d, name from updates where code='BENCHMARKS'

query IIITRT rowsort
select * from _AS3AP_sel_1_ncl
----

statement ok
create table _AS3AP_join_2_ncl(us integer , un char(20) , hs integer , hn char(20) )

statement ok
insert into _AS3AP_join_2_ncl select uniques.si, uniques.name, hundred.si, hundred.name from uniques, hundred where uniques.code=hundred.code and uniques.code='BENCHMARKS'

statement ok
create view tempint as select * from hundred where i=0

query IIIRRITTTTT rowsort
select * from tempint
----

query IIIRRITTTTT rowsort
select * from hundred
----

statement ok
update hundred set si=-5000 where i=0

statement ok
update hundred set si=-500000000 where i=0

statement ok
delete from hundred where i=0

statement ok
insert into hundred select * from tempint

query IIIRRITTTTT rowsort
select * from hundred
----

query IIIRRITTTTT rowsort
select * from updates
----

statement ok
delete from updates where k=5005

statement ok
create view saveupdates as select * from updates where k between 5010 and 6009

query IIIRRITTTTT rowsort
select * from saveupdates
----

statement ok
update updates set k=k -100000 where k between 5010 and 6009

statement ok
insert into updates values(6000, 0, 60000, 39997.90, 50005.00, 50005.00, '1985-11-10', 'CONTROLLER', 'ALICE IN WONDERLAND', 'UNIVERSITY OF ILLINOIS AT CHICAGO ', 'Krabbe')

query IIIRRITTTTT rowsort
select * from updates
----
6000
0
60000
39997.900
50005.000
50005
1985-11-10
CONTROLLER
ALICE IN WONDERLAND
UNIVERSITY OF ILLINOIS AT CHICAGO 
Krabbe

statement ok
delete from updates where k=6000 and i=0

query IIIRRITTTTT rowsort
select * from updates
----

statement ok
insert into updates values(5005, 5005, 50005, 50005.00, 50005.00, 50005.00, '1988-1-1', 'CONTROLLER', 'ALICE IN WONDERLAND', 'UNIVERSITY OF ILLINOIS AT CHICAGO ', 'Krabbe')

query IIIRRITTTTT rowsort
select * from updates
----
5005
5005
50005
50005.000
50005.000
50005
1988-01-01
CONTROLLER
ALICE IN WONDERLAND
UNIVERSITY OF ILLINOIS AT CHICAGO 
Krabbe

statement ok
update updates set k= -5000 where k=5005

query IIIRRITTTTT rowsort
select * from updates
----
-5000
5005
50005
50005.000
50005.000
50005
1988-01-01
CONTROLLER
ALICE IN WONDERLAND
UNIVERSITY OF ILLINOIS AT CHICAGO 
Krabbe

statement ok
delete from updates where k= -5000

query IIIRRITTTTT rowsort
select * from updates
----

statement ok
insert into updates values(1000000001, 50005, 50005, 50005.00, 50005.00, 50005.00, '1988-1-1', 'CONTROLLER', 'ALICE IN WONDERLAND', 'UNIVERSITY OF ILLINOIS AT CHICAGO ', 'Krabbe')

query IIIRRITTTTT rowsort
select * from updates
----
1000000001
50005
50005
50005.000
50005.000
50005
1988-01-01
CONTROLLER
ALICE IN WONDERLAND
UNIVERSITY OF ILLINOIS AT CHICAGO 
Krabbe

statement ok
update updates set k= -1000 where k=1000000001

query IIIRRITTTTT rowsort
select * from updates
----
-1000
50005
50005
50005.000
50005.000
50005
1988-01-01
CONTROLLER
ALICE IN WONDERLAND
UNIVERSITY OF ILLINOIS AT CHICAGO 
Krabbe

statement ok
delete from updates where k= -1000

query IIIRRITTTTT rowsort
select * from updates
----

statement ok
insert into updates values(5005, 5005, 50005, 50005.00, 50005.00, 50005.00, '1988-1-1', 'CONTROLLER', 'ALICE IN WONDERLAND', 'UNIVERSITY OF ILLINOIS AT CHICAGO ', 'Krabbe')

query IIIRRITTTTT rowsort
select * from updates
----
5005
5005
50005
50005.000
50005.000
50005
1988-01-01
CONTROLLER
ALICE IN WONDERLAND
UNIVERSITY OF ILLINOIS AT CHICAGO 
Krabbe

statement ok
update updates set code='SQL+GROUPS' where k=5005

query IIIRRITTTTT rowsort
select * from updates
----
5005
5005
50005
50005.000
50005.000
50005
1988-01-01
SQL+GROUPS
ALICE IN WONDERLAND
UNIVERSITY OF ILLINOIS AT CHICAGO 
Krabbe

statement ok
delete from updates where k=5005

query IIIRRITTTTT rowsort
select * from updates
----

statement ok
insert into updates values(5005, 5005, 50005, 50005.00, 50005.00, 50005.00, '1988-1-1', 'CONTROLLER', 'ALICE IN WONDERLAND', 'UNIVERSITY OF ILLINOIS AT CHICAGO ', 'Krabbe')

query IIIRRITTTTT rowsort
select * from updates
----
5005
5005
50005
50005.000
50005.000
50005
1988-01-01
CONTROLLER
ALICE IN WONDERLAND
UNIVERSITY OF ILLINOIS AT CHICAGO 
Krabbe

statement ok
update updates set i=500015 where k=5005

query IIIRRITTTTT rowsort
select * from updates
----
5005
500015
50005
50005.000
50005.000
50005
1988-01-01
CONTROLLER
ALICE IN WONDERLAND
UNIVERSITY OF ILLINOIS AT CHICAGO 
Krabbe

statement ok
delete from updates where k= -5000

query IIIRRITTTTT rowsort
select * from updates
----
5005
500015
50005
50005.000
50005.000
50005
1988-01-01
CONTROLLER
ALICE IN WONDERLAND
UNIVERSITY OF ILLINOIS AT CHICAGO 
Krabbe

statement ok
insert into updates select * from saveupdates

query IIIRRITTTTT rowsort
select * from updates
----
5005
500015
50005
50005.000
50005.000
50005
1988-01-01
CONTROLLER
ALICE IN WONDERLAND
UNIVERSITY OF ILLINOIS AT CHICAGO 
Krabbe

statement ok
delete from updates where k<0

query IIIRRITTTTT rowsort
select * from updates
----
5005
500015
50005
50005.000
50005.000
50005
1988-01-01
CONTROLLER
ALICE IN WONDERLAND
UNIVERSITY OF ILLINOIS AT CHICAGO 
Krabbe

statement ok
rollback

