statement ok
create table example ( val1 integer, val2 varchar(10), val3 float )

statement ok
create view example_view as select * from example

statement ok
insert into example values( 1, 'test', 0.1 )

statement ok
insert into example values( 5, 'xtest', 0.9 )

statement ok
insert into example values( 9, 'testx', 9.1 )

statement ok
insert into example values( 0, 'texst', 99999.1 )

statement ok
insert into example values( 8, 'texxst', 0.0001 )

query ITR rowsort
select * from example order by val1, val2
----
0
texst
99999.100
1
test
0.100
5
xtest
0.900
8
texxst
0.000
9
testx
9.100

query ITR rowsort
select * from example_view order by val1, val2
----
0
texst
99999.100
1
test
0.100
5
xtest
0.900
8
texxst
0.000
9
testx
9.100

statement ok
insert into example values( 1, 'test', 0.1 )

statement ok
insert into example values( 5, 'xtest', 0.9 )

statement ok
insert into example values( 9, 'testx', 9.1 )

statement ok
insert into example values( 0, 'texst', 99999.1 )

statement ok
insert into example values( 8, 'texxst', 0.0001 )

query ITR rowsort
select * from example order by val1, val2
----
0
texst
99999.100
0
texst
99999.100
1
test
0.100
1
test
0.100
5
xtest
0.900
5
xtest
0.900
8
texxst
0.000
8
texxst
0.000
9
testx
9.100
9
testx
9.100

query ITR rowsort
select * from example_view order by val1, val2
----
0
texst
99999.100
0
texst
99999.100
1
test
0.100
1
test
0.100
5
xtest
0.900
5
xtest
0.900
8
texxst
0.000
8
texxst
0.000
9
testx
9.100
9
testx
9.100

query ITR rowsort
select * from example where val1 >= 5 order by val1, val2
----
5
xtest
0.900
5
xtest
0.900
8
texxst
0.000
8
texxst
0.000
9
testx
9.100
9
testx
9.100

query ITR rowsort
select * from example_view where val1 > 5 order by val1, val2
----
8
texxst
0.000
8
texxst
0.000
9
testx
9.100
9
testx
9.100

statement ok
drop view example_view

statement ok
drop table example

statement ok
create table example ( val1 integer, val2 varchar(10), val3 float )

statement ok
create view example_view as select * from example

statement ok
insert into example values( 1, 'test', 0.1 )

statement ok
insert into example values( 5, 'xtest', 0.9 )

statement ok
insert into example values( 9, 'testx', 9.1 )

statement ok
insert into example values( 0, 'texst', 99999.1 )

statement ok
insert into example values( 8, 'texxst', 0.0001 )

query ITR rowsort
select * from example order by val1, val2
----
0
texst
99999.100
1
test
0.100
5
xtest
0.900
8
texxst
0.000
9
testx
9.100

query ITR rowsort
select * from example_view order by val1, val2
----
0
texst
99999.100
1
test
0.100
5
xtest
0.900
8
texxst
0.000
9
testx
9.100

query ITR rowsort
select * from example order by val1, val2
----
0
texst
99999.100
1
test
0.100
5
xtest
0.900
8
texxst
0.000
9
testx
9.100

statement ok
delete from example where val1 >= 5

query ITR rowsort
select * from example order by val1, val2
----
0
texst
99999.100
1
test
0.100

statement ok
drop view example_view

statement ok
drop table example

statement ok
create table example ( val1 integer, val2 varchar(10), val3 float )

statement ok
create view example_view as select * from example

statement ok
insert into example values( 1, 'test', 0.1 )

statement ok
insert into example values( 5, 'xtest', 0.9 )

statement ok
insert into example values( 9, 'testx', 9.1 )

statement ok
insert into example values( 0, 'texst', 99999.1 )

statement ok
insert into example values( 8, 'texxst', 0.0001 )

query ITR rowsort
select * from example order by val1, val2
----
0
texst
99999.100
1
test
0.100
5
xtest
0.900
8
texxst
0.000
9
testx
9.100

query ITR rowsort
select * from example_view order by val1, val2
----
0
texst
99999.100
1
test
0.100
5
xtest
0.900
8
texxst
0.000
9
testx
9.100

query ITR rowsort
select * from example order by val1, val2
----
0
texst
99999.100
1
test
0.100
5
xtest
0.900
8
texxst
0.000
9
testx
9.100

statement ok
delete from example where val1 = 5

query ITR rowsort
select * from example order by val1, val2
----
0
texst
99999.100
1
test
0.100
8
texxst
0.000
9
testx
9.100

statement ok
delete from example where val1 = 9

query ITR rowsort
select * from example order by val1, val2
----
0
texst
99999.100
1
test
0.100
8
texxst
0.000

statement ok
delete from example where val1 = 8

query ITR rowsort
select * from example order by val1, val2
----
0
texst
99999.100
1
test
0.100

statement ok
drop view example_view

statement ok
drop table example

statement ok
create table example ( val1 integer, val2 varchar(10), val3 float )

statement ok
create view example_view as select * from example

statement ok
insert into example values( 1, 'test', 0.1 )

statement ok
insert into example values( 5, 'xtest', 0.9 )

statement ok
insert into example values( 9, 'testx', 9.1 )

statement ok
insert into example values( 0, 'texst', 99999.1 )

statement ok
insert into example values( 8, 'texxst', 0.0001 )

query ITR rowsort
select * from example order by val1, val2
----
0
texst
99999.100
1
test
0.100
5
xtest
0.900
8
texxst
0.000
9
testx
9.100

query ITR rowsort
select * from example_view order by val1, val2
----
0
texst
99999.100
1
test
0.100
5
xtest
0.900
8
texxst
0.000
9
testx
9.100

query ITR rowsort
select * from example order by val1, val2
----
0
texst
99999.100
1
test
0.100
5
xtest
0.900
8
texxst
0.000
9
testx
9.100

statement ok
delete from example where val1 > 5

query ITR rowsort
select * from example order by val1, val2
----
0
texst
99999.100
1
test
0.100
5
xtest
0.900

statement ok
drop view example_view

statement ok
drop table example

statement ok
create table example ( val1 integer, val2 varchar(10), val3 float )

statement ok
create view example_view as select * from example

statement ok
insert into example values( 1, 'test', 0.1 )

statement ok
insert into example values( 5, 'xtest', 0.9 )

statement ok
insert into example values( 9, 'testx', 9.1 )

statement ok
insert into example values( 0, 'texst', 99999.1 )

statement ok
insert into example values( 8, 'texxst', 0.0001 )

query ITR rowsort
select * from example order by val1, val2
----
0
texst
99999.100
1
test
0.100
5
xtest
0.900
8
texxst
0.000
9
testx
9.100

query ITR rowsort
select * from example_view order by val1, val2
----
0
texst
99999.100
1
test
0.100
5
xtest
0.900
8
texxst
0.000
9
testx
9.100

query ITR rowsort
select * from example order by val1, val2
----
0
texst
99999.100
1
test
0.100
5
xtest
0.900
8
texxst
0.000
9
testx
9.100

statement ok
update example set val3=-1.0 where val1 >= 5

query ITR rowsort
select * from example order by val1, val2
----
0
texst
99999.100
1
test
0.100
5
xtest
-1.000
8
texxst
-1.000
9
testx
-1.000

statement ok
drop view example_view

statement ok
drop table example

statement ok
create table example ( val1 integer, val2 varchar(10), val3 float )

statement ok
create view example_view as select * from example

statement ok
insert into example values( 1, 'test', 0.1 )

statement ok
insert into example values( 5, 'xtest', 0.9 )

statement ok
insert into example values( 9, 'testx', 9.1 )

statement ok
insert into example values( 0, 'texst', 99999.1 )

statement ok
insert into example values( 8, 'texxst', 0.0001 )

query ITR rowsort
select * from example order by val1, val2
----
0
texst
99999.100
1
test
0.100
5
xtest
0.900
8
texxst
0.000
9
testx
9.100

query ITR rowsort
select * from example_view order by val1, val2
----
0
texst
99999.100
1
test
0.100
5
xtest
0.900
8
texxst
0.000
9
testx
9.100

query ITR rowsort
select * from example order by val1, val2
----
0
texst
99999.100
1
test
0.100
5
xtest
0.900
8
texxst
0.000
9
testx
9.100

statement ok
update example set val1 = -5 where val1 = 5

query ITR rowsort
select * from example order by val1, val2
----
-5
xtest
0.900
0
texst
99999.100
1
test
0.100
8
texxst
0.000
9
testx
9.100

statement ok
update example set val1 = -5 where val1 = 9

query ITR rowsort
select * from example order by val1, val2
----
-5
testx
9.100
-5
xtest
0.900
0
texst
99999.100
1
test
0.100
8
texxst
0.000

statement ok
update example set val1 = -5 where val1 = 8

query ITR rowsort
select * from example order by val1, val2
----
-5
testx
9.100
-5
texxst
0.000
-5
xtest
0.900
0
texst
99999.100
1
test
0.100

statement ok
drop view example_view

statement ok
drop table example

statement ok
create table example ( val1 integer, val2 varchar(10), val3 float )

statement ok
create view example_view as select * from example

statement ok
insert into example values( 1, 'test', 0.1 )

statement ok
insert into example values( 5, 'xtest', 0.9 )

statement ok
insert into example values( 9, 'testx', 9.1 )

statement ok
insert into example values( 0, 'texst', 99999.1 )

statement ok
insert into example values( 8, 'texxst', 0.0001 )

query ITR rowsort
select * from example order by val1, val2
----
0
texst
99999.100
1
test
0.100
5
xtest
0.900
8
texxst
0.000
9
testx
9.100

query ITR rowsort
select * from example_view order by val1, val2
----
0
texst
99999.100
1
test
0.100
5
xtest
0.900
8
texxst
0.000
9
testx
9.100

query ITR rowsort
select * from example order by val1, val2
----
0
texst
99999.100
1
test
0.100
5
xtest
0.900
8
texxst
0.000
9
testx
9.100

statement ok
update example set val2 = 'updated' where val1 > 5

query ITR rowsort
select * from example order by val1, val2
----
0
texst
99999.100
1
test
0.100
5
xtest
0.900
8
updated
0.000
9
updated
9.100

statement ok
drop view example_view

statement ok
drop table example

statement ok
START TRANSACTION

statement ok
create table example ( val1 integer, val2 varchar(10), val3 float )

statement ok
create view example_view as select * from example

statement ok
insert into example values( 1, 'test', 0.1 )

statement ok
insert into example values( 5, 'xtest', 0.9 )

statement ok
insert into example values( 9, 'testx', 9.1 )

statement ok
insert into example values( 0, 'texst', 99999.1 )

statement ok
insert into example values( 8, 'texxst', 0.0001 )

statement ok
COMMIT

query ITR rowsort
select * from example order by val1, val2
----
0
texst
99999.100
1
test
0.100
5
xtest
0.900
8
texxst
0.000
9
testx
9.100

query ITR rowsort
select * from example_view order by val1, val2
----
0
texst
99999.100
1
test
0.100
5
xtest
0.900
8
texxst
0.000
9
testx
9.100

statement ok
drop view example_view

statement ok
drop table example

