statement ok
CREATE TABLE tmp (initial integer)

statement ok
ALTER TABLE tmp ADD COLUMN a integer default 3

statement ok
ALTER TABLE tmp ADD COLUMN b string

statement ok
ALTER TABLE tmp ADD COLUMN c text

statement ok
ALTER TABLE tmp ADD COLUMN d double

statement ok
ALTER TABLE tmp ADD COLUMN e float

statement ok
ALTER TABLE tmp ADD COLUMN f smallint

statement ok
ALTER TABLE tmp ADD COLUMN g string

statement ok
ALTER TABLE tmp ADD COLUMN h string

statement ok
ALTER TABLE tmp ADD COLUMN i char

statement ok
ALTER TABLE tmp ADD COLUMN j string

statement ok
ALTER TABLE tmp ADD COLUMN k integer

statement ok
ALTER TABLE tmp ADD COLUMN l string

statement ok
ALTER TABLE tmp ADD COLUMN m string

statement ok
ALTER TABLE tmp ADD COLUMN n string

statement ok
ALTER TABLE tmp ADD COLUMN p string

statement ok
ALTER TABLE tmp ADD COLUMN q string

statement ok
ALTER TABLE tmp ADD COLUMN r string

statement ok
ALTER TABLE tmp ADD COLUMN s string

statement ok
ALTER TABLE tmp ADD COLUMN t string

statement ok
ALTER TABLE tmp ADD COLUMN u string

statement ok
ALTER TABLE tmp ADD COLUMN v timestamp

statement ok
ALTER TABLE tmp ADD COLUMN w interval second

statement ok
ALTER TABLE tmp ADD COLUMN x string

statement ok
ALTER TABLE tmp ADD COLUMN y string

statement ok
ALTER TABLE tmp ADD COLUMN z string

statement ok
INSERT INTO tmp (a, b, c, d, e, f, g, h, i, j, k, l, m, n, p, q, r, s, t, u,
	v, w, x, y, z)
   VALUES (4, 'name', 'text', 4.1, 4.1, 2, '(4.1,4.1,3.1,3.1)',
        'Mon May  1 00:30:30 1995', 'c', '{Mon May  1 00:30:30 1995, Monday Aug 24 14:43:07 1992, epoch}',
	314159, '(1,1)', '512',
	'1 2 3 4 5 6 7 8', 'magnetic disk', '(1.1,1.1)', '(4.1,4.1,3.1,3.1)',
	'(0,2,4.1,4.1,3.1,3.1)', '(4.1,4.1,3.1,3.1)', '["epoch" "infinity"]',
	cast('2014-11-14 16:27:15.0' as timestamp), '3610', '{1.0,2.0,3.0,4.0}', '{1.0,2.0,3.0,4.0}', '{1,2,3,4}')

query IITTRRITTTTITTTTTTTTTTTTTT rowsort
SELECT * FROM tmp
----
NULL
4
name
text
4.100
4.100
2
(4.1,4.1,3.1,3.1)
Mon May  1 00:30:30 1995
c
{Mon May  1 00:30:30 1995, Monday Aug 24 14:43:07 1992, epoch}
314159
(1,1)
512
1 2 3 4 5 6 7 8
magnetic disk
(1.1,1.1)
(4.1,4.1,3.1,3.1)
(0,2,4.1,4.1,3.1,3.1)
(4.1,4.1,3.1,3.1)
["epoch" "infinity"]
2014-11-14 16:27:15
1:00:10
{1.0,2.0,3.0,4.0}
{1.0,2.0,3.0,4.0}
{1,2,3,4}

statement ok
DROP TABLE tmp

statement ok
CREATE TABLE tmp (
	initial 	integer
)

statement ok
ALTER TABLE tmp ADD COLUMN a integer

statement ok
ALTER TABLE tmp ADD COLUMN b string

statement ok
ALTER TABLE tmp ADD COLUMN c text

statement ok
ALTER TABLE tmp ADD COLUMN d double

statement ok
ALTER TABLE tmp ADD COLUMN e float

statement ok
ALTER TABLE tmp ADD COLUMN f smallint

statement ok
ALTER TABLE tmp ADD COLUMN g string

statement ok
ALTER TABLE tmp ADD COLUMN h string

statement ok
ALTER TABLE tmp ADD COLUMN i char

statement ok
ALTER TABLE tmp ADD COLUMN j string

statement ok
ALTER TABLE tmp ADD COLUMN k integer

statement ok
ALTER TABLE tmp ADD COLUMN l string

statement ok
ALTER TABLE tmp ADD COLUMN m string

statement ok
ALTER TABLE tmp ADD COLUMN n string

statement ok
ALTER TABLE tmp ADD COLUMN p string

statement ok
ALTER TABLE tmp ADD COLUMN q string

statement ok
ALTER TABLE tmp ADD COLUMN r string

statement ok
ALTER TABLE tmp ADD COLUMN s string

statement ok
ALTER TABLE tmp ADD COLUMN t string

statement ok
ALTER TABLE tmp ADD COLUMN u string

statement ok
ALTER TABLE tmp ADD COLUMN v timestamp

statement ok
ALTER TABLE tmp ADD COLUMN w interval second

statement ok
ALTER TABLE tmp ADD COLUMN x string

statement ok
ALTER TABLE tmp ADD COLUMN y string

statement ok
ALTER TABLE tmp ADD COLUMN z string

statement ok
INSERT INTO tmp (a, b, c, d, e, f, g, h, i, j, k, l, m, n, p, q, r, s, t, u,
	v, w, x, y, z)
   VALUES (4, 'name', 'text', 4.1, 4.1, 2, '(4.1,4.1,3.1,3.1)',
        'Mon May  1 00:30:30 1995', 'c', '{Mon May  1 00:30:30 1995, Monday Aug 24 14:43:07 1992, epoch}',
	314159, '(1,1)', '512',
	'1 2 3 4 5 6 7 8', 'magnetic disk', '(1.1,1.1)', '(4.1,4.1,3.1,3.1)',
	'(0,2,4.1,4.1,3.1,3.1)', '(4.1,4.1,3.1,3.1)', '["epoch" "infinity"]',
	cast('2014-11-14 23:59:59.9' as timestamptz), '3610', '{1.0,2.0,3.0,4.0}', '{1.0,2.0,3.0,4.0}', '{1,2,3,4}')

query IITTRRITTTTITTTTTTTTTTTTTT rowsort
SELECT * FROM tmp
----
NULL
4
name
text
4.100
4.100
2
(4.1,4.1,3.1,3.1)
Mon May  1 00:30:30 1995
c
{Mon May  1 00:30:30 1995, Monday Aug 24 14:43:07 1992, epoch}
314159
(1,1)
512
1 2 3 4 5 6 7 8
magnetic disk
(1.1,1.1)
(4.1,4.1,3.1,3.1)
(0,2,4.1,4.1,3.1,3.1)
(4.1,4.1,3.1,3.1)
["epoch" "infinity"]
2014-11-14 23:59:59.900000
1:00:10
{1.0,2.0,3.0,4.0}
{1.0,2.0,3.0,4.0}
{1,2,3,4}

statement ok
DROP TABLE tmp

statement ok
CREATE TABLE tmp (regtable int)

statement ok
CREATE TEMP TABLE tmp (tmptable int)

statement ok
ALTER TABLE tmp RENAME TO tmp_new

query I rowsort
SELECT * FROM tmp
----

query I rowsort
SELECT * FROM tmp_new
----

statement ok
ALTER TABLE tmp RENAME TO tmp_new2

statement error
SELECT * FROM tmp

query I rowsort
SELECT * FROM tmp_new
----

query I rowsort
SELECT * FROM tmp_new2
----

statement ok
DROP TABLE tmp_new

statement ok
DROP TABLE tmp_new2

statement error
DROP TABLE tmp

statement error
ALTER INDEX onek_unique1 RENAME TO tmp_onek_unique1

statement error
ALTER INDEX tmp_onek_unique1 RENAME TO onek_unique1

statement ok
CREATE VIEW tmp_view (unique1) AS SELECT unique1 FROM tenk1

statement error
ALTER TABLE tmp_view RENAME TO tmp_view_new

statement error
ANALYZE tenk1

query I rowsort
SELECT unique1 FROM tenk1 WHERE unique1 < 5
----
0
1
2
3
4

statement error
DROP VIEW tmp_view_new

statement ok
alter table stud_emp rename to pg_toast_stud_emp

statement ok
alter table pg_toast_stud_emp rename to stud_emp

statement ok
CREATE TABLE tmp2 (a int primary key)

statement ok
CREATE TABLE tmp3 (a int, b int)

statement ok
CREATE TABLE tmp4 (a int, b int, unique(a,b))

statement ok
CREATE TABLE tmp5 (a int, b int)

statement ok
INSERT INTO tmp2 values (1)

statement ok
INSERT INTO tmp2 values (2)

statement ok
INSERT INTO tmp2 values (3)

statement ok
INSERT INTO tmp2 values (4)

statement ok
INSERT INTO tmp3 values (1,10)

statement ok
INSERT INTO tmp3 values (1,20)

statement ok
INSERT INTO tmp3 values (5,50)

statement error
ALTER TABLE tmp3 add constraint tmpconstr foreign key(c) references tmp2 match full

statement error
ALTER TABLE tmp3 add constraint tmpconstr foreign key(a) references tmp2(b) match full

statement error
ALTER TABLE tmp3 add constraint tmpconstr foreign key (a) references tmp2 match full

statement ok
DELETE FROM tmp3 where a=5

statement ok
ALTER TABLE tmp3 add constraint tmpconstr foreign key (a) references tmp2 match full

statement error
ALTER TABLE tmp5 add constraint tmpconstr foreign key(a) references tmp4(a) match full

statement ok
DROP TABLE tmp5

statement ok
DROP TABLE tmp4

statement ok
DROP TABLE tmp3

statement ok
DROP TABLE tmp2

statement ok
CREATE   TABLE PKTABLE (ptest1 int PRIMARY KEY)

statement ok
CREATE TEMP TABLE FKTABLE (ftest1 inet)

statement error
ALTER TABLE FKTABLE ADD FOREIGN KEY(ftest1) references pktable

statement error
ALTER TABLE FKTABLE ADD FOREIGN KEY(ftest1) references pktable(ptest1)

statement ok
DROP TABLE FKTABLE

statement ok
CREATE   TABLE FKTABLE (ftest1 varchar(10))

statement error
ALTER TABLE FKTABLE ADD FOREIGN KEY(ftest1) references pktable

statement error
ALTER TABLE FKTABLE ADD FOREIGN KEY(ftest1) references pktable(ptest1)

statement ok
DROP TABLE pktable cascade

statement ok
DROP TABLE fktable

statement ok
CREATE   TABLE PKTABLE (ptest1 int, ptest2 inet,
                           PRIMARY KEY(ptest1, ptest2))

statement ok
CREATE   TABLE FKTABLE (ftest1 inet, ftest2 timestamp)

statement error
ALTER TABLE FKTABLE ADD FOREIGN KEY(ftest1, ftest2) references pktable

statement ok
DROP TABLE FKTABLE

statement ok
CREATE    TABLE FKTABLE (ftest1 inet, ftest2 timestamp)

statement error
ALTER TABLE FKTABLE ADD FOREIGN KEY(ftest1, ftest2)
     references pktable(ptest1, ptest2)

statement ok
DROP TABLE FKTABLE

statement ok
CREATE   TABLE FKTABLE (ftest1 int, ftest2 inet)

statement error
ALTER TABLE FKTABLE ADD FOREIGN KEY(ftest1, ftest2)
     references pktable(ptest2, ptest1)

statement error
ALTER TABLE FKTABLE ADD FOREIGN KEY(ftest2, ftest1)
     references pktable(ptest1, ptest2)

statement ok
DROP TABLE FKTABLE

statement ok
DROP TABLE PKTABLE cascade

statement ok
create table atacc1 ( test int )

statement error
alter table atacc1 add constraint atacc_test1 check (test>3)

statement ok
insert into atacc1 (test) values (2)

statement ok
insert into atacc1 (test) values (4)

statement ok
drop table atacc1

statement ok
create table atacc1 ( test int )

statement ok
insert into atacc1 (test) values (2)

statement error
alter table atacc1 add constraint atacc_test1 check (test>3)

statement ok
insert into atacc1 (test) values (4)

statement ok
drop table atacc1

statement ok
create table atacc1 ( test int )

statement error
alter table atacc1 add constraint atacc_test1 check (test1>3)

statement ok
drop table atacc1

statement ok
create table atacc1 ( test int, test2 int, test3 int)

statement error
alter table atacc1 add constraint atacc_test1 check (test+test2<test3*4)

statement ok
insert into atacc1 (test,test2,test3) values (4,4,2)

statement ok
insert into atacc1 (test,test2,test3) values (4,4,5)

statement ok
drop table atacc1

statement error
create table atacc1 (test int check (test>3), test2 int)

statement error
alter table atacc1 add check (test2>test)

statement error
insert into atacc1 (test2, test) values (3, 4)

statement error
drop table atacc1

statement ok
create table atacc1 (test int)

statement ok
create table atacc2 (test2 int)

statement ok
create table atacc3 (test int, test2 int, test3 int)

statement error
alter table atacc2 add constraint foo check (test2>0)

statement ok
insert into atacc2 (test2) values (-3)

statement ok
insert into atacc2 (test2) values (3)

statement ok
insert into atacc3 (test2) values (-3)

statement ok
insert into atacc3 (test2) values (3)

statement ok
drop table atacc3

statement ok
drop table atacc2

statement ok
drop table atacc1

statement ok
create table atacc1 (test int)

statement ok
create table atacc2 (test2 int)

statement ok
create table atacc3 (test int, test2 int, test3 int)

statement error
alter table   atacc2 add constraint foo check (test2>0)

statement ok
insert into atacc2 (test2) values (-3)

statement ok
insert into atacc2 (test2) values (3)

statement ok
insert into atacc3 (test2) values (-3)

statement ok
insert into atacc3 (test2) values (3)

statement ok
drop table atacc3

statement ok
drop table atacc2

statement ok
drop table atacc1

statement ok
create table atacc1 ( test int )

statement ok
alter table atacc1 add constraint atacc_test1 unique (test)

statement ok
insert into atacc1 (test) values (2)

statement error
insert into atacc1 (test) values (2)

statement ok
insert into atacc1 (test) values (4)

statement ok
drop table atacc1

statement ok
create table atacc1 ( test int )

statement ok
insert into atacc1 (test) values (2)

statement ok
insert into atacc1 (test) values (2)

statement error
alter table atacc1 add constraint atacc_test1 unique (test)

statement ok
insert into atacc1 (test) values (3)

statement ok
drop table atacc1

statement ok
create table atacc1 ( test int )

statement error
alter table atacc1 add constraint atacc_test1 unique (test1)

statement ok
drop table atacc1

statement ok
create table atacc1 ( test int, test2 int)

statement ok
alter table atacc1 add constraint atacc_test1 unique (test, test2)

statement ok
insert into atacc1 (test,test2) values (4,4)

statement error
insert into atacc1 (test,test2) values (4,4)

statement ok
insert into atacc1 (test,test2) values (4,5)

statement ok
insert into atacc1 (test,test2) values (5,4)

statement ok
insert into atacc1 (test,test2) values (5,5)

statement ok
alter table atacc1 drop constraint atacc_test1

statement ok
drop table atacc1

statement ok
create table atacc1 (test int, test2 int, unique(test))

statement ok
alter table atacc1 add unique (test2)

statement ok
insert into atacc1 (test2, test) values (3, 3)

statement error
insert into atacc1 (test2, test) values (2, 3)

statement ok
drop table atacc1

statement ok
create table atacc1 ( test int )

statement ok
alter table atacc1 add constraint atacc_test1 primary key (test)

statement ok
insert into atacc1 (test) values (2)

statement error
insert into atacc1 (test) values (2)

statement ok
insert into atacc1 (test) values (4)

statement error
insert into atacc1 (test) values(NULL)

statement ok
alter table atacc1 drop constraint atacc_test1 restrict

statement ok
alter table atacc1 add constraint atacc_test1 primary key (test)

statement ok
drop table atacc1

statement ok
create table atacc1 ( test int )

statement ok
insert into atacc1 (test) values (2)

statement ok
insert into atacc1 (test) values (2)

statement error
alter table atacc1 add constraint atacc_test1 primary key (test)

statement ok
insert into atacc1 (test) values (3)

statement ok
delete from atacc1 where test = 2

statement ok
alter table atacc1 add constraint atacc_test1 primary key (test)

statement ok
drop table atacc1

statement ok
create table atacc1 ( test int )

statement ok
insert into atacc1 (test) values (NULL)

statement error
alter table atacc1 add constraint atacc_test1 primary key (test)

statement ok
insert into atacc1 (test) values (3)

statement ok
drop table atacc1

statement ok
create table atacc1 ( test int )

statement error
alter table atacc1 add constraint atacc_test1 primary key (test1)

statement ok
drop table atacc1

statement ok
create table atacc1 ( test int, test2 int)

statement ok
alter table atacc1 add constraint atacc_test1 primary key (test, test2)

statement error
alter table atacc1 add constraint atacc_test2 primary key (test)

statement ok
insert into atacc1 (test,test2) values (4,4)

statement error
insert into atacc1 (test,test2) values (4,4)

statement error
insert into atacc1 (test,test2) values (NULL,3)

statement error
insert into atacc1 (test,test2) values (3, NULL)

statement error
insert into atacc1 (test,test2) values (NULL,NULL)

statement ok
insert into atacc1 (test,test2) values (4,5)

statement ok
insert into atacc1 (test,test2) values (5,4)

statement ok
insert into atacc1 (test,test2) values (5,5)

statement ok
drop table atacc1

statement ok
create table atacc1 (test int, test2 int, primary key(test))

statement ok
insert into atacc1 (test2, test) values (3, 3)

statement error
insert into atacc1 (test2, test) values (2, 3)

statement error
insert into atacc1 (test2, test) values (1, NULL)

statement ok
drop table atacc1

statement error
alter table pg_class alter column relname drop not null

statement error
alter table pg_class alter relname set not null

statement error
alter table non_existent alter column bar set not null

statement error
alter table non_existent alter column bar drop not null

statement ok
create table atacc1 (test int not null)

statement ok
alter table atacc1 add constraint "atacc1_pkey" primary key (test)

statement error
alter table atacc1 alter column test drop not null

statement ok
alter table atacc1 drop constraint "atacc1_pkey"

statement error
alter table atacc1 alter column test drop not null

statement ok
alter table atacc1 alter test set null

statement ok
insert into atacc1 values (null)

statement error
alter table atacc1 alter test set not null

query I rowsort
select * from atacc1
----
NULL

statement ok
delete from atacc1

statement ok
alter table atacc1 alter test set not null

statement error
alter table atacc1 alter bar set not null

statement error
alter table atacc1 alter bar drop not null

statement ok
create view myview as select * from atacc1

statement error
alter table myview alter column test drop not null

statement error
alter table myview alter column test set not null

statement ok
drop view myview

statement ok
drop table atacc1

statement ok
create table parent (a int)

statement ok
create table child (a int, b varchar(255))

statement ok
alter table parent alter a set not null

statement error
insert into parent values (NULL)

statement ok
insert into child (a, b) values (NULL, 'foo')

statement error
alter table parent alter a drop not null

statement error
insert into parent values (NULL)

statement ok
insert into child (a, b) values (NULL, 'foo')

statement ok
alter table   parent alter a set not null

statement error
alter table child alter a set not null

statement ok
delete from parent

statement ok
alter table   parent alter a set not null

statement error
insert into parent values (NULL)

statement error
alter table child alter a set not null

statement ok
insert into child (a, b) values (NULL, 'foo')

statement ok
delete from child

statement ok
alter table child alter a set not null

statement error
insert into child (a, b) values (NULL, 'foo')

statement ok
drop table child

statement ok
drop table parent

statement ok
create table def_test (
	c1	integer default 5,
	c2	text default 'initial_default'
)

statement ok
insert into def_test default values

query IT rowsort
select * from def_test
----
5
initial_default

statement ok
alter table def_test alter column c1 drop default

statement ok
insert into def_test default values

query IT rowsort
select * from def_test
----
5
initial_default
NULL
initial_default

statement ok
alter table def_test alter column c2 drop default

statement ok
insert into def_test default values

query IT rowsort
select * from def_test
----
5
initial_default
NULL
NULL
NULL
initial_default

statement ok
alter table def_test alter column c1 set default 10

statement ok
alter table def_test alter column c2 set default 'new_default'

statement ok
insert into def_test default values

query IT rowsort
select * from def_test
----
10
new_default
5
initial_default
NULL
NULL
NULL
initial_default

statement ok
alter table def_test alter column c1 set default 'wrong_datatype'

statement ok
alter table def_test alter column c2 set default 20

statement error
alter table def_test alter column c3 set default 30

statement ok
create view def_view_test as select * from def_test

statement error
create rule def_view_test_ins as
	on insert to def_view_test
	do instead insert into def_test select new.*

statement error
insert into def_view_test default values

statement error
alter table def_view_test alter column c1 set default 45

statement error
insert into def_view_test default values

statement error
alter table def_view_test alter column c2 set default 'view_default'

statement error
insert into def_view_test default values

query IT rowsort
select * from def_view_test
----
10
new_default
5
initial_default
NULL
NULL
NULL
initial_default

statement error
drop rule def_view_test_ins on def_view_test

statement ok
drop view def_view_test

statement ok
drop table def_test

statement error
alter table pg_class drop column relname

statement error
alter table nosuchtable drop column bar

statement ok
create table atacc1 (a integer not null, b integer, c integer not null, d integer)

statement ok
insert into atacc1 values (1, 2, 3, 4)

statement ok
alter table atacc1 drop a

statement error
alter table atacc1 drop a

query III rowsort
select * from atacc1
----
2
3
4

statement error
select * from atacc1 order by a

statement error
select * from atacc1 order by "........pg.dropped.1........"

statement error
select * from atacc1 group by a

statement error
select * from atacc1 group by "........pg.dropped.1........"

query III rowsort
select atacc1.* from atacc1
----
2
3
4

statement error
select a from atacc1

statement error
select atacc1.a from atacc1

query III rowsort
select b,c,d from atacc1
----
2
3
4

statement error
select a,b,c,d from atacc1

statement error
select * from atacc1 where a = 1

statement error
select "........pg.dropped.1........" from atacc1

statement error
select atacc1."........pg.dropped.1........" from atacc1

statement error
select "........pg.dropped.1........",b,c,d from atacc1

statement error
select * from atacc1 where "........pg.dropped.1........" = 1

statement error
update atacc1 set a = 3

statement error
update atacc1 set b = 2 where a = 3

statement error
update atacc1 set "........pg.dropped.1........" = 3

statement error
update atacc1 set b = 2 where "........pg.dropped.1........" = 3

statement error
insert into atacc1 values (10, 11, 12, 13)

statement error
insert into atacc1 values (default, 11, 12, 13)

statement ok
insert into atacc1 values (11, 12, 13)

statement error
insert into atacc1 (a) values (10)

statement error
insert into atacc1 (a) values (default)

statement error
insert into atacc1 (a,b,c,d) values (10,11,12,13)

statement error
insert into atacc1 (a,b,c,d) values (default,11,12,13)

statement ok
insert into atacc1 (b,c,d) values (11,12,13)

statement error
insert into atacc1 ("........pg.dropped.1........") values (10)

statement error
insert into atacc1 ("........pg.dropped.1........") values (default)

statement error
insert into atacc1 ("........pg.dropped.1........",b,c,d) values (10,11,12,13)

statement error
insert into atacc1 ("........pg.dropped.1........",b,c,d) values (default,11,12,13)

statement error
delete from atacc1 where a = 3

statement error
delete from atacc1 where "........pg.dropped.1........" = 3

statement ok
delete from atacc1

statement error
alter table atacc1 drop bar

statement error
alter table atacc1 drop xmin

statement ok
create view myview as select * from atacc1

query III rowsort
select * from myview
----

statement error
alter table myview drop d

statement ok
drop view myview

statement error
analyze atacc1(a)

statement error
analyze atacc1("........pg.dropped.1........")

statement ok
call analyze(0, 0, 'sys', 'atacc1')

statement error
alter table atacc1 alter a set storage plain

statement error
alter table atacc1 alter "........pg.dropped.1........" set storage plain

statement error
alter table atacc1 alter a set statistics 0

statement error
alter table atacc1 alter "........pg.dropped.1........" set statistics 0

statement error
alter table atacc1 alter a set default 3

statement error
alter table atacc1 alter "........pg.dropped.1........" set default 3

statement error
alter table atacc1 alter a drop default

statement error
alter table atacc1 alter "........pg.dropped.1........" drop default

statement error
alter table atacc1 alter a set not null

statement error
alter table atacc1 alter "........pg.dropped.1........" set not null

statement error
alter table atacc1 alter a drop not null

statement error
alter table atacc1 alter "........pg.dropped.1........" drop not null

statement error
alter table atacc1 rename a to x

statement error
alter table atacc1 rename "........pg.dropped.1........" to x

statement error
alter table atacc1 add primary key(a)

statement error
alter table atacc1 add primary key("........pg.dropped.1........")

statement error
alter table atacc1 add unique(a)

statement error
alter table atacc1 add unique("........pg.dropped.1........")

statement error
alter table atacc1 add check (a > 3)

statement error
alter table atacc1 add check ("........pg.dropped.1........" > 3)

statement ok
create table atacc2 (id integer unique)

statement error
alter table atacc1 add foreign key (a) references atacc2(id)

statement error
alter table atacc1 add foreign key ("........pg.dropped.1........") references atacc2(id)

statement error
alter table atacc2 add foreign key (id) references atacc1(a)

statement error
alter table atacc2 add foreign key (id) references atacc1("........pg.dropped.1........")

statement ok
drop table atacc2

statement error
create index "testing_idx" on atacc1(a)

statement error
create index "testing_idx" on atacc1("........pg.dropped.1........")

statement ok
insert into atacc1 values (21, 22, 23)

statement ok
create table test1 as select * from atacc1 WITH DATA

query III rowsort
select * from test1
----
21
22
23

statement ok
drop table test1

statement error
select * into test2 from atacc1

statement error
select * from test2

statement error
drop table test2

statement ok
alter table atacc1 drop c

statement ok
alter table atacc1 drop d

statement error
alter table atacc1 drop b

query I rowsort
select * from atacc1
----
21

statement ok
drop table atacc1

statement ok
create table parent (a int, b int, c int)

statement ok
insert into parent values (1, 2, 3)

statement ok
alter table parent drop a

statement ok
create table child (b int, c int, d varchar(255))

statement ok
insert into child values (12, 13, 'testing')

query II rowsort
select * from parent
----
2
3

query IIT rowsort
select * from child
----
12
13
testing

statement ok
alter table parent drop c

query I rowsort
select * from parent
----
2

query IIT rowsort
select * from child
----
12
13
testing

statement ok
drop table child

statement ok
drop table parent

statement ok
create table test (a integer, b integer, c integer)

statement ok
insert into test values (1,2,3)

statement ok
alter table test drop a

statement error
copy test to stdout

statement error
copy test(a) to stdout

statement error
copy test("........pg.dropped.1........") to stdout

statement error
copy test from stdin
<COPY_INTO_DATA>
10	11	12
\.
select * from test;
copy test from stdin;
21	22
\.
select * from test;
copy test(a) from stdin;
copy test("........pg.dropped.1........") from stdin;
copy test(b,c) from stdin;
31	32
\.
select * from test;
drop table test;

statement ok
create table dropColumn (a int, b int, e int)

statement ok
create table dropColumnChild (a int, b int, e int, c int)

statement ok
create table dropColumnAnother (a int, b int, e int, c int, d int)

statement ok
alter table dropColumnchild drop column a

statement ok
alter table   dropColumnChild drop column b

statement ok
alter table   dropColumn drop column e

statement ok
alter table dropColumnChild drop column c

statement ok
alter table dropColumn drop column a

statement ok
drop table dropColumnAnother

statement ok
drop table dropColumnChild

statement ok
drop table dropColumn

statement ok
create table renameColumn (a int)

statement ok
create table renameColumnChild (a int, b int)

statement ok
create table renameColumnAnother (a int, b int, c int)

statement ok
alter table renameColumnChild rename column a to d

statement error
alter table   renameColumnChild rename column a to d

statement ok
alter table   renameColumn rename column a to d

statement error
alter table renameColumn rename column a to d

statement ok
alter table renameColumnChild rename column b to a

statement ok
alter table renameColumn add column w int

statement ok
alter table   renameColumn add column x int

statement ok
drop table renameColumn cascade

statement ok
drop table renameColumnChild cascade

statement ok
drop table renameColumnAnother cascade

statement ok
create table p1 (f1 int, f2 int)

statement ok
create table c1 (f2 int, f1 int not null)

statement ok
alter table c1 drop column f1

statement ok
alter table p1 drop column f1

statement error
select f1 from c1

statement error
alter table c1 drop column f1

statement error
select f1 from c1

statement ok
drop table c1

statement ok
drop table p1 cascade

statement ok
create table p1 (f1 int, f2 int)

statement ok
create table c1 (f1 int, f2 int)

statement ok
alter table c1 drop column f1

statement ok
alter table p1 drop column f1

statement error
select f1 from c1

statement ok
drop table c1

statement ok
drop table p1 cascade

statement ok
create table p1 (f1 int, f2 int)

statement ok
create table c1 (f1 int, f2 int)

statement ok
alter table c1 drop column f1

statement ok
alter table   p1 drop column f1

statement error
alter table c1 drop column f1

statement ok
drop table c1

statement ok
drop table p1 cascade

statement ok
create table p1 (f1 int, f2 int)

statement ok
create table c1 (f1 int not null, f2 int)

statement ok
alter table c1 drop column f1

statement ok
alter table   p1 drop column f1

statement error
alter table c1 drop column f1

statement ok
drop table c1

statement ok
drop table p1 cascade

statement ok
create table p1(id int, name text)

statement ok
create table p2(id2 int, name text, height int)

statement ok
create table c1(age int, id int, name text)

statement ok
create table gc1(age int, id int, name text)

statement ok
alter table   p1 drop column name

statement ok
alter table p2 drop column name

statement ok
alter table gc1 drop column name

statement ok
alter table c1 drop column name

statement error
alter table gc1 drop column name

statement ok
alter table p2 drop column height

statement ok
drop table c1

statement ok
drop table p2 cascade

statement ok
drop table p1 cascade

statement ok
create table p1 (f1 int)

statement ok
create table c1 (f1 int, f2 text, f3 int)

statement error
alter table p1 add column a1 int check (a1 > 0)

statement ok
alter table p1 add column f2 text

statement error
insert into p1 values (1,2,'abc')

statement error
insert into c1 values(11,'xyz',33,0)

statement error
insert into c1 values(11,'xyz',33,22)

query IT rowsort
select * from p1
----

statement error
update p1 set a1 = a1 + 1, f2 = upper(f2)

query IT rowsort
select * from p1
----

statement ok
drop table c1 cascade

statement ok
drop table p1 cascade

statement error
create domain mytype as text

statement error
create temp table foo (f1 text, f2 mytype, f3 text)

statement ok
create temp table foo (f1 text, f2 text, f3 text) on commit preserve rows

statement ok
insert into foo values('aa','bb','cc')

query TTT rowsort
select * from foo
----
aa
bb
cc

statement error
drop domain mytype cascade

statement error
alter table foo drop column f2

query TTT rowsort
select * from foo
----
aa
bb
cc

statement ok
insert into foo (f1, f3) values('qq','rr')

query TTT rowsort
select * from foo
----
aa
bb
cc
qq
NULL
rr

statement ok
update foo set f3 = 'zz'

query TTT rowsort
select * from foo
----
aa
bb
zz
qq
NULL
zz

query TT rowsort
select f3,max(f1) from foo group by f3
----
zz
qq

statement error
alter table foo alter f1 TYPE integer

statement error
alter table foo alter f1 TYPE varchar(10)

statement ok
drop table foo

statement error
create table anothertab (atcol1 bigint GENERATED ALWAYS AS IDENTITY check (atcol1 <= 3), atcol2 boolean)

statement error
insert into anothertab (atcol1, atcol2) values (default, true)

statement error
insert into anothertab (atcol1, atcol2) values (default, false)

statement error
insert into anothertab (atcol2) values (true)

statement error
insert into anothertab (atcol2) values (false)

statement error
select * from anothertab

statement error
alter table anothertab alter column atcol1 type boolean

statement error
alter table anothertab alter column atcol1 type integer

statement error
select * from anothertab

statement error
insert into anothertab (atcol1, atcol2) values (45, null)

statement error
insert into anothertab (atcol1, atcol2) values (default, null)

statement error
insert into anothertab (atcol2) values (null)

statement error
select * from anothertab

statement error
alter table anothertab alter column atcol2 type text
      using case when atcol2 is true then 'IT WAS TRUE'
                 when atcol2 is false then 'IT WAS FALSE'
                 else 'IT WAS NULL!' COMMIT

statement error
select * from anothertab

statement error
alter table anothertab alter column atcol1 type boolean
        using case when atcol1 % 2 = 0 then true else false COMMIT

statement error
alter table anothertab alter column atcol1 drop default

statement error
alter table anothertab alter column atcol1 type boolean
        using case when atcol1 % 2 = 0 then true else false COMMIT

statement error
alter table anothertab drop constraint anothertab_chk

statement error
alter table anothertab alter column atcol1 type boolean
        using case when atcol1 % 2 = 0 then true else false COMMIT

statement error
select * from anothertab

statement error
drop table anothertab

statement ok
create table another (f1 int, f2 text)

statement ok
insert into another values(1, 'one')

statement ok
insert into another values(2, 'two')

statement ok
insert into another values(3, 'three')

query IT rowsort
select * from another
----
1
one
2
two
3
three

statement error
alter table another
  alter f1 type text using f2 || ' more',
  alter f2 type bigint using f1 * 10

query IT rowsort
select * from another
----
1
one
2
two
3
three

statement ok
drop table another

