statement ok
CREATE TABLE FLOAT8_TBL(f1 double)

statement ok
INSERT INTO FLOAT8_TBL(f1) VALUES ('    0.0   ')

statement ok
INSERT INTO FLOAT8_TBL(f1) VALUES ('1004.30  ')

statement ok
INSERT INTO FLOAT8_TBL(f1) VALUES ('   -34.84')

statement ok
INSERT INTO FLOAT8_TBL(f1) VALUES ('1.2345678901234e+200')

statement ok
INSERT INTO FLOAT8_TBL(f1) VALUES ('1.2345678901234e-200')

statement error
SELECT cast('10e400' as double)

statement error
SELECT cast('-10e400' as double)

query R rowsort
SELECT cast('10e-400' as double)
----
0.000

query R rowsort
SELECT cast('-10e-400' as double)
----
-0.000

statement error
INSERT INTO FLOAT8_TBL(f1) VALUES ('     ')

statement error
INSERT INTO FLOAT8_TBL(f1) VALUES ('xyz')

statement error
INSERT INTO FLOAT8_TBL(f1) VALUES ('5.0.0')

statement error
INSERT INTO FLOAT8_TBL(f1) VALUES ('5 . 0')

statement error
INSERT INTO FLOAT8_TBL(f1) VALUES ('5.   0')

statement error
INSERT INTO FLOAT8_TBL(f1) VALUES ('    - 3')

statement error
INSERT INTO FLOAT8_TBL(f1) VALUES ('123           5')

statement error
SELECT cast('NaN' as double)

statement error
SELECT cast('nan' as double)

statement error
SELECT cast('   NAN  ' as double)

statement error
SELECT cast('infinity' as double)

statement error
SELECT cast('          -INFINiTY   ' as double)

statement error
SELECT cast('N A N' as double)

statement error
SELECT cast('NaN x' as double)

statement error
SELECT cast(' INFINITY    x' as double)

statement error
SELECT cast('Infinity' as double) + 100.0

statement error
SELECT cast('Infinity' as double) / cast('Infinity' as double)

statement error
SELECT cast('nan' as double) / cast('nan' as double)

query TR rowsort
SELECT '' AS five, FLOAT8_TBL.* FROM FLOAT8_TBL
----
(empty)
-34.840
(empty)
0.000
(empty)
0.000
(empty)
1004.300
(empty)
123456789012339998178055383778200200677029538578556143779522728938091625064448320947338361845446375953513236661280206676435709550555887864880290298685218909703795934625015156010452441377150897232019456.000

query TR rowsort
SELECT '' AS four, f.* FROM FLOAT8_TBL f WHERE f.f1 <> '1004.3'
----
(empty)
-34.840
(empty)
0.000
(empty)
0.000
(empty)
123456789012339998178055383778200200677029538578556143779522728938091625064448320947338361845446375953513236661280206676435709550555887864880290298685218909703795934625015156010452441377150897232019456.000

query TR rowsort
SELECT '' AS one, f.* FROM FLOAT8_TBL f WHERE f.f1 = '1004.3'
----
(empty)
1004.300

query TR rowsort
SELECT '' AS three, f.* FROM FLOAT8_TBL f WHERE '1004.3' > f.f1
----
(empty)
-34.840
(empty)
0.000
(empty)
0.000

query TR rowsort
SELECT '' AS three, f.* FROM FLOAT8_TBL f WHERE  f.f1 < '1004.3'
----
(empty)
-34.840
(empty)
0.000
(empty)
0.000

query TR rowsort
SELECT '' AS four, f.* FROM FLOAT8_TBL f WHERE '1004.3' >= f.f1
----
(empty)
-34.840
(empty)
0.000
(empty)
0.000
(empty)
1004.300

query TR rowsort
SELECT '' AS four, f.* FROM FLOAT8_TBL f WHERE  f.f1 <= '1004.3'
----
(empty)
-34.840
(empty)
0.000
(empty)
0.000
(empty)
1004.300

query TRR rowsort
SELECT '' AS three, f.f1, f.f1 * '-10' AS x
   FROM FLOAT8_TBL f
   WHERE f.f1 > '0.0'
----
(empty)
0.000
-0.000
(empty)
1004.300
-10043.000
(empty)
123456789012339998178055383778200200677029538578556143779522728938091625064448320947338361845446375953513236661280206676435709550555887864880290298685218909703795934625015156010452441377150897232019456.000
-1234567890123399913794890757235813374503004947069577139607308220320830081115633519821727956265376688922332076663453501146522921266006748684440747767305662452619402064126970511294121746841176936258994176.000

query TRR rowsort
SELECT '' AS three, f.f1, f.f1 + '-10' AS x
   FROM FLOAT8_TBL f
   WHERE f.f1 > '0.0'
----
(empty)
0.000
-10.000
(empty)
1004.300
994.300
(empty)
123456789012339998178055383778200200677029538578556143779522728938091625064448320947338361845446375953513236661280206676435709550555887864880290298685218909703795934625015156010452441377150897232019456.000
123456789012339998178055383778200200677029538578556143779522728938091625064448320947338361845446375953513236661280206676435709550555887864880290298685218909703795934625015156010452441377150897232019456.000

query TRR rowsort
SELECT '' AS three, f.f1, f.f1 / '-10' AS x
   FROM FLOAT8_TBL f
   WHERE f.f1 > '0.0'
----
(empty)
0.000
-0.000
(empty)
1004.300
-100.430
(empty)
123456789012339998178055383778200200677029538578556143779522728938091625064448320947338361845446375953513236661280206676435709550555887864880290298685218909703795934625015156010452441377150897232019456.000
-12345678901234000242715932631233699019373519099830516241626767075434701066000142655056684073226431786681325478311449202755034544052789598765292499990687682497995576475771397156110260806029664948584448.000

query TRR rowsort
SELECT '' AS three, f.f1, f.f1 - '-10' AS x
   FROM FLOAT8_TBL f
   WHERE f.f1 > '0.0'
----
(empty)
0.000
10.000
(empty)
1004.300
1014.300
(empty)
123456789012339998178055383778200200677029538578556143779522728938091625064448320947338361845446375953513236661280206676435709550555887864880290298685218909703795934625015156010452441377150897232019456.000
123456789012339998178055383778200200677029538578556143779522728938091625064448320947338361845446375953513236661280206676435709550555887864880290298685218909703795934625015156010452441377150897232019456.000

query TRR rowsort
SELECT '' AS five, f.f1, abs(f1) AS abs_f1
   FROM FLOAT8_TBL f
----
(empty)
-34.840
34.840
(empty)
0.000
0.000
(empty)
0.000
0.000
(empty)
1004.300
1004.300
(empty)
123456789012339998178055383778200200677029538578556143779522728938091625064448320947338361845446375953513236661280206676435709550555887864880290298685218909703795934625015156010452441377150897232019456.000
123456789012339998178055383778200200677029538578556143779522728938091625064448320947338361845446375953513236661280206676435709550555887864880290298685218909703795934625015156010452441377150897232019456.000

statement error
SELECT '' AS five, f.f1, truncate(f1) AS trunc_f1
   FROM FLOAT8_TBL f

query TRR rowsort
SELECT '' AS five, f.f1, round(f.f1, 0) AS round_f1
   FROM FLOAT8_TBL f
----
(empty)
-34.840
-35.000
(empty)
0.000
0.000
(empty)
0.000
0.000
(empty)
1004.300
1004.000
(empty)
123456789012339998178055383778200200677029538578556143779522728938091625064448320947338361845446375953513236661280206676435709550555887864880290298685218909703795934625015156010452441377150897232019456.000
123456789012339998178055383778200200677029538578556143779522728938091625064448320947338361845446375953513236661280206676435709550555887864880290298685218909703795934625015156010452441377150897232019456.000

query R rowsort
select ceil(f1) as ceil_f1 from float8_tbl f
----
-34.000
0.000
1.000
1005.000
123456789012339998178055383778200200677029538578556143779522728938091625064448320947338361845446375953513236661280206676435709550555887864880290298685218909703795934625015156010452441377150897232019456.000

query R rowsort
select ceiling(f1) as ceiling_f1 from float8_tbl f
----
-34.000
0.000
1.000
1005.000
123456789012339998178055383778200200677029538578556143779522728938091625064448320947338361845446375953513236661280206676435709550555887864880290298685218909703795934625015156010452441377150897232019456.000

query R rowsort
select floor(f1) as floor_f1 from float8_tbl f
----
-35.000
0.000
0.000
1004.000
123456789012339998178055383778200200677029538578556143779522728938091625064448320947338361845446375953513236661280206676435709550555887864880290298685218909703795934625015156010452441377150897232019456.000

query I rowsort
select sign(f1) as sign_f1 from float8_tbl f
----
-1
0
1
1
1

query R rowsort
SELECT sqrt(cast('64' as double)) AS eight
----
8.000

statement error
SELECT |/ cast('64' as double) AS eight

statement error
SELECT '' AS three, f.f1, |/f.f1 AS sqrt_f1
   FROM FLOAT8_TBL f
   WHERE f.f1 > '0.0'

query TRR rowsort
SELECT '' AS three, f.f1, sqrt(f.f1) AS sqrt_f1
   FROM FLOAT8_TBL f
   WHERE f.f1 > '0.0'
----
(empty)
0.000
0.000
(empty)
1004.300
31.691
(empty)
123456789012339998178055383778200200677029538578556143779522728938091625064448320947338361845446375953513236661280206676435709550555887864880290298685218909703795934625015156010452441377150897232019456.000
11111111061110855832475960131515802919230774013133302736783987266313218340995733875581840744471592960.000

query R rowsort
SELECT power(cast('144' as double), cast('0.5' as double))
----
12.000

query TRR rowsort
SELECT '' AS three, f.f1, exp(ln(f.f1)) AS exp_ln_f1
   FROM FLOAT8_TBL f
   WHERE f.f1 > '0.0'
----
(empty)
0.000
0.000
(empty)
1004.300
1004.300
(empty)
123456789012339998178055383778200200677029538578556143779522728938091625064448320947338361845446375953513236661280206676435709550555887864880290298685218909703795934625015156010452441377150897232019456.000
123456789012337907618915656982899758457848548062038974501011355340441912052320364158926749531018954609904320718811813928034851684327891460744017297629524593833159509337197905090570433269440788350107648.000

statement error
SELECT ||/ cast('27' as double) AS three

statement error
SELECT '' AS five, f.f1, ||/f.f1 AS cbrt_f1 FROM FLOAT8_TBL f

query TR rowsort
SELECT '' AS five, * FROM FLOAT8_TBL
----
(empty)
-34.840
(empty)
0.000
(empty)
0.000
(empty)
1004.300
(empty)
123456789012339998178055383778200200677029538578556143779522728938091625064448320947338361845446375953513236661280206676435709550555887864880290298685218909703795934625015156010452441377150897232019456.000

statement ok
UPDATE FLOAT8_TBL
   SET f1 = FLOAT8_TBL.f1 * '-1'
   WHERE FLOAT8_TBL.f1 > '0.0'

statement error
SELECT '' AS bad, f.f1 * '1e200' from FLOAT8_TBL f

statement error
SELECT '' AS bad, f.f1 ^ '3' from FLOAT8_TBL f

query TR rowsort
SELECT '' AS bad, log(-f.f1) from FLOAT8_TBL f where f.f1 < '0.0' 
----
(empty)
-460.306
(empty)
3.551
(empty)
460.728
(empty)
6.912

query TR rowsort
SELECT '' AS bad, exp(-f.f1) from FLOAT8_TBL f where f.f1 > '-1000.0'
----
(empty)
1.000
(empty)
1.000
(empty)
1351511512605753.000

statement error
SELECT '' AS bad, f.f1 / '0.0' from FLOAT8_TBL f

query TR rowsort
SELECT '' AS five, * FROM FLOAT8_TBL
----
(empty)
-0.000
(empty)
-1004.300
(empty)
-123456789012339998178055383778200200677029538578556143779522728938091625064448320947338361845446375953513236661280206676435709550555887864880290298685218909703795934625015156010452441377150897232019456.000
(empty)
-34.840
(empty)
0.000

statement error
INSERT INTO FLOAT8_TBL(f1) VALUES ('10e400')

statement error
INSERT INTO FLOAT8_TBL(f1) VALUES ('-10e400')

statement ok
INSERT INTO FLOAT8_TBL(f1) VALUES ('10e-400')

statement ok
INSERT INTO FLOAT8_TBL(f1) VALUES ('-10e-400')

statement ok
DELETE FROM FLOAT8_TBL

statement ok
INSERT INTO FLOAT8_TBL(f1) VALUES ('0.0')

statement ok
INSERT INTO FLOAT8_TBL(f1) VALUES ('-34.84')

statement ok
INSERT INTO FLOAT8_TBL(f1) VALUES ('-1004.30')

statement ok
INSERT INTO FLOAT8_TBL(f1) VALUES ('-1.2345678901234e+200')

statement ok
INSERT INTO FLOAT8_TBL(f1) VALUES ('-1.2345678901234e-200')

query TR rowsort
SELECT '' AS five, * FROM FLOAT8_TBL
----
(empty)
-0.000
(empty)
-1004.300
(empty)
-123456789012339998178055383778200200677029538578556143779522728938091625064448320947338361845446375953513236661280206676435709550555887864880290298685218909703795934625015156010452441377150897232019456.000
(empty)
-34.840
(empty)
0.000

statement ok
DROP TABLE FLOAT8_TBL

