statement ok
 
CREATE TABLE TIMESTAMP_TBL ( d1 timestamp(2) )

statement ok
create table test_now (test_now timestamp(2))

statement ok
create table test_current_date (test_current_date date)

statement ok
insert into test_now values (now)

statement ok
insert into test_current_date values (current_date)

statement ok
INSERT INTO TIMESTAMP_TBL VALUES ((select test_now from test_now))

statement ok
INSERT INTO TIMESTAMP_TBL VALUES (cast((select test_now from test_now) as timestamp))

statement ok
INSERT INTO TIMESTAMP_TBL VALUES (cast((select test_current_date from test_current_date) as timestamp))

statement ok
INSERT INTO TIMESTAMP_TBL VALUES (cast((select test_current_date from test_current_date) - interval '1' DAY as timestamp))

statement ok
INSERT INTO TIMESTAMP_TBL VALUES (cast((select test_current_date from test_current_date) + interval '1' DAY as timestamp))

query I rowsort
SELECT count(*) AS One FROM TIMESTAMP_TBL WHERE d1 = cast((select test_current_date from test_current_date) as timestamp)
----
1

query I rowsort
SELECT count(*) AS One FROM TIMESTAMP_TBL WHERE d1 = cast((select test_current_date from test_current_date) + interval '1' DAY as timestamp)
----
1

query I rowsort
SELECT count(*) AS One FROM TIMESTAMP_TBL WHERE d1 = cast((select test_current_date from test_current_date) - interval '1' DAY as timestamp)
----
1

query I rowsort
SELECT count(*) AS None FROM TIMESTAMP_TBL WHERE d1 = cast((select test_now from test_now) as timestamp)
----
2

statement error
INSERT INTO TIMESTAMP_TBL VALUES ('tomorrow EST')

statement error
INSERT INTO TIMESTAMP_TBL VALUES ('tomorrow zulu')

statement ok
DELETE FROM TIMESTAMP_TBL

statement ok
START TRANSACTION

statement ok
INSERT INTO TIMESTAMP_TBL VALUES ((select test_now from test_now))

statement ok
INSERT INTO TIMESTAMP_TBL VALUES ((select test_now from test_now))

query I rowsort
SELECT count(*) AS two FROM TIMESTAMP_TBL WHERE d1 <= cast((select test_now from test_now) as timestamp)
----
2

statement ok
COMMIT

statement ok
DELETE FROM TIMESTAMP_TBL

statement ok
drop table test_now

statement ok
drop table test_current_date

statement error
INSERT INTO TIMESTAMP_TBL VALUES ('-infinity')

statement error
INSERT INTO TIMESTAMP_TBL VALUES ('infinity')

statement error
INSERT INTO TIMESTAMP_TBL VALUES ('epoch')

statement error
INSERT INTO TIMESTAMP_TBL VALUES ('invalid')

statement error
INSERT INTO TIMESTAMP_TBL VALUES ('Mon Feb 10 17:32:01 1997 PST')

statement error
INSERT INTO TIMESTAMP_TBL VALUES ('Invalid Abstime')

statement error
INSERT INTO TIMESTAMP_TBL VALUES ('Undefined Abstime')

statement error
INSERT INTO TIMESTAMP_TBL VALUES ('Mon Feb 10 17:32:01.000001 1997 PST')

statement error
INSERT INTO TIMESTAMP_TBL VALUES ('Mon Feb 10 17:32:01.999999 1997 PST')

statement error
INSERT INTO TIMESTAMP_TBL VALUES ('Mon Feb 10 17:32:01.4 1997 PST')

statement error
INSERT INTO TIMESTAMP_TBL VALUES ('Mon Feb 10 17:32:01.5 1997 PST')

statement error
INSERT INTO TIMESTAMP_TBL VALUES ('Mon Feb 10 17:32:01.6 1997 PST')

statement ok
INSERT INTO TIMESTAMP_TBL VALUES ('1997-01-02')

statement ok
INSERT INTO TIMESTAMP_TBL VALUES ('1997-01-02 03:04:05')

statement error
INSERT INTO TIMESTAMP_TBL VALUES ('1997-02-10 17:32:01-08')

statement ok
INSERT INTO TIMESTAMP_TBL VALUES ('1997-02-10 17:32:01-0800')

statement ok
INSERT INTO TIMESTAMP_TBL VALUES ('1997-02-10 17:32:01 -08:00')

statement error
INSERT INTO TIMESTAMP_TBL VALUES ('19970210 173201 -0800')

statement ok
INSERT INTO TIMESTAMP_TBL VALUES ('1997-06-10 17:32:01 -07:00')

statement ok
INSERT INTO TIMESTAMP_TBL VALUES ('2001-09-22T18:19:20')

statement error
INSERT INTO TIMESTAMP_TBL VALUES ('2000-03-15 08:14:01 GMT+8')

statement error
INSERT INTO TIMESTAMP_TBL VALUES ('2000-03-15 13:14:02 GMT-1')

statement error
INSERT INTO TIMESTAMP_TBL VALUES ('2000-03-15 12:14:03 GMT -2')

statement error
INSERT INTO TIMESTAMP_TBL VALUES ('2000-03-15 03:14:04 EST+3')

statement error
INSERT INTO TIMESTAMP_TBL VALUES ('2000-03-15 02:14:05 EST +2:00')

statement error
INSERT INTO TIMESTAMP_TBL VALUES ('Feb 10 17:32:01 1997 -0800')

statement error
INSERT INTO TIMESTAMP_TBL VALUES ('Feb 10 17:32:01 1997')

statement error
INSERT INTO TIMESTAMP_TBL VALUES ('Feb 10 5:32PM 1997')

statement ok
INSERT INTO TIMESTAMP_TBL VALUES ('1997/02/10 17:32:01-0800')

statement error
INSERT INTO TIMESTAMP_TBL VALUES ('1997-02-10 17:32:01 PST')

statement error
INSERT INTO TIMESTAMP_TBL VALUES ('Feb-10-1997 17:32:01 PST')

statement error
INSERT INTO TIMESTAMP_TBL VALUES ('02-10-1997 17:32:01 PST')

statement error
INSERT INTO TIMESTAMP_TBL VALUES ('19970210 173201 PST')

statement error
INSERT INTO TIMESTAMP_TBL VALUES ('97FEB10 5:32:01PM UTC')

statement error
INSERT INTO TIMESTAMP_TBL VALUES ('97/02/10 17:32:01 UTC')

statement error
INSERT INTO TIMESTAMP_TBL VALUES ('1997.041 17:32:01 UTC')

statement error
INSERT INTO TIMESTAMP_TBL VALUES ('1997-06-10 18:32:01 PDT')

statement error
INSERT INTO TIMESTAMP_TBL VALUES ('Feb 10 17:32:01 1997')

statement error
INSERT INTO TIMESTAMP_TBL VALUES ('Feb 11 17:32:01 1997')

statement error
INSERT INTO TIMESTAMP_TBL VALUES ('Feb 12 17:32:01 1997')

statement error
INSERT INTO TIMESTAMP_TBL VALUES ('Feb 13 17:32:01 1997')

statement error
INSERT INTO TIMESTAMP_TBL VALUES ('Feb 14 17:32:01 1997')

statement error
INSERT INTO TIMESTAMP_TBL VALUES ('Feb 15 17:32:01 1997')

statement error
INSERT INTO TIMESTAMP_TBL VALUES ('Feb 16 17:32:01 1997')

statement error
INSERT INTO TIMESTAMP_TBL VALUES ('Feb 16 17:32:01 0097 BC')

statement error
INSERT INTO TIMESTAMP_TBL VALUES ('Feb 16 17:32:01 0097')

statement error
INSERT INTO TIMESTAMP_TBL VALUES ('Feb 16 17:32:01 0597')

statement error
INSERT INTO TIMESTAMP_TBL VALUES ('Feb 16 17:32:01 1097')

statement error
INSERT INTO TIMESTAMP_TBL VALUES ('Feb 16 17:32:01 1697')

statement error
INSERT INTO TIMESTAMP_TBL VALUES ('Feb 16 17:32:01 1797')

statement error
INSERT INTO TIMESTAMP_TBL VALUES ('Feb 16 17:32:01 1897')

statement error
INSERT INTO TIMESTAMP_TBL VALUES ('Feb 16 17:32:01 1997')

statement error
INSERT INTO TIMESTAMP_TBL VALUES ('Feb 16 17:32:01 2097')

statement error
INSERT INTO TIMESTAMP_TBL VALUES ('Feb 28 17:32:01 1996')

statement error
INSERT INTO TIMESTAMP_TBL VALUES ('Feb 29 17:32:01 1996')

statement error
INSERT INTO TIMESTAMP_TBL VALUES ('Mar 01 17:32:01 1996')

statement error
INSERT INTO TIMESTAMP_TBL VALUES ('Dec 30 17:32:01 1996')

statement error
INSERT INTO TIMESTAMP_TBL VALUES ('Dec 31 17:32:01 1996')

statement error
INSERT INTO TIMESTAMP_TBL VALUES ('Jan 01 17:32:01 1997')

statement error
INSERT INTO TIMESTAMP_TBL VALUES ('Feb 28 17:32:01 1997')

statement error
INSERT INTO TIMESTAMP_TBL VALUES ('Feb 29 17:32:01 1997')

statement error
INSERT INTO TIMESTAMP_TBL VALUES ('Mar 01 17:32:01 1997')

statement error
INSERT INTO TIMESTAMP_TBL VALUES ('Dec 30 17:32:01 1997')

statement error
INSERT INTO TIMESTAMP_TBL VALUES ('Dec 31 17:32:01 1997')

statement error
INSERT INTO TIMESTAMP_TBL VALUES ('Dec 31 17:32:01 1999')

statement error
INSERT INTO TIMESTAMP_TBL VALUES ('Jan 01 17:32:01 2000')

statement error
INSERT INTO TIMESTAMP_TBL VALUES ('Dec 31 17:32:01 2000')

statement error
INSERT INTO TIMESTAMP_TBL VALUES ('Jan 01 17:32:01 2001')

statement error
INSERT INTO TIMESTAMP_TBL VALUES ('Feb 16 17:32:01 -0097')

statement error
INSERT INTO TIMESTAMP_TBL VALUES ('Feb 16 17:32:01 5097 BC')

query TT rowsort
SELECT '' AS "64", d1 FROM TIMESTAMP_TBL
----
(empty)
1997-01-02 00:00:00
(empty)
1997-01-02 03:04:05
(empty)
1997-02-11 01:32:01
(empty)
1997-02-11 01:32:01
(empty)
1997-02-11 01:32:01
(empty)
1997-06-11 00:32:01
(empty)
2001-09-22 18:19:20

query TT rowsort
SELECT '' AS "48", d1 FROM TIMESTAMP_TBL
   WHERE d1 > cast('1997-01-02' as timestamp)
----
(empty)
1997-01-02 03:04:05
(empty)
1997-02-11 01:32:01
(empty)
1997-02-11 01:32:01
(empty)
1997-02-11 01:32:01
(empty)
1997-06-11 00:32:01
(empty)
2001-09-22 18:19:20

query TT rowsort
SELECT '' AS "15", d1 FROM TIMESTAMP_TBL
   WHERE d1 < cast('1997-01-02' as timestamp)
----

query TT rowsort
SELECT '' AS one, d1 FROM TIMESTAMP_TBL
   WHERE d1 = cast('1997-01-02' as timestamp)
----
(empty)
1997-01-02 00:00:00

query TT rowsort
SELECT '' AS "63", d1 FROM TIMESTAMP_TBL
   WHERE d1 <> cast('1997-01-02' as timestamp)
----
(empty)
1997-01-02 03:04:05
(empty)
1997-02-11 01:32:01
(empty)
1997-02-11 01:32:01
(empty)
1997-02-11 01:32:01
(empty)
1997-06-11 00:32:01
(empty)
2001-09-22 18:19:20

query TT rowsort
SELECT '' AS "16", d1 FROM TIMESTAMP_TBL
   WHERE d1 <= cast('1997-01-02' as timestamp)
----
(empty)
1997-01-02 00:00:00

query TT rowsort
SELECT '' AS "49", d1 FROM TIMESTAMP_TBL
   WHERE d1 >= cast('1997-01-02' as timestamp)
----
(empty)
1997-01-02 00:00:00
(empty)
1997-01-02 03:04:05
(empty)
1997-02-11 01:32:01
(empty)
1997-02-11 01:32:01
(empty)
1997-02-11 01:32:01
(empty)
1997-06-11 00:32:01
(empty)
2001-09-22 18:19:20

query TT rowsort
SELECT '' AS "54", d1 - cast('1997-01-02' as timestamp) AS diff
   FROM TIMESTAMP_TBL WHERE d1 BETWEEN '1902-01-01' AND '2038-01-01'
----
(empty)
0:00:00
(empty)
160 days, 0:32:01
(empty)
1724 days, 18:19:20
(empty)
3:04:05
(empty)
40 days, 1:32:01
(empty)
40 days, 1:32:01
(empty)
40 days, 1:32:01

query TT rowsort
SELECT '' AS date_trunc_week, date_trunc( 'week', cast('2004-02-29 15:44:17.71393' as timestamp) ) AS week_trunc
----
(empty)
2004-02-23 00:00:00

query TT rowsort
SELECT '' AS "54", d1 - cast('1997-01-02' as timestamp) AS diff
  FROM TIMESTAMP_TBL
  WHERE d1 BETWEEN cast('1902-01-01' as timestamp)
   AND cast('2038-01-01' as timestamp)
----
(empty)
0:00:00
(empty)
160 days, 0:32:01
(empty)
1724 days, 18:19:20
(empty)
3:04:05
(empty)
40 days, 1:32:01
(empty)
40 days, 1:32:01
(empty)
40 days, 1:32:01

statement error
SELECT '' AS "54", d1 as "timestamp",
   date_part( 'year', d1) AS "year", date_part( 'month', d1) AS "month",
   date_part( 'day', d1) AS "day", date_part( 'hour', d1) AS "hour",
   date_part( 'minute', d1) AS "minute", date_part( 'second', d1) AS "second"
   FROM TIMESTAMP_TBL WHERE d1 BETWEEN '1902-01-01' AND '2038-01-01'

statement error
SELECT '' AS "54", d1 as "timestamp",
   date_part( 'quarter', d1) AS quarter, date_part( 'msec', d1) AS msec,
   date_part( 'usec', d1) AS usec
   FROM TIMESTAMP_TBL WHERE d1 BETWEEN '1902-01-01' AND '2038-01-01'

statement error
SELECT '' AS to_char_1, to_char(d1, 'DAY Day day DY Dy dy MONTH Month month RM MON Mon mon')
   FROM TIMESTAMP_TBL

statement error
SELECT '' AS to_char_2, to_char(d1, 'FMDAY FMDay FMday FMMONTH FMMonth FMmonth FMRM')
   FROM TIMESTAMP_TBL

statement error
SELECT '' AS to_char_3, to_char(d1, 'Y,YYY YYYY YYY YY Y CC Q MM WW DDD DD D J')
   FROM TIMESTAMP_TBL

statement error
SELECT '' AS to_char_4, to_char(d1, 'FMY,YYY FMYYYY FMYYY FMYY FMY FMCC FMQ FMMM FMWW FMDDD FMDD FMD FMJ')
   FROM TIMESTAMP_TBL

statement error
SELECT '' AS to_char_5, to_char(d1, 'HH HH12 HH24 MI SS SSSS')
   FROM TIMESTAMP_TBL

statement error
SELECT '' AS to_char_6, to_char(d1, E'"HH:MI:SS is" HH:MI:SS "\\"text between quote marks\\""')
   FROM TIMESTAMP_TBL

statement error
SELECT '' AS to_char_7, to_char(d1, 'HH24
   FROM TIMESTAMP_TBL

statement error
SELECT '' AS to_char_8, to_char(d1, 'YYYYTH YYYYth Jth')
   FROM TIMESTAMP_TBL

statement error
SELECT '' AS to_char_9, to_char(d1, 'YYYY A.D. YYYY a.d. YYYY bc HH:MI:SS P.M. HH:MI:SS p.m. HH:MI:SS pm')
   FROM TIMESTAMP_TBL

statement error
SELECT '' AS to_timestamp_1, to_timestamp('0097/Feb/16
SELECT '' AS to_timestamp_2, to_timestamp('97/2/16 8:14:30', 'FMYYYY/FMMM/FMDD FMHH:FMMI:FMSS')

statement error
SELECT '' AS to_timestamp_3, to_timestamp('1985 January 12', 'YYYY FMMonth DD')

statement error
SELECT '' AS to_timestamp_4, to_timestamp('My birthday-> Year: 1976, Month: May, Day: 16',
                                          '"My birthday-> Year" YYYY, "Month:" FMMonth, "Day:" DD')

statement error
SELECT '' AS to_timestamp_5, to_timestamp('1,582nd VIII 21', 'Y,YYYth FMRM DD')

statement error
SELECT '' AS to_timestamp_6, to_timestamp('15 "text between quote marks" 98 54 45',
                                          E'HH "\\text between quote marks\\"" YY MI SS')

statement error
SELECT '' AS to_timestamp_7, to_timestamp('05121445482000', 'MMDDHHMISSYYYY')

statement error
SELECT '' AS to_timestamp_8, to_timestamp('2000January09Sunday', 'YYYYFMMonthDDFMDay')

statement error
SELECT '' AS to_timestamp_9, to_timestamp('97/Feb/16', 'YYMonDD')

statement error
SELECT '' AS to_timestamp_10, to_timestamp('19971116', 'YYYYMMDD')

statement error
SELECT '' AS to_timestamp_11, to_timestamp('20000-1116', 'YYYY-MMDD')

statement error
SELECT '' AS to_timestamp_12, to_timestamp('9-1116', 'Y-MMDD')

statement error
SELECT '' AS to_timestamp_13, to_timestamp('95-1116', 'YY-MMDD')

statement error
SELECT '' AS to_timestamp_14, to_timestamp('995-1116', 'YYY-MMDD')

statement ok
 
INSERT INTO TIMESTAMP_TBL VALUES (null)

statement error
SELECT d1, day(d1) FROM TIMESTAMP_TBL

query TI rowsort
SELECT d1, "day"(d1) FROM TIMESTAMP_TBL
----
1997-01-02 00:00:00
2
1997-01-02 03:04:05
2
1997-02-11 01:32:01
11
1997-02-11 01:32:01
11
1997-02-11 01:32:01
11
1997-06-11 00:32:01
11
2001-09-22 18:19:20
22
NULL
NULL

statement error
SELECT d1, month(d1) FROM TIMESTAMP_TBL

query TI rowsort
SELECT d1, "month"(d1) FROM TIMESTAMP_TBL
----
1997-01-02 00:00:00
1
1997-01-02 03:04:05
1
1997-02-11 01:32:01
2
1997-02-11 01:32:01
2
1997-02-11 01:32:01
2
1997-06-11 00:32:01
6
2001-09-22 18:19:20
9
NULL
NULL

statement error
SELECT d1, year(d1) FROM TIMESTAMP_TBL

query TI rowsort
SELECT d1, "year"(d1) FROM TIMESTAMP_TBL
----
1997-01-02 00:00:00
1997
1997-01-02 03:04:05
1997
1997-02-11 01:32:01
1997
1997-02-11 01:32:01
1997
1997-02-11 01:32:01
1997
1997-06-11 00:32:01
1997
2001-09-22 18:19:20
2001
NULL
NULL

query TI rowsort
SELECT d1, extract(day from d1) FROM TIMESTAMP_TBL
----
1997-01-02 00:00:00
2
1997-01-02 03:04:05
2
1997-02-11 01:32:01
11
1997-02-11 01:32:01
11
1997-02-11 01:32:01
11
1997-06-11 00:32:01
11
2001-09-22 18:19:20
22
NULL
NULL

query TI rowsort
SELECT d1, extract(week from d1) FROM TIMESTAMP_TBL
----
1997-01-02 00:00:00
1
1997-01-02 03:04:05
1
1997-02-11 01:32:01
7
1997-02-11 01:32:01
7
1997-02-11 01:32:01
7
1997-06-11 00:32:01
24
2001-09-22 18:19:20
38
NULL
NULL

query TI rowsort
SELECT d1, extract(month from d1) FROM TIMESTAMP_TBL
----
1997-01-02 00:00:00
1
1997-01-02 03:04:05
1
1997-02-11 01:32:01
2
1997-02-11 01:32:01
2
1997-02-11 01:32:01
2
1997-06-11 00:32:01
6
2001-09-22 18:19:20
9
NULL
NULL

query TI rowsort
SELECT d1, extract(quarter from d1) FROM TIMESTAMP_TBL
----
1997-01-02 00:00:00
1
1997-01-02 03:04:05
1
1997-02-11 01:32:01
1
1997-02-11 01:32:01
1
1997-02-11 01:32:01
1
1997-06-11 00:32:01
2
2001-09-22 18:19:20
3
NULL
NULL

statement error
SELECT d1, extract(halfyear from d1) FROM TIMESTAMP_TBL

query TI rowsort
SELECT d1, extract(year from d1) FROM TIMESTAMP_TBL
----
1997-01-02 00:00:00
1997
1997-01-02 03:04:05
1997
1997-02-11 01:32:01
1997
1997-02-11 01:32:01
1997
1997-02-11 01:32:01
1997
1997-06-11 00:32:01
1997
2001-09-22 18:19:20
2001
NULL
NULL

query TI rowsort
SELECT d1, extract(century from d1) FROM TIMESTAMP_TBL
----
1997-01-02 00:00:00
20
1997-01-02 03:04:05
20
1997-02-11 01:32:01
20
1997-02-11 01:32:01
20
1997-02-11 01:32:01
20
1997-06-11 00:32:01
20
2001-09-22 18:19:20
21
NULL
NULL

statement error
SELECT d1, extract(millennium from d1) FROM TIMESTAMP_TBL

query TI rowsort
SELECT d1, extract(epoch from d1) FROM TIMESTAMP_TBL
----
1997-01-02 00:00:00
852163200000
1997-01-02 03:04:05
852174245000
1997-02-11 01:32:01
855624721000
1997-02-11 01:32:01
855624721000
1997-02-11 01:32:01
855624721000
1997-06-11 00:32:01
865989121000
2001-09-22 18:19:20
1001182760000
NULL
NULL

query TI rowsort
SELECT d1, week(d1) FROM TIMESTAMP_TBL
----
1997-01-02 00:00:00
1
1997-01-02 03:04:05
1
1997-02-11 01:32:01
7
1997-02-11 01:32:01
7
1997-02-11 01:32:01
7
1997-06-11 00:32:01
24
2001-09-22 18:19:20
38
NULL
NULL

query TI rowsort
SELECT d1, weekofyear(d1) FROM TIMESTAMP_TBL
----
1997-01-02 00:00:00
1
1997-01-02 03:04:05
1
1997-02-11 01:32:01
7
1997-02-11 01:32:01
7
1997-02-11 01:32:01
7
1997-06-11 00:32:01
24
2001-09-22 18:19:20
38
NULL
NULL

query TI rowsort
SELECT d1, dayofmonth(d1) FROM TIMESTAMP_TBL
----
1997-01-02 00:00:00
2
1997-01-02 03:04:05
2
1997-02-11 01:32:01
11
1997-02-11 01:32:01
11
1997-02-11 01:32:01
11
1997-06-11 00:32:01
11
2001-09-22 18:19:20
22
NULL
NULL

query TI rowsort
SELECT d1, dayofweek(d1) FROM TIMESTAMP_TBL
----
1997-01-02 00:00:00
4
1997-01-02 03:04:05
4
1997-02-11 01:32:01
2
1997-02-11 01:32:01
2
1997-02-11 01:32:01
2
1997-06-11 00:32:01
3
2001-09-22 18:19:20
6
NULL
NULL

query TI rowsort
SELECT d1, dayofyear(d1) FROM TIMESTAMP_TBL
----
1997-01-02 00:00:00
2
1997-01-02 03:04:05
2
1997-02-11 01:32:01
42
1997-02-11 01:32:01
42
1997-02-11 01:32:01
42
1997-06-11 00:32:01
162
2001-09-22 18:19:20
265
NULL
NULL

statement error
SELECT d1, hour(d1) FROM TIMESTAMP_TBL

query TI rowsort
SELECT d1, "hour"(d1) FROM TIMESTAMP_TBL
----
1997-01-02 00:00:00
0
1997-01-02 03:04:05
3
1997-02-11 01:32:01
1
1997-02-11 01:32:01
1
1997-02-11 01:32:01
1
1997-06-11 00:32:01
0
2001-09-22 18:19:20
18
NULL
NULL

statement error
SELECT d1, minute(d1) FROM TIMESTAMP_TBL

query TI rowsort
SELECT d1, "minute"(d1) FROM TIMESTAMP_TBL
----
1997-01-02 00:00:00
0
1997-01-02 03:04:05
4
1997-02-11 01:32:01
32
1997-02-11 01:32:01
32
1997-02-11 01:32:01
32
1997-06-11 00:32:01
32
2001-09-22 18:19:20
19
NULL
NULL

statement error
SELECT d1, second(d1) FROM TIMESTAMP_TBL

query TR rowsort
SELECT d1, "second"(d1) FROM TIMESTAMP_TBL
----
1997-01-02 00:00:00
0.000
1997-01-02 03:04:05
5.000
1997-02-11 01:32:01
1.000
1997-02-11 01:32:01
1.000
1997-02-11 01:32:01
1.000
1997-06-11 00:32:01
1.000
2001-09-22 18:19:20
20.000
NULL
NULL

query TI rowsort
SELECT d1, extract(hour from d1) FROM TIMESTAMP_TBL
----
1997-01-02 00:00:00
0
1997-01-02 03:04:05
3
1997-02-11 01:32:01
1
1997-02-11 01:32:01
1
1997-02-11 01:32:01
1
1997-06-11 00:32:01
0
2001-09-22 18:19:20
18
NULL
NULL

query TI rowsort
SELECT d1, extract(minute from d1) FROM TIMESTAMP_TBL
----
1997-01-02 00:00:00
0
1997-01-02 03:04:05
4
1997-02-11 01:32:01
32
1997-02-11 01:32:01
32
1997-02-11 01:32:01
32
1997-06-11 00:32:01
32
2001-09-22 18:19:20
19
NULL
NULL

query TR rowsort
SELECT d1, extract(second from d1) FROM TIMESTAMP_TBL
----
1997-01-02 00:00:00
0.000
1997-01-02 03:04:05
5.000
1997-02-11 01:32:01
1.000
1997-02-11 01:32:01
1.000
1997-02-11 01:32:01
1.000
1997-06-11 00:32:01
1.000
2001-09-22 18:19:20
20.000
NULL
NULL

statement error
SELECT d1, sql_add(d1, 365*24*60*60.0) FROM TIMESTAMP_TBL

statement error
SELECT d1, sql_add(d1, cast(365*24*60*60 as interval second)) FROM TIMESTAMP_TBL

statement error
SELECT d1, sql_add(d1, cast(12 as interval month)) FROM TIMESTAMP_TBL

statement error
SELECT d1, sql_add(d1, cast(-18 as interval month)) FROM TIMESTAMP_TBL

statement error
SELECT d1, sql_sub(d1, 365*24*60*60.0) FROM TIMESTAMP_TBL

statement error
SELECT d1, sql_sub(d1, cast(365*24*60*60 as interval second)) FROM TIMESTAMP_TBL

statement error
SELECT d1, sql_sub(d1, cast(12 as interval month)) FROM TIMESTAMP_TBL

statement error
SELECT d1, sql_sub(d1, cast(-18 as interval month)) FROM TIMESTAMP_TBL

query TT rowsort
SELECT d1, sql_sub(d1, cast('2001-12-12 23:22:21' as timestamp)) FROM TIMESTAMP_TBL
----
1997-01-02 00:00:00
-1806 days, 0:37:39
1997-01-02 03:04:05
-1806 days, 3:41:44
1997-02-11 01:32:01
-1766 days, 2:09:40
1997-02-11 01:32:01
-1766 days, 2:09:40
1997-02-11 01:32:01
-1766 days, 2:09:40
1997-06-11 00:32:01
-1646 days, 1:09:40
2001-09-22 18:19:20
-82 days, 18:56:59
NULL
NULL

query TT rowsort
SELECT d1, sql_sub(cast('2001-12-12 23:22:21' as timestamp), d1) FROM TIMESTAMP_TBL
----
1997-01-02 00:00:00
1805 days, 23:22:21
1997-01-02 03:04:05
1805 days, 20:18:16
1997-02-11 01:32:01
1765 days, 21:50:20
1997-02-11 01:32:01
1765 days, 21:50:20
1997-02-11 01:32:01
1765 days, 21:50:20
1997-06-11 00:32:01
1645 days, 22:50:20
2001-09-22 18:19:20
81 days, 5:03:01
NULL
NULL

statement ok
DROP TABLE TIMESTAMP_TBL

