statement ok
CREATE TABLE update_test (
    a   INT DEFAULT 10,
    b   INT
)

statement ok
INSERT INTO update_test VALUES (5, 10)

statement ok
INSERT INTO update_test VALUES (10, 15)

query II rowsort
SELECT * FROM update_test
----
10
15
5
10

statement error
UPDATE update_test SET a = DEFAULT, b = DEFAULT

query II rowsort
SELECT * FROM update_test
----
10
15
5
10

statement ok
DROP TABLE update_test

