statement ok
CREATE TABLE vactst (i INT)

statement ok
INSERT INTO vactst VALUES (1)

statement ok
INSERT INTO vactst SELECT * FROM vactst

statement ok
INSERT INTO vactst SELECT * FROM vactst

statement ok
INSERT INTO vactst SELECT * FROM vactst

statement ok
INSERT INTO vactst SELECT * FROM vactst

statement ok
INSERT INTO vactst SELECT * FROM vactst

statement ok
INSERT INTO vactst SELECT * FROM vactst

statement ok
INSERT INTO vactst SELECT * FROM vactst

statement ok
INSERT INTO vactst SELECT * FROM vactst

statement ok
INSERT INTO vactst SELECT * FROM vactst

statement ok
INSERT INTO vactst SELECT * FROM vactst

statement ok
INSERT INTO vactst SELECT * FROM vactst

statement ok
INSERT INTO vactst VALUES (0)

query I rowsort
SELECT count(*) FROM vactst
----
2049

query II rowsort
SELECT i, count(*) AS count FROM vactst GROUP BY i ORDER BY i
----
0
1
1
2048

query I rowsort
SELECT count(*) FROM vactst WHERE i <> 0
----
2048

statement ok
DELETE FROM vactst WHERE i <> 0

query I rowsort
SELECT * FROM vactst
----
0

query TTTTIIIIIII rowsort
select "schema", "table", "column", type, count, typewidth, columnsize, heapsize, hashes, "imprints", sorted from sys.storage(current_schema, 'vactst')
----
sys
vactst
i
int
2049
4
8196
0
0
0
0

statement ok
call vacuum(current_schema, 'vactst')

query TTTTIIIIIII rowsort
select "schema", "table", "column", type, count, typewidth, columnsize, heapsize, hashes, "imprints", sorted from sys.storage(current_schema, 'vactst')
----
sys
vactst
i
int
1
4
4
0
0
0
1

statement ok
UPDATE vactst SET i = i + 1

statement ok
INSERT INTO vactst SELECT * FROM vactst

statement ok
INSERT INTO vactst SELECT * FROM vactst

statement ok
INSERT INTO vactst SELECT * FROM vactst

statement ok
INSERT INTO vactst SELECT * FROM vactst

statement ok
INSERT INTO vactst SELECT * FROM vactst

statement ok
INSERT INTO vactst SELECT * FROM vactst

statement ok
INSERT INTO vactst SELECT * FROM vactst

statement ok
INSERT INTO vactst SELECT * FROM vactst

statement ok
INSERT INTO vactst SELECT * FROM vactst

statement ok
INSERT INTO vactst SELECT * FROM vactst

statement ok
INSERT INTO vactst SELECT * FROM vactst

statement ok
INSERT INTO vactst SELECT * FROM vactst

statement ok
INSERT INTO vactst SELECT * FROM vactst

statement ok
INSERT INTO vactst SELECT * FROM vactst

statement ok
INSERT INTO vactst SELECT * FROM vactst

statement ok
INSERT INTO vactst SELECT * FROM vactst

statement ok
INSERT INTO vactst SELECT * FROM vactst

statement ok
INSERT INTO vactst SELECT * FROM vactst

statement ok
INSERT INTO vactst SELECT * FROM vactst

statement ok
INSERT INTO vactst SELECT * FROM vactst

statement ok
INSERT INTO vactst VALUES (0)

query I rowsort
SELECT count(*) FROM vactst
----
1048577

query II rowsort
SELECT i, count(*) AS count FROM vactst GROUP BY i ORDER BY i
----
0
1
1
1048576

query I rowsort
SELECT count(*) FROM vactst WHERE i <> 0
----
1048576

statement ok
DELETE FROM vactst WHERE i <> 0

query TTTTIIIIIII rowsort
select "schema", "table", "column", type, count, typewidth, columnsize, heapsize, hashes, "imprints", sorted from sys.storage(current_schema, 'vactst')
----
sys
vactst
i
int
1048577
4
4194308
0
0
0
0

statement ok
call vacuum(current_schema, 'vactst')

query TTTTIIIIIII rowsort
select "schema", "table", "column", type, count, typewidth, columnsize, heapsize, hashes, "imprints", sorted from sys.storage(current_schema, 'vactst')
----
sys
vactst
i
int
1
4
4
0
0
0
1

statement ok
DELETE FROM vactst

query I rowsort
SELECT * FROM vactst
----

statement ok
DROP TABLE vactst

