statement ok
START TRANSACTION

statement ok
CREATE FUNCTION capi00(inp INTEGER) RETURNS INTEGER LANGUAGE C {
    size_t i;
    result->initialize(result, inp.count);
    for(i = 0; i < inp.count; i++) {
        result->data[i] = inp.data[i] * 2;
    }
}

statement ok
CREATE TABLE integers(i INTEGER)

statement ok
INSERT INTO integers VALUES (1), (2), (3), (4), (5)

query I rowsort
SELECT * FROM integers
----
1
2
3
4
5

statement ok
UPDATE integers SET i=capi00(i)

query I rowsort
SELECT * FROM integers
----
10
2
4
6
8

statement ok
DROP FUNCTION capi00

statement ok
DROP TABLE integers

statement ok
ROLLBACK

