statement ok
START TRANSACTION

statement ok
create procedure "sys"."dict_compress"(sname string, tname string, cname string) external name "dict"."compress"

statement ok
create procedure "sys"."dict_compress"(sname string, tname string, cname string, ordered_values bool) external name "dict"."compress"

statement ok
create procedure "sys"."for_compress"(sname string, tname string, cname string) external name "for"."compress"

statement ok
COMMIT

statement ok
START TRANSACTION

statement ok
CREATE TABLE "rt2" ("c0" BOOLEAN)

statement ok
INSERT INTO "rt2" VALUES (true)

statement ok
CREATE TABLE x (x int)

statement ok
INSERT INTO x VALUES (1),(2),(3)

statement ok
COMMIT

statement ok
START TRANSACTION

statement ok
CALL "sys"."dict_compress"('sys','rt2','c0', true)

statement ok
CALL "sys"."dict_compress"('sys','x','x', true)

statement ok
COMMIT

query I nosort
SELECT 1 FROM rt2 WHERE rt2.c0 <> false
----
1

query I nosort
SELECT 1 FROM rt2 WHERE rt2.c0 <> true
----

query I nosort
SELECT CAST(SUM(count) AS BIGINT) FROM (SELECT CAST(rt2.c0 <> false AS INT) as count FROM rt2) as res
----
1

query I nosort
SELECT CAST(SUM(count) AS BIGINT) FROM (SELECT CAST(rt2.c0 <> true AS INT) as count FROM rt2) as res
----
0

query I nosort
SELECT 1 FROM rt2 WHERE rt2.c0 = false
----

query I nosort
SELECT 1 FROM rt2 WHERE rt2.c0 = true
----
1

query I nosort
SELECT * FROM x WHERE x < 1
----

query I nosort
SELECT * FROM x WHERE x < 2
----
1

query I nosort
SELECT * FROM x WHERE x <= 1
----
1

query I rowsort
SELECT * FROM x WHERE x <= 2
----
1
2

query I nosort
SELECT * FROM x WHERE x > 2
----
3

query I nosort
SELECT * FROM x WHERE x > 3
----

query I rowsort
SELECT * FROM x WHERE x >= 2
----
2
3

query I nosort
SELECT * FROM x WHERE x >= 3
----
3

statement ok
START TRANSACTION

statement ok
DROP TABLE rt2

statement ok
DROP TABLE x

statement ok
COMMIT

statement ok
START TRANSACTION

statement ok
CREATE TABLE mt0(c1 int)

statement ok
CREATE TABLE t2(c1 int, c2 TIMESTAMP)

statement ok
CREATE VIEW v2(vc0) AS (SELECT 2 FROM mt0)

statement ok
INSERT INTO t2(c1) VALUES(32448)

statement ok
COMMIT

statement ok
CALL "sys"."dict_compress"('sys','t2','c2',true)

statement ok
START TRANSACTION

statement ok rowcount 0
UPDATE t2 SET c2 = COALESCE(t2.c2 - INTERVAL '2' SECOND, t2.c2 - INTERVAL '4' MONTH) WHERE (SELECT TRUE FROM v2)

statement ok
ROLLBACK

statement ok
START TRANSACTION

statement ok
DROP VIEW v2

statement ok
DROP TABLE mt0

statement ok
DROP TABLE t2

statement ok
COMMIT

statement ok
START TRANSACTION

statement ok
CREATE TABLE rt3 (c0 DATE)

statement ok rowcount 3
INSERT INTO rt3 VALUES (NULL),(NULL),(NULL)

statement ok
COMMIT

statement ok
CALL "sys"."dict_compress"('sys','rt3','c0',false)

query I nosort
SELECT 1 FROM rt3 WHERE rt3.c0 <> DATE '2000-12-14'
----

query I nosort
SELECT 1 FROM rt3 WHERE DATE '2000-12-14' <> (SELECT rt3.c0 FROM (SELECT 1) vx(x))
----

query I nosort
SELECT CAST(SUM(count) AS BIGINT) FROM (SELECT CAST(DATE '2000-12-14' <> (SELECT rt3.c0 FROM (SELECT 1) vx(x)) AS INT) as count FROM rt3) as res
----
NULL

statement ok
DROP TABLE rt3

statement ok
START TRANSACTION

statement ok
CREATE TABLE t4 (c0 INT, c1 INT)

statement ok rowcount 3
insert into t4 values (1,1),(2,2),(3,3)

statement ok
CREATE TABLE t5 (c0 INT)

statement ok
COMMIT

statement ok
CALL "sys"."dict_compress"('sys','t5','c0',false)

query I nosort
SELECT 1 FROM t4 CROSS JOIN (SELECT (VALUES (z.z)) FROM t5 CROSS JOIN LATERAL (
SELECT 2 FROM (SELECT 3) x(x) JOIN (VALUES (4, t5.c0), (5, t5.c0)) AS y(y,r) ON TRUE
) AS z(z)) AS w(w)
----

statement ok
DROP TABLE t4

statement ok
DROP TABLE t5

statement ok
START TRANSACTION

statement ok
CREATE TABLE t0 (c0 INT NOT NULL)

statement ok rowcount 2
INSERT INTO t0 VALUES (1), (3)

statement ok
COMMIT

statement ok
CALL "sys"."dict_compress"('sys','t0','c0')

query I nosort
SELECT t0.c0 FROM t0 WHERE t0.c0 <= 2
----
1

query I nosort
SELECT CAST(SUM(count) AS BIGINT) FROM (SELECT CAST(t0.c0 <= 2 AS INT) as count FROM t0) as res
----
1

statement ok
DROP TABLE t0

statement ok
START TRANSACTION

statement ok
CREATE TABLE t0 (c0 INT, c1 DOUBLE PRECISION)

statement ok rowcount 1
INSERT INTO t0 VALUES (NULL, 0.1338142586871145)

statement ok
COMMIT

statement ok
CALL "sys"."dict_compress"('sys','t0','c0', true)

statement ok
CALL "sys"."dict_compress"('sys','t0','c1', true)

query I nosort
SELECT 1 FROM t0 WHERE t0.c0 < 1
----

query I nosort
SELECT 1 FROM t0 WHERE t0.c0 <= 1
----

query I nosort
SELECT 1 FROM t0 WHERE t0.c0 > -1
----

query I nosort
SELECT 1 FROM t0 WHERE t0.c0 >= -1
----

query I nosort
SELECT 1 FROM t0 WHERE t0.c0 = 1
----

query I nosort
SELECT 1 FROM t0 WHERE t0.c0 <> 1
----

# output of json."integer"(JSON '{"x":"x"}') is NULL
query I nosort
SELECT 1 FROM t0 WHERE t0.c1 >= json."integer"(JSON '{"x":"x"}')
----

statement ok rowcount 1
INSERT INTO t0 VALUES (1, NULL)

query I nosort
SELECT t0.c0 FROM t0 WHERE t0.c0 <> 1
----

query I nosort
SELECT 1 FROM t0 WHERE t0.c1 >= json."integer"(JSON '{"x":"x"}')
----

statement ok
DROP TABLE t0

statement ok
START TRANSACTION

statement ok
CREATE TABLE t0 (c0 INT)

statement ok rowcount 1
INSERT INTO t0 VALUES (2)

statement ok
COMMIT

statement ok
CALL "sys"."dict_compress"('sys','t0','c0', true)

query I nosort
SELECT * FROM t0 WHERE c0 > 1
----
2

statement ok
DROP TABLE t0

statement ok
START TRANSACTION

statement ok
DROP ALL PROCEDURE "sys"."dict_compress"

statement ok
DROP ALL PROCEDURE "sys"."for_compress"

statement ok
COMMIT

