statement ok
CREATE TABLE TBLCHECK(nr int CHECK (nr > 10))

statement ok
INSERT INTO TBLCHECK VALUES (11)

statement error 40002!UPDATE: CHECK constraint violated: tblcheck_nr_check
INSERT INTO TBLCHECK VALUES (10)

statement error 40002!UPDATE: CHECK constraint violated: tblcheck_nr_check
INSERT INTO TBLCHECK VALUES (09)

statement error 40002!UPDATE: CHECK constraint violated: tblcheck_nr_check
INSERT INTO TBLCHECK VALUES (01)

statement error 40002!UPDATE: CHECK constraint violated: tblcheck_nr_check
INSERT INTO TBLCHECK VALUES (00)

statement error 40002!UPDATE: CHECK constraint violated: tblcheck_nr_check
INSERT INTO TBLCHECK VALUES (-01)

statement error 40002!UPDATE: CHECK constraint violated: tblcheck_nr_check
INSERT INTO TBLCHECK VALUES (-+02)

statement error 40002!UPDATE: CHECK constraint violated: tblcheck_nr_check
INSERT INTO TBLCHECK VALUES (+-+03)

statement error 40002!UPDATE: CHECK constraint violated: tblcheck_nr_check
INSERT INTO TBLCHECK VALUES (-+-04)

statement error 40002!UPDATE: CHECK constraint violated: tblcheck_nr_check
INSERT INTO TBLCHECK VALUES (+-+-05)

query I rowsort
SELECT * FROM TBLCHECK
----
11

statement error 40002!UPDATE: CHECK constraint violated: tblcheck_nr_check
UPDATE TBLCHECK SET nr = nr -10

statement ok
UPDATE TBLCHECK SET nr = nr +10

query I rowsort
SELECT * FROM TBLCHECK
----
21

statement ok
DROP TABLE TBLCHECK

