statement ok
START TRANSACTION

statement ok
CREATE TABLE pyapi09table(i integer)

statement ok
INSERT INTO pyapi09table VALUES (1), (2), (3), (4)

statement ok
CREATE FUNCTION pyapi09() returns TABLE(i integer)
language P
{
    res = _conn.execute('SELECT i FROM pyapi09table;')
    return res
}

query I rowsort
SELECT * FROM pyapi09()
----
1
2
3
4

statement ok
DROP FUNCTION pyapi09

statement ok
DROP TABLE pyapi09table

statement ok
CREATE TABLE pyapi09table(i integer)

statement ok
INSERT INTO pyapi09table VALUES (1), (2), (3), (4)

statement ok
CREATE TABLE pyapi09multiplication(i integer)

statement ok
INSERT INTO pyapi09multiplication VALUES (3)

statement ok
CREATE FUNCTION pyapi09(i integer) returns integer
language P
{
    res = _conn.execute('SELECT i FROM pyapi09multiplication;')
    return res['i'] * i
}

query I rowsort
SELECT pyapi09(i) FROM pyapi09table
----
12
3
6
9

statement ok
UPDATE pyapi09multiplication SET i=10

query I rowsort
SELECT pyapi09(i) FROM pyapi09table
----
10
20
30
40

statement ok
DROP FUNCTION pyapi09

statement ok
DROP TABLE pyapi09table

statement ok
DROP TABLE pyapi09multiplication

statement ok
CREATE FUNCTION pyapi09create() returns TABLE(s BLOB)
language P
{
    import pickle
    result = numpy.arange(100000)
    return pickle.dumps(result)
}

statement ok
CREATE TABLE pyapi09objects AS SELECT * FROM pyapi09create() WITH DATA

statement ok
CREATE FUNCTION pyapi09load() returns TABLE(i INTEGER)
language P
{
    import pickle
    res = _conn.execute('SELECT s FROM pyapi09objects;')
    array = pickle.loads(res['s'][0])
    print(array)
    return array[:10]
}

query I rowsort
SELECT * FROM pyapi09load()
----
0
1
2
3
4
5
6
7
8
9

statement ok
DROP FUNCTION pyapi09create

statement ok
DROP FUNCTION pyapi09load

statement ok
DROP TABLE pyapi09objects

statement ok
CREATE FUNCTION pyapi09() returns TABLE(i INTEGER)
language P
{
    res = _conn.execute('SELECT * FROM unknown_table;')
    return numpy.arange(10)
}

statement error
SELECT * FROM pyapi09()

statement ok
ROLLBACK

statement ok
START TRANSACTION

statement ok
CREATE FUNCTION pyapi09() returns TABLE(i INTEGER)
language P
{
    try: res = _conn.execute('SELECT * FROM unknown_table;')
    except: pass
    return numpy.arange(10)
}

query I rowsort
SELECT * FROM pyapi09()
----
0
1
2
3
4
5
6
7
8
9

statement error
SELECT 1

statement ok
ROLLBACK

