statement ok
DROP TABLE IF EXISTS t2

statement ok
DROP TABLE IF EXISTS t3

statement ok
CREATE TABLE t2(
  c1 INT NOT NULL,
  c2 INT,
  c15 DOUBLE,
  PRIMARY KEY(c1)
)

statement ok
CREATE TABLE t3(
  c5 TIMESTAMP
)

statement ok rowcount 6
INSERT INTO t2(c1,c2,c15) VALUES
  (1,3,599.0),
  (2,4,375.0),
  (3,4,789.0),
  (4,3,435.0),
  (5,2,NULL),
  (6,2,827.0)

statement ok rowcount 6
INSERT INTO t3(c5) VALUES
  (TIMESTAMP '2002-11-29 06:01:10'),
  (TIMESTAMP '2009-02-17 14:54:39'),
  (TIMESTAMP '2012-02-14 07:00:27'),
  (TIMESTAMP '2005-01-28 21:54:29'),
  (NULL),
  (TIMESTAMP '2012-02-14 07:00:27')

-- original
statement ok rowcount 5
INSERT INTO t2(c1,c2)
SELECT c1+33,c2 FROM t2
WHERE c15 IS NOT NULL
AND EXISTS(
  SELECT c5 FROM t3
  UNION
  SELECT * FROM (
    SELECT k FROM (
      SELECT c5 k, c5 FROM t3
      EXCEPT
      SELECT c5, c5 FROM t3
    ) a
    WHERE k BETWEEN DATE '2000-01-01' AND DATE '2030-01-01'
    INTERSECT
    SELECT c5 FROM t3 WHERE 1=0
  ) s
)

query II rowsort
SELECT c1,c2 FROM t2 WHERE c1>=34 ORDER BY c1
----
34
3
35
4
36
4
37
3
39
2

statement ok rowcount 5
DELETE FROM t2 WHERE c1>=34

-- mutated
statement ok rowcount 5
INSERT INTO t2(c1,c2)
SELECT c1+33,c2 FROM t2
WHERE c15 IS NOT NULL
AND EXISTS(
  SELECT c5 FROM t3
  UNION
  SELECT * FROM (
    SELECT k FROM (
      SELECT c5 k, c5 FROM t3
      EXCEPT
      SELECT c5, c5 FROM t3
    ) a
    WHERE 1=0 AND k BETWEEN DATE '2000-01-01' AND DATE '2030-01-01'
    INTERSECT
    SELECT c5 FROM t3 WHERE 1=0
  ) s
)

query II rowsort
SELECT c1,c2 FROM t2 WHERE c1>=34 ORDER BY c1
----
34
3
35
4
36
4
37
3
39
2

statement ok
DROP TABLE t2

statement ok
DROP TABLE t3

