statement ok
DROP TABLE IF EXISTS t2

statement ok
DROP TABLE IF EXISTS t1

statement ok
CREATE TABLE t1(
  c1 INT,
  c3 VARCHAR(100),
  c4 INT,
  c6 VARCHAR(100)
)

statement ok
CREATE TABLE t2(
  c1 INT,
  c2 INT,
  c6 VARCHAR(100),
  c13 TIMESTAMP
)

statement ok rowcount 2
INSERT INTO t1 VALUES
  (4, 'x', 1, 'rpuirlu'),
  (8, 'y', 1, 'trc')

statement ok rowcount 3
INSERT INTO t2 VALUES
  (3, 4, NULL, TIMESTAMP '2002-09-11 17:01:39'),
  (8, 8, 'egculthpiak', TIMESTAMP '2002-05-04 20:51:45'),
  (1, 6, 'tdingsooyv', TIMESTAMP '2010-04-13 15:30:07')

-- original
statement ok rowcount 2
UPDATE t2
SET c6 = d.v, c2 = ABS(d.k)
FROM (
  SELECT c1 AS k, LOWER(c6) AS v
  FROM t1
) AS d
WHERE
  (
    NOT t2.c13 BETWEEN TIMESTAMP '2007-09-07 20:32:59'
                   AND TIMESTAMP '2024-07-12 00:28:28'
    OR (
      CAST('2003-02-07 23:56:12' AS TIMESTAMP)
      BETWEEN TIMESTAMP '2003-05-29 18:50:56'
          AND TIMESTAMP '2007-02-14 04:35:02'
    )
  )
  AND t2.c2 = d.k

query IIT rowsort
SELECT c1, c2, c6 FROM t2 ORDER BY c1
----
1
6
tdingsooyv
3
4
rpuirlu
8
8
trc

statement ok rowcount 3
DELETE FROM t2

statement ok rowcount 3
INSERT INTO t2 VALUES
  (3, 4, NULL, TIMESTAMP '2002-09-11 17:01:39'),
  (8, 8, 'egculthpiak', TIMESTAMP '2002-05-04 20:51:45'),
  (1, 6, 'tdingsooyv', TIMESTAMP '2010-04-13 15:30:07');

-- rewritten / mutated
statement ok rowcount 2
UPDATE t2
SET c6 = d.v, c2 = ABS(d.k)
FROM (
  SELECT c1 AS k, LOWER(c6) AS v
  FROM t1
) AS d
WHERE
  (
    NOT (
      t2.c13 > TIMESTAMP '2007-09-07 20:32:59'
      AND t2.c13 < TIMESTAMP '2024-07-12 00:28:28'
    )
    OR (
      CAST('2003-02-07 23:56:12' AS TIMESTAMP)
      BETWEEN TIMESTAMP '2003-05-29 18:50:56'
          AND TIMESTAMP '2007-02-14 04:35:02'
    )
  )
  AND t2.c2 = d.k

query IIT rowsort
SELECT c1, c2, c6 FROM t2 ORDER BY c1
----
1
6
tdingsooyv
3
4
rpuirlu
8
8
trc

statement ok
DROP TABLE t2

statement ok
DROP TABLE t1

