statement ok
start transaction

statement ok
create table testme (b varchar(16))

statement ok
insert into testme values ('another'), ('testing'), ('all')

query T rowsort
select group_concat(b) from testme
----
another,testing,all

statement ok
insert into testme values ('lets'), ('get'), ('harder')

query T rowsort
select group_concat(b) from testme
----
another,testing,all,lets,get,harder

statement ok
insert into testme values ('even'), ('more'), ('serious')

query T rowsort
select group_concat(b) from testme
----
another,testing,all,lets,get,harder,even,more,serious

statement ok
insert into testme values (NULL)

query T rowsort
select group_concat(b) from testme
----
another,testing,all,lets,get,harder,even,more,serious

statement ok
delete from testme where b is null

query T rowsort
select group_concat(b) from testme
----
another,testing,all,lets,get,harder,even,more,serious

statement ok
insert into testme values (''), ('stress'), ('')

query T rowsort
select group_concat(b) from testme
----
another,testing,all,lets,get,harder,even,more,serious,,stress,

statement ok
rollback

