statement ok
CREATE TABLE sys.abc (a INT, b VARCHAR(10))

statement ok
INSERT INTO sys.abc VALUES (1, 'one')

statement ok
INSERT INTO sys.abc VALUES (2, 'two')

query IT rowsort
SELECT * FROM sys.abc
----
1
one
2
two

statement ok
DELETE FROM sys.statistics

statement ok
ANALYZE sys.abc

query TIIIIITTII rowsort
SELECT   type, width,   "sample", "count", "unique", nils, minval, maxval, sorted, revsorted FROM sys.statistics
----
int
4
2
2
2
0
1
2
1
0
varchar
1
2
2
2
0
one
two
1
0

query TIIIIITTII rowsort
-- expected 2 rows
SELECT   type, width,   "sample", "count", "unique", nils, minval, maxval, sorted, revsorted FROM sys.statistics where column_id not in (select id from sys.columns)
----

statement ok
-- expected 0 rows
ALTER TABLE sys.abc DROP COLUMN b

query TIIIIITTII rowsort
SELECT   type, width,   "sample", "count", "unique", nils, minval, maxval, sorted, revsorted FROM sys.statistics where column_id not in (select id from sys.columns)
----

statement ok
-- expected 0 rows but found 1 row !
DROP TABLE sys.abc CASCADE

query TIIIIITTII rowsort
SELECT   type, width,   "sample", "count", "unique", nils, minval, maxval, sorted, revsorted FROM sys.statistics where column_id not in (select id from sys.columns)
----

query TIIIIITTII rowsort
-- expected 0 rows but found 2 rows !
SELECT   type, width,   "sample", "count", "unique", nils, minval, maxval, sorted, revsorted FROM sys.statistics
----

statement ok
-- expected 0 rows but found 2 rows !
DELETE FROM sys.statistics

