query I rowsort
SELECT count(*) = 0 FROM sys.statistics
----
1

query I rowsort
ANALYZE sys
----
1

query I rowsort
SELECT count(*) > 0 FROM sys.statistics WHERE nils <> 0
----
1

query I rowsort
SELECT count(*) > 0 FROM sys.statistics WHERE nils <> 0 AND (minval IS NULL OR maxval IS NULL)
----
1

query I rowsort
SELECT count(*) > 0 FROM sys.statistics WHERE count > 0 AND (minval IS NULL OR maxval IS NULL)
----
1

query I rowsort
ANALYZE tmp
----
1

query I rowsort
SELECT count(*) > 0 FROM sys.statistics WHERE nils <> 0
----
1

query I rowsort
SELECT count(*) > 0 FROM sys.statistics WHERE nils <> 0 AND (minval IS NULL OR maxval IS NULL)
----
1

query I rowsort
SELECT count(*) > 0 FROM sys.statistics WHERE count > 0 AND (minval IS NULL OR maxval IS NULL)
----
1

query I rowsort
ANALYZE profiler
----
1

query I rowsort
SELECT count(*) > 0 FROM sys.statistics WHERE nils <> 0
----
1

query I rowsort
SELECT count(*) > 0 FROM sys.statistics WHERE nils <> 0 AND (minval IS NULL OR maxval IS NULL)
----
1

query I rowsort
SELECT count(*) > 0 FROM sys.statistics WHERE count > 0 AND (minval IS NULL OR maxval IS NULL)
----
1

query T rowsort
select '~BeginVariableOutput~'
----
~BeginVariableOutput~

statement ok
DELETE FROM sys.statistics

query T rowsort
select '~EndVariableOutput~'
----
~EndVariableOutput~

