query T rowsort
SELECT count(*) = 0 FROM sys.statistics
----
True

query T rowsort
ANALYZE sys
----
True

query T rowsort
SELECT count(*) > 0 FROM sys.statistics WHERE nils <> 0
----
True

query T rowsort
SELECT count(*) > 0 FROM sys.statistics WHERE nils <> 0 AND (minval IS NULL OR maxval IS NULL)
----
True

query T rowsort
SELECT count(*) > 0 FROM sys.statistics WHERE count > 0 AND (minval IS NULL OR maxval IS NULL)
----
True

query T rowsort
ANALYZE tmp
----
True

query T rowsort
SELECT count(*) > 0 FROM sys.statistics WHERE nils <> 0
----
True

query T rowsort
SELECT count(*) > 0 FROM sys.statistics WHERE nils <> 0 AND (minval IS NULL OR maxval IS NULL)
----
True

query T rowsort
SELECT count(*) > 0 FROM sys.statistics WHERE count > 0 AND (minval IS NULL OR maxval IS NULL)
----
True

query T rowsort
ANALYZE profiler
----
True

query T rowsort
SELECT count(*) > 0 FROM sys.statistics WHERE nils <> 0
----
True

query T rowsort
SELECT count(*) > 0 FROM sys.statistics WHERE nils <> 0 AND (minval IS NULL OR maxval IS NULL)
----
True

query T rowsort
SELECT count(*) > 0 FROM sys.statistics WHERE count > 0 AND (minval IS NULL OR maxval IS NULL)
----
True

query T rowsort
select '~BeginVariableOutput~'
----
~BeginVariableOutput~

statement ok
DELETE FROM sys.statistics

query T rowsort
select '~EndVariableOutput~'
----
~EndVariableOutput~


