statement ok
create table t1_2073 (id serial, toggle boolean)

statement ok
create table t2_2073 (id serial, ref bigint)

statement ok
insert into t1_2073 (toggle) values (false)

statement ok
insert into t1_2073 (toggle) values (false)

statement ok
create trigger updateMe
        after update on t1_2073 referencing new row new_row
        for each row when ( new_row.toggle = true )
                insert into t2_2073 (ref) values (new_row.id)

statement ok
update t1_2073 set toggle = true where id = 1

query II rowsort
select * from t2_2073
----
1
1

statement ok
drop table t1_2073 CASCADE

statement ok
drop table t2_2073 CASCADE

statement ok
create table t1_2073 (id serial, toggle boolean)

statement ok
create table t2_2073 (id serial, ref bigint)

statement ok
insert into t1_2073 (toggle) values (false)

statement ok
insert into t1_2073 (toggle) values (false)

statement ok
create trigger updateMe2
        after update on t1_2073 referencing new row new_row
        for each row insert into t2_2073 (ref) values (new_row.id)

statement ok
update t1_2073 set toggle = true where id = 1

query II rowsort
select * from t2_2073
----
1
1

statement ok
drop table t1_2073 CASCADE

statement ok
drop table t2_2073 CASCADE

