statement ok
CREATE SEQUENCE sys.myseq_5700 AS INTEGER

statement ok
CREATE TABLE kvk (
        id                INTEGER       NOT NULL       DEFAULT next value for myseq_5700,
        kvk               BIGINT,
        bedrijfsnaam      VARCHAR(256),
        adres             VARCHAR(256),
        postcode          VARCHAR(10),
        plaats            VARCHAR(32),
        type              VARCHAR(14),
        kvks              INTEGER,
        sub               INTEGER,
        bedrijfsnaam_size SMALLINT,
        adres_size        SMALLINT,
        website           VARCHAR(255),
        CONSTRAINT kvk_id_pkey PRIMARY KEY (id)
)

statement ok
insert into  kvk(kvk, bedrijfsnaam, adres, postcode, plaats, type, kvks, sub, bedrijfsnaam_size,  adres_size, website) values (1, 'table1', 'table1', 'table1',  'table1',  'table1',  23, 24, 1, 1, 'table1')

statement ok
insert into  kvk(kvk, bedrijfsnaam, adres, postcode, plaats, type, kvks, sub, bedrijfsnaam_size,  adres_size, website) values (1, 'table1', 'table1', 'table1',  'table1',  'table1',  23, 24, 1, 1, 'table2')

statement ok
CREATE TABLE kvk_extra_nieuw (
        kvk          BIGINT,
        bedrijfsnaam VARCHAR(256),
        straat       VARCHAR(256),
        nummer       INTEGER,
        toevoeging   VARCHAR(16),
        postcode     VARCHAR(10),
        plaats       VARCHAR(32),
        website      VARCHAR(128),
        type         VARCHAR(14),
        status       VARCHAR(64),
        kvks         INTEGER,
        sub          INTEGER
)

statement ok
insert into  kvk_extra_nieuw values (1, 'test', 'test', 10,  'test',  'test',  'test',  'test',  'test',  'test', 10, 11)

statement ok
insert into  kvk_extra_nieuw values (2, 'test', 'test', 10,  'test',  'test',  'test',  'test',  'test',  'test', 10, 11)

statement ok
insert into  kvk_extra_nieuw values (3, 'test', 'test', 10,  'test',  'test',  'test',  'test',  'test',  'test', 10, 11)

statement ok
insert into  kvk_extra_nieuw values (4, 'test', 'test', 10,  'test',  'test',  'test',  'test',  'test',  'test', 10, 11)

statement ok
insert into  kvk_extra_nieuw values (5, 'test', 'test', 10,  'test',  'test',  'test',  'test',  'test',  'test', 10, 11)

query IITTTTTIIIIT rowsort
select * from  kvk
----
1
1
table1
table1
table1
table1
table1
23
24
1
1
table1
2
1
table1
table1
table1
table1
table1
23
24
1
1
table2

query ITTITTTTTTII rowsort
select * from  kvk_extra_nieuw
----
1
test
test
10
test
test
test
test
test
test
10
11
2
test
test
10
test
test
test
test
test
test
10
11
3
test
test
10
test
test
test
test
test
test
10
11
4
test
test
10
test
test
test
test
test
test
10
11
5
test
test
10
test
test
test
test
test
test
10
11

statement ok
update kvk set website = (select distinct kvk_extra_nieuw.website from kvk, kvk_extra_nieuw WHERE
kvk.kvk = kvk_extra_nieuw.kvk and kvk_extra_nieuw.website is not null)

query IITTTTTIIIIT rowsort
select * from  kvk
----
1
1
table1
table1
table1
table1
table1
23
24
1
1
test
2
1
table1
table1
table1
table1
table1
23
24
1
1
test

statement ok
drop table kvk_extra_nieuw

statement ok
drop table  kvk

statement ok
drop SEQUENCE sys.myseq_5700

