statement ok
create table merging (aa int, bb clob)

statement ok
create table predata (aa int, bb int)

statement ok
start transaction

statement ok rowcount 1
insert into merging values (-100, 1)

statement ok rowcount 6
insert into predata values (15, 3), (3, 1), (2, 1), (5, 3), (NULL, 2), (3, 2)

statement ok rowcount 2
merge into predata using (select aa, bb from merging) sub on predata.bb = sub.bb
      when matched then delete when not matched then insert values (6, 6)

query II rowsort
select aa, bb from predata
----
15
3
3
2
5
3
NULL
2

statement ok rowcount 4
delete from predata

statement ok rowcount 6
insert into predata values (15, 3), (3, 1), (2, 1), (5, 3), (4, 1), (6, 3)

statement ok rowcount 3
merge into predata using (select aa, bb from merging) sub on predata.bb = sub.bb
      when not matched then insert values (null, null) when matched then update set bb = 3

query II rowsort
select aa, bb from predata
----
15
3
2
3
3
3
4
3
5
3
6
3

statement ok rowcount 6
delete from predata

statement ok rowcount 6
insert into predata values (15, 3), (3, 1), (2, 1), (5, 3), (8, 2), (NULL, 4)

statement ok rowcount 2
merge into predata using (select aa, bb from merging) as sub on predata.bb = sub.bb
      when matched then update set bb = predata.bb + 1

statement ok rowcount 0
merge into predata othertt using (select aa, bb from merging) as sub on othertt.bb = sub.bb
      when matched then update set bb = othertt.bb + sub.bb

query II rowsort
select aa, bb from predata
----
15
3
2
2
3
2
5
3
8
2
NULL
4

statement ok rowcount 6
delete from predata

statement ok rowcount 4
insert into predata values (15, 1), (3, 1), (6, 3), (8, 2)

statement ok rowcount 1
insert into merging values (-500, -300)

statement ok rowcount 1
merge into predata using (select aa, bb from merging) as sub on predata.bb = sub.bb
      when not matched then insert values (sub.aa, 2)

query II rowsort
select aa, bb from predata
----
-500
2
15
1
3
1
6
3
8
2

statement ok rowcount 1
insert into merging values (1900, 2)

statement ok rowcount 1
merge into predata othertt using (select aa, bb from merging) as sub on othertt.bb = sub.bb
      when not matched then insert values (sub.aa + 5, sub.bb * 2)

query II rowsort
select aa, bb from predata
----
-495
-600
-500
2
15
1
3
1
6
3
8
2

statement ok rowcount 6
delete from predata

statement ok rowcount 1
insert into predata values (2, 2)

statement ok rowcount 2
merge into predata using (select aa, bb from merging) thee on predata.bb = thee.bb
      when not matched then insert

query II rowsort
select aa, bb from predata
----
2
2
NULL
NULL
NULL
NULL

statement ok
rollback

statement ok rowcount 1
insert into predata values (1, 1)

statement ok rowcount 2
insert into merging values (1, 1), (2, 1)

statement error
merge into predata using (select aa, bb from merging) as sub on predata.bb = sub.bb
      when matched then update set aa = sub.aa

query II rowsort
select aa, bb from predata
----
1
1

statement error
merge into predata using (select aa, bb from merging) as sub on predata.bb = sub.bb
      when matched then delete

query II rowsort
select aa, bb from predata
----
1
1

statement error
merge into predata othertt using (select aa, bb from merging) as sub on othertt.bb = sub.bb
      when not matched then insert values (othertt.aa, othertt.bb)

statement error
merge into predata using (select aa, bb from merging) as sub on predata.bb = sub.bb
      when not matched then insert select 41, -12

statement error
merge into predata using (select aa, bb from merging) as sub on predata.bb = sub.bb
      when not matched then insert select aa, bb from predata

statement error
merge into predata using (select aa, bb from merging) as sub on predata.bb = sub.bb
      when matched then update set bb = bb - 1

statement ok
drop table merging

statement ok
drop table predata

