statement ok
CREATE TABLE food_store (id INT, "name" TEXT, new_item BOOL)

statement ok rowcount 5
INSERT INTO food_store VALUES (1, 'bread', false), (2, 'coffee', false), (3, 'tea', false), (4, 'butter', false), (5, 'chocolate', false)

statement ok
CREATE TABLE releases (id INT, reason CLOB)

statement ok rowcount 2
INSERT INTO releases VALUES (5, 'too warm to eat chocolate'), (6, 'end of chestnuts season')

statement ok
CREATE TABLE incoming (id INT, "name" CLOB)

statement ok rowcount 1
INSERT INTO incoming VALUES (6, 'ice cream')

statement ok rowcount 1
MERGE INTO food_store AS to_update USING releases AS food_updates
  ON to_update.id = food_updates.id
  WHEN MATCHED THEN DELETE

statement ok rowcount 1
MERGE INTO food_store USING (SELECT id, "name" FROM incoming) AS new_food
  ON food_store.id = new_food.id
  WHEN NOT MATCHED THEN INSERT VALUES (new_food.id, new_food."name", true)

query ITI rowsort
SELECT id, "name", new_item FROM food_store
----
1
bread
0
2
coffee
0
3
tea
0
4
butter
0
6
ice cream
1

statement ok rowcount 1
TRUNCATE incoming

statement ok rowcount 3
INSERT INTO incoming VALUES (1, 'cookies'), (2, 'cake'), (7, 'peanuts')

statement ok rowcount 3
MERGE INTO food_store USING (SELECT id, "name" FROM incoming) AS food_updates
  ON food_store.id = food_updates.id
  WHEN NOT MATCHED THEN INSERT VALUES (food_updates.id, food_updates."name", true)
  WHEN MATCHED THEN UPDATE SET "name" = food_updates."name", new_item = true

query ITI rowsort
SELECT id, "name", new_item FROM food_store
----
1
cookies
1
2
cake
1
3
tea
0
4
butter
0
6
ice cream
1
7
peanuts
1

statement ok rowcount 2
TRUNCATE releases

statement ok rowcount 2
INSERT INTO releases VALUES (1, 'chocolate cookies'), (1, 'gluten cookies')

statement error
MERGE INTO food_store USING (SELECT id, reason FROM releases) AS food_updates
  ON food_store.id = food_updates.id
  WHEN MATCHED THEN UPDATE SET new_item = true

query ITI rowsort
SELECT id, "name", new_item FROM food_store
----
1
cookies
1
2
cake
1
3
tea
0
4
butter
0
6
ice cream
1
7
peanuts
1

statement ok
DROP TABLE food_store

statement ok
DROP TABLE releases

statement ok
DROP TABLE incoming

