statement ok
create table tr(a int)

statement ok
insert into tr values (1), (1)

query I rowsort
select count(*) from (select a + rand() as arand from tr) as ntr group by arand
----
1
1

statement ok
create table trand (a int, b int default rand())

statement ok
insert into trand(a) values (1)

statement ok
insert into trand(a) values (2)

statement ok
insert into trand(a) values (3)

statement ok
alter table trand add column c int default rand()

statement ok
alter table trand add column d int default null

query I rowsort
select count(*) from trand group by b
----
1
1
1

query I rowsort
select count(*) from trand group by c
----
1
1
1

statement ok
update trand set d = rand()

query I rowsort
select count(*) from trand group by d
----
1
1
1

statement ok
update trand set a = a + rand()

query I rowsort
select count(*) from trand group by a
----
1
1
1

statement ok
drop table tr

statement ok
drop table trand

