statement ok
CREATE TABLE datepoint_wrong (mydate DATE, insiderange BOOLEAN DEFAULT FALSE, rangename CHAR(8))

statement ok
INSERT INTO datepoint_wrong (mydate) VALUES ('2012-05-09')

statement ok
INSERT INTO datepoint_wrong (mydate) VALUES ('2012-03-09')

statement ok
CREATE TABLE daterange_wrong (startdate DATE, enddate DATE, name CHAR(8))

statement ok
INSERT INTO daterange_wrong (startdate, enddate, name) VALUES ('2012-03-01','2012-03-31','A')

query TITTTT rowsort
SELECT * FROM datepoint_wrong A, daterange_wrong B WHERE A.mydate BETWEEN B.startdate AND B.enddate
----
2012-03-09
0
NULL
2012-03-01
2012-03-31
A

statement ok
UPDATE datepoint_wrong
SET (insiderange, rangename) = (
	SELECT TRUE, name
	FROM (
		SELECT startdate, enddate, name
		FROM daterange_wrong
	) AS B
	WHERE datepoint_wrong.mydate >= B.startdate
	AND datepoint_wrong.mydate <= B.enddate
)

query TIT rowsort
SELECT * FROM datepoint_wrong
----
2012-03-09
1
A
2012-05-09
NULL
NULL

statement ok
CREATE TABLE datepoint_correct1 (mydate DATE, insiderange BOOLEAN DEFAULT FALSE, rangename CHAR(8))

statement ok
INSERT INTO datepoint_correct1 (mydate) VALUES ('2012-05-09')

statement ok
INSERT INTO datepoint_correct1 (mydate) VALUES ('2012-03-09')

statement ok
INSERT INTO datepoint_correct1 (mydate) VALUES ('2012-04-09')

statement ok
CREATE TABLE daterange_correct1 (startdate DATE, enddate DATE, name CHAR(8))

statement ok
INSERT INTO daterange_correct1 (startdate, enddate, name) VALUES ('2012-03-01','2012-03-31','A')

query TITTTT rowsort
SELECT * FROM datepoint_correct1 A, daterange_correct1 B WHERE A.mydate BETWEEN B.startdate AND B.enddate
----
2012-03-09
0
NULL
2012-03-01
2012-03-31
A

statement ok
UPDATE datepoint_correct1
SET (insiderange, rangename) = (
	SELECT TRUE, name
	FROM (
		SELECT startdate, enddate, name
		FROM daterange_correct1
	) AS B
	WHERE datepoint_correct1.mydate >= B.startdate
	AND datepoint_correct1.mydate <= B.enddate
)

query TIT rowsort
SELECT * FROM datepoint_correct1
----
2012-03-09
1
A
2012-04-09
NULL
NULL
2012-05-09
NULL
NULL

statement ok
CREATE TABLE datepoint_correct2 (mydate DATE, insiderange BOOLEAN DEFAULT FALSE, rangename CHAR(8))

statement ok
INSERT INTO datepoint_correct2 (mydate) VALUES ('2012-03-09')

statement ok
INSERT INTO datepoint_correct2 (mydate) VALUES ('2012-05-09')

statement ok
CREATE TABLE daterange_correct2 (startdate DATE, enddate DATE, name CHAR(8))

statement ok
INSERT INTO daterange_correct2 (startdate, enddate, name) VALUES ('2012-03-01','2012-03-31','A')

query TITTTT rowsort
SELECT * FROM datepoint_correct2 A, daterange_correct2 B WHERE A.mydate BETWEEN B.startdate AND B.enddate
----
2012-03-09
0
NULL
2012-03-01
2012-03-31
A

statement ok
UPDATE datepoint_correct2
SET (insiderange, rangename) = (
	SELECT TRUE, name
	FROM (
		SELECT startdate, enddate, name
		FROM daterange_correct2
	) AS B
	WHERE datepoint_correct2.mydate >= B.startdate
	AND datepoint_correct2.mydate <= B.enddate
)

query TIT rowsort
SELECT * FROM datepoint_correct2
----
2012-03-09
1
A
2012-05-09
NULL
NULL

statement ok
DROP TABLE datepoint_wrong

statement ok
DROP TABLE datepoint_correct1

statement ok
DROP TABLE datepoint_correct2

statement ok
DROP TABLE daterange_wrong

statement ok
DROP TABLE daterange_correct1

statement ok
DROP TABLE daterange_correct2

