statement ok
CREATE TABLE t1 (id VARCHAR(48), col1 VARCHAR(32), col2 VARCHAR(8), excepted BOOLEAN)

statement ok
INSERT INTO t1 (id, col1, col2, excepted) VALUES ('12', 'col1.A.99.code', '.03', 'false'), ('12', 'col1.A.99.code', '.02', 'false')

statement ok
CREATE TABLE t2 (id  VARCHAR(48), col3 VARCHAR(32), col2 VARCHAR(8), row int)

statement ok
INSERT INTO t2 (id, col3, col2, row) VALUES ('12',null,null,null)

statement ok
UPDATE t2 SET (col3, col2, row) =
(SELECT col1, col2, row
FROM (
	SELECT id, col1, col2,
		   ROW_NUMBER() OVER (PARTITION BY id ORDER BY (col1 LIKE '%.%.99.%') ASC,
			                  col1 ASC, col2 ASC) AS row
	FROM t1
	WHERE excepted = false
  	  AND col1 LIKE '%.A.%'
)  AS t3
WHERE t3.row = 1
AND t2.id= t3.id
)

query TTTI rowsort
SELECT * FROM t2
----
12
col1.A.99.code
.02
1

statement ok
DROP TABLE t2

statement ok
CREATE TABLE t2 (id  VARCHAR(48), col3 VARCHAR(32), col2 VARCHAR(8), row int)

statement ok
INSERT INTO t2 (id, col3, col2, row) VALUES ('12',null,null,null)

statement ok
CREATE TABLE t3 AS (
	SELECT id, col1, col2,
	       ROW_NUMBER() OVER (PARTITION BY id ORDER BY (col1 LIKE '%.%.99.%') ASC,
			                  col1 ASC,col2 ASC) AS row
	FROM t1
	WHERE excepted = false AND col1 LIKE '%.A.%'
) WITH DATA

statement ok
UPDATE t2 SET (col3, col2, row) = (SELECT col1, col2, row FROM t3 WHERE t2.id= t3.id AND t3.row = 1)

query TTTI rowsort
SELECT * FROM t2
----
12
col1.A.99.code
.02
1

statement ok
DROP TABLE t1

statement ok
DROP TABLE t2

statement ok
DROP TABLE t3

