statement ok
CREATE TABLE datepoint (mydate DATE, insiderange BOOLEAN DEFAULT FALSE, rangename CHAR(8))

statement ok
INSERT INTO datepoint (mydate) VALUES ('2012-05-09')

statement ok
INSERT INTO datepoint (mydate) VALUES ('2012-03-09')

statement ok
CREATE TABLE daterange (startdate DATE, enddate DATE, name CHAR(8))

statement ok
INSERT INTO daterange (startdate, enddate, name) VALUES ('2012-03-01','2012-03-31','A')

query TTTTIT rowsort
SELECT *
FROM (
	SELECT startdate, enddate, name
	FROM daterange
) AS B, datepoint
WHERE datepoint.mydate >= B.startdate
AND datepoint.mydate <= B.enddate
----
2012-03-01
2012-03-31
A
2012-03-09
0
NULL

statement ok
UPDATE datepoint
SET (insiderange) = (
	SELECT TRUE
	FROM (
		SELECT startdate, enddate, name
		FROM daterange
	) AS B
	WHERE datepoint.mydate >= B.startdate
	AND datepoint.mydate <= B.enddate
)

query TIT rowsort
SELECT * FROM datepoint
----
2012-03-09
1
NULL
2012-05-09
NULL
NULL

statement ok
DROP TABLE datepoint

statement ok
DROP TABLE daterange

statement ok
CREATE TABLE datepoint (mydate DATE, insiderange BOOLEAN DEFAULT FALSE, rangename CHAR(8))

statement ok
INSERT INTO datepoint (mydate) VALUES ('2012-05-09')

statement ok
INSERT INTO datepoint (mydate) VALUES ('2012-03-09')

statement ok
CREATE TABLE daterange (startdate DATE, enddate DATE, name CHAR(8))

statement ok
INSERT INTO daterange (startdate, enddate, name) VALUES ('2012-03-01','2012-03-31','A')

statement ok
UPDATE datepoint
SET insiderange = (
	SELECT TRUE
	FROM (
		SELECT startdate, enddate, name
		FROM daterange
	) AS B
	WHERE datepoint.mydate >= B.startdate
	AND datepoint.mydate <= B.enddate
)

query TIT rowsort
SELECT * FROM datepoint
----
2012-03-09
1
NULL
2012-05-09
NULL
NULL

statement ok
DROP TABLE datepoint

statement ok
DROP TABLE daterange

