statement ok
CREATE TABLE test (ID BIGINT, UUID STRING, sec BIGINT, data VARCHAR(1000))

statement ok rowcount 2
INSERT INTO test VALUES
  (1000000, 'uuid0000', 1621539934, 'a0' )
, (1000003, 'uuid0003', 1621539934, 'a3' )

statement ok
CREATE TABLE extra (ID BIGINT, UUID STRING, sec BIGINT, extra VARCHAR(1000))

statement ok rowcount 12
INSERT INTO extra VALUES
  (1000009, 'uuid0009', 1621539934, 'a9' )
, (1000009, 'uuid0009', 1621539934, 'a9' )
, (1000009, 'uuid0009', 1621539934, 'a9' )
, (1000009, 'uuid0009', 1621539934, 'a9' )
, (1000000, 'uuid0000', 1621539934, 'a0' )
, (1000000, 'uuid0000', 1621539934, 'a0' )
, (1000000, 'uuid0000', 1621539934, 'a0' )
, (1000000, 'uuid0000', 1621539934, 'a0' )
, (1000003, 'uuid0003', 1621539934, 'a3' )
, (1000003, 'uuid0003', 1621539934, 'a3' )
, (1000003, 'uuid0003', 1621539934, 'a3' )
, (1000003, 'uuid0003', 1621539934, 'a3' )

query II nosort
SELECT id, COUNT(*) as cnt FROM extra GROUP BY id ORDER BY id
----
1000000
4
1000003
4
1000009
4

statement error 42S22!SELECT: no such column 'ca.id'
WITH ca AS
(
        SELECT e.ID as id
             , e.UUID as uuid
             , e.sec as sec
          FROM extra AS e
LEFT OUTER JOIN test AS t
            ON t.ID = e.ID
           AND t.UUID = e.UUID
           AND t.sec = e.sec
         WHERE t.ID IS NULL
           AND t.UUID IS NULL
           AND t.sec IS NULL
)
DELETE
FROM extra AS i
WHERE i.id = ca.id
  AND i.sec = ca.sec
  AND i.uuid = ca.uuid

query I rowsort
SELECT COUNT(*) FROM extra
----
12

query TTTI rowsort
select table, column, type, count from sys.storage() where table = 'extra'
----
extra
extra
varchar
12
extra
id
bigint
12
extra
sec
bigint
12
extra
uuid
clob
12

statement ok
DROP TABLE IF EXISTS test

statement ok
DROP TABLE IF EXISTS extra


