statement ok
CREATE TABLE t1
  (id INT NOT NULL
  ,c1 DOUBLE NOT NULL
  ,c2 DOUBLE NOT NULL
  ,c3 DOUBLE NOT NULL
  ,c4 DOUBLE NOT NULL
  ,c5 DOUBLE NOT NULL
  ,c6 DOUBLE NOT NULL
  ,c7 DOUBLE NOT NULL
  )

statement ok
CREATE TABLE t2
  (id INT NOT NULL
  ,c1 DOUBLE NOT NULL
  ,c2 DOUBLE NOT NULL
  ,c3 DOUBLE NOT NULL
  ,c4 DOUBLE NOT NULL
  ,c5 DOUBLE NOT NULL
  ,c6 DOUBLE NOT NULL
  ,c7 DOUBLE NOT NULL
  )

statement ok
INSERT INTO t1
VALUES
  (1,1.0,2.0,3.0,4.0,5.0,6.0,7.0),
  (2,2.0,3.0,4.0,5.0,6.0,7.0,8.0),
  (3,3.0,4.0,5.0,6.0,7.0,8.0,9.0),
  (4,4.0,5.0,6.0,7.0,8.0,9.0,1.0),
  (5,5.0,6.0,7.0,8.0,9.0,1.0,2.0)

statement ok
INSERT INTO t2
VALUES
  (1,11.0,12.0,13.0,14.0,15.0,16.0,17.0),
  (2,12.0,13.0,14.0,15.0,16.0,17.0,18.0),
  (3,13.0,14.0,15.0,16.0,17.0,18.0,19.0),
  (4,14.0,15.0,16.0,17.0,18.0,19.0,11.0),
  (5,15.0,16.0,17.0,18.0,19.0,11.0,12.0)

query IRRRRRRR rowsort
SELECT * FROM t1
----
1
1.000
2.000
3.000
4.000
5.000
6.000
7.000
2
2.000
3.000
4.000
5.000
6.000
7.000
8.000
3
3.000
4.000
5.000
6.000
7.000
8.000
9.000
4
4.000
5.000
6.000
7.000
8.000
9.000
1.000
5
5.000
6.000
7.000
8.000
9.000
1.000
2.000

query IRRRRRRR rowsort
SELECT * FROM t2
----
1
11.000
12.000
13.000
14.000
15.000
16.000
17.000
2
12.000
13.000
14.000
15.000
16.000
17.000
18.000
3
13.000
14.000
15.000
16.000
17.000
18.000
19.000
4
14.000
15.000
16.000
17.000
18.000
19.000
11.000
5
15.000
16.000
17.000
18.000
19.000
11.000
12.000

statement ok
UPDATE t1
   SET c1 = (SELECT c1
               FROM t2
              WHERE t2.id = t1.id
            )
      ,c2 = (SELECT c2
               FROM t2
              WHERE t2.id = t1.id
            )
      ,c3 = (SELECT c3
               FROM t2
              WHERE t2.id = t1.id
            )
      ,c4 = (SELECT c4
               FROM t2
              WHERE t2.id = t1.id
            )
      ,c5 = (SELECT c5
               FROM t2
              WHERE t2.id = t1.id
            )
      ,c6 = (SELECT c6
               FROM t2
              WHERE t2.id = t1.id
            )
      ,c7 = (SELECT c7
               FROM t2
              WHERE t2.id = t1.id
            )
 WHERE EXISTS (SELECT id
                 FROM t2
                WHERE t2.id = t1.id
              )

query IRRRRRRR rowsort
SELECT * FROM t1
----
1
11.000
12.000
13.000
14.000
15.000
16.000
17.000
2
12.000
13.000
14.000
15.000
16.000
17.000
18.000
3
13.000
14.000
15.000
16.000
17.000
18.000
19.000
4
14.000
15.000
16.000
17.000
18.000
19.000
11.000
5
15.000
16.000
17.000
18.000
19.000
11.000
12.000

statement ok
DROP TABLE t1

statement ok
DROP TABLE t2

