query I rowsort
select 1
----
1

statement ok
CREATE TABLE foo (id INTEGER, name VARCHAR(20))

statement ok
INSERT INTO foo VALUES (1, 'Tim')

statement ok
INSERT INTO foo VALUES (2, 'Jochem')

statement ok
drop table foo

query I rowsort
select 1
----
1

statement ok
CREATE TABLE ff(id INTEGER, name VARCHAR(20))

statement ok
INSERT INTO ff VALUES (1, 'Tim')

statement ok
INSERT INTO ff VALUES (2, 'Jochem')

query IT rowsort
select * from ff
----
1
Tim
2
Jochem

statement ok
drop table ff

query I rowsort
select (4-1)*5
----
15

query TTIII rowsort
select name, query, "type", system, commit_action from sys._tables
	where name like 'foo' or name like 'ff'
----

statement ok
create table s4(i time)

statement ok
drop table s4

statement ok
create table r(i int)

statement ok
insert into r values(1)

statement ok
insert into r values(2)

query I rowsort
select * from r
----
1
2

statement ok
delete from r where i>1

query I rowsort
select * from r
----
1

query I rowsort
select * from r
----
1

query TTIII rowsort
select name, query, "type", system, commit_action from sys._tables
	where name in ('s4', 'r', 'foo', 'ff')
----
r
NULL
0
0
0

statement ok
drop table r

statement ok
create table r(i int)

statement ok
insert into r values(1)

statement ok
insert into r values(2)

query I rowsort
select * from r
----
1
2

statement ok
drop table r

statement ok
create table r(i int)

statement ok
insert into r values(1)

statement ok
insert into r values(2)

statement ok
delete from r where i>1

query I rowsort
select * from r
----
1

query I rowsort
select * from r
----
1

statement ok
drop table r

statement ok
create table r(i int)

statement ok
insert into r values(1)

statement ok
drop table r

statement error
select name, count(*) from sys._tables

query TIII rowsort
select name, 1, 2, 3  from sys._tables
	where name in ('s4', 'r', 'foo', 'ff')
----

