statement ok
create table test_update (id varchar(1), x int)

statement ok
insert into test_update values ('a', 1)

statement ok
insert into test_update values ('b', 2)

query TI rowsort
select * from test_update order by id
----
a
1
b
2

statement ok
update test_update set x=x+1 where x >= 2

query TI rowsort
select * from test_update order by id
----
a
1
b
3

statement ok
drop table test_update

