statement ok
set optimizer = 'sequential_pipe'

statement ok
CREATE TABLE mytest(a HUGEINT, b HUGEINT, c HUGEINT, d HUGEINT, e HUGEINT)

statement ok
INSERT INTO mytest VALUES (1234567890987654321, 10000000000, NULL, NULL, NULL)

query T python .explain.function_histogram
explain UPDATE mytest SET a = 1234567890987654321
----
user.main
1
querylog.define
1
sql.mvc
1
sql.tid
1
algebra.project
1
sql.update
1
aggr.count
1
sql.affectedRows
1

query T python .explain.function_histogram
explain UPDATE mytest SET b = 10000000000
----
user.main
1
querylog.define
1
sql.mvc
1
sql.tid
1
algebra.project
1
sql.update
1
aggr.count
1
sql.affectedRows
1

query T python .explain.function_histogram
explain UPDATE mytest SET c = a * b
----
user.main
1
querylog.define
1
sql.mvc
1
sql.tid
1
sql.bind
2
algebra.projection
2
sql.update
1
aggr.count
1
sql.affectedRows
1

query T python .explain.function_histogram
explain UPDATE mytest SET d = c * b
----
user.main
1
querylog.define
1
sql.mvc
1
sql.tid
1
sql.bind
2
algebra.projection
2
sql.update
1
aggr.count
1
sql.affectedRows
1

query T python .explain.function_histogram
explain UPDATE mytest SET e = d + a
----
user.main
1
querylog.define
1
sql.mvc
1
sql.tid
1
sql.bind
2
algebra.projection
2
sql.update
1
aggr.count
1
sql.affectedRows
1

statement ok
        UPDATE mytest SET a = 1234567890987654321

statement ok
        UPDATE mytest SET b = 10000000000

statement ok
        UPDATE mytest SET c = a * b

statement ok
        UPDATE mytest SET d = c * b

statement ok
        UPDATE mytest SET e = d + a

query IIIII rowsort
SELECT a, b, c, d, e from mytest
----
1234567890987654321
10000000000
12345678909876543210000000000
123456789098765432100000000000000000000
123456789098765432101234567890987654321

statement ok
DROP TABLE mytest

query I rowsort
SELECT 123456789098765432101234567890987654321
----
123456789098765432101234567890987654321

statement ok
START TRANSACTION

statement ok
CREATE TABLE sql_int128 (i HUGEINT)

query T python .explain.function_histogram
explain INSERT INTO sql_int128 VALUES (123456789098765432101234567890987654321)
----
user.main
1
querylog.define
1
sql.mvc
1
sql.claim
1
sql.append
1
sql.affectedRows
1

statement ok
        INSERT INTO sql_int128 VALUES (123456789098765432101234567890987654321)

query I rowsort
SELECT * FROM sql_int128
----
123456789098765432101234567890987654321

statement ok
ROLLBACK

statement ok
set optimizer = 'default_pipe'

