statement ok
create table foo (i int , j int);

statement ok
insert into foo values (1, 10), (2, 20), (3, 30);

query II nosort
delete from foo where i > 1 returning i*2, j*j as k
----
4
400
6
900

query I nosort
select count(*) from foo
----
1

statement ok
truncate foo

statement ok
insert into foo values (1, 10), (2, 20), (3, 30);

query II nosort
update foo set j = -j where i < 3 returning j+5 as bla, i+i
----
-5
2
-15
4

statement ok
truncate foo

statement ok
insert into foo values (1, 10), (2, 20), (3, 30);


query I nosort
update foo set j = -j returning j+5
----
-5
-15
-25

query I nosort
update foo set i = -i returning -j
----
10
20
30

query I nosort
update foo set i = -i returning sum(j)
----
-60

statement error 42000!SELECT: identifier 'k' unknown
update foo set i = -i returning k

statement error 42000!SELECT: identifier 'k' unknown
delete from foo where i > 0 returning k

statement error 42000!SELECT: subquery not allowed
update foo set i = -i returning i in (select j from foo)

statement error 42000!SELECT: identifier 'k' unknown
delete from foo returning k

query I nosort
delete from foo returning i*i
----
1
4
9

statement ok
truncate foo

query I nosort
insert into foo(j,i) values (1,10), (-1,-10) returning j as bla
----
1
-1

query I nosort
insert into foo values (1,10), (-1,-10) returning i+2*j
----
21
-21


query I nosort
insert into foo(j) values (10), (-10) returning i IS NOT DISTINCT FROM NULL
----
1
1

query I nosort
select count(*) from foo
----
6


statement error 42000!SELECT: identifier 'k' unknown
insert into foo values (1,10), (-1,-10) returning k

statement ok
create function read_dump_rel(rel STRING) RETURNS STRING external name sql.read_dump_rel

query T nosort
select read_dump_rel(
'REF 1 (2)
table("sys"."foo")[ "foo"."i", "foo"."j", "foo"."%TID%" ]
update(
& REF 1 
project (
select (
& REF 1 
) [ ("foo"."i") < (int(31) "3") ]
) [ "foo"."%TID%" , "sys"."sql_neg"("foo"."j") as "foo"."j" ]
) [ "foo"."%TID%" , "foo"."j" ] [ "sys"."sql_add"("foo"."j" , int(3) "5") as "bla", "sys"."sql_add"("foo"."i", "foo"."i") ]')
----
@ REF 1 (2)@table("sys"."foo") [ "foo"."i", "foo"."j" NOT NULL, "foo"."%TID%" NOT NULL UNIQUE ]@update(@& REF 1 @project (@select (@& REF 1 @) [ ("foo"."i") < (int(31) "3") ]@) [ "foo"."%TID%" NOT NULL UNIQUE, "sys"."sql_neg"("foo"."j" NOT NULL) NOT NULL as "foo"."j" ]@) [ "foo"."i", "foo"."j" NOT NULL, "foo"."%TID%" NOT NULL UNIQUE ] [ "sys"."sql_add"("foo"."j" NOT NULL, int(3) "5") NOT NULL as "bla", "sys"."sql_add"("foo"."i", "foo"."i") ]

query T nosort
select read_dump_rel(
'REF 1 (2)
table("sys"."foo") [ "foo"."i" , "foo"."j" , "foo"."%TID%" ]
delete(
& REF 1 
project (
select (
& REF 1 
) [ ("foo"."i" ) > (int(31) "0") ]
) [ "foo"."%TID%" ]
) [ "foo"."j" ]')
----
@ REF 1 (2)@table("sys"."foo") [ "foo"."i", "foo"."j" NOT NULL, "foo"."%TID%" NOT NULL UNIQUE ]@delete(@& REF 1 @project (@select (@& REF 1 @) [ ("foo"."i") > (int(31) "0") ]@) [ "foo"."%TID%" NOT NULL UNIQUE ]@) [ "foo"."j" NOT NULL ]

query T nosort
select read_dump_rel(
'insert(
table("sys"."foo") [ "foo"."i", "foo"."j", "foo"."%TID%" ]
[  [ int(31) NULL, int(31) NULL ] as "%4"."%4",  [ int(31) "10", int(31)["sys"."sql_neg"(tinyint(4) "10") ] ] as "%1"."%1" ]
) [ "foo"."i" ]')
----
@insert(@table("sys"."foo") [ "foo"."i", "foo"."j" NOT NULL, "foo"."%TID%" NOT NULL UNIQUE ]@ [  [ int(31) NULL, int(31) NULL ] as "%4"."%4",  [ int(31) "10", int(31)["sys"."sql_neg"(tinyint(4) "10") NOT NULL] NOT NULL ] as "%1"."%1" ]@) [ "foo"."i" ]
