statement ok
START TRANSACTION

statement ok
CREATE TABLE aap (id int)

statement ok
INSERT INTO aap VALUES (1)

statement ok
INSERT INTO aap VALUES (6)

statement ok
INSERT INTO aap VALUES (8)

statement ok
INSERT INTO aap VALUES (10)

statement ok
COMMIT

query I rowsort
SELECT * FROM aap
----
1
10
6
8

statement ok
UPDATE aap SET id=2 WHERE id=1

query I rowsort
SELECT * FROM aap
----
10
2
6
8

statement ok
UPDATE aap SET id=7 WHERE id=8

query I rowsort
SELECT * FROM aap
----
10
2
6
7

statement ok
DROP TABLE aap

