statement ok
START TRANSACTION

statement ok
CREATE TABLE "t1" ("c0" BIGINT NOT NULL,CONSTRAINT "t1_c0_pkey" PRIMARY KEY ("c0"))

statement ok
INSERT INTO t1(c0) VALUES(2), (+ ((VALUES (sql_min(3, 4)))))

query I rowsort
SELECT * from t1
----
2
3

statement ok
ROLLBACK

statement ok
CREATE TABLE "sys"."t0" ("c0" TIME NOT NULL, "c1" VARCHAR(143),
	CONSTRAINT "t0_c0_pkey" PRIMARY KEY ("c0"), CONSTRAINT "t0_c0_unique" UNIQUE ("c0"), CONSTRAINT "t0_c1_unique" UNIQUE ("c1"))

statement ok
COPY 7 RECORDS INTO "sys"."t0" FROM stdin USING DELIMITERS E'\t',E'\n','"'
<COPY_INTO_DATA>
21:19:08	""
13:02:49	NULL
01:02:11	NULL
16:34:25	NULL
12:11:43	NULL
10:35:38	NULL
04:26:50	NULL

statement ok
CREATE TABLE "sys"."t1" ("c0" CHAR(375) NOT NULL, CONSTRAINT "t1_c0_pkey" PRIMARY KEY ("c0"), CONSTRAINT "t1_c0_fkey" FOREIGN KEY ("c0") REFERENCES "sys"."t0" ("c1"))

statement ok
insert into t1 values ('')

statement error
insert into t1(c0) values ((select 'a')), ('b')

statement error
insert into t1(c0) values(r']BW扗}FUp'), (cast((values (greatest(r'Aᨐ', r'_'))) as string(616))), (r'')

statement ok
DROP TABLE t1

statement ok
DROP TABLE t0

statement ok
CREATE TABLE "sys"."t0" ("c0" BOOLEAN,"c1" DECIMAL(14,3))

statement ok
COPY 7 RECORDS INTO "sys"."t0" FROM stdin USING DELIMITERS E'\t',E'\n','"'
<COPY_INTO_DATA>
false	0.458
true	4.112
false	0.201
false	0.347
true	0.420
false	0.127
false	0.502

statement ok
CREATE TABLE "sys"."t1" ("c0" BOOLEAN,"c1" DECIMAL(14,3))

statement ok
COPY 10 RECORDS INTO "sys"."t1" FROM stdin USING DELIMITERS E'\t',E'\n','"'
<COPY_INTO_DATA>
NULL	0.000
false	0.187
false	0.000
false	NULL
false	NULL
true	NULL
NULL	0.325
NULL	0.374
true	NULL
true	NULL

statement error
select 1 from t1, t0 where cast(t1.c1 as clob) not like ((select 'A' from t0, t1) except all (select 'B' from t0))

statement error
select 1 from t1, t0 where (select 1 from t1) like cast(t1.c1 as clob)

statement error
select 1 from t1, t0 where cast(t1.c1 as clob) between 'b' and ((select 'A' from t0))

statement error
select 1 from t1, t0 where ((select 'A' from t0)) between cast(t1.c1 as clob) and 'a'

statement error
select 1 from t1, t0 where cast(t1.c1 as clob) between ((select 1 from t0)) and 'c'

statement ok
drop table t0

statement ok
drop table t1

statement ok
START TRANSACTION

statement ok
CREATE TABLE "t0" ("c0" DOUBLE PRECISION,"c2" BIGINT)

statement ok
INSERT INTO "t0" VALUES (NULL, 4), (NULL, 6), (NULL, 0), (NULL, 2), (NULL, 1)

statement ok
CREATE TABLE "t2" ("c0" DOUBLE PRECISION,"c1" bigint,"c2" BIGINT,"c4" REAL)

statement ok
INSERT INTO "t2" VALUES (4, 0, 6, NULL),(0.692789052132086, -1, 9, NULL),(2, 0, 6, NULL),(0.9469594820593024, 1, NULL, NULL),(NULL, 0, 6, NULL),
(0.39272912837466945, 8, NULL, NULL),(NULL, NULL, 4, NULL),(2, 0, 6, NULL),(-1596101049, 0, 6, NULL),(-1951243968, 0, 6, NULL),(NULL, 0, 6, NULL),
(NULL, 0, 6, NULL),(NULL, 0, 6, NULL),(NULL, 0, 6, NULL)

query T rowsort
SELECT 4 = ANY(SELECT t2.c2 FROM t2) FROM t0
----
True
True
True
True
True

statement ok
ROLLBACK

statement ok
START TRANSACTION

statement ok
CREATE TABLE "t0" ("c0" REAL,"c1" BOOLEAN,"c3" DOUBLE PRECISION)

statement ok
INSERT INTO "t0" VALUES (NULL, false, NULL)

statement ok
CREATE TABLE "t1" ("c0" REAL)

statement ok
INSERT INTO "t1" VALUES (2),(2),(2),(2),(2),(2),(2),(0.27167553),(0.67248166),(0.7818908),(-9.1086214e+08),(-0.9899925)

statement ok
CREATE TABLE "t2" ("c0" REAL,"c1" BOOLEAN)

statement ok
INSERT INTO "t2" VALUES (-1.2357439e+08, false), (0.16160075, false), (NULL, true)

query R rowsort
SELECT t0.c3 FROM t2, t0 WHERE FALSE BETWEEN t0.c3 = ANY(SELECT t0.c0 FROM t0 WHERE t0.c1) AND TRUE
----
NULL
NULL
NULL

query T rowsort
SELECT FALSE BETWEEN t0.c3 = ANY(SELECT t0.c0 FROM t0 WHERE t0.c1) AND TRUE FROM t2, t0
----
True
True
True

statement ok
ROLLBACK

statement ok
START TRANSACTION

statement ok
CREATE TABLE "sys"."t0" ("c0" BINARY LARGE OBJECT NOT NULL,CONSTRAINT "t0_c0_pkey" PRIMARY KEY ("c0"),CONSTRAINT "t0_c0_unique" UNIQUE ("c0"))

statement ok
INSERT INTO "sys"."t0" VALUES (BINARY LARGE OBJECT 'F4BECB7E'),(BINARY LARGE OBJECT ''),(BINARY LARGE OBJECT 'E0'),(BINARY LARGE OBJECT 'B0'),(BINARY LARGE OBJECT 'A0FA'),
(BINARY LARGE OBJECT 'E67D3FC0'),(BINARY LARGE OBJECT 'A324'),(BINARY LARGE OBJECT '49E0')

statement ok
CREATE TABLE "sys"."t1" ("c0" BINARY LARGE OBJECT)

statement ok
INSERT INTO "sys"."t1" VALUES (BINARY LARGE OBJECT ''), (BINARY LARGE OBJECT 'A0'), (BINARY LARGE OBJECT '')

query T rowsort
SELECT t0.c0 FROM t1, t0 WHERE 4 NOT IN (6, 1.7976931348623157E308, 0)
----
(empty)
(empty)
(empty)
49E0
49E0
49E0
A0FA
A0FA
A0FA
A324
A324
A324
B0
B0
B0
E0
E0
E0
E67D3FC0
E67D3FC0
E67D3FC0
F4BECB7E
F4BECB7E
F4BECB7E

query T rowsort
SELECT 4 NOT IN (6, 1.7976931348623157E308, 0) FROM t1, t0
----
True
True
True
True
True
True
True
True
True
True
True
True
True
True
True
True
True
True
True
True
True
True
True
True

statement ok
ROLLBACK

statement ok
START TRANSACTION

statement ok
CREATE TABLE "sys"."t1" ("c1" TINYINT,"c2" CHAR(22),"c4" INTEGER)

statement ok
INSERT INTO "sys"."t1" VALUES (NULL, NULL, 0),(NULL, NULL, -391221783),(NULL, NULL, -1107653660),(NULL, NULL, 0),(7, 'cTR'' Abp', 0),(7, 'cTR'' Abp', 1),(7, 'cTR'' Abp', -1)

query T rowsort
SELECT t1.c2 FROM t1 WHERE CASE 3 WHEN ((SELECT 0.48) INTERSECT DISTINCT (SELECT -1.2)) THEN FALSE ELSE TRUE END
----
NULL
NULL
NULL
NULL
cTR' Abp
cTR' Abp
cTR' Abp

query T rowsort
SELECT CASE 3 WHEN ((SELECT 0.48) INTERSECT DISTINCT (SELECT -1.2)) THEN FALSE ELSE TRUE END FROM t1
----
True
True
True
True
True
True
True

statement ok
ROLLBACK

statement ok
START TRANSACTION

statement ok
CREATE TABLE "t1" ("c0" SMALLINT NOT NULL,"c2" SMALLINT)

statement ok
INSERT INTO "t1" VALUES (4, NULL),(3, 4),(3, 5),(2, NULL),(6, NULL),(6, NULL),(6, NULL),(6, NULL),(6, NULL),(6, NULL),(6, NULL),(6, NULL),(6, NULL),(6, NULL),(3, NULL),(5, NULL),
(0, 8),(3, NULL),(8, 7),(-1, 6),(3, -3),(7, 7),(0, 1),(8, NULL),(9, NULL),(9, NULL),(-1, NULL),(2, NULL),(7, 8),(1, 2)

statement ok
CREATE TABLE "t2" ("c0" SMALLINT)

statement ok
INSERT INTO "t2" VALUES (NULL), (NULL), (0)

query I rowsort
SELECT t1.c0 FROM t1 FULL OUTER JOIN (SELECT 3.3 FROM t2) AS sub0 ON true WHERE (EXISTS (SELECT 1)) OR greatest(TRUE, FALSE)
----
-1
-1
-1
-1
-1
-1
0
0
0
0
0
0
1
1
1
2
2
2
2
2
2
3
3
3
3
3
3
3
3
3
3
3
3
3
3
3
4
4
4
5
5
5
6
6
6
6
6
6
6
6
6
6
6
6
6
6
6
6
6
6
6
6
6
6
6
6
6
6
6
6
6
6
7
7
7
7
7
7
8
8
8
8
8
8
9
9
9
9
9
9

query T rowsort
SELECT (EXISTS (SELECT 1)) OR greatest(TRUE, FALSE) FROM t1 FULL OUTER JOIN (SELECT 3.3 FROM t2) AS sub0 ON true
----
True
True
True
True
True
True
True
True
True
True
True
True
True
True
True
True
True
True
True
True
True
True
True
True
True
True
True
True
True
True
True
True
True
True
True
True
True
True
True
True
True
True
True
True
True
True
True
True
True
True
True
True
True
True
True
True
True
True
True
True
True
True
True
True
True
True
True
True
True
True
True
True
True
True
True
True
True
True
True
True
True
True
True
True
True
True
True
True
True
True

query I rowsort
SELECT 1 FROM t1 JOIN (SELECT 3.3 FROM t2) AS sub0 ON true WHERE (EXISTS (SELECT 1)) OR true >= true
----
1
1
1
1
1
1
1
1
1
1
1
1
1
1
1
1
1
1
1
1
1
1
1
1
1
1
1
1
1
1
1
1
1
1
1
1
1
1
1
1
1
1
1
1
1
1
1
1
1
1
1
1
1
1
1
1
1
1
1
1
1
1
1
1
1
1
1
1
1
1
1
1
1
1
1
1
1
1
1
1
1
1
1
1
1
1
1
1
1
1

statement ok
ROLLBACK

statement ok
START TRANSACTION

statement ok
CREATE TABLE "sys"."t0" ("c0" DECIMAL(18,3) NOT NULL,"c2" UUID,"c3" CHARACTER LARGE OBJECT,CONSTRAINT "t0_c0_pkey" PRIMARY KEY ("c0"))

statement ok
COPY 7 RECORDS INTO "sys"."t0" FROM stdin USING DELIMITERS E'\t',E'\n','"'
<COPY_INTO_DATA>
0.790	NULL	"-1900689153"
0.184	99ccfc7f-b976-fec3-71ec-4b288badccea	"c2306ddc-bbd0-ded7-7679-d940bb5abc68"
0.309	1ef3706c-8ff1-e8d9-30cd-bfa4df474c76	""
0.033	4e102536-8e5b-2bae-2bed-fdbd3dcfe88a	NULL
0.095	cbd717c5-6248-e6ae-9c9c-e7cde9ddbc18	NULL
0.251	39a0b33b-a1ca-48ff-86ff-e5f08fda4aaf	NULL
0.276	7baae4a1-bd03-8aff-dc8b-6bae5099697f	NULL

statement ok
CREATE TABLE "sys"."t1" ("c0" DECIMAL(18,3) NOT NULL,"c2" UUID,CONSTRAINT "t1_c0_pkey" PRIMARY KEY ("c0"),CONSTRAINT "t1_c0_unique" UNIQUE ("c0"))

statement ok
CREATE TABLE "sys"."t2" ("c2" BIGINT)

statement ok
COPY 7 RECORDS INTO "sys"."t2" FROM stdin USING DELIMITERS E'\t',E'\n','"'
<COPY_INTO_DATA>
5
0
35340968
3
NULL
NULL
1804976115

statement ok
merge into t2 using (select * from t1) as t1 on (((((values (false), (false)))and("isauuid"(r'AJr1G'))))or(exists ((select distinct l2t2.c2 from t0 as l2t0, t2 as l2t2 where false group by l2t2.c2, l2t2.c2,
0.200162480534249) union all (select distinct -25669977 from t1 as l2t1 where false)))) when matched then update set c2 = (coalesce(0.05676984416302433, cast(0.05650992 as bigint)))
when not matched then insert (c2) values (cast(((0.6603879962021974581176664287340827286243438720703125)<>(0.99667693019570047230359932655119337141513824462890625)) as bigint))

statement ok
ROLLBACK

statement ok
START TRANSACTION

statement ok
CREATE TABLE "t2" ("c0" TINYINT)

statement ok
INSERT INTO "t2" VALUES (1), (0)

query T rowsort
select min(case 2 when 3 then uuid 'dbC4da54-8C0B-4b83-E74E-30242dA0a5fF' end) from (values(1)) x(x) group by x
----
NULL

query T rowsort
select min(case (select 2 where false) when 3 then uuid 'dbC4da54-8C0B-4b83-E74E-30242dA0a5fF' end) from t2 group by 0.88
----
NULL

statement ok
ROLLBACK

statement ok
START TRANSACTION

statement ok
CREATE TABLE "t0" ("c0" BIGINT NOT NULL)

statement ok
INSERT INTO "t0" VALUES (4), (5), (6), (8), (1), (3)

statement ok
CREATE TABLE "t1" ("c0" BIGINT NOT NULL)

statement ok
INSERT INTO "t1" VALUES (1), (2), (3), (4), (5), (6), (7), (-28044611), (2089944981)

statement ok
CREATE TABLE "t2" ("c0" UUID,"c2" DOUBLE PRECISION)

statement ok
INSERT INTO "t2" VALUES ('55c1fcb5-9a6d-bbd0-adad-63bd0bdceb6c', 1643235318), (NULL, 1643235318), ('2adc9dae-4bee-e16b-009c-5597cf3129eb', 1643235318),
('c235ee8f-3ade-64b3-df8e-0aa8b72e9ee8', 1643235318), (NULL, 1643235318), (NULL, 1643235318), ('e991e02d-81e5-8e1b-f619-bb2c3d0ee13e', 1643235318), ('62f0ffc6-d452-5f88-fb8a-fd752b88db3e', 1643235318)

query I rowsort
SELECT count(*) FROM t1 GROUP BY t1.c0, least(COALESCE(7, 0.0021309160474272115237681646249257028102874755859375, t1.c0), 1024325040), BLOB '', BLOB 'E0'
----
1
1
1
1
1
1
1
1
1

query I rowsort
SELECT count(*) FROM t1 GROUP BY t1.c0, least(COALESCE(7, 0.0021309160474272115237681646249257028102874755859375, t1.c0), 1024325040), BLOB '', BLOB 'E0'
HAVING ((SELECT DISTINCT least(FALSE, TRUE) FROM t1 AS l1t1, t0 AS l1t0, t2 AS l1t2 WHERE TRUE) EXCEPT ALL (SELECT DISTINCT least(FALSE, FALSE) FROM t2 AS l1t2, t1 AS l1t1, t0 AS l1t0 WHERE TRUE)) ORDER BY 0.656665542677417 ASC NULLS FIRST
----

query I rowsort
SELECT count(*) FROM t1 GROUP BY t1.c0, least(COALESCE(7, 0.0021309160474272115237681646249257028102874755859375, t1.c0), 1024325040), BLOB '', BLOB 'E0'
HAVING NOT (((SELECT DISTINCT least(FALSE, TRUE) FROM t1 AS l1t1, t0 AS l1t0, t2 AS l1t2 WHERE TRUE) EXCEPT ALL (SELECT DISTINCT least(FALSE, FALSE) FROM t2 AS l1t2, t1 AS l1t1, t0 AS l1t0 WHERE TRUE))) ORDER BY 0.656665542677417 ASC NULLS FIRST
----

query I rowsort
SELECT count(*) FROM t1 GROUP BY t1.c0, least(COALESCE(7, 0.0021309160474272115237681646249257028102874755859375, t1.c0), 1024325040), BLOB '', BLOB 'E0'
HAVING (((SELECT DISTINCT least(FALSE, TRUE) FROM t1 AS l1t1, t0 AS l1t0, t2 AS l1t2 WHERE TRUE) EXCEPT ALL (SELECT DISTINCT least(FALSE, FALSE) FROM t2 AS l1t2, t1 AS l1t1, t0 AS l1t0 WHERE TRUE))) IS NULL ORDER BY 0.656665542677417 ASC NULLS FIRST
----
1
1
1
1
1
1
1
1
1

statement ok
ROLLBACK

statement ok
START TRANSACTION

statement ok
CREATE TABLE "sys"."t0" ("c1" REAL NOT NULL,"c2" SMALLINT,"c3" UUID)

statement ok
INSERT INTO "sys"."t0" VALUES (1.2981725e+09, 0, '7dd474c9-f093-8ecd-5f7c-0f9100ac11ba'),(0.49708593, 0, '0aead7ff-1812-bac2-fb0e-f982697d5ddd'),
(0.058829725, 0, '2c8f3ee5-76d2-949f-d4c2-1d2aefc63f3c'),(0.761042, NULL, 'ebdbec5b-679b-7e71-3da8-4daaeb68ee20')

query I rowsort
SELECT 1 FROM t0 HAVING max((t0.c2) IN (52545019, 6))
----


query I rowsort
SELECT 1 FROM t0 GROUP BY t0.c1 HAVING max((t0.c2) IN (52545019, 6))
----


statement ok
ROLLBACK

statement ok
START TRANSACTION

statement ok
CREATE TABLE "t0" ("c0" INTEGER,"c1" DOUBLE PRECISION,CONSTRAINT "t0_c0_unique" UNIQUE ("c0"))

statement ok
INSERT INTO "t0" VALUES (7, NULL),(NULL, NULL),(9, NULL),(-793549595, NULL),(6, NULL),(233979498, NULL),(0, NULL),
(1748037394, -1),(4, NULL),(-270118799, NULL),(-24786483, NULL),(NULL, NULL),(798507700, 4),(1415564245, 0.8530306516131312)

statement ok
CREATE TABLE "t1" ("c0" INTEGER,"c2" UUID)

statement ok
INSERT INTO "t1" VALUES (1212396328, NULL),(-4, NULL),(-270118799, NULL),(1, NULL),(2, '5a6cad30-d7a2-e40b-b55b-aba3ac86aadd')

statement ok
CREATE TABLE "t2" ("c0" INTEGER NOT NULL,CONSTRAINT "t2_c0_pkey" PRIMARY KEY ("c0"))

statement ok
INSERT INTO "t2" VALUES (4),(5),(6),(7),(8),(9),(10),(11),(12),(13),(0)

query I rowsort
SELECT 1 FROM t0, t2 RIGHT OUTER JOIN (VALUES (((SELECT '1') INTERSECT ALL (SELECT DISTINCT '3' FROM t2 AS l1t2 WHERE FALSE)))) AS sub0 ON ('6' LIKE (SELECT DISTINCT 'e' FROM t1 AS l2t1)) GROUP BY t0.c1
----
1
1
1
1

query I rowsort
SELECT 1 FROM t0, t2 RIGHT OUTER JOIN (VALUES (((SELECT '1') INTERSECT ALL (SELECT DISTINCT '3' FROM t2 AS l1t2 WHERE FALSE)))) AS sub0 ON ('6' LIKE (SELECT DISTINCT 'e' FROM t1 AS l2t1)) GROUP BY t0.c1 HAVING count(*) <> 0
----
1
1
1
1

query I rowsort
SELECT 1 FROM t0, t2 RIGHT OUTER JOIN (VALUES (((SELECT '1') INTERSECT ALL (SELECT DISTINCT '3' FROM t2 AS l1t2 WHERE FALSE)))) AS sub0 ON ('6' LIKE (SELECT DISTINCT 'e' FROM t1 AS l2t1)) GROUP BY t0.c1 HAVING NOT (count(*) <> 0)
----


query I rowsort
SELECT 1 FROM t0, t2 RIGHT OUTER JOIN (VALUES (((SELECT '1') INTERSECT ALL (SELECT DISTINCT '3' FROM t2 AS l1t2 WHERE FALSE)))) AS sub0 ON ('6' LIKE (SELECT DISTINCT 'e' FROM t1 AS l2t1)) GROUP BY t0.c1 HAVING (count(*) <> 0) IS NULL
----


statement ok
ROLLBACK

statement ok
START TRANSACTION

statement ok
CREATE TABLE "t0" ("c0" REAL,"c1" DOUBLE,"c4" CHARACTER LARGE OBJECT,CONSTRAINT "t0_c1_unique" UNIQUE ("c1"))

statement ok
CREATE TABLE "t1" ("c2" BINARY LARGE OBJECT NOT NULL)

statement ok
INSERT INTO "t1" VALUES (BINARY LARGE OBJECT '7982'),(BINARY LARGE OBJECT '7982'),(BINARY LARGE OBJECT '7982'),(BINARY LARGE OBJECT '7982'),(BINARY LARGE OBJECT '7982'),
(BINARY LARGE OBJECT '7982'),(BINARY LARGE OBJECT '7982'),(BINARY LARGE OBJECT '7982'),(BINARY LARGE OBJECT '7982'),(BINARY LARGE OBJECT '7982'),(BINARY LARGE OBJECT '7982'),
(BINARY LARGE OBJECT '7982'),(BINARY LARGE OBJECT '7982'),(BINARY LARGE OBJECT '7982'),(BINARY LARGE OBJECT '7982'),(BINARY LARGE OBJECT '7982'),(BINARY LARGE OBJECT '7982'),
(BINARY LARGE OBJECT '7982')

statement ok
CREATE TABLE "t2" ("c0" UUID NOT NULL,"c2" BIGINT,CONSTRAINT "t2_c0_pkey" PRIMARY KEY ("c0"),CONSTRAINT "t2_c0_unique" UNIQUE ("c0"))

statement ok
INSERT INTO "t2" VALUES ('6b1b3e0e-655f-cbf3-bfa6-58cac0fdb5b7', -156155021)

query T rowsort
SELECT t1.c2 FROM t1, t2 RIGHT OUTER JOIN (VALUES (UUID '131b9167-efFa-92FE-523A-5EF2Ca7963a8', 1)) AS sub0 ON false WHERE ((SELECT DISTINCT 3 FROM t0 AS l2t0) EXCEPT ALL (SELECT 2 FROM t0 AS l2t0)) IS NULL
----
7982
7982
7982
7982
7982
7982
7982
7982
7982
7982
7982
7982
7982
7982
7982
7982
7982
7982

query T rowsort
SELECT ((SELECT DISTINCT 3 FROM t0 AS l2t0) EXCEPT ALL (SELECT 2 FROM t0 AS l2t0)) IS NULL FROM t1, t2 RIGHT OUTER JOIN (VALUES (UUID '131b9167-efFa-92FE-523A-5EF2Ca7963a8', 1)) AS sub0 ON false
----
True
True
True
True
True
True
True
True
True
True
True
True
True
True
True
True
True
True

query T rowsort
SELECT t1.c2 FROM t1, t2 RIGHT OUTER JOIN (VALUES (UUID '131b9167-efFa-92FE-523A-5EF2Ca7963a8', ((scale_down(4, 3))&(sql_max(1220354535, -236857972))))) AS sub0 ON ((((NOT (FALSE))AND("isauuid"(r'*O'))))AND(((r'h')NOT LIKE(r'N')))) 
WHERE (((SELECT DISTINCT BLOB '' FROM t0 AS l2t0, t2 AS l2t2 WHERE TRUE) EXCEPT ALL (SELECT BLOB 'afd907d0A0' FROM t0 AS l2t0 WHERE TRUE))) IS NULL
----
7982
7982
7982
7982
7982
7982
7982
7982
7982
7982
7982
7982
7982
7982
7982
7982
7982
7982

query I rowsort
SELECT CAST(SUM(count) AS BIGINT) FROM (SELECT CAST((((SELECT DISTINCT BLOB '' FROM t0 AS l2t0, t2 AS l2t2 WHERE TRUE) EXCEPT ALL (SELECT BLOB 'afd907d0A0' FROM t0 AS l2t0 WHERE TRUE))) IS NULL AS INT) as count FROM t1, t2 
RIGHT OUTER JOIN (VALUES (UUID '131b9167-efFa-92FE-523A-5EF2Ca7963a8', ((scale_down(4, 3))&(sql_max(1220354535, -236857972))))) AS sub0 ON ((((NOT (FALSE))AND("isauuid"(r'*O'))))AND(((r'h')NOT LIKE(r'N'))))) as res
----
18

statement ok
ROLLBACK

statement ok
START TRANSACTION

statement ok
CREATE TABLE "sys"."t1" ("c0" VARCHAR(127),"c2" BOOLEAN,"c3" DOUBLE,"c4" REAL,"c5" DECIMAL(18,3),"c7" DECIMAL(18,3),"c8" BIGINT,"c9" BOOLEAN,"c10" REAL,"c11" BIGINT,"c12" TINYINT)

statement ok
CREATE TABLE "sys"."t2" ("c2" UUID)

statement ok
INSERT INTO "sys"."t2" VALUES ('5a8f807e-47aa-3ddd-9b12-65ec99aa6b89'), ('adb2afe1-0aff-5af0-aee1-bf5dfdafcdaf'), ('4b9d0cdd-fd79-ac10-8ab5-6dd3dddebd8a')

statement ok
MERGE INTO t1 USING (SELECT * FROM t2) AS t2 ON CASE 1 WHEN (VALUES (2)) THEN '6' BETWEEN 0.77 AND 0.28 WHEN 3 THEN TRUE END WHEN MATCHED THEN DELETE WHEN NOT MATCHED THEN INSERT (c4, c9) VALUES (0.66, true)

statement ok
ROLLBACK

statement ok
START TRANSACTION

statement ok
CREATE TABLE "sys"."t0" ("c0" BIGINT,"c2" DECIMAL(18,3),"c4" BIGINT,"c5" VARCHAR(253))

statement ok
CREATE TABLE "sys"."t1" ("c2" BINARY LARGE OBJECT)

statement ok
CREATE TABLE "sys"."t2" ("c2" BIGINT)

statement ok
INSERT INTO "sys"."t2" VALUES (6),(7),(1),(1457323133),(8)

statement ok
INSERT INTO t1(c2) VALUES(COALESCE(BLOB '23f0', ifthenelse(FALSE, BLOB '', BLOB '70'), COALESCE(BLOB 'f7b1FD', BLOB 'A0', BLOB '0c', BLOB '', BLOB ''))),
(CASE WHEN NOT EXISTS (SELECT ALL l2t2.c2 FROM t2 AS l2t2, t0 AS l2t0, t1 AS l2t1 WHERE FALSE) THEN BLOB 'F0' ELSE (SELECT DISTINCT NULL WHERE TRUE) END)

statement ok
ROLLBACK

statement ok
START TRANSACTION

statement ok
CREATE TABLE "sys"."t0" ("c0" DECIMAL(18,3) NOT NULL,CONSTRAINT "t0_c0_pkey" PRIMARY KEY ("c0"),CONSTRAINT "t0_c0_unique" UNIQUE ("c0"))

statement ok
INSERT INTO "sys"."t0" VALUES (0.070), (1.000)

statement ok
CREATE TABLE "sys"."t1" ("c0" DECIMAL(18,3) NOT NULL,"c2" INTERVAL SECOND)

statement ok
INSERT INTO "sys"."t1" VALUES (0.263, NULL), (0.263, NULL), (0.263, NULL)

statement ok
CREATE TABLE "sys"."t2" ("c0" DECIMAL(18,3),"c2" CHAR(294))

query I nosort
select 1 from t0 having min(t0.c0) > 2 order by null asc nulls last, '0.9' desc nulls last
----


query TI nosort
select interval '4' month, count(*) from t2, t0, t1 cross join (select t2.c0, case when least(false, true) then 2 when (date '1970-01-01') is not null then 3.2 when (values (true), (true)) 
then sql_max(0.54, 0.15) end from t1, t2, t0 full outer join (select (select 0.16 from t1 as l2t1, t2 as l2t2 where true) from t0 as l1t0, t1 as l1t1, t2 as l1t2 where false) as sub0 on case blob ''
when blob '14' then false when blob '15' then false end where ((t2.c2)ilike(t2.c2))) as sub0 where ((nullif(t2.c2, t2.c2))ilike((select l2t2.c2 from t2 as l2t2, t1 as l2t1 where true))) group by 5
having (scale_up(min(case when ((t2.c2)ilike(t2.c2)) then t0.c0 end), 2)) between asymmetric (cast(0.42 as smallint)) and (least(-3, 0.31)) order by null asc nulls last, lower(r'0.4') desc nulls last
----


statement ok
ROLLBACK
