statement ok
START TRANSACTION

statement ok
CREATE TABLE "t0" ("c0" BIGINT,"c1" DOUBLE PRECISION,"c3" TIME,"c4" INTERVAL DAY)

statement ok rowcount 5
INSERT INTO "t0" VALUES (6, NULL, NULL, NULL), (8, NULL, NULL, NULL), (44, 0.011253359357251025, NULL, INTERVAL '345600' SECOND), (45, 2099043029, NULL, NULL), (-6, NULL, NULL, INTERVAL '86400' SECOND)

statement ok
CREATE TABLE "t1" ("c0" BIGINT)

statement ok rowcount 7
INSERT INTO "t1" VALUES (-482276492),(2),(0),(-1048351158),(1849849110),(6),(3)

query I rowsort
SELECT 1 FROM t0 FULL OUTER JOIN (SELECT DISTINCT NULLIF(t0.c0, 1) FROM t0 FULL OUTER JOIN (SELECT 1 FROM t1) AS sub0 ON FALSE) AS sub0 ON FALSE
----
1
1
1
1
1
1
1
1
1
1
1

statement ok
ROLLBACK

statement ok
START TRANSACTION

statement ok
CREATE TABLE "t1" ("c0" UUID)

statement ok rowcount 4
INSERT INTO "t1" VALUES ('f4ecc4d5-5f7c-ce6a-199e-dd98c59f7bbf'), ('f4ecc4d5-5f7c-ce6a-199e-dd98c59f7bbf'), ('f4ecc4d5-5f7c-ce6a-199e-dd98c59f7bbf'), ('f4ecc4d5-5f7c-ce6a-199e-dd98c59f7bbf')

query T rowsort
SELECT t1.c0 FROM t1 WHERE ((((FALSE)OR(CAST(greatest(5, 1) AS BOOLEAN))))OR((((t1.c0) BETWEEN SYMMETRIC (t1.c0) AND (t1.c0))OR(((t1.c0)<(t1.c0))))))
----
f4ecc4d5-5f7c-ce6a-199e-dd98c59f7bbf
f4ecc4d5-5f7c-ce6a-199e-dd98c59f7bbf
f4ecc4d5-5f7c-ce6a-199e-dd98c59f7bbf
f4ecc4d5-5f7c-ce6a-199e-dd98c59f7bbf

statement ok
ROLLBACK

statement ok
START TRANSACTION

statement ok
CREATE TABLE "t0" ("c0" TIMESTAMP,"c1" BINARY LARGE OBJECT,"c2" INTERVAL MONTH NOT NULL,CONSTRAINT "t0_c1_c0_unique" UNIQUE ("c1", "c0"))

statement ok rowcount 1
INSERT INTO "t0" VALUES (TIMESTAMP '1970-01-01 00:00:00.000000', BINARY LARGE OBJECT 'D0', INTERVAL '0' MONTH)

statement ok rowcount 1
MERGE INTO t0 USING (VALUES (1)) AS mergejoined(c0) ON TRUE WHEN MATCHED THEN UPDATE SET c0 = TIMESTAMP '1970-01-01 01:00:00' WHEN NOT MATCHED THEN INSERT (c0) VALUES (TIMESTAMP '1970-01-01 01:00:00')

statement ok
ROLLBACK

statement ok
START TRANSACTION

statement ok
CREATE TABLE "t1" ("c0" INTEGER)

statement ok rowcount 4
INSERT INTO "t1" VALUES (1), (2), (3), (4)

query I rowsort
SELECT 1 FROM t1 FULL OUTER JOIN (SELECT 2 FROM t1 JOIN (SELECT sql_min(TIME '01:00:00', TIME '12:05:37') FROM t1) AS sub0(c0) ON TRUE WHERE true) AS sub0(c0) 
ON CAST(6 AS DOUBLE)/(CASE 3 WHEN sub0.c0 THEN 0.2 END) > 2
----
1
1
1
1
1
1
1
1
1
1
1
1
1
1
1
1
1
1
1
1

statement ok
ROLLBACK

statement ok
START TRANSACTION

statement ok
CREATE TABLE t0(c0 INTERVAL DAY PRIMARY KEY, c1 BIGINT)

statement ok
CREATE TABLE t1(c0 INTERVAL DAY, c1 BIGINT)

statement ok rowcount 2
INSERT INTO t1(c1) VALUES(3), (5)

statement ok rowcount 3
INSERT INTO t0(c0) VALUES(INTERVAL '9' DAY), (INTERVAL '7' DAY), (INTERVAL '8' DAY)

statement ok rowcount 3
TRUNCATE t0

statement ok rowcount 1
INSERT INTO t0(c0) VALUES(INTERVAL '8' DAY)

query T rowsort
SELECT t0.c0 FROM t0 WHERE (SELECT INTERVAL '2' DAY FROM t1 GROUP BY t1.c0) NOT IN (t0.c0)
----
8

statement ok
ROLLBACK

