statement ok
CREATE TABLE "t0" ("c0" INTEGER NOT NULL,"c1" BOOLEAN,"c2" DECIMAL(18,3),"c4" VARCHAR(328),"c5" BIGINT,"c6" BIGINT,
	CONSTRAINT "t0_c0_pkey" PRIMARY KEY ("c0"),CONSTRAINT "t0_c1_c2_c0_unique" UNIQUE ("c1", "c2", "c0"))

statement ok
COPY 10 RECORDS INTO "t0" FROM stdin USING DELIMITERS E'\t',E'\n','"'
<COPY_INTO_DATA>
0	true	0.003	NULL	5	NULL
61	true	0.003	NULL	NULL	NULL
63	true	0.003	""	NULL	NULL
64	true	0.003	"-1736272448"	NULL	NULL
5	true	0.003	NULL	NULL	NULL
1791642786	true	0.003	NULL	NULL	NULL
66	NULL	0.533	"vBow손1s"	NULL	NULL
67	true	0.071	NULL	NULL	NULL
68	NULL	NULL	NULL	9	NULL
4	false	0.051	"-d'o"	9	8

statement ok
CREATE TABLE "t1" ("c0" INTEGER,"c1" BOOLEAN,"c2" DECIMAL(18,3),"c4" BIGINT,"c5" BOOLEAN)

statement ok
CREATE TABLE "t2" ("c0" INTEGER,"c2" DECIMAL(18,3),"c4" CHAR(238))

statement ok
COPY 1 RECORDS INTO "t2" FROM stdin USING DELIMITERS E'\t',E'\n','"'
<COPY_INTO_DATA>
3	0.800	""

statement error
select ((((select 1.75) union all (select 4))) between ((select 3 from t1)) and 2) = true

statement error
select cast(sum(count) as bigint) from (select all cast(((((select all -1.75501356E8 from t0 as l3t0 where l3t0.c1) union all (select 1699564541 from t0 as l3t0 where l3t0.c1)))
not between symmetric ((select -1732113123 from t2 as l3t2, t1 as l3t1 where l3t1.c5)) and (((0)%(6)))) = true as int) as count from t2) as res

statement error
select substr(((select 'i') union all (select 'am')),(select 3 where false), 2) = 'wrong'

statement ok
DROP TABLE t0

statement ok
DROP TABLE t1

statement ok
DROP TABLE t2

statement ok
START TRANSACTION

statement ok
CREATE TABLE "t0" ("c0" DOUBLE PRECISION NOT NULL,"c1" DOUBLE PRECISION NOT NULL,"c3" VARCHAR(262),
	CONSTRAINT "t0_c1_c0_pkey" PRIMARY KEY ("c1", "c0"),CONSTRAINT "t0_c1_unique" UNIQUE ("c1"),CONSTRAINT "t0_c0_c1_unique" UNIQUE ("c0", "c1"))

statement ok
COPY 9 RECORDS INTO "t0" FROM stdin USING DELIMITERS E'\t',E'\n','"'
<COPY_INTO_DATA>
0.07173150209697887	0.3762572797867427	"⫦"
0.07173150209697887	0.7497553638422215	"⫦"
0.07173150209697887	0.89932406	"⫦"
0.07173150209697887	0.07273821484427745	"⫦"
0.8777133490819231	0.1691861742790084	"-1570122933"
7	0.09299678140556933	"2"
0	1.0368e+09	"-555907821"
-7.2367456e-09	9	"yTP&ZZRpc"
0.7609541233251694	0.3262794048812502	"-1e500"

statement ok
CREATE TABLE "t2" ("c1" DOUBLE PRECISION)

statement ok
COPY 16 RECORDS INTO "t2" FROM stdin USING DELIMITERS E'\t',E'\n','"'
<COPY_INTO_DATA>
1
1
1
1
1
1
1
1
1
1
134379065
1
NULL
3
15
0.6251660224137027

query I rowsort
SELECT 1 FROM t2 WHERE NULL NOT IN (SELECT 1 FROM t2)
----

query I rowsort
SELECT 1 FROM t2 WHERE NULL <> ALL(SELECT 1 FROM t2)
----

query T rowsort
SELECT t0.c3 FROM t0, t2 WHERE NULLIF(t0.c3, t0.c3) <> ALL(SELECT DISTINCT '1' FROM t0)
----

query I rowsort
SELECT CAST(SUM(count) AS BIGINT) FROM (SELECT CAST(NULLIF(t0.c3, t0.c3) <> ALL(SELECT DISTINCT '1' FROM t0) AS INT) as count FROM t0, t2) as res
----
NULL

statement ok
ROLLBACK

statement ok
START TRANSACTION

statement ok
CREATE TABLE "sys"."t0" ("c0" REAL NOT NULL)

statement ok
COPY 13 RECORDS INTO "sys"."t0" FROM stdin USING DELIMITERS E'\t',E'\n','"'
<COPY_INTO_DATA>
0.4565038
0.16247
2.3203078e+08
3
5
6
0.10937838
0
7.6096134e+08
0.38702926
0.7541958
-0.81387746
-2.0329117e+09

statement ok
CREATE TABLE "sys"."t1" ("c0" DECIMAL(18,3) NOT NULL)

statement ok
COPY 29 RECORDS INTO "sys"."t1" FROM stdin USING DELIMITERS E'\t',E'\n','"'
<COPY_INTO_DATA>
0.000
0.872
0.697
7335630872.000
0.138
0.725
0.094
0.408
0.289
0.099
-1.000
0.090
0.006
-0.222
-7.000
0.727
0.882
0.647
5.000
0.638
0.227
0.036
-3.000
0.755
0.014
0.548
0.254
841884503.000
0.784

statement error
select ((select 1 from t1, t0)) in (2, t1.c0) from t1

statement ok
ROLLBACK

statement ok
START TRANSACTION

statement ok
CREATE TABLE "sys"."t1" ("c2" BIGINT NOT NULL,"c4" DATE,CONSTRAINT "t1_c2_pkey" PRIMARY KEY ("c2"))

statement ok
CREATE TABLE "sys"."t2" ("c0" DOUBLE NOT NULL,"c2" INTERVAL DAY,CONSTRAINT "t2_c0_unique" UNIQUE ("c0"),CONSTRAINT "t2_c0_c2_unique" UNIQUE ("c0", "c2"))

query I rowsort
SELECT 1 FROM t2, t1 WHERE (t2.c0 > 4 OR false) AND 9 IN (t2.c0, t1.c2) = TRUE
----

query I rowsort
SELECT 1 FROM t2, t1 WHERE (t2.c0 > 4 OR false) AND (CASE WHEN 9 IN (t2.c0, t1.c2) THEN TRUE END)
----

query T rowsort
SELECT t1.c2 FROM t2, t1 WHERE (((((((((t2.c0)^(2))) NOT BETWEEN SYMMETRIC (least(t1.c2, t1.c2)) AND (4))AND(NOT (TRUE))))OR(least(FALSE, FALSE))))AND(CASE WHEN (9) NOT IN (t2.c0, t1.c2) THEN TRUE ELSE greatest(TRUE, FALSE) END))
----

statement ok
ROLLBACK

statement ok
START TRANSACTION

statement ok
CREATE TABLE "sys"."t0" ("c2" INTEGER NOT NULL)

statement ok
CREATE TABLE "sys"."t2" ("c7" TINYINT NOT NULL,"c6" UUID,"c5" TIMESTAMP,"c4" BIGINT)

statement ok
INSERT INTO "sys"."t2" VALUES (8, NULL, NULL, NULL)

query I rowsort
SELECT 1 FROM t2 JOIN (SELECT 2) AS sub0 (c0) ON (CASE WHEN CAST(2 AS BOOLEAN) THEN NULL END <> t2.c6)
----

query I rowsort
SELECT CAST(SUM(count) AS BIGINT) FROM (SELECT ALL CAST(NOT ((CASE WHEN TRUE THEN FALSE END) = TRUE) AS INT) as count FROM t2 JOIN
((SELECT ((1)/(round(0.84, 0.7281314))) FROM t0, t2 WHERE CAST(abs(t2.c7) AS BOOLEAN)) EXCEPT ALL (SELECT least("epoch_ms"(TIME '21:17:08'),
CASE WHEN TRUE THEN ((-23)/(t2.c7)) WHEN ((r'1e500')LIKE(r'H')) THEN sql_max(2, 2) WHEN least(TRUE, FALSE) THEN ((t0.c2)%(4)) END) FROM t0, t2 WHERE FALSE)) AS sub0 ON ((CASE WHEN CAST(2 AS BOOLEAN) THEN NULL END)<>(t2.c6))) as res
----
NULL

statement ok
ROLLBACK

statement ok
CREATE TABLE t0(c0 VARCHAR(128),c1 UUID)

statement ok
CREATE TABLE t2(LIKE t0)

statement ok
ALTER TABLE t2 ADD COLUMN c2 UUID

query I rowsort
SELECT 1 FROM t2, t0 WHERE CASE WHEN NULL THEN t0.c0 WHEN FALSE THEN t2.c2 END LIKE CASE WHEN FALSE THEN t0.c0 END
----

statement ok
DROP TABLE t0

statement ok
DROP TABLE t2

statement ok
START TRANSACTION

statement ok
CREATE TABLE "sys"."t1" ("c0" DOUBLE,"c1" BOOLEAN NOT NULL,"c3" SMALLINT NOT NULL,"c4" CHARACTER LARGE OBJECT NOT NULL,"c5" VARCHAR(15) NOT NULL,"c6" BIGINT,
	CONSTRAINT "t1_c1_c4_c5_c3_pkey" PRIMARY KEY ("c1", "c4", "c5", "c3"),CONSTRAINT "t1_c1_c0_unique" UNIQUE ("c1", "c0"),CONSTRAINT "t1_c1_unique" UNIQUE ("c1"),
	CONSTRAINT "t1_c3_c0_c1_c5_c4_unique" UNIQUE ("c3", "c0", "c1", "c5", "c4"))

statement ok
CREATE TABLE "sys"."t2" ("c0" VARCHAR(407)  NOT NULL,"c2" CHARACTER LARGE OBJECT,CONSTRAINT "t2_c0_pkey" PRIMARY KEY ("c0"),CONSTRAINT "t2_c0_unique" UNIQUE ("c0"))

statement ok
CREATE FUNCTION mystringudf(a clob, b clob) RETURNS INT RETURN a || b

statement ok
MERGE INTO t2 USING (SELECT * FROM t1) AS t1 ON TRUE WHEN MATCHED THEN UPDATE SET c2 = mystringudf('1', '2')

statement ok
MERGE INTO t2 USING (SELECT * FROM t1) AS t1 ON NOT (greatest(FALSE, TRUE)) WHEN MATCHED THEN UPDATE SET c0 = r'', c2 = (ifthenelse(((-1.2422299E8)<=(6)), CAST(6 AS STRING), mystringudf(r'', r'833481730')))

statement ok
ROLLBACK

statement ok
CREATE TABLE t1(c2 DOUBLE PRECISION)

statement ok
CREATE TABLE t2(c2 DECIMAL, c4 tinyint)

statement ok
INSERT INTO t2(c4) VALUES (89), (9), (2), (6), (2), (5), (3), (0)

statement ok
TRUNCATE t2

statement ok
INSERT INTO t2(c2) VALUES (10), (6)

query I rowsort
SELECT 1 FROM t2, t1 WHERE t1.c2 BETWEEN t2.c2 AND 10
----

statement ok
DROP TABLE t1

statement ok
DROP TABLE t2

statement ok
CREATE TABLE t1(c0 UUID)

statement ok
CREATE TABLE t2(c0 integer)

statement ok
INSERT INTO t1(c0) VALUES(UUID '7FF36D5B-dB28-0fDB-9ea8-c574aE686E0e'), (UUID 'EAfDd2f4-CAaE-BBc0-54AA-8E3A4B978434')

statement ok
DELETE FROM t1

query I rowsort
SELECT 1 FROM t2, t1 WHERE UUID 'da9eBfcb-C2eA-416F-F8a9-F49b2aB1FCb8' BETWEEN t1.c0 AND (CASE WHEN FALSE THEN t1.c0 WHEN FALSE THEN UUID 'D2aFBA26-0f86-c893-B0C1-1Cd1DdC9aadE' END)
----

statement ok
DROP TABLE t1

statement ok
DROP TABLE t2

statement ok
CREATE TABLE t2(c0 int, c2 boolean)

statement ok
INSERT INTO t2(c2, c0) VALUES (false, -2)

statement ok
DELETE FROM t2

query I rowsort
SELECT 1 FROM t2 JOIN (VALUES (0.54), (1.2)) AS sub0 ON ((t2.c0) IN (8)) BETWEEN t2.c2 AND TRUE
----

statement ok
DROP TABLE t2

statement ok
START TRANSACTION

statement ok
CREATE TABLE "sys"."t0" ("c4" DOUBLE NOT NULL)

statement error
insert into t0(c4) values(power(1770290607, case when greatest(false, true) then cast(5 as real) end)), (-1.722544153E9)

statement error
INSERT INTO t0(c4) VALUES(power(1770290607, CASE WHEN (UUID 'aE792C3f-21e0-323f-1C8A-DfBD3aB655CF') IN (UUID 'b30E22a2-3d7A-1003-BEB6-F9dE845bEAd1',
UUID '6E391a40-3Fc6-F594-036D-737eCaDC937c') THEN CAST(r'jV㋕<2H' AS REAL) WHEN greatest(FALSE, TRUE) THEN CAST(5 AS REAL) WHEN NOT (TRUE)
THEN + (3) WHEN NOT (TRUE) THEN least(5, 0.5809714) WHEN NOT (TRUE) THEN ((0.022229422)*(1666367947)) END)), (-1.722544153E9)

statement ok
ROLLBACK

statement ok
START TRANSACTION

statement ok
CREATE TABLE "t0" ("c0" DOUBLE PRECISION NOT NULL,"c2" VARCHAR(64))

statement ok
INSERT INTO "t0" VALUES (-0, ''),(0.9006985362687353, '-698480774'),(0.48543984754620684, 'w(冒'),(3.9612322048489266, '8'),(0.5616282788859702, NULL),
(3.6391771849823393, NULL),(9, NULL),(2, NULL),(0.1798248731156511, '2')

statement ok
CREATE TABLE "t1" ("c0" DOUBLE PRECISION)

statement ok
INSERT INTO "t1" VALUES (0.6521791858367552),(0.08122328703285808),(NULL),(0.346309674594371),(-172200039.77765536),(1)

statement ok
CREATE TABLE "t2" ("c1" DOUBLE PRECISION,"c2" BOOLEAN,"c3" BOOLEAN,CONSTRAINT "t2_c1_unique" UNIQUE ("c1"))

statement ok
INSERT INTO "t2" VALUES (0.7020559018817172, false, NULL),(0.6236223127320935, false, false),(7, true, true),(NULL, true, true)

query I rowsort
SELECT 1 FROM t0, t1 CROSS JOIN (SELECT DISTINCT t1.c0 > 4 FROM t1, t2 WHERE t2.c2) AS sub0
----
108 values hashing to ff26cf0928970b7e2ae36570fa1cf383

query I rowsort
SELECT SUM(agg0) FROM (SELECT 1 as agg0 FROM t0, t1 CROSS JOIN (SELECT DISTINCT t1.c0 > 4 FROM t1, t2 
WHERE t2.c2) AS sub0 WHERE ('Bw') NOT IN (least(t0.c2, t0.c2), CAST(t1.c0 AS VARCHAR(64)))
UNION ALL
SELECT 1 as agg0 FROM t0, t1 CROSS JOIN (SELECT DISTINCT t1.c0 > 4 FROM t1, t2
WHERE t2.c2) AS sub0 WHERE NOT (('Bw') NOT IN (least(t0.c2, t0.c2), CAST(t1.c0 AS VARCHAR(64))))
UNION ALL
SELECT 1 as agg0 FROM t0, t1 CROSS JOIN (SELECT DISTINCT t1.c0 > 4 FROM t1, t2
WHERE t2.c2) AS sub0 WHERE (('Bw') NOT IN (least(t0.c2, t0.c2), CAST(t1.c0 AS VARCHAR(64)))) IS NULL) as asdf
----
108

query I rowsort
SELECT 1 FROM t0, t1 CROSS JOIN (SELECT DISTINCT t1.c0 > 4 FROM t1, t2 WHERE t2.c2) AS sub0 WHERE (('Bw') NOT IN (least(t0.c2, t0.c2), CAST(t1.c0 AS VARCHAR(64)))) IS NULL
----
58 values hashing to 8fdc0683e1f7f9ff9590af46dca75282

statement ok
ROLLBACK

statement ok
START TRANSACTION

statement ok
CREATE TABLE "sys"."t1" ("c3" BOOLEAN)

query T rowsort
select (345*(case when t1.c3 then 0 else 58.9 end))*3 from t1
union all
select (345*(case when t1.c3 then 0 else 58.9 end))*3 from t1
----

query T rowsort
select (11*(case when t1.c3 then 0 else 0.57 end))*3 from t1
union all
select (11*(case when t1.c3 then 0 else 0.57 end))*3 from t1
----

statement ok
ROLLBACK

query T rowsort
select round((0.52)*(0.10), -8)
----
0.0000

statement ok
START TRANSACTION

statement ok
CREATE TABLE "t0" ("c0" BOOLEAN,"c2" BOOLEAN,CONSTRAINT "t0_c2_c0_unique" UNIQUE ("c2", "c0"),CONSTRAINT "t0_c2_c0_fkey" FOREIGN KEY ("c2", "c0") REFERENCES "t0" ("c2", "c0"))

statement ok
CREATE TABLE "t1" ("c4" CHARACTER LARGE OBJECT)

statement ok
UPDATE t0 SET c0 = t0.c2 FROM t1 WHERE CAST(t1.c4 AS BOOLEAN)

statement ok
ROLLBACK

statement ok
START TRANSACTION

statement ok
CREATE TABLE "sys"."t0" ("c1" CHARACTER LARGE OBJECT,"c2" BOOLEAN NOT NULL,CONSTRAINT "t0_c2_pkey" PRIMARY KEY ("c2"),
	CONSTRAINT "t0_c2_unique" UNIQUE ("c2"),CONSTRAINT "t0_c1_c2_unique" UNIQUE ("c1", "c2"))

statement ok
COPY 2 RECORDS INTO "sys"."t0" FROM stdin USING DELIMITERS E'\t',E'\n','"'
<COPY_INTO_DATA>
"v"	false
"0.5984453937840536"	true

statement ok
CREATE TABLE "sys"."t1" ("c0" CHARACTER LARGE OBJECT NOT NULL,"c1" REAL,"c3" DECIMAL(18,3),
	CONSTRAINT "t1_c0_pkey" PRIMARY KEY ("c0"),CONSTRAINT "t1_c0_unique" UNIQUE ("c0"))

statement ok
COPY 25 RECORDS INTO "sys"."t1" FROM stdin USING DELIMITERS E'\t',E'\n','"'
<COPY_INTO_DATA>
""	0.25307873	NULL
"false"	-2.6924675e+08	NULL
"-579379537"	1	NULL
"0"	0.5760949	NULL
"1778035546"	-9.342304e+08	NULL
"0.39176894283958363"	0.63520056	NULL
"8"	NULL	NULL
"nr"	NULL	NULL
"true"	-1.8958627e+09	NULL
"P啕O"	4	NULL
"FALSE"	1	NULL
"1365951424"	0.026853533	NULL
"w"	NULL	NULL
"ỬJ}j6"	NULL	NULL
"-2002788279"	0.135553	NULL
"6"	0.28696647	0.667
"5"	1.4837969e+09	0.290
"g"	NULL	NULL
"럟Kx"	0.061084658	1.587
"zx별Z"	7	0.000
"[ә8|蜼j"	NULL	0.863
"-1061609345"	8.999999	0.535
"죸?Zm5dMv"	0.4159582	0.146
"-269246755"	-0.62566406	7.531
"\tyT"	0.6758237	-0.366

query I rowsort
select cast(sum(count) as bigint) from (select cast((("concat"(t0.c1, t0.c1))not ilike(nullif(r'O', substr(t0.c1, 3, 1807556376)))) as int) as count from t1, t0) as res
----
50

statement ok
ROLLBACK

statement ok
START TRANSACTION

statement ok
CREATE TABLE "sys"."t0" ("c2" CHAR(478) NOT NULL,CONSTRAINT "t0_c2_pkey" PRIMARY KEY ("c2"),CONSTRAINT "t0_c2_unique" UNIQUE ("c2"))

statement ok
COPY 34 RECORDS INTO "sys"."t0" FROM stdin USING DELIMITERS E'\t',E'\n','"'
<COPY_INTO_DATA>
"0.5674989590909305"
"*"
""
"Zu4Bmo孥흢"
"0.26528947469340614"
"LvuGwY"
"㟚"
"i"
"-2080035418"
"0.48394748670656496"
"403902031"
"-436959214"
"k*nd\015>"
"P"
"-0.557532"
",^"
"9"
"3"
"᳀"
"{Y0uzQ*"
"1405379655"
"꼱,"
"Ml|t"
">"
"o5jbd-H"
"X8par"
"Z6\t8"
"-1542018934"
"-112082496"
"0.5111159857154056"
"0"
"F6km?\015zO1"
"\tVoL^HW/摇"
"L䶍"

statement ok
CREATE TABLE "sys"."t1" ("c2" SMALLINT NOT NULL,CONSTRAINT "t1_c2_unique" UNIQUE ("c2"))

statement ok
COPY 3 RECORDS INTO "sys"."t1" FROM stdin USING DELIMITERS E'\t',E'\n','"'
<COPY_INTO_DATA>
0
5
1

query T rowsort
SELECT t0.c2 FROM t0, t1 WHERE ((((10)+(0.3607000614109831)))<(least(t1.c2, t1.c2)))
----

query I rowsort
SELECT CAST(((((10)+(0.3607000614109831)))<(least(t1.c2, t1.c2))) AS INT) as count FROM t0, t1
----
102 values hashing to a98471bd784fc82e6e3165302bc0080a

query T rowsort
SELECT t1.c2 > 10 + 0.3607000614109831 FROM t1
----
False
False
False

query T rowsort
SELECT t1.c2 > 10 + 0.3611111111 FROM t1
----
False
False
False

query T rowsort
SELECT t1.c2 > 10 + 0.361111111 FROM t1
----
False
False
False

query I rowsort
SELECT CAST(SUM(count) AS BIGINT) FROM (SELECT CAST(((((10)+(0.3607000614109831)))<(least(t1.c2, t1.c2))) AS INT) as count FROM t0, t1) as res
----
0

statement ok
ROLLBACK

statement ok
START TRANSACTION

statement ok
CREATE TABLE "sys"."t0" ("c0" TINYINT NOT NULL,CONSTRAINT "t0_c0_pkey" PRIMARY KEY ("c0"),CONSTRAINT "t0_c0_unique" UNIQUE ("c0"))

statement ok
COPY 7 RECORDS INTO "sys"."t0" FROM stdin USING DELIMITERS E'\t',E'\n','"'
<COPY_INTO_DATA>
1
2
-7
9
7
6
0

statement ok
CREATE TABLE "sys"."t2" ("c2" UUID NOT NULL,CONSTRAINT "t2_c2_pkey" PRIMARY KEY ("c2"),CONSTRAINT "t2_c2_unique" UNIQUE ("c2"))

statement ok
COPY 9 RECORDS INTO "sys"."t2" FROM stdin USING DELIMITERS E'\t',E'\n','"'
<COPY_INTO_DATA>
5d2afc8a-c83e-1d00-c578-3c51f8da86db
1eb55e78-39e5-bde9-2aba-fe71a903ffcf
20f96ff1-8c3d-3db9-fb48-7c48e5fca4a7
9a7a5e6f-eab3-2353-cbc6-45c1e4bf8944
619bd7bb-bc92-3a8b-c63e-cdb5630c5f9b
4bad7ebd-7f57-afdd-246e-3b600d7a9daf
cdd9b65e-3ebb-f4e6-2f13-a11b4ffd6db1
bebfb44f-1cfc-905c-fd0e-0e5feeb39d4d
15aaa8c9-16c4-40d6-cdd1-a19be9d2add7

query I rowsort
SELECT t0.c0 FROM t0 WHERE t0.c0 BETWEEN 0 AND 0
----
0

query I rowsort
SELECT t0.c0 FROM t0 WHERE t0.c0 BETWEEN 0 AND NULL
----

query I rowsort
SELECT t0.c0 FROM t0 WHERE t0.c0 BETWEEN NULL AND 0
----

query I rowsort
SELECT t0.c0 FROM t0 WHERE t0.c0 BETWEEN NULL AND NULL
----

query I rowsort
SELECT t0.c0 FROM t0 WHERE t0.c0 BETWEEN 3 AND 0
----

query I rowsort
SELECT t0.c0 FROM t0 WHERE t0.c0 NOT BETWEEN 3 AND 0
----
-7
0
1
2
6
7
9

query I rowsort
SELECT t0.c0 FROM t0 WHERE t0.c0 NOT BETWEEN 0 AND 0
----
-7
1
2
6
7
9

query I rowsort
SELECT t0.c0 FROM t0 WHERE t0.c0 NOT BETWEEN 0 AND NULL
----
-7

query I rowsort
SELECT t0.c0 FROM t0 WHERE t0.c0 NOT BETWEEN NULL AND 0
----
1
2
6
7
9

query I rowsort
SELECT t0.c0 FROM t0 WHERE t0.c0 NOT BETWEEN NULL AND NULL
----

statement ok
set optimizer='sequential_pipe'

query T python .explain.function_histogram
EXPLAIN SELECT t0.c0 FROM t0 WHERE t0.c0 NOT BETWEEN 0 AND 2
----
user.main
1
querylog.define
1
sql.mvc
1
sql.tid
1
sql.bind
1
algebra.select
1
algebra.projection
1
bat.pack
5
sql.resultSet
1

statement ok
set optimizer='default_pipe'

query T rowsort
SELECT t2.c2 FROM t0, t2 WHERE (- (t0.c0)) BETWEEN ASYMMETRIC (CAST(0.49579459740908504716827565061976201832294464111328125 AS TINYINT)) AND (CASE WHEN FALSE THEN t0.c0 END)
----

query I rowsort
SELECT CAST(SUM(count) AS BIGINT) FROM (SELECT ALL CAST((- (t0.c0)) BETWEEN ASYMMETRIC (CAST(0.49579459740908504716827565061976201832294464111328125 AS TINYINT)) AND 
(CASE WHEN FALSE THEN t0.c0 END) AS INT) as count FROM t0, t2) as res
----
0

statement ok
ROLLBACK

statement ok
CREATE TABLE t1(c0 BLOB)

statement ok
INSERT INTO t1(c0) VALUES(BLOB 'F0'), (BLOB '')

statement ok
TRUNCATE TABLE t1

statement ok
INSERT INTO t1 VALUES (BLOB'B0'),(BLOB'30BECB2B'),(BLOB'9CEF30'),(BLOB'CDBEECE140'),(BLOB''),(BLOB''),(BLOB'6A439500'),(BLOB''),(BLOB'02C0'),
(BLOB'F85EB11410'),(BLOB'6AFD2F50'),(BLOB'6AFD2F50'),(BLOB'6AFD2F50'),(BLOB'6AFD2F50'),(BLOB'6AFD2F50'),(BLOB'FCED'),(BLOB'FB')

statement ok
DELETE FROM t1 WHERE (4) NOT IN (0.8192590328639373087327157918480224907398223876953125)

statement ok
DROP TABLE t1

statement ok
CREATE TABLE t0(c0 BLOB, c1 tinyint)

statement ok
CREATE TABLE t1(c0 BLOB, c1 tinyint, c3 CLOB)

statement ok
CREATE TABLE t2(c0 BLOB, c1 tinyint)

statement ok
INSERT INTO t0(c0) VALUES(BLOB '48A9F0'), (BLOB 'b0'), (BLOB ''), (BLOB ''), (BLOB 'c0'), (BLOB '278fBAb660'), (BLOB 'BEFbb0'), (BLOB '2cDce0'), (BLOB 'd0'), (BLOB 'a0'),
(BLOB '3bCeE0'), (BLOB '1F4aeF'), (BLOB '6BCfC200'), (BLOB '40'), (BLOB 'a0aE92C0'), (BLOB 'ea'), (BLOB ''), (BLOB 'd0')

statement ok
DELETE FROM t0

statement ok
INSERT INTO t0(c0) VALUES(BLOB 'f0'), (BLOB ''), (BLOB 'C7c1Ffda'), (BLOB 'Fc46fbB0'), (BLOB 'F4b71E00'), (BLOB '9B'), (BLOB 'd8e0')

statement ok
INSERT INTO t1(c3) VALUES('c-#'), ('0.383799472247898')

statement ok
INSERT INTO t0(c0) VALUES(BLOB ''), (BLOB 'bEB52EFd'), (BLOB '3e7A0a90'), (BLOB '70'), (BLOB 'aDC0'), (BLOB 'B0'), (BLOB 'A0'), (BLOB 'a8c3ebA0'), (BLOB '43aB7AfFe0'), (BLOB '90')

statement ok
INSERT INTO t2(c0) VALUES(BLOB '050aC56fd0')

query T rowsort
SELECT '' >= t1.c3 FROM t0, t1, t2
----
False
False
False
False
False
False
False
False
False
False
False
False
False
False
False
False
False
False
False
False
False
False
False
False
False
False
False
False
False
False
False
False
False
False

statement ok
DROP TABLE t0

statement ok
DROP TABLE t1

statement ok
DROP TABLE t2

statement ok
START TRANSACTION

statement ok
CREATE TABLE "sys"."t0" ("c1" BIGINT NOT NULL,"c5" BINARY LARGE OBJECT,CONSTRAINT "t0_c1_pkey" PRIMARY KEY ("c1"),CONSTRAINT "t0_c5_unique" UNIQUE ("c5"))

statement ok
COPY 5 RECORDS INTO "sys"."t0" FROM stdin USING DELIMITERS E'\t',E'\n','"'
<COPY_INTO_DATA>
1150662203	
-1997528658	8BBD50
8	B4
20	E4FCBC9E10
0	D0

statement ok
CREATE TABLE "sys"."t1" ("c0" CHARACTER LARGE OBJECT NOT NULL,"c2" CHARACTER LARGE OBJECT,"c3" DECIMAL(18,3) NOT NULL,"c5" CHARACTER LARGE OBJECT NOT NULL,
	"c6" CHAR(175),"c7" DOUBLE,CONSTRAINT "t1_c0_unique" UNIQUE ("c0"))

statement ok
COPY 8 RECORDS INTO "sys"."t1" FROM stdin USING DELIMITERS E'\t',E'\n','"'
<COPY_INTO_DATA>
"sIm&S"	NULL	0.383	"xvᝅ〯p]"	"0.8474899180729288"	0.39434750848770694
"uꑳ䍴HnkZf"	NULL	0.453	"357028814"	"葬L*鴎k"	NULL
"\t멥U\015W"	NULL	0.842	"XJ"	NULL	NULL
")\006x+okyG"	"U"	0.033	"G&"	"8Zc"	NULL
"0"	"p-J"	0.033	""	"2006489952"	NULL
"0.6387965642930552"	">*"	0.899	"I8NdU3M"	"dH/"	0.68878347
"-1798514093"	NULL	0.265	"Q"	"wGy1y_9.x"	0.9869141021920103
""	NULL	0.459	"꺦"	"l"	3.1323088

query I rowsort
select 1 from t1, t0 where (case when false then t1.c3 else 6 end) <= (case when false then t0.c1 when true then t1.c7 end)
----

query I rowsort
select t0.c1 from t1, t0 where ((case when false then t1.c3 else 6 end)<=(case when false then 9 when false then t0.c1 when true then t1.c7 else 5 end))
----

statement ok
ROLLBACK
