statement ok
START TRANSACTION

statement ok
CREATE TABLE "sys"."t2" (
	"c0" DOUBLE        NOT NULL,
	"c1" INTERVAL MONTH,
	CONSTRAINT "t2_c0_pkey" PRIMARY KEY ("c0"),
	CONSTRAINT "t2_c1_c0_unique" UNIQUE ("c1", "c0")
)

statement ok
COPY 1 RECORDS INTO "sys"."t2" FROM stdin USING DELIMITERS E'\t',E'\n','"'
<COPY_INTO_DATA>
1662973479	1626041622

query R rowsort
SELECT ALL t2.c0 FROM t2 WHERE ((COALESCE(0.9, 0.5, 0.7, 0.6, 0.8)) IS NULL) IS NOT NULL
----
1662973479.000

query I rowsort
SELECT CAST(SUM(count) AS BIGINT) FROM (SELECT ALL CAST(((COALESCE(0.9, 0.5, 0.7, 0.6, 0.8)) IS NULL) IS NOT NULL AS INT)
as count FROM t2) as res
----
1

statement ok
ROLLBACK

statement ok
START TRANSACTION

statement ok
CREATE TABLE "sys"."t0" ("c0" TIME,"c1" SMALLINT NOT NULL)

statement ok
CREATE TABLE "sys"."t1" ("c1" SMALLINT,"c2" DATE NOT NULL)

statement ok
CREATE TABLE "sys"."t2" ("c0" TIME,"c1" SMALLINT,CONSTRAINT "t2_c0_unique" UNIQUE ("c0"))

statement ok
COPY 3 RECORDS INTO "sys"."t2" FROM stdin USING DELIMITERS E'\t',E'\n','"'
<COPY_INTO_DATA>
NULL	0
16:03:32	NULL
02:15:11	NULL

query I rowsort
select all t0.c1 from t0, t1 natural join t2 where (t1.c1) not between symmetric (t1.c1) and (t0.c1)
----

statement ok
ROLLBACK

statement ok
CREATE TABLE t2(c1 bigint UNIQUE PRIMARY KEY NOT NULL)

statement ok
CREATE IMPRINTS INDEX i0 ON t2 (c1)

statement ok
INSERT INTO t2(c1) VALUES(68055641)

statement ok
CREATE INDEX i1 ON t2 (c1)

statement ok
INSERT INTO t2(c1) VALUES(1807763525)

statement ok
DROP TABLE t2

statement ok
START TRANSACTION

statement ok
CREATE TABLE "sys"."t0" ("c0" DOUBLE,"c1" DOUBLE NOT NULL,CONSTRAINT "t0_c1_c0_unique" UNIQUE ("c1", "c0"))

statement ok
COPY 8 RECORDS INTO "sys"."t0" FROM stdin USING DELIMITERS E'\t',E'\n','"'
<COPY_INTO_DATA>
NULL	0.11556091558253245
0.29659357385748286	68693719
0.9191040589762235	0.5658689286027364
NULL	0.1019666413117839
NULL	0.64159659402381
NULL	0.06945707167931647
1696129939	1930440479
0.291412016319756	0.19803645886665644

statement ok
CREATE TABLE "sys"."t1" ("c1" DOUBLE,CONSTRAINT "t1_c1_unique" UNIQUE ("c1"))

query I rowsort
select cast(sum(count) as bigint) from (select cast(not ((-307103413) in (0.68224454, 0.9718348)) as int) as count from t0 right outer join t1
on (t0.c1) between symmetric (t1.c1) and (((- (-1063131904))&(coalesce(-569972440, 1845997183))))) as res
----
NULL

statement ok
ROLLBACK

statement ok
START TRANSACTION

statement ok
CREATE TABLE "sys"."t0" ("c0" TIMESTAMP NOT NULL,CONSTRAINT "t0_c0_pkey" PRIMARY KEY ("c0"),CONSTRAINT "t0_c0_unique" UNIQUE ("c0"))

statement ok
COPY 3 RECORDS INTO "sys"."t0" FROM stdin USING DELIMITERS E'\t',E'\n','"'
<COPY_INTO_DATA>
"1970-01-12 10:04:08.000000"
"1970-01-06 03:09:33.000000"
"1970-01-19 10:03:56.000000"

statement ok
CREATE TABLE "sys"."t1" ("c0" TIMESTAMP)

statement ok
COPY 3 RECORDS INTO "sys"."t1" FROM stdin USING DELIMITERS E'\t',E'\n','"'
<COPY_INTO_DATA>
"1970-01-16 15:26:07.000000"
"1970-01-21 09:11:00.000000"
"1969-12-24 08:07:10.000000"

statement ok
CREATE TABLE "sys"."t2" ("c0" INTERVAL MONTH,"c1" DOUBLE,"c2" BOOLEAN)

statement ok
COPY 4 RECORDS INTO "sys"."t2" FROM stdin USING DELIMITERS E',',E'\n','"'
<COPY_INTO_DATA>
1293946112,0.3251224351379446,true
1293946112,0.3251224351379446,true
540568573,NULL,false
NULL,NULL,false

query I rowsort
SELECT 1 FROM t2 LEFT JOIN t0 ON CASE CAST(t2.c0 AS VARCHAR(32)) WHEN CAST(t2.c2 AS VARCHAR(32)) THEN 4 WHEN COALESCE('a', 'b') THEN 3 END IS NOT NULL
----
1
1
1
1

query I rowsort
SELECT CAST(SUM(count) AS BIGINT) FROM (SELECT CAST(t2.c2 AS INT) as count FROM t2 LEFT OUTER JOIN t0 ON (CASE CAST(t2.c0 AS VARCHAR(32)) WHEN CAST('*D' AS VARCHAR(32)) THEN CASE 'u--'
WHEN 'Q' THEN 0.81 END WHEN CAST(t2.c2 AS VARCHAR(32)) THEN CASE 51854410 WHEN 0.6132552 THEN 134188918 END WHEN COALESCE('鈋', 'Nb|k', 's{%g.8Bj') THEN CAST(571120738 AS INT)
ELSE CAST(0.13 AS REAL) END) IS NOT NULL CROSS JOIN (SELECT ALL COALESCE(t1.c0, t0.c0) FROM t0, t1) AS sub0) as res
----
54

statement ok
ROLLBACK

statement ok
START TRANSACTION

statement ok
CREATE TABLE "sys"."t0" ("c0" BOOLEAN NOT NULL,CONSTRAINT "t0_c0_pkey" PRIMARY KEY ("c0"),CONSTRAINT "t0_c0_unique" UNIQUE ("c0"))

statement ok
CREATE IMPRINTS INDEX "i0" ON "sys"."t0" ("c0")

statement ok
CREATE TABLE "sys"."t2" ("c0" BOOLEAN)

query I rowsort
SELECT 1 FROM t0 FULL OUTER JOIN t2 ON CASE WHEN TRUE THEN EXISTS (SELECT 1 FROM t2) END
----

query I rowsort
SELECT CAST(SUM(count) AS BIGINT) FROM (SELECT ALL CAST((CASE TIMESTAMP '1970-01-23 00:06:34' WHEN TIMESTAMP '1970-01-15 23:55:20' THEN 0.1 ELSE 0.7 END) NOT IN (COALESCE(0.8, 0.2), COALESCE(0.4, 0.5, 0.9, 0.8)) AS INT) as count
FROM t0 FULL OUTER JOIN t2 ON CASE WHEN t2.c0 THEN (DATE '1970-01-24') IN (DATE '1970-01-11', DATE '1969-12-18') WHEN (t2.c0) NOT BETWEEN SYMMETRIC (t0.c0) AND (CASE DATE '1970-01-01' WHEN DATE '1970-01-15' THEN TRUE ELSE t2.c0 END)
THEN t0.c0 WHEN NOT (((t2.c0)<=(t2.c0))) THEN NOT EXISTS (SELECT DISTINCT INTERVAL '903334778' SECOND FROM t2 WHERE t2.c0) END) as res
----
NULL

statement ok
ROLLBACK

statement ok
START TRANSACTION

statement ok
CREATE TABLE "sys"."t2" ("c0" CHARACTER LARGE OBJECT NOT NULL)

statement ok
INSERT INTO t2 VALUES (TIME '20:39:07' BETWEEN TIME '11:09:56' AND TIME '04:20:04')

query T rowsort
SELECT c0 from t2
----
false

statement error
INSERT INTO t2(c0) VALUES(CAST((CASE WHEN r'' THEN TIME '06:29:46' WHEN r'b_P' THEN TIME '20:39:07' END) BETWEEN ASYMMETRIC (COALESCE(TIME '11:09:56', TIME '12:05:55')) AND (COALESCE(TIME '18:59:07', TIME '04:20:04', TIME '19:01:06')) AS STRING(638)))

statement ok
ROLLBACK

statement ok
START TRANSACTION

statement ok
CREATE TABLE "sys"."t0" ("c0" DATE NOT NULL,CONSTRAINT "t0_c0_pkey" PRIMARY KEY ("c0"))

statement ok
CREATE TABLE "sys"."t1" ("c0" DATE NOT NULL)

statement ok
CREATE INDEX "i1" ON "sys"."t1" ("c0")

statement ok
CREATE ORDERED INDEX "i2" ON "sys"."t1" ("c0")

statement ok
create view v0(c0) as (select 1 from t0,t1 where ((t0.c0)>=(t1.c0)))

query I rowsort
select '12' like 'i' from t0, t1 right outer join v0 on exists (select 'a' from t0, t1)
----

statement ok
ROLLBACK

statement ok
START TRANSACTION

statement ok
CREATE TABLE "sys"."t0" ("c0" CHARACTER LARGE OBJECT NOT NULL,"c1" INTEGER,CONSTRAINT "t0_c0_pkey" PRIMARY KEY ("c0"),CONSTRAINT "t0_c0_unique" UNIQUE ("c0"),CONSTRAINT "t0_c1_unique" UNIQUE ("c1"))

statement ok
COPY 4 RECORDS INTO "sys"."t0" FROM stdin USING DELIMITERS E'\t',E'\n','"'
<COPY_INTO_DATA>
"0.6010931584470857"	-743829177
"0.42620477484022556"	NULL
"1329239822"	-2112960019
"(tO\\i4"	NULL

statement ok
CREATE TABLE "sys"."t1" ("c0" CHARACTER LARGE OBJECT,"c1" INTEGER)

statement ok
COPY 3 RECORDS INTO "sys"."t1" FROM stdin USING DELIMITERS E'\t',E'\n','"'
<COPY_INTO_DATA>
NULL	-1356169629
NULL	21282885
"380068065"	2028904352

statement ok
CREATE TABLE "sys"."t2" ("c0" CHARACTER LARGE OBJECT)

statement ok
COPY 20 RECORDS INTO "sys"."t2" FROM stdin USING DELIMITERS E'\t',E'\n','"'
<COPY_INTO_DATA>
"1339658188"
"g曹"
NULL
"1886645193"
"I+"
"YhN"
"밿o{%p"
"n8v"
"nFa{#"
"1001686043"
">+"
"0.3359225172978786"
"_"
"990996842"
"B3弸_"
""
"Pd\\"
"!jt*cw+~"
""
"<P9\t-s펰>"

statement ok
create view v0(c0, c1, c2, c3) as (select distinct timestamp '1970-01-15 12:32:10', date '1970-01-19', t1.c1, t1.c1 from t0, t1 where ((t1.c1)=(t1.c1)))

query I rowsort
select 1 from t2 right outer join t1 on t1.c0 not like t2.c0
----
1
1
1
1
1
1
1
1
1
1
1
1
1
1
1
1
1
1
1
1
1

query I rowsort
select 1 from t2 join t1 on t1.c0 not like t2.c0
----
1
1
1
1
1
1
1
1
1
1
1
1
1
1
1
1
1
1
1

query I rowsort
select cast((((coalesce(t2.c0, t2.c0))not ilike(t2.c0))) = true as int) as count from v0, t2 right outer join t1 on not (not (((t1.c0)not ilike(t2.c0))))
----
0
0
0
0
0
0
0
0
0
0
0
0
0
0
0
0
0
0
0
0
0
0
0
0
0
0
0
0
0
0
0
0
0
0
0
0
0
0
0
0
0
0
0
0
0
0
0
0
0
0
0
0
0
0
0
0
0
NULL
NULL
NULL
NULL
NULL
NULL

statement ok
ROLLBACK

statement ok
START TRANSACTION

statement ok
CREATE TABLE "sys"."t1" ("c0" BOOLEAN)

statement ok
INSERT INTO t1(c0) VALUES(TRUE), ((EXISTS (SELECT DATE '1970-01-06' FROM t1)) BETWEEN (TRUE) AND ((1) IN (1)))

query I rowsort
SELECT c0 from t1
----
0
1

statement ok
ROLLBACK

statement ok
START TRANSACTION

statement ok
CREATE TABLE "sys"."t0" ("c0" TIMESTAMP,"c1" CHARACTER LARGE OBJECT NOT NULL,CONSTRAINT "t0_c1_pkey" PRIMARY KEY ("c1"),CONSTRAINT "t0_c0_c1_unique" UNIQUE ("c0", "c1"))

statement ok
COPY 4 RECORDS INTO "sys"."t0" FROM stdin USING DELIMITERS E'\t',E'\n','"'
<COPY_INTO_DATA>
"1970-01-23 07:23:51.000000"	"1906903205"
"1970-01-23 07:23:51.000000"	"0.4338646653291859"
"1970-01-23 07:23:51.000000"	"-1882905169"
"1970-01-23 07:23:51.000000"	"*"

statement ok
CREATE TABLE "sys"."t1" ("c0" CHAR(343) NOT NULL,"c2" SMALLINT NOT NULL,CONSTRAINT "t1_c0_pkey" PRIMARY KEY ("c0"),CONSTRAINT "t1_c0_unique" UNIQUE ("c0"),CONSTRAINT "t1_c2_unique" UNIQUE ("c2"),CONSTRAINT "t1_c2_c0_unique" UNIQUE ("c2", "c0"))

statement ok
COPY 3 RECORDS INTO "sys"."t1" FROM stdin USING DELIMITERS E'\t',E'\n','"'
<COPY_INTO_DATA>
"+}TD"	1
""	3
"541635614"	5

statement ok
CREATE TABLE "sys"."t2" ("c0" CHAR(343) NOT NULL,"c2" SMALLINT NOT NULL)

query T rowsort
SELECT t0.c1 FROM t0, t1 FULL OUTER JOIN t2 ON TRUE WHERE (t0.c1) BETWEEN SYMMETRIC ('p%AY') AND (t1.c0)
----
*
-1882905169
-1882905169
0.4338646653291859
0.4338646653291859
1906903205
1906903205

query I rowsort
SELECT t1.c2 FROM t0, t1 FULL OUTER JOIN t2 ON NOT (((TIME '03:59:32') IS NULL) = TRUE) WHERE (t0.c1) NOT BETWEEN SYMMETRIC ('p%AY') AND (t1.c0)
----
1
5
5
5
5

query I rowsort
SELECT CAST(SUM(count) AS BIGINT) FROM (SELECT ALL CAST((t0.c1) NOT BETWEEN SYMMETRIC ('p%AY') AND (t1.c0) AS INT) as count FROM t0, t1 FULL OUTER JOIN t2 ON NOT (((TIME '03:59:32') IS NULL) = TRUE)) as res
----
5

statement ok
ROLLBACK

statement ok
CREATE TABLE t1(c0 TIME  DEFAULT (TIME '23:27:06'), c1 CHAR(317))

statement ok
INSERT INTO t1(c1, c0) VALUES(r'V', TIME '14:09:48'), (r'c', TIME '01:06:46')

statement ok
DELETE FROM t1 WHERE NOT (CAST(((854517748)/(-1764883455)) AS BOOLEAN))

statement ok
INSERT INTO t1(c0) VALUES(TIME '09:41:58')

statement ok
DROP TABLE t1

statement ok
CREATE TABLE t0(c0 TIME NULL PRIMARY KEY, c1 TIMESTAMP)

statement ok
CREATE TABLE IF NOT EXISTS t1(c0 TIMESTAMP, c1 INTERVAL SECOND)

statement ok
CREATE TABLE t2(LIKE t1)

statement ok
INSERT INTO t1(c1) VALUES(INTERVAL '1520729315' SECOND)

statement ok
CREATE ORDERED INDEX i0 ON t0 (c0)

statement ok
INSERT INTO t2(c0) VALUES(TIMESTAMP '1970-01-02 17:11:53')

statement ok
CREATE UNIQUE INDEX i1 ON t0 (c0, c1)

statement ok
INSERT INTO t0(c0) VALUES(TIME '20:35:54')

query I rowsort
SELECT CAST(TIMESTAMP '1970-01-01 19:30:21' = ALL(SELECT DISTINCT t2.c0 FROM t1, t2) AS INT) as count FROM t2, t0 LEFT OUTER JOIN t1 ON NOT EXISTS (SELECT DISTINCT t2.c0 FROM t1, t0, t2)
----
0

statement ok
DROP TABLE t0

statement ok
DROP TABLE t1

statement ok
DROP TABLE t2

statement ok
CREATE TABLE t0(c1 INTERVAL SECOND UNIQUE)

statement error
DROP INDEX t0_c1_unique

statement error
INSERT INTO t0 VALUES (INTERVAL '2071616848' SECOND), (INTERVAL '2071616848' SECOND)

statement ok
DROP TABLE t0

statement ok
START TRANSACTION

statement ok
CREATE TABLE "sys"."t0" ("c0" CHAR(473),"c1" INTERVAL SECOND NOT NULL,
	CONSTRAINT "t0_c0_unique" UNIQUE ("c0"),
	CONSTRAINT "t0_c1_unique" UNIQUE ("c1"),
	CONSTRAINT "t0_c0_c1_unique" UNIQUE ("c0", "c1")
)

statement ok
CREATE INDEX "i0" ON "sys"."t0" ("c1", "c0")

statement ok
COPY 18 RECORDS INTO "sys"."t0" FROM stdin USING DELIMITERS E'\t',E'\n','"'
<COPY_INTO_DATA>
"Qnec4v3|"	916700621.000
"B"	916700622.000
NULL	2052029418.000
"R"	1043124199.000
""	165830731.000
NULL	345888540.000
"[|"	393122059.000
" 瘞o"	1919932925.000
NULL	894242295.000
NULL	973935741.000
"W~[G-"	449082176.000
NULL	553114649.000
"MH锈"	2121838025.000
"'F6ꒉ"	97497547.000
NULL	2056175383.000
NULL	836812973.000
"/j"	97497548.000
"\t()Y%"	709557814.000

statement ok
CREATE TABLE "sys"."t1" ("c0" CHAR(473) NOT NULL)

statement ok
COPY 40 RECORDS INTO "sys"."t1" FROM stdin USING DELIMITERS E'\t',E'\n','"'
<COPY_INTO_DATA>
"v0"
"?}z#4齩"
"}IFT"
"A铑"
"1953144617"
"F฀r.(H"
"Vt1"
"E+Tx4A"
"b"
"O-,j3맲"
"0.6948820797452814"
"\015Hꢖ"
"^"
"RﻻK2"
"858302044"
"鄌"
"Y7瑚?뮱Qpt鿌"
"["
"-1593184632"
"0.4196422515625643"
"F9"
"VA"
"fN\n?菸\015Bb"
"0.3418058502965632"
"pM\015"
"{dT"
""
"vT"
"Ri5D"
"o_⑦l"
" "
"j"
""
""
"1814883154"
"715827645"
""
"pv"
"'AㆁB^UrHl"
"670216259"

statement ok
CREATE TABLE "sys"."t2" ("c0" DECIMAL(18,3) NOT NULL,"c1" DATE DEFAULT DATE '1970-01-07',
	CONSTRAINT "t2_c0_pkey" PRIMARY KEY ("c0"),
	CONSTRAINT "t2_c1_c0_unique" UNIQUE ("c1", "c0")
)

statement ok
COPY 8 RECORDS INTO "sys"."t2" FROM stdin USING DELIMITERS E'\t',E'\n','"'
<COPY_INTO_DATA>
0.203	1970-01-16
0.252	1970-01-07
0.511	1970-01-07
0.880	1970-01-23
0.209	1970-01-07
0.713	1970-01-07
0.199	1970-01-07
0.109	1970-01-07

query I rowsort
SELECT count(*) FROM t1 WHERE t1.c0 <> ALL(SELECT '1' WHERE FALSE)
----
40

query T rowsort
SELECT t1.c0 FROM t1 WHERE t1.c0 <> ALL(SELECT DISTINCT CAST(0.5646222839477373 AS INT) FROM t0, t1 WHERE (t0.c1) NOT BETWEEN ASYMMETRIC (COALESCE(t0.c1, t0.c1)) AND (t0.c1))
----
 
'A@B^UrHl
(empty)
(empty)
(empty)
(empty)
-1593184632
0.3418058502965632
0.4196422515625643
0.6948820797452814
1814883154
1953144617
670216259
715827645
858302044
?}z#4@
@
@H@
A@
E+Tx4A
F9
F@r.(H
O-,j3@
R@K2
Ri5D
VA
Vt1
Y7@?@Qpt@
[
^
b
fN@?@@Bb
j
o_@l
pM@
pv
v0
vT
{dT
}IFT

query I rowsort
SELECT CAST(SUM(count) AS BIGINT) FROM (SELECT ALL CAST(t1.c0 <> ALL(SELECT DISTINCT CAST(0.5646222839477373 AS INT) FROM t0, t1 WHERE (t0.c1) NOT BETWEEN ASYMMETRIC (COALESCE(t0.c1, t0.c1)) AND (t0.c1)) AS INT) as count FROM t1) as res
----
40

statement ok
ROLLBACK

statement ok
START TRANSACTION

statement ok
CREATE TABLE "sys"."t0" ("c0" TIME,"c1" DECIMAL(18,3))

statement ok
COPY 1 RECORDS INTO "sys"."t0" FROM stdin USING DELIMITERS E'\t',E'\n','"'
<COPY_INTO_DATA>
05:09:43	0.122

statement ok
CREATE TABLE "sys"."t1" ("c1" DECIMAL(18,3))

statement ok
COPY 2 RECORDS INTO "sys"."t1" FROM stdin USING DELIMITERS E'\t',E'\n','"'
<COPY_INTO_DATA>
0.320
0.995

statement ok
CREATE TABLE "sys"."t2" ("c0" DOUBLE NOT NULL,CONSTRAINT "t2_c0_pkey" PRIMARY KEY ("c0"),CONSTRAINT "t2_c0_unique" UNIQUE ("c0"))

statement ok
COPY 5 RECORDS INTO "sys"."t2" FROM stdin USING DELIMITERS E'\t',E'\n','"'
<COPY_INTO_DATA>
0.5352396631754883
0.4722686692942629
0.06898879964424565
946154646
0.5253008674729628

query I rowsort
select cast((t2.c0) not in ((select all 1.360204425E9 from t0), t2.c0) as int) from t1 full outer join t2 on false
----
0
0
0
0
0
NULL
NULL

statement ok
COPY 2 RECORDS INTO "sys"."t0" FROM stdin USING DELIMITERS E'\t',E'\n','"'
<COPY_INTO_DATA>
NULL	0.824
NULL	NULL

query I rowsort
select cast((t2.c0) not in ((select all 1.360204425E9 from t0), t2.c0) as int) from t1 full outer join t2 on false
----
0
0
0
0
0
NULL
NULL

statement ok
ROLLBACK

statement ok
START TRANSACTION

statement ok
CREATE TABLE "sys"."t0" ("c0" INTERVAL SECOND,CONSTRAINT "t0_c0_unique" UNIQUE ("c0"))

statement ok
COPY 5 RECORDS INTO "sys"."t0" FROM stdin USING DELIMITERS E'\t',E'\n','"'
<COPY_INTO_DATA>
1177718831.000
216055657.000
1178886037.000
859694812.000
979878169.000

statement ok
CREATE TABLE "sys"."t1" ("c0" INTERVAL SECOND)

statement ok
COPY 4 RECORDS INTO "sys"."t1" FROM stdin USING DELIMITERS E'\t',E'\n','"'
<COPY_INTO_DATA>
506889709.000
2018784278.000
106857823.000
NULL

statement ok
CREATE TABLE "sys"."t2" ("c0" INTERVAL SECOND)

statement ok
COPY 3 RECORDS INTO "sys"."t2" FROM stdin USING DELIMITERS E'\t',E'\n','"'
<COPY_INTO_DATA>
645994103.000
368127331.000
1669757164.000

query T rowsort
SELECT t2.c0 FROM t2 RIGHT OUTER JOIN t0 ON t2.c0 = ANY(SELECT t1.c0 FROM t1, t2)
----
NULL
NULL
NULL
NULL
NULL

statement error
SELECT CAST(((t0.c0)<(COALESCE((SELECT DISTINCT t0.c0 FROM t0, t2, t1), t0.c0, t2.c0))) AS INT) FROM t2 RIGHT OUTER JOIN t0 ON t2.c0 = ANY(SELECT t1.c0 FROM t1, t2)

statement ok
ROLLBACK

statement ok
CREATE TABLE "t0" ("c0" TIME NOT NULL,"c1" INTERVAL SECOND,"c2" TIME,CONSTRAINT "t0_c0_pkey" PRIMARY KEY ("c0"))

statement ok
INSERT INTO "t0" VALUES (TIME '03:34:11', INTERVAL '1713881698' SECOND, NULL)

statement ok
CREATE TABLE "t1" ("c0" TIME,"c2" TIME)

statement ok
INSERT INTO "t1" VALUES (TIME '20:46:35', NULL)

statement ok
INSERT INTO "t1" VALUES (TIME '21:28:54', NULL)

statement ok
INSERT INTO "t1" VALUES (TIME '08:15:08', TIME '20:32:11')

statement ok
CREATE TABLE "t2" ("c0" BOOLEAN NOT NULL,"c1" BOOLEAN,CONSTRAINT "t2_c0_pkey" PRIMARY KEY ("c0"),CONSTRAINT "t2_c0_unique" UNIQUE ("c0"),CONSTRAINT "t2_c1_unique" UNIQUE ("c1"))

query T rowsort
SELECT t1.c2 FROM t2 RIGHT OUTER JOIN t1 ON (t2.c1) WHERE (SELECT TIME '10:00:00') = ALL(SELECT t0.c2 FROM t0, t2)
----
20:32:11
NULL
NULL

statement error
SELECT t1.c2 FROM t2 RIGHT OUTER JOIN t1 ON (t2.c1) WHERE (SELECT t1.c2 FROM t1) = ALL(SELECT t0.c2 FROM t0, t2)

query T rowsort
SELECT t1.c2 FROM t2 RIGHT OUTER JOIN t1 ON (t2.c1) WHERE (SELECT t1.c2 FROM t1, t2) = ALL(SELECT t0.c2 FROM t0, t2)
----
20:32:11
NULL
NULL

query T rowsort
SELECT t1.c2 FROM t2 RIGHT OUTER JOIN t1 ON NOT (t2.c1) WHERE (((((((0.98) NOT IN (17))OR(t2.c0)))AND((t2.c0) BETWEEN ASYMMETRIC (t2.c0) AND
((SELECT ALL t2.c0 FROM t2, t0 WHERE t2.c1)))))OR((SELECT t1.c2 FROM t1, t2) = ALL(SELECT ALL t0.c2 FROM t0, t1, t2)))
----
20:32:11
NULL
NULL

query I rowsort
SELECT CAST(SUM(count) AS BIGINT) FROM (SELECT CAST((((((((0.98) NOT IN (17))OR(t2.c0)))AND((t2.c0) BETWEEN ASYMMETRIC (t2.c0) AND
((SELECT t2.c0 FROM t2, t0 WHERE t2.c1)))))OR((SELECT ALL t1.c2 FROM t1, t2) = ALL(SELECT t0.c2 FROM t0, t1, t2))) AS INT) as count FROM t2 RIGHT OUTER JOIN t1 ON NOT (t2.c1)) as res
----
3

statement ok
DROP TABLE t0

statement ok
DROP TABLE t1

statement ok
DROP TABLE t2

statement ok
START TRANSACTION

statement ok
CREATE TABLE "t0"("c0" INTERVAL SECOND)

statement ok
INSERT INTO "t0" VALUES (INTERVAL '350200327' SECOND)

statement ok
CREATE TABLE "t1"("c0" INTERVAL SECOND)

statement ok
INSERT INTO "t1" VALUES (INTERVAL '1236176693' SECOND)

statement ok
CREATE TABLE "t2"("c0" INTERVAL SECOND NOT NULL)

statement ok
INSERT INTO "t2" VALUES (INTERVAL '1253074618' SECOND)

query I rowsort
SELECT t1.c0 > COALESCE((SELECT INTERVAL '1' SECOND FROM t2), (SELECT t1.c0 FROM t1)) FROM t1
----
1

query I rowsort
SELECT CAST(SUM(count) AS BIGINT) FROM (SELECT ALL CAST((t1.c0) NOT BETWEEN ASYMMETRIC (COALESCE((SELECT DISTINCT INTERVAL '1584712456' SECOND FROM t2), (SELECT t1.c0 FROM t2, t1, t0))) AND (t1.c0) AS INT) as count FROM t1) as res
----
1

statement ok
ROLLBACK

statement ok
START TRANSACTION

statement ok
CREATE TABLE "t0" ("c0" TIME,"c1" TIMESTAMP NOT NULL,CONSTRAINT "t0_c1_pkey" PRIMARY KEY ("c1"))

statement ok
INSERT INTO "t0" VALUES (NULL, TIMESTAMP '1970-01-06 16:28:55.000000')

statement ok
INSERT INTO "t0" VALUES (NULL, TIMESTAMP '1970-01-18 19:02:05.000000')

statement ok
INSERT INTO "t0" VALUES (NULL, TIMESTAMP '1970-01-09 14:51:19.000000')

statement ok
INSERT INTO "t0" VALUES (NULL, TIMESTAMP '1970-01-25 19:25:31.000000')

statement ok
INSERT INTO "t0" VALUES (TIME '15:23:49', TIMESTAMP '1970-01-13 01:58:15.000000')

statement ok
CREATE TABLE "t1" ("c1" TIMESTAMP NOT NULL,CONSTRAINT "t1_c1_pkey" PRIMARY KEY ("c1"))

statement ok
INSERT INTO "t1" VALUES (TIMESTAMP '1970-01-16 14:51:17.000000')

statement ok
INSERT INTO "t1" VALUES (TIMESTAMP '1970-01-14 12:10:12.000000')

statement ok
INSERT INTO "t1" VALUES (TIMESTAMP '1970-01-02 08:05:41.000000')

statement ok
CREATE TABLE "t2" ("c1" TIMESTAMP NOT NULL,CONSTRAINT "t2_c1_pkey" PRIMARY KEY ("c1"))

query T rowsort
SELECT t1.c1 FROM t1 WHERE COALESCE(NOT (SELECT FALSE FROM t2), true)
----
1970-01-02 08:05:41
1970-01-14 12:10:12
1970-01-16 14:51:17

query T rowsort
SELECT t1.c1 FROM t1 WHERE COALESCE(NOT (SELECT FALSE FROM t2), false)
----

query T rowsort
SELECT t1.c1 FROM t1 WHERE COALESCE(NOT ((SELECT DISTINCT FALSE FROM t1, t0, t2)), COALESCE((FALSE) = FALSE, ((t1.c1)<(t1.c1)), (t1.c1) NOT BETWEEN SYMMETRIC (TIMESTAMP '1970-01-02 00:34:29')
AND (t1.c1), (FALSE) = FALSE, (DATE '1970-01-01') NOT IN (DATE '1970-01-02', DATE '1970-01-02')), FALSE)
----
1970-01-02 08:05:41
1970-01-14 12:10:12
1970-01-16 14:51:17

query I rowsort
SELECT CAST(SUM(count) AS BIGINT) FROM (SELECT CAST(COALESCE(NOT ((SELECT DISTINCT FALSE FROM t1, t0, t2)), COALESCE((FALSE) = FALSE, ((t1.c1)<(t1.c1)), (t1.c1) NOT BETWEEN SYMMETRIC (TIMESTAMP '1970-01-02 00:34:29')
AND (t1.c1), (FALSE) = FALSE, (DATE '1970-01-01') NOT IN (DATE '1970-01-02', DATE '1970-01-02')), FALSE) AS INT) as count FROM t1) as res
----
3

statement ok
ROLLBACK

statement ok
START TRANSACTION

statement ok
CREATE TABLE "t0" ("c0" BOOLEAN NOT NULL,"c1" INTERVAL MONTH,CONSTRAINT "t0_c0_pkey" PRIMARY KEY ("c0"))

statement ok
INSERT INTO "t0" VALUES (false, NULL)

statement ok
CREATE TABLE "t1" ("c0" BOOLEAN)

statement ok
CREATE TABLE "t2" ("c1" DOUBLE PRECISION NOT NULL,"c2" DECIMAL(18,3) NOT NULL,CONSTRAINT "t2_c2_pkey" PRIMARY KEY ("c2"),CONSTRAINT "t2_c2_unique" UNIQUE ("c2"),CONSTRAINT "t2_c1_c2_unique" UNIQUE ("c1", "c2"))

statement ok
INSERT INTO "t2" VALUES (0.9896628791758083, 0.017)

statement ok
INSERT INTO "t2" VALUES (-808084788, 0.922)

query I rowsort
SELECT t0.c0 FROM t0 WHERE (t0.c0 <> ALL(SELECT TRUE FROM t0, t1) AND t0.c0) = FALSE
----
0

query I rowsort
SELECT t0.c0 FROM t0 WHERE (((((((t0.c0 <> ALL(SELECT ALL t0.c0 FROM t0, t2, t1))OR(t0.c0)))AND(t0.c0)))OR(t0.c0))) = FALSE
----
0

query I rowsort
SELECT CAST(SUM(count) AS BIGINT) FROM (SELECT CAST((((((((t0.c0 <> ALL(SELECT t0.c0 FROM t0, t2, t1))OR(t0.c0)))AND(t0.c0)))OR(t0.c0))) = FALSE AS INT) as count FROM t0) as res
----
1

statement ok
ROLLBACK

