statement ok
START TRANSACTION

statement ok
CREATE TABLE "t2" ("c0" INT)

statement ok
create view v1(vc0) as (select 1 where false)

statement ok
create view v2(vc0) as (select true)

query I nosort
SELECT (SELECT 'a' FROM v1) <> ALL(SELECT 'b' FROM t2) FROM v2
----
1

query I nosort
SELECT CAST(SUM(count) AS BIGINT) FROM (SELECT CAST((SELECT 'a' FROM v1) <> ALL((SELECT 'b' FROM t2) UNION (SELECT 'c' FROM v1)) AS INT)
as count FROM v2) as res
----
1

query I nosort
SELECT 1 FROM v2 WHERE (SELECT 'a' FROM v1) <> ALL((SELECT 'b' FROM t2) UNION (SELECT 'c' FROM v1))
----
1

statement ok
ROLLBACK

statement ok
START TRANSACTION

statement ok
CREATE TABLE t0 (c0 INT)

statement ok
INSERT INTO t0 VALUES (1)

statement ok
CREATE TABLE t1 (c0 INT)

statement ok
INSERT INTO t1 VALUES (1)

query I nosort
SELECT 1 = ANY(SELECT 1 FROM t1 JOIN (SELECT count(*) GROUP BY t0.c0) AS x(x) ON TRUE) FROM t0
----
1

statement ok
ROLLBACK

statement ok
START TRANSACTION

statement ok
CREATE VIEW v1(vc0, vc1, vc2) AS (WITH ctel0n0(ct0n0,ct0n1) AS (VALUES (4, 5)) SELECT 1, 2, 3 FROM ctel0n0)

query III rowsort
SELECT * FROM v1
----
1
2
3

statement error 42000!CREATE VIEW: LIMIT not supported
CREATE VIEW v2(vc0, vc1, vc2) AS (WITH ctel0n0(ct0n0,ct0n1) AS (VALUES (4, 5)) SELECT 1, 2, 3 FROM ctel0n0 LIMIT 7)

statement ok
ROLLBACK

statement ok
CREATE TABLE mct20 (c0 INTERVAL DAY, c1 DATE)

query I nosort
select 1 from mct20 inner join (select x.x from (values (true)) x(x)) as nort0(norc0)
on true and greatest(((select nort0.norc0) intersect (select true)), true)
----

query I nosort
select rank() over (order by ((select mct20.c0) union all (select interval '1' day))) from mct20
----

query T nosort
select sum(((select mct20.c0) union all (select interval '1' day))) over () from mct20
----

query T nosort
select sum(((select interval '2' day) union all (select interval '1' day))) over () from mct20
----

query T nosort
select max(((select mct20.c0) union all (select interval '1' day))) over () from mct20
----

statement ok rowcount 1
INSERT INTO mct20 VALUES (INTERVAL '1' DAY, DATE '2010-01-01')

statement error GDK reported error: BATsubcross: more than one match
select 1 from mct20 where ((select true) union all (select true))

statement error GDK reported error: mergejoin: more than one match
select 1 from mct20 inner join (select x.x from (values (true)) x(x)) as nort0(norc0)
on true and greatest(((select nort0.norc0) union all (select true)), true)

statement error GDK reported error: mergejoin: more than one match
select 1 from mct20 inner join (select x.x from (values (true)) x(x)) as nort0(norc0)
on ((select nort0.norc0) union all (select true))

statement error GDK reported error: mergejoin: more than one match
select 1 from mct20 inner join (select x.x from (values (true)) x(x)) as nort0(norc0)
on true where ((select nort0.norc0) union all (select true))

statement error GDK reported error: mergejoin: more than one match
select rank() over (order by ((select mct20.c0) union all (select interval '1' day))) from mct20
----

statement error GDK reported error: mergejoin: more than one match
select sum(((select mct20.c0) union all (select interval '1' day))) over () from mct20
----

statement error GDK reported error: BATsubcross: more than one match
select sum(((select interval '2' day) union all (select interval '1' day))) over () from mct20
----

statement error GDK reported error: mergejoin: more than one match
select max(((select mct20.c0) union all (select interval '1' day))) over () from mct20
----

statement ok
DROP TABLE mct20

statement ok
START TRANSACTION

statement ok
CREATE TABLE t0(c0 INT)

query I nosort
with x(x) as (select 4) select 2 > all(select 3 from t0 full outer join (values (x.x)) as y(y) on false) from x
----
0

statement ok rowcount 0
update t0 set c0 = (with x(x) as (select 3)
select 79 from x join (select 1) as y(y) on v17.c0 <= -4 where x.x > 1) from t0 v17

statement ok rowcount 1
INSERT INTO t0 VALUES (1)

statement ok rowcount 1
update t0 set c0 = (with x(x) as (select 3)
select 79 from x join (select 1) as y(y) on v17.c0 <= -4 where x.x > 1) from t0 v17

query I nosort
SELECT c0 FROM t0
----
NULL

statement ok
CREATE TABLE rt0 (c0 INT)

statement ok
CREATE TABLE rt2v2 (c0 UUID)

statement ok rowcount 1
INSERT INTO rt2v2 VALUES (uuid 'dbC4da54-8C0B-4b83-E74E-30342dA0a5fF')

statement ok rowcount 0
update rt2v2 set c0 = (select rt2v2.c0 from rt0 where false) from rt0 where cast(2 in (select null where true) as boolean)

statement ok
ROLLBACK

statement ok
START TRANSACTION

statement ok
create table t0 (c0 int)

statement ok
create or replace view vx(vc0, vc1, vc2) as (values (1,0,2))

query I nosort
SELECT 1 FROM (values (0)) vx(vc1) WHERE 1 > ALL(SELECT vx.vc1 FROM t0)
----
1

query I nosort
SELECT vx.vc2 FROM vx JOIN (VALUES (1)) AS x(x) ON TRUE WHERE vx.vc0 >= ALL(SELECT t0.c0 FROM t0) AND 1 >= ALL(SELECT vx.vc1 FROM t0)
----
2

query I nosort
SELECT CAST(SUM(count) AS BIGINT) FROM (SELECT CAST(vx.vc0 >= ALL(SELECT t0.c0 FROM t0) AND 1 >= ALL(SELECT vx.vc1 FROM t0) AS INT)
as count FROM vx JOIN (VALUES (1)) AS x(x) ON TRUE) as res
----
1

statement ok
create or replace view vx(x) AS (VALUES (184),(33),(3600))

statement ok
create or replace view vy(y) AS (VALUES (FALSE),(FALSE))

query I nosort
SELECT 1 FROM vy WHERE NOT EXISTS (SELECT 1 FROM vx WHERE vy.y)
----
1
1

query I nosort
SELECT vy.y FROM vy WHERE CAST(NOT EXISTS (SELECT 1 FROM vx WHERE vy.y) AS BOOLEAN)
----
0
0

query I nosort
SELECT CAST(SUM(count) AS BIGINT) FROM (SELECT CAST(CAST(NOT EXISTS (SELECT 1 FROM vx WHERE vy.y) AS BOOLEAN) AS INT) as count FROM vy) as res
----
2

statement ok
ROLLBACK

statement ok
START TRANSACTION

statement ok
create table t0 (c0 int, CONSTRAINT "t0_c0_pkey" PRIMARY KEY ("c0"))

statement ok rowcount 1
MERGE INTO t0 USING (SELECT 1 FROM t0
FULL OUTER JOIN (SELECT 1 FROM t0 AS w RIGHT OUTER JOIN (SELECT 1) AS z(z) ON EXISTS (SELECT 1 WHERE w.c0 > 0)) AS y(y)
ON y.y = y.y) AS x(x) ON TRUE WHEN NOT MATCHED THEN INSERT (c0) VALUES (1)

statement ok rowcount 1
TRUNCATE t0

statement ok
CREATE TABLE rt0 (c0 INT)

query I nosort
SELECT 1 FROM rt0 WHERE 5 <= ALL(SELECT 2 FROM generate_series((SELECT 3, rt0.c0, 4 FROM rt0 x)))
----

query I nosort
SELECT 1 FROM t0 WHERE 5 <= ALL(SELECT 2 FROM generate_series((SELECT 3, t0.c0, 4 FROM t0 x)))
----

statement ok
create or replace view vx(vc0, vc1) as (select 10, 2)

query I nosort
SELECT vx.vc1 <> ALL(SELECT x.x) FROM vx JOIN (SELECT 1) AS x(x) ON vx.vc1 <> ALL(SELECT vx.vc1 FROM t0) AND (SELECT FALSE FROM t0)
----

query I nosort
SELECT vx.vc1 <> ALL(SELECT x.x FROM t0) FROM vx JOIN (SELECT 1) AS x(x) ON vx.vc1 <> ALL(SELECT vx.vc1 FROM t0) AND (SELECT FALSE FROM t0)
----

query I nosort
SELECT 1 FROM vx JOIN (SELECT 1) AS x(x) ON vx.vc1 <> ALL(SELECT vx.vc1 FROM t0) AND (SELECT FALSE FROM t0)
----

query I nosort
SELECT 1 FROM vx WHERE vx.vc1 <> ALL(SELECT vx.vc1 FROM t0) AND (SELECT FALSE FROM t0)
----

query I nosort
SELECT 1 FROM (SELECT DISTINCT c0 FROM rt0) vt(vc1) WHERE (1) IN (SELECT 2 FROM rt0 GROUP BY rt0.c0, vt.vc1)
----

statement ok
CREATE TABLE integers(i INTEGER)

statement ok rowcount 4
INSERT INTO integers VALUES (1), (2), (3), (NULL)

query I rowsort
SELECT i IN (SELECT i1.i FROM (SELECT * FROM integers i1 WHERE i1.i=integers.i) i1 JOIN generate_series(1, 3, 1) tbl(i) ON i1.i=tbl.i) FROM integers
----
0
0
1
1

query I rowsort
SELECT i IN (SELECT i1.i FROM (SELECT * FROM integers i1 WHERE i1.i=integers.i) i1 LEFT JOIN generate_series(1, 3, 1) tbl(i) ON i1.i=tbl.i) FROM integers
----
0
1
1
1

query I rowsort
SELECT i IN (SELECT i1.i FROM generate_series(1, 3, 1) tbl(i) RIGHT JOIN (SELECT * FROM integers i1 WHERE i1.i=integers.i) i1 ON i1.i=tbl.i) FROM integers
----
0
1
1
1

query I rowsort
SELECT i IN (SELECT i1.i FROM (SELECT * FROM integers i1 WHERE i1.i=integers.i) i1 RIGHT JOIN generate_series(1, 3, 1) tbl(i) ON i1.i=tbl.i) FROM integers
----
1
1
NULL
NULL

query I rowsort
SELECT i IN (SELECT i1.i FROM generate_series(1, 3, 1) tbl(i) LEFT JOIN (SELECT * FROM integers i1 WHERE i1.i=integers.i) i1 ON i1.i=tbl.i) FROM integers
----
1
1
NULL
NULL

query I nosort
SELECT 1 FROM rt0 JOIN ((SELECT 2) EXCEPT (SELECT 3)) AS x(x) ON TRUE
----

query I nosort
SELECT 1 FROM rt0 JOIN (VALUES (1),(2),(3)) AS x(x) ON TRUE
----

query I nosort
SELECT 1 FROM rt0 JOIN LATERAL ((SELECT 2) EXCEPT (SELECT 3)) AS x(x) ON TRUE
----

query I nosort
SELECT 1 FROM rt0 JOIN LATERAL (VALUES (1),(2),(3)) AS x(x) ON TRUE
----

query I nosort
SELECT 1 FROM rt0 JOIN LATERAL (with x(x) as (select rt0.c0) (select x from x)) AS x(x) ON TRUE
----

statement ok rowcount 4
INSERT INTO rt0 VALUES (1), (2), (3), (NULL)

query I rowsort
SELECT rt0.c0 FROM rt0 JOIN LATERAL (with x(x) as (select rt0.c0) (select rt0.c0 + x.x from x)) AS x(x) ON TRUE
----
1
2
3
NULL

query I rowsort
SELECT rt0.c0 FROM rt0 CROSS JOIN LATERAL (with x(x) as (select rt0.c0) (select rt0.c0 + x.x from x)) AS x(x)
----
1
2
3
NULL

query I nosort
SELECT rt0.c0 FROM rt0 CROSS JOIN LATERAL ((SELECT rt0.c0 + 2) INTERSECT (SELECT rt0.c0 - 2)) AS x(x)
----
NULL

query I rowsort
SELECT rt0.c0 FROM rt0 CROSS JOIN LATERAL (VALUES (rt0.c0), (4)) AS x(x)
----
1
1
2
2
3
3
NULL
NULL

statement error 42000!SELECT: relation name "rt0" specified more than once
SELECT 1 FROM rt0 JOIN ((SELECT 1) UNION ALL (SELECT 2)) AS rt0(c0) ON TRUE

statement ok
ROLLBACK

statement error 42000!SELECT: relation name "rt0" specified more than once
SELECT 1 FROM (SELECT 1) rt0(c0) JOIN ((SELECT 1) UNION ALL (SELECT 2)) AS rt0(c0) ON TRUE

statement error 42000!SELECT: relation name "rt0" specified more than once
SELECT 1 FROM (SELECT 1) rt0(c0) JOIN LATERAL ((SELECT 1) UNION ALL (SELECT 2)) AS rt0(c0) ON TRUE

statement error 42000!SELECT: identifier 'c0' ambiguous
SELECT c0 FROM (SELECT 1) rt1(c0) JOIN ((SELECT 1) EXCEPT (SELECT 2)) AS rt0(c0) ON TRUE

statement error 42000!SELECT: identifier 'c0' ambiguous
SELECT c0 FROM (SELECT 1) rt1(c0) JOIN LATERAL ((SELECT 1) EXCEPT (SELECT 2)) AS rt0(c0) ON TRUE

statement error 42000!SELECT: relation name "rt0" specified more than once
SELECT 1 FROM (SELECT 1) rt0(c0) CROSS JOIN (WITH x(x) AS (SELECT 2) SELECT 3 FROM x) AS rt0(c1)

statement error 42000!SELECT: relation name "rt0" specified more than once
SELECT 1 FROM (SELECT 1) rt0(c0) CROSS JOIN LATERAL (WITH x(x) AS (SELECT 2) SELECT 3 FROM x) AS rt0(c1)

statement error 42000!SELECT: identifier 'c0' ambiguous
SELECT c0 FROM (SELECT 1) rt1(c0) CROSS JOIN (WITH x(x) AS (SELECT 2) SELECT 3) AS rt0(c0)

statement error 42000!SELECT: identifier 'c0' ambiguous
SELECT c0 FROM (SELECT 1) rt1(c0) CROSS JOIN LATERAL (WITH x(x) AS (SELECT 2) SELECT 3) AS rt0(c0)

statement ok
START TRANSACTION

statement ok
CREATE TABLE rt1 (c0 VARCHAR(32))

statement ok rowcount 1
INSERT INTO rt1 VALUES ('abc')

query I nosort
SELECT 'c' <> ANY(VALUES (rt1.c0), ('b')) FROM rt1
----
1

statement ok
CREATE TABLE t2 (c0 INT)

statement ok rowcount 2
INSERT INTO t2 VALUES (1), (2)

query I nosort
SELECT CAST(SUM(count) AS BIGINT) FROM (SELECT CAST(EXISTS (SELECT 1 WHERE FALSE HAVING max(cast(3 > t2.c0 OR (SELECT min('true') FROM t2)
= 'true' as int)) > 0) = FALSE AS INT) as count FROM t2) as res
----
0

query I nosort
SELECT EXISTS (SELECT 1 WHERE FALSE HAVING max(t2.c0) > 0) FROM t2
----
1

query I nosort
SELECT EXISTS (SELECT 1 WHERE FALSE HAVING max(cast(3 > t2.c0 as int)) > 0) FROM t2
----
1

query I nosort
SELECT EXISTS (SELECT 1 WHERE FALSE HAVING max(cast(3 > t2.c0 OR (SELECT min('true') FROM t2) = 'true' as int)) > 0) FROM t2
----
1

query I nosort
SELECT t2.c0 FROM t2 WHERE EXISTS (SELECT 1 WHERE FALSE HAVING max((SELECT min(1) FROM t2)) > 0)
----

statement ok
SAVEPOINT sp1

statement error 42000!SELECT: aggregate functions not allowed in WHERE clause
SELECT t2.c0 FROM t2 WHERE EXISTS (SELECT 1 WHERE FALSE HAVING max(cast(3 > t2.c0 OR (SELECT min('true') FROM t2) = 'true' as int)) > 0)

statement ok
ROLLBACK TO SAVEPOINT sp1

statement ok
CREATE TABLE rt2 ("c0" INTERVAL DAY)

statement ok rowcount 2
INSERT INTO rt2 VALUES (INTERVAL '0' SECOND),(INTERVAL '0' SECOND)

statement ok
SAVEPOINT sp2

statement error
SELECT TRUE FROM rt2 AS x RIGHT OUTER JOIN LATERAL (SELECT x.c0, TRUE FROM rt2) AS y(y,z) ON y.z

statement ok
ROLLBACK TO SAVEPOINT sp2

statement error
SELECT TRUE FROM rt2 AS x FULL OUTER JOIN LATERAL (SELECT x.c0, TRUE FROM rt2) AS y(y,z) ON y.z

statement ok
ROLLBACK TO SAVEPOINT sp2

query I nosort
SELECT TRUE FROM rt2 AS x JOIN LATERAL (SELECT x.c0, TRUE FROM rt2) AS y(y,z) ON y.z
----
1
1
1
1

query I nosort
SELECT TRUE FROM rt2 AS x CROSS JOIN LATERAL (SELECT x.c0, TRUE FROM rt2) AS y(y,z)
----
1
1
1
1

query I nosort
SELECT TRUE FROM rt2 AS x LEFT OUTER JOIN LATERAL (SELECT x.c0, TRUE FROM rt2) AS y(y,z) ON y.z
----
1
1
1
1

statement ok
create table t0 (c0 int)

query I nosort
SELECT (SELECT FALSE FROM t0 LEFT OUTER JOIN (VALUES (y.z), (y.z)) AS x(x) ON y.y = y.y) FROM t0
JOIN (VALUES ('b', 3)) AS y(y,z) ON y.y >= ANY(VALUES (y.y))
----

statement ok
CREATE TABLE rt3 (c0 DATE)

statement ok rowcount 4
INSERT INTO rt3 VALUES (DATE '4153-10-28'),(DATE '2471-08-17'),(DATE '2022-02-08'),(DATE '1970-01-20')

query T nosort
SELECT (SELECT DATE '2011-10-01' FROM rt3 y RIGHT OUTER JOIN (VALUES (DATE '2010-10-01'), (z.c0)) AS x(x) ON 
length('a') > 0 WHERE rt3.c0 = DATE '2012-10-01') FROM rt3, rt3 z
----
NULL
NULL
NULL
NULL
NULL
NULL
NULL
NULL
NULL
NULL
NULL
NULL
NULL
NULL
NULL
NULL

statement ok
CREATE TABLE t1 (c0 INT)

statement ok
CREATE TABLE t3 (c0 BOOLEAN)

query I nosort
SELECT EXISTS (SELECT 1 FROM t0 FULL OUTER JOIN (SELECT 3) AS x(x) ON t3.c0 CROSS JOIN (SELECT t3.c0) AS y(y) WHERE y.y) FROM t3
----

query I nosort
SELECT 1 FROM t0 CROSS JOIN LATERAL (SELECT 1 FROM t1 WHERE (SELECT t1.c0 FROM t1) NOT IN (COALESCE(t1.c0, t0.c0))) AS x(x)
----

statement ok
CREATE TABLE rt4 (c0 INT NOT NULL, CONSTRAINT rt4_c0_unique UNIQUE (c0))

statement ok rowcount 1
INSERT INTO rt4 VALUES (1)

query I nosort
SELECT rt4.c0 FROM rt4 WHERE NOT EXISTS ((SELECT rt4.c0 FROM t1) INTERSECT (SELECT rt4.c0))
----
1

query I nosort
SELECT rt4.c0 FROM rt4 WHERE NOT EXISTS ((SELECT rt4.c0 FROM t1) INTERSECT ALL (SELECT rt4.c0))
----
1

query I nosort
SELECT rt4.c0 FROM rt4 WHERE NOT EXISTS ((SELECT rt4.c0) INTERSECT (SELECT rt4.c0))
----

query I nosort
SELECT rt4.c0 FROM rt4 WHERE NOT EXISTS ((SELECT rt4.c0) INTERSECT ALL (SELECT rt4.c0))
----

query I nosort
SELECT CAST(SUM(count) AS BIGINT) FROM (SELECT CAST(NOT EXISTS ((SELECT rt4.c0 FROM t1) INTERSECT (SELECT rt4.c0)) AS INT) as count FROM rt4) as res
----
1

query I nosort
SELECT 1 FROM t0 LEFT OUTER JOIN LATERAL (VALUES (t0.c0)) AS x(x) ON t0.c0 < ALL(SELECT 1)
----

query I nosort
SELECT 1 FROM t0 LEFT OUTER JOIN LATERAL (SELECT 2, (VALUES (3), (t0.c0))) AS x(x,y) ON x.x IN (SELECT x.x)
----

query I nosort
SELECT 1 FROM t0 LEFT OUTER JOIN LATERAL (SELECT DISTINCT 3 FROM t1 AS tx JOIN (SELECT 1) AS y(y)
ON tx.c0 > 2 OR t0.c0 > 3) AS x(x) ON (SELECT TRUE FROM t1) OR FALSE
----

query I nosort
SELECT 1 FROM (SELECT TRUE) AS vx(x), t3 WHERE vx.x AND greatest(t3.c0, EXISTS (SELECT 1 WHERE vx.x))
----

query I nosort
SELECT (SELECT 1 FROM (VALUES (1),(2),(3)) z(z) FULL OUTER JOIN (VALUES (2, 3), (4, t0.c0)) AS x(x,y) ON z.z) FROM t0
----

query I nosort
select 1 where (2,3) in (select x,y from (values (2, 3), (4, 5)) x(x,y))
----
1

query I nosort
select 1 where (2,3) in (select 2,3 union all select 3,4)
----
1

query I nosort
select 1 where (2,3) in (with x(x,y) as (select 2,3) select x,y from x)
----
1

query I nosort
select 1 where (2,3) in ((values (2, 3), (4, 5)))
----
1

statement ok
create table t4 (c0 int, c1 int)

statement ok rowcount 3
insert into t4 values (1,1),(2,2),(3,3)

query I nosort
select c1 from t4 where (c0,3) in (select 2,3 union all select 3,4)
----
2

query I nosort
select c1 from t4 where (c0,3) in ((select 2,3 union all select 3,4),(select 2,3 union all select 6,7))
----
2

query I rowsort
select c1 from t4 where (c0,3) in ((select 2,3 union all select 3,4),(select 3,3 union all select 5,4))
----
2
3

query I nosort
select c1 from t4 where (c0,3) in (select 2,3 where false)
----

query I nosort
SELECT 1 FROM (values (1, 4), (3, (select 2))) x(x,y) WHERE greatest(FALSE, FALSE)
----

query I nosort
SELECT 1 FROM (values (1, 4), (3, (select 2 where true))) x(x,y) WHERE greatest(FALSE, FALSE)
----

query I nosort
SELECT EXISTS (VALUES (1, FALSE), (2, 1 < ALL(SELECT x.x))) FROM (SELECT 1) x(x)
----
1

query I nosort
SELECT 1 FROM (values (1, 4), (3, 2)) x(x,y) WHERE greatest(FALSE, FALSE)
----

query I nosort
SELECT 1 FROM t0 RIGHT OUTER JOIN (SELECT TRUE) AS z(z) ON 1 = ANY(SELECT t0.c0 FROM (SELECT 3) x(x))
AND (SELECT TRUE FROM (SELECT 4) x(x) FULL OUTER JOIN (SELECT 5) AS y(y) ON z.z)
----
1

query I nosort
SELECT 1 FROM t0 JOIN (VALUES (3, (SELECT 4))) AS x(x,y) ON x.x
----

query I nosort
select x from (select 2) as x(x) left outer join lateral (select distinct 3 from t1 where x.x > 0) as z(z)
on 4 > all(select x.x) and (x.x > 0 or x.x > 0)
----
2

query I nosort
SELECT 1 FROM t0 LEFT JOIN (SELECT 2) AS x(x) ON (VALUES (t0.c0), (x.x))
----

query I nosort
SELECT 1 FROM t0 LEFT JOIN (SELECT 2) AS x(x) ON (SELECT t0.c0 UNION ALL SELECT x.x) > 0
----

query I nosort
SELECT min((SELECT t0.c0 + t0.c0)) FROM t0
----
NULL

query I nosort
SELECT min((SELECT CASE t0.c0 WHEN t0.c0 THEN t0.c0 END)) FROM t0
----
NULL

query I nosort
SELECT 1 FROM (SELECT 2) AS x(x) LEFT OUTER JOIN (SELECT 3) y(y) ON (SELECT TRUE) OR (SELECT TRUE)
----
1

query I nosort
SELECT 1 FROM t0 CROSS JOIN LATERAL (SELECT 1 FROM (SELECT t0.c0 FROM t0) y(y) CROSS JOIN LATERAL (SELECT 5) x(x)) z(z)
----

query I nosort
SELECT EXISTS (SELECT 1 FROM (SELECT DISTINCT 1) y(y) WHERE x.x = ANY(VALUES (y.y))) FROM rt2 CROSS JOIN (SELECT 3) x(x)
----
0
0

statement ok
ROLLBACK

statement error 42000!SELECT: cannot use non GROUP BY column 'y.y' in query results without an aggregate function
SELECT y.y BETWEEN 1 AND max(x.x) FROM (SELECT 1) x(x), (SELECT 1) y(y)

statement error 42000!SELECT: cannot use non GROUP BY column 'y.y' in query results without an aggregate function
SELECT y.y BETWEEN max(x.x) AND 1 FROM (SELECT 1) x(x), (SELECT 1) y(y)

statement error 42000!SELECT: cannot use non GROUP BY column 'y.y' in query results without an aggregate function
SELECT 1 BETWEEN y.y AND max(x.x) FROM (SELECT 1) x(x), (SELECT 1) y(y)

statement error 42000!SELECT: cannot use non GROUP BY column 'y.y' in query results without an aggregate function
SELECT y.y BETWEEN 1 AND max(x.x) FROM (SELECT 1) x(x), (SELECT 1) y(y)

statement error 42000!SELECT: cannot use non GROUP BY column 'y.y' in query results without an aggregate function
SELECT y.y LIKE max(x.x) FROM (SELECT '1') x(x), (SELECT '1') y(y)

statement error 42000!SELECT: cannot use non GROUP BY column 'x.x' in query results without an aggregate function
SELECT max(y.y) LIKE x.x FROM (SELECT '1') x(x), (SELECT '1') y(y)

statement error 42000!SELECT: cannot use non GROUP BY column 'y.y' in query results without an aggregate function
SELECT [y.y] "like" [max(x.x), '', false] FROM (SELECT '1') x(x), (SELECT '1') y(y)

statement error 42000!SELECT: cannot use non GROUP BY column 'x.x' in query results without an aggregate function
SELECT [max(y.y)] "like" [x.x, '', false] FROM (SELECT '1') x(x), (SELECT '1') y(y)

statement error 42000!SELECT: cannot use non GROUP BY column 'y.y' in query results without an aggregate function
SELECT y.y IN (max(x.x)) FROM (SELECT 1) x(x), (SELECT 1) y(y)

statement error 42000!SELECT: cannot use non GROUP BY column 'y.y' in query results without an aggregate function
SELECT y.y AND max(x.x) FROM (SELECT 1) x(x), (SELECT 1) y(y)

statement error 42000!SELECT: cannot use non GROUP BY column 'y.y' in query results without an aggregate function
SELECT y.y OR max(x.x) FROM (SELECT 1) x(x), (SELECT 1) y(y)

statement error 42000!SELECT: cannot use non GROUP BY column 'y.y' in query results without an aggregate function
SELECT y.y + max(x.x) FROM (SELECT 1) x(x), (SELECT 1) y(y)

statement error 42000!SELECT: cannot use non GROUP BY column 'y.y' in query results without an aggregate function
SELECT case y.y when max(x.x) then 1 end FROM (SELECT 1) x(x), (SELECT 1) y(y)

statement error 42000!SELECT: cannot use non GROUP BY column 'x.x' in query results without an aggregate function
SELECT case 2 when x.x then min(y.y) end FROM (SELECT 1) x(x), (SELECT 1) y(y)

statement error 42000!SELECT: cannot use non GROUP BY column 'x.x' in query results without an aggregate function
SELECT case x.x when 2 then min(y.y) end FROM (SELECT 1) x(x), (SELECT 1) y(y)

statement error 42000!SELECT: cannot use non GROUP BY column 'x.x' in query results without an aggregate function
SELECT case 1 when 2 then x.x when max(y.y) then 3 end FROM (SELECT 1) x(x), (SELECT 1) y(y)

statement error 42000!SELECT: cannot use non GROUP BY column 'y.y' in query results without an aggregate function
SELECT y.y FROM (SELECT 1) x(x), (SELECT 1) y(y) order by min(x.x)

statement error 42000!SELECT: cannot use non GROUP BY column 'y.y' in query results without an aggregate function
SELECT ntile(y.y) over () FROM (SELECT 1) x(x), (SELECT 1) y(y) order by min(x.x)

statement error 42000!SELECT: cannot use non GROUP BY column 'x.y' in query results without an aggregate function
SELECT x.y, EXISTS (SELECT MIN(x.x)) FROM (SELECT 1, 2) x(x,y)

statement error 42000!SELECT: cannot use non GROUP BY column 'x.y' in query results without an aggregate function
SELECT x.y, (SELECT MIN(x.x)) FROM (SELECT 1, 2) x(x,y)

statement error 42000!SELECT: cannot use non GROUP BY column 'x.y' in query results without an aggregate function
SELECT (SELECT MIN(x.x)) FROM (SELECT 1, 2) x(x,y) ORDER BY x.y

statement error 42000!SELECT: cannot use non GROUP BY column 'x.y' in query results without an aggregate function
SELECT x.y, MIN(x.x + x.y) FROM (SELECT 1, 2) x(x,y)

statement error 42000!SELECT: cannot use non GROUP BY column 'x.x' in query results without an aggregate function
SELECT MAX(x), idontexist(x.x) FROM (SELECT 1) x(x)

query I nosort
SELECT ['1'] "like" [max(x.x), '', false] FROM (SELECT '1') x(x), (SELECT '1') y(y)
----
1

query I nosort
SELECT [max(y.y)] "like" ['1', '', false] FROM (SELECT '1') x(x), (SELECT '1') y(y)
----
1

statement error Subquery has too many columns
select 1 where (2,3) in (select x,y,2 from (values (2, 3), (4, 5)) x(x,y))

statement error Subquery has too few columns
select 1 where (2,3) in (select 2 union all select 3)

statement error SELECT: subquery must return only one column
select 1 where (2) in (with x(x,y) as (select 2,3) select x,y from x)

statement error GDK reported error: BATsubcross: more than one match
select x FROM (VALUES (1),(2),(3)) x(x) where ((select 3 union all select 3)) in (select 3)

statement error GDK reported error: BATsubcross: more than one match
select x FROM (VALUES (1),(2),(3)) x(x) where (2, (select 3 union all select 3)) in (select 2,3)

