statement ok
START TRANSACTION

statement ok
CREATE TABLE "t1" ("c0" INTEGER)

statement ok rowcount 31
INSERT INTO "t1" VALUES (8), (8), (-173909322), (4), (7), (-8), (11), (2112833619), (583284612), (581585171), (1), (6), (7), (0), (2), (1), (1041993071),
(NULL), (0), (-1498894491), (-47709878), (4), (6), (-526272879), (-1468874541), (4), (3), (-756533326), (7), (0), (-73089569)

statement ok
CREATE TABLE "t2" ("c0" INTEGER)

statement ok rowcount 53
INSERT INTO "t2" VALUES (2), (1), (6), (1), (-888425077), (2), (5), (-1), (554424471), (2), (-2097744654), (30), (0), (1), (2), (9), (NULL), (NULL),
(0), (1), (0), (1457967621), (-2007218942), (2), (-32), (6), (1379912927), (0), (9), (0), (-1149644916), (-1471582802), (0), (NULL), (7), (2003447142),
(NULL), (1041993071), (NULL), (-888425077), (2086619558), (-1), (6), (337689526), (NULL), (7), (7), (-109524918), (4), (10), (742198232), (0), (0)

query I rowsort
SELECT t2.c0 FROM t2 JOIN (SELECT DISTINCT TIME '01:00:00', greatest(t1.c0, 0.3)%asin(0.7) FROM t1) AS sub0(c0,c1) ON sub0.c1 <= t2.c0 WHERE '' NOT ILIKE 'x'
----
377 values hashing to 3fcc20c12d29f4847a2af7e1c9e3c51b

query T rowsort
SELECT '' NOT ILIKE 'x' FROM t2 JOIN (SELECT DISTINCT TIME '01:00:00', greatest(t1.c0, 0.3)%asin(0.7) FROM t1) AS sub0(c0,c1) ON sub0.c1 <= t2.c0
----
377 values hashing to 19d4c8a836908c70817468cb9b9d7405

statement ok
ROLLBACK

statement ok
START TRANSACTION

statement ok
create or replace view v18(vc0) as (select sql_max(1, 1) from ((select 2) intersect all (select 4)) v0(vc0) where 1 not between v0.vc0 and 3*v0.vc0)

query I rowsort
SELECT v18.vc0 FROM v18 WHERE -7 NOT BETWEEN 0.4 AND v18.vc0
----

query I rowsort
SELECT -7 NOT BETWEEN 0.4 AND v18.vc0 FROM v18
----

statement ok
create or replace view v19(vc0) as (select vc0 from ((select 2) intersect all (select 4)) v0(vc0) where 1 not between v0.vc0 and 3*v0.vc0)

query I rowsort
SELECT v19.vc0 FROM v19 WHERE -7 NOT BETWEEN 0.4 AND v19.vc0
----

query I rowsort
SELECT -7 NOT BETWEEN 0.4 AND v19.vc0 FROM v19
----

statement ok
create or replace view v20(vc0,vc1) as (select sql_max(1, 1), vc0 from ((select 2) intersect all (select 4)) v0(vc0) where 1 not between v0.vc0 and v0.vc0)

query I rowsort
SELECT v20.vc0 FROM v20 WHERE 7 > v20.vc0 and v20.vc1 between 3 and 5
----

# '7 > v20.vc0' doesn't get pushed, while 'v20.vc1 between 3 and 5' does
query T nosort
plan SELECT 1 FROM v20 WHERE 7 > v20.vc0 and v20.vc1 between 3 and 5
----
project (
| select (
| | project (
| | | intersect (
| | | | project (
| | | | | select (
| | | | | |  [ boolean "true" ]
| | | | | ) [ tinyint "2" ! <= tinyint "1" ! <= tinyint "2" BETWEEN , tinyint "3" <= tinyint "2" <= tinyint "5" BETWEEN  ]
| | | | ) [ tinyint "2" as "v0"."vc0" ],
| | | | project (
| | | | | select (
| | | | | |  [ boolean "true" ]
| | | | | ) [ tinyint "4" ! <= tinyint "1" ! <= tinyint "4" BETWEEN , tinyint "3" <= tinyint "4" <= tinyint "5" BETWEEN  ]
| | | | ) [ tinyint "4" as "v0"."vc0" ]
| | | ) [ "v0"."vc0" NOT NULL ]
| | ) [ "sys"."sql_max"(tinyint "1", tinyint "1") NOT NULL as "v20"."vc0" ]
| ) [ tinyint "7" > "v20"."vc0" NOT NULL ]
) [ tinyint "1" ]

statement ok
ROLLBACK

statement ok
START TRANSACTION

statement ok
CREATE TABLE "t2" ("c0" BINARY LARGE OBJECT,"c1" DECIMAL(18,3))

statement ok rowcount 3
INSERT INTO "t2" VALUES (BINARY LARGE OBJECT 'D4A0', 1.000),(NULL, 1.000),(BINARY LARGE OBJECT '', 1.000)

statement ok
create view v0(vc0) as (values (interval '0' month)) with check option

statement ok rowcount 3
UPDATE t2 SET c1 = 1 FROM v0 WHERE NOT ((NULLIF("netmask"('243.197.122.2'), "hostmask"('186.223.199.22'))) IS NULL)

statement ok
ROLLBACK

statement ok
CREATE TABLE "t1" ("c0" BINARY LARGE OBJECT,"c1" INTERVAL SECOND,"c2" CHARACTER LARGE OBJECT)

statement ok rowcount 8
COPY 8 RECORDS INTO "t1" FROM stdin USING DELIMITERS E'\t',E'\n','"'
<COPY_INTO_DATA>
10	532548976.000	"3#*"
NULL	NULL	"3)y_쁩4"
NULL	1856447053.000	NULL
NULL	479496423.000	NULL
NULL	1330303297.000	NULL
NULL	98123216.000	NULL
NULL	1010163365.000	NULL
5BCD	6.000	NULL

statement ok
START TRANSACTION

statement ok
CREATE TABLE "t2" ("c0" INTEGER,"c2" INET,CONSTRAINT "t2_c0_pkey" PRIMARY KEY ("c0"))

statement ok rowcount 7
COPY 7 RECORDS INTO "t2" FROM stdin USING DELIMITERS E'\t',E'\n','"'
<COPY_INTO_DATA>
-993571553	159.130.67.123
1321672995	NULL
0	247.170.21.12/1
1612467504	219.100.91.237
40	9.223.250.28
1070403840	133.137.205.71
861414840	NULL

statement ok
create view v4(vc0) as (values ("insert"(r'2', ((5)|(1571515754)), nullif(68, 0.681765350302749428834658829146064817905426025390625), r' ') not ilike
nullif(case (select interval '1807439388' month from t1 as tt1l4n0, t2 as tt2l4n1) when sql_sub(interval '16' month, interval '169164132' month) then
(select r'0.9840143051690606' from t1 as tt1l4n0 where false) when sql_sub(interval '2140361559' month, interval '1731030991' month) then least(r'yh', r'')
when sql_add(interval '323468641' month, interval '484732283' month) then cast(interval '340353783' second as string(241)) when sql_min(null, interval '351381849' month)
then "right"(r'0.6603113972580116', 1409573249) when abs(interval '41293241' month) then cast(1654332323 as string(452)) else nullif(r'', r'i') end, r'EI')))

statement error GDK reported error: BATsubcross: more than one match
UPDATE t1 SET c2 = 1 FROM v4 WHERE ((((((((INTERVAL '1' MONTH NOT IN ((SELECT INTERVAL '3' MONTH FROM v4)))AND(sys.md5(t1.c2) <> ANY(SELECT '1'))))
AND (CASE WHEN (r'1810575798') BETWEEN '1' AND ((SELECT r'' WHERE TRUE)) THEN false ELSE true END))))))

statement ok
ROLLBACK

query I rowsort
SELECT 1 FROM t1 WHERE 2 IN (3, (SELECT 4 FROM (select 1) as v0(c0))) AND '8' <> ANY(SELECT '1') AND ('2' > (SELECT '' WHERE TRUE)) IS NULL
----

statement ok
DROP TABLE t1

query T nosort
SELECT json."text"(JSON '""', '344567')
----
(empty)

query T nosort
select json.text(json '[1,2,3,4]', null)
----
NULL

query T nosort
select json.text(null, '23131')
----
NULL

query T nosort
select json.isvalid(json.tojsonarray(x)) from (values ('a"'),('"b'),('c"')) x(x)
----
True

statement ok
START TRANSACTION

statement ok
CREATE TABLE "t1" ("c0" TIME)

statement ok
COPY 15 RECORDS INTO "t1" FROM stdin USING DELIMITERS E'\t',E'\n','"'
<COPY_INTO_DATA>
01:00:00
01:00:00
23:00:02
01:00:00
01:00:00
01:00:00
01:00:00
23:00:00
01:00:00
01:00:00
01:00:00
01:00:00
01:00:00
01:00:00
00:00:00

statement ok
CREATE TABLE "t2" ("c1" TIME)

statement ok
COPY 140 RECORDS INTO "t2" FROM stdin USING DELIMITERS E'\t',E'\n','"'
<COPY_INTO_DATA>
00:59:53
01:00:00
01:00:00
01:00:00
NULL
01:00:04
01:00:04
01:00:00
01:00:00
01:00:00
01:00:00
01:00:00
01:00:00
01:00:00
01:00:00
01:00:00
01:00:00
01:00:00
01:00:00
01:00:00
00:59:55
01:00:00
01:00:00
01:00:00
01:00:00
01:00:00
01:00:00
01:00:00
01:00:00
01:00:00
01:00:00
01:00:00
01:00:00
01:00:00
01:00:00
01:00:00
01:00:00
01:00:00
01:00:00
01:00:00
01:00:08
01:00:00
01:00:00
01:00:00
01:00:00
01:00:00
00:59:56
01:00:00
01:00:00
01:00:00
NULL
01:00:00
01:00:00
02:00:00
01:00:00
01:00:00
01:00:00
01:00:01
NULL
01:00:00
01:00:00
01:00:00
01:00:00
01:00:00
01:00:00
01:00:00
01:00:00
01:00:00
01:00:00
01:00:00
01:00:00
01:00:00
01:00:00
01:00:09
01:00:00
01:00:00
01:00:00
01:00:00
01:00:00
01:00:00
01:00:00
01:00:00
01:00:00
23:00:02
01:00:00
01:00:00
01:00:00
01:00:00
01:00:00
01:00:00
01:00:00
01:00:00
01:00:00
01:00:00
01:00:00
01:00:00
01:00:00
01:00:00
01:00:00
01:00:00
01:00:00
01:00:00
01:00:00
01:00:00
01:00:00
01:00:00
03:00:00
01:00:00
01:00:00
01:00:00
01:00:00
01:00:00
01:00:00
01:00:00
01:00:00
01:00:00
01:00:00
01:00:00
01:00:00
01:00:00
01:00:00
01:00:00
01:00:00
01:00:00
01:00:00
01:00:00
01:00:00
01:00:00
01:00:00
01:00:00
01:00:00
01:00:00
23:00:00
01:00:00
01:00:00
01:00:00
01:00:00
01:00:00
01:00:00
01:00:00

query T rowsort
SELECT json.tojsonarray('<') FROM t1, t2 GROUP BY t1.c0
----
[ "<", "<", "<", "<", "<", "<", "<", "<", "<", "<", "<", "<", "<", "<", "<", "<", "<", "<", "<", "<", "<", "<", "<", "<", "<", "<", "<", "<", "<", "<", "<", "<", "<", "<", "<", "<", "<", "<", "<", "<", "<", "<", "<", "<", "<", "<", "<", "<", "<", "<", "<", "<", "<", "<", "<", "<", "<", "<", "<", "<", "<", "<", "<", "<", "<", "<", "<", "<", "<", "<", "<", "<", "<", "<", "<", "<", "<", "<", "<", "<", "<", "<", "<", "<", "<", "<", "<", "<", "<", "<", "<", "<", "<", "<", "<", "<", "<", "<", "<", "<", "<", "<", "<", "<", "<", "<", "<", "<", "<", "<", "<", "<", "<", "<", "<", "<", "<", "<", "<", "<", "<", "<", "<", "<", "<", "<", "<", "<", "<", "<", "<", "<", "<", "<", "<", "<", "<", "<", "<", "<" ]
[ "<", "<", "<", "<", "<", "<", "<", "<", "<", "<", "<", "<", "<", "<", "<", "<", "<", "<", "<", "<", "<", "<", "<", "<", "<", "<", "<", "<", "<", "<", "<", "<", "<", "<", "<", "<", "<", "<", "<", "<", "<", "<", "<", "<", "<", "<", "<", "<", "<", "<", "<", "<", "<", "<", "<", "<", "<", "<", "<", "<", "<", "<", "<", "<", "<", "<", "<", "<", "<", "<", "<", "<", "<", "<", "<", "<", "<", "<", "<", "<", "<", "<", "<", "<", "<", "<", "<", "<", "<", "<", "<", "<", "<", "<", "<", "<", "<", "<", "<", "<", "<", "<", "<", "<", "<", "<", "<", "<", "<", "<", "<", "<", "<", "<", "<", "<", "<", "<", "<", "<", "<", "<", "<", "<", "<", "<", "<", "<", "<", "<", "<", "<", "<", "<", "<", "<", "<", "<", "<", "<" ]
[ "<", "<", "<", "<", "<", "<", "<", "<", "<", "<", "<", "<", "<", "<", "<", "<", "<", "<", "<", "<", "<", "<", "<", "<", "<", "<", "<", "<", "<", "<", "<", "<", "<", "<", "<", "<", "<", "<", "<", "<", "<", "<", "<", "<", "<", "<", "<", "<", "<", "<", "<", "<", "<", "<", "<", "<", "<", "<", "<", "<", "<", "<", "<", "<", "<", "<", "<", "<", "<", "<", "<", "<", "<", "<", "<", "<", "<", "<", "<", "<", "<", "<", "<", "<", "<", "<", "<", "<", "<", "<", "<", "<", "<", "<", "<", "<", "<", "<", "<", "<", "<", "<", "<", "<", "<", "<", "<", "<", "<", "<", "<", "<", "<", "<", "<", "<", "<", "<", "<", "<", "<", "<", "<", "<", "<", "<", "<", "<", "<", "<", "<", "<", "<", "<", "<", "<", "<", "<", "<", "<" ]
[ "<", "<", "<", "<", "<", "<", "<", "<", "<", "<", "<", "<", "<", "<", "<", "<", "<", "<", "<", "<", "<", "<", "<", "<", "<", "<", "<", "<", "<", "<", "<", "<", "<", "<", "<", "<", "<", "<", "<", "<", "<", "<", "<", "<", "<", "<", "<", "<", "<", "<", "<", "<", "<", "<", "<", "<", "<", "<", "<", "<", "<", "<", "<", "<", "<", "<", "<", "<", "<", "<", "<", "<", "<", "<", "<", "<", "<", "<", "<", "<", "<", "<", "<", "<", "<", "<", "<", "<", "<", "<", "<", "<", "<", "<", "<", "<", "<", "<", "<", "<", "<", "<", "<", "<", "<", "<", "<", "<", "<", "<", "<", "<", "<", "<", "<", "<", "<", "<", "<", "<", "<", "<", "<", "<", "<", "<", "<", "<", "<", "<", "<", "<", "<", "<", "<", "<", "<", "<", "<", "<", "<", "<", "<", "<", "<", "<", "<", "<", "<", "<", "<", "<", "<", "<", "<", "<", "<", "<", "<", "<", "<", "<", "<", "<", "<", "<", "<", "<", "<", "<", "<", "<", "<", "<", "<", "<", "<", "<", "<", "<", "<", "<", "<", "<", "<", "<", "<", "<", "<", "<", "<", "<", "<", "<", "<", "<", "<", "<", "<", "<", "<", "<", "<", "<", "<", "<", "<", "<", "<", "<", "<", "<", "<", "<", "<", "<", "<", "<", "<", "<", "<", "<", "<", "<", "<", "<", "<", "<", "<", "<", "<", "<", "<", "<", "<", "<", "<", "<", "<", "<", "<", "<", "<", "<", "<", "<", "<", "<", "<", "<", "<", "<", "<", "<", "<", "<", "<", "<", "<", "<", "<", "<", "<", "<", "<", "<", "<", "<", "<", "<", "<", "<", "<", "<", "<", "<", "<", "<", "<", "<", "<", "<", "<", "<", "<", "<", "<", "<", "<", "<", "<", "<", "<", "<", "<", "<", "<", "<", "<", "<", "<", "<", "<", "<", "<", "<", "<", "<", "<", "<", "<", "<", "<", "<", "<", "<", "<", "<", "<", "<", "<", "<", "<", "<", "<", "<", "<", "<", "<", "<", "<", "<", "<", "<", "<", "<", "<", "<", "<", "<", "<", "<", "<", "<", "<", "<", "<", "<", "<", "<", "<", "<", "<", "<", "<", "<", "<", "<", "<", "<", "<", "<", "<", "<", "<", "<", "<", "<", "<", "<", "<", "<", "<", "<", "<", "<", "<", "<", "<", "<", "<", "<", "<", "<", "<", "<", "<", "<", "<", "<", "<", "<", "<", "<", "<", "<", "<", "<", "<", "<", "<", "<", "<", "<", "<", "<", "<", "<", "<", "<", "<", "<", "<", "<", "<", "<", "<", "<", "<", "<", "<", "<", "<", "<", "<", "<", "<", "<", "<", "<", "<", "<", "<", "<", "<", "<", "<", "<", "<", "<", "<", "<", "<", "<", "<", "<", "<", "<", "<", "<", "<", "<", "<", "<", "<", "<", "<", "<", "<", "<", "<", "<", "<", "<", "<", "<", "<", "<", "<", "<", "<", "<", "<", "<", "<", "<", "<", "<", "<", "<", "<", "<", "<", "<", "<", "<", "<", "<", "<", "<", "<", "<", "<", "<", "<", "<", "<", "<", "<", "<", "<", "<", "<", "<", "<", "<", "<", "<", "<", "<", "<", "<", "<", "<", "<", "<", "<", "<", "<", "<", "<", "<", "<", "<", "<", "<", "<", "<", "<", "<", "<", "<", "<", "<", "<", "<", "<", "<", "<", "<", "<", "<", "<", "<", "<", "<", "<", "<", "<", "<", "<", "<", "<", "<", "<", "<", "<", "<", "<", "<", "<", "<", "<", "<", "<", "<", "<", "<", "<", "<", "<", "<", "<", "<", "<", "<", "<", "<", "<", "<", "<", "<", "<", "<", "<", "<", "<", "<", "<", "<", "<", "<", "<", "<", "<", "<", "<", "<", "<", "<", "<", "<", "<", "<", "<", "<", "<", "<", "<", "<", "<", "<", "<", "<", "<", "<", "<", "<", "<", "<", "<", "<", "<", "<", "<", "<", "<", "<", "<", "<", "<", "<", "<", "<", "<", "<", "<", "<", "<", "<", "<", "<", "<", "<", "<", "<", "<", "<", "<", "<", "<", "<", "<", "<", "<", "<", "<", "<", "<", "<", "<", "<", "<", "<", "<", "<", "<", "<", "<", "<", "<", "<", "<", "<", "<", "<", "<", "<", "<", "<", "<", "<", "<", "<", "<", "<", "<", "<", "<", "<", "<", "<", "<", "<", "<", "<", "<", "<", "<", "<", "<", "<", "<", "<", "<", "<", "<", "<", "<", "<", "<", "<", "<", "<", "<", "<", "<", "<", "<", "<", "<", "<", "<", "<", "<", "<", "<", "<", "<", "<", "<", "<", "<", "<", "<", "<", "<", "<", "<", "<", "<", "<", "<", "<", "<", "<", "<", "<", "<", "<", "<", "<", "<", "<", "<", "<", "<", "<", "<", "<", "<", "<", "<", "<", "<", "<", "<", "<", "<", "<", "<", "<", "<", "<", "<", "<", "<", "<", "<", "<", "<", "<", "<", "<", "<", "<", "<", "<", "<", "<", "<", "<", "<", "<", "<", "<", "<", "<", "<", "<", "<", "<", "<", "<", "<", "<", "<", "<", "<", "<", "<", "<", "<", "<", "<", "<", "<", "<", "<", "<", "<", "<", "<", "<", "<", "<", "<", "<", "<", "<", "<", "<", "<", "<", "<", "<", "<", "<", "<", "<", "<", "<", "<", "<", "<", "<", "<", "<", "<", "<", "<", "<", "<", "<", "<", "<", "<", "<", "<", "<", "<", "<", "<", "<", "<", "<", "<", "<", "<", "<", "<", "<", "<", "<", "<", "<", "<", "<", "<", "<", "<", "<", "<", "<", "<", "<", "<", "<", "<", "<", "<", "<", "<", "<", "<", "<", "<", "<", "<", "<", "<", "<", "<", "<", "<", "<", "<", "<", "<", "<", "<", "<", "<", "<", "<", "<", "<", "<", "<", "<", "<", "<", "<", "<", "<", "<", "<", "<", "<", "<", "<", "<", "<", "<", "<", "<", "<", "<", "<", "<", "<", "<", "<", "<", "<", "<", "<", "<", "<", "<", "<", "<", "<", "<", "<", "<", "<", "<", "<", "<", "<", "<", "<", "<", "<", "<", "<", "<", "<", "<", "<", "<", "<", "<", "<", "<", "<", "<", "<", "<", "<", "<", "<", "<", "<", "<", "<", "<", "<", "<", "<", "<", "<", "<", "<", "<", "<", "<", "<", "<", "<", "<", "<", "<", "<", "<", "<", "<", "<", "<", "<", "<", "<", "<", "<", "<", "<", "<", "<", "<", "<", "<", "<", "<", "<", "<", "<", "<", "<", "<", "<", "<", "<", "<", "<", "<", "<", "<", "<", "<", "<", "<", "<", "<", "<", "<", "<", "<", "<", "<", "<", "<", "<", "<", "<", "<", "<", "<", "<", "<", "<", "<", "<", "<", "<", "<", "<", "<", "<", "<", "<", "<", "<", "<", "<", "<", "<", "<", "<", "<", "<", "<", "<", "<", "<", "<", "<", "<", "<", "<", "<", "<", "<", "<", "<", "<", "<", "<", "<", "<", "<", "<", "<", "<", "<", "<", "<", "<", "<", "<", "<", "<", "<", "<", "<", "<", "<", "<", "<", "<", "<", "<", "<", "<", "<", "<", "<", "<", "<", "<", "<", "<", "<", "<", "<", "<", "<", "<", "<", "<", "<", "<", "<", "<", "<", "<", "<", "<", "<", "<", "<", "<", "<", "<", "<", "<", "<", "<", "<", "<", "<", "<", "<", "<", "<", "<", "<", "<", "<", "<", "<", "<", "<", "<", "<", "<", "<", "<", "<", "<", "<", "<", "<", "<", "<", "<", "<", "<", "<", "<", "<", "<", "<", "<", "<", "<", "<", "<", "<", "<", "<", "<", "<", "<", "<", "<", "<", "<", "<", "<", "<", "<", "<", "<", "<", "<", "<", "<", "<", "<", "<", "<", "<", "<", "<", "<", "<", "<", "<", "<", "<", "<", "<", "<", "<", "<", "<", "<", "<", "<", "<", "<", "<", "<", "<", "<", "<", "<", "<", "<", "<", "<", "<", "<", "<", "<", "<", "<", "<", "<", "<", "<", "<", "<", "<", "<", "<", "<", "<", "<", "<", "<", "<", "<", "<", "<", "<", "<", "<", "<", "<", "<", "<", "<", "<", "<", "<", "<", "<", "<", "<", "<", "<", "<", "<", "<", "<", "<", "<", "<", "<", "<", "<", "<", "<", "<", "<", "<", "<", "<", "<", "<", "<", "<", "<", "<", "<", "<", "<", "<", "<", "<", "<", "<", "<", "<", "<", "<", "<", "<", "<", "<", "<", "<", "<", "<", "<", "<", "<", "<", "<", "<", "<", "<", "<", "<", "<", "<", "<", "<", "<", "<", "<", "<", "<", "<", "<", "<", "<", "<", "<", "<", "<", "<", "<", "<", "<", "<", "<", "<", "<", "<", "<", "<", "<", "<", "<", "<", "<", "<", "<", "<", "<", "<", "<", "<", "<", "<", "<", "<", "<", "<", "<", "<", "<", "<", "<", "<", "<", "<", "<", "<", "<", "<", "<", "<", "<", "<", "<", "<", "<", "<", "<", "<", "<", "<", "<", "<", "<", "<", "<", "<", "<", "<", "<", "<", "<", "<", "<", "<", "<", "<", "<", "<", "<", "<", "<", "<", "<", "<", "<", "<", "<", "<", "<", "<", "<", "<", "<", "<", "<", "<", "<", "<", "<", "<", "<", "<", "<", "<", "<", "<", "<", "<", "<", "<", "<", "<", "<", "<", "<", "<", "<", "<", "<", "<", "<", "<", "<", "<", "<", "<", "<", "<", "<", "<", "<", "<", "<", "<", "<", "<", "<", "<", "<", "<", "<", "<", "<", "<", "<", "<", "<", "<", "<", "<", "<", "<", "<", "<", "<", "<", "<", "<", "<", "<", "<", "<", "<", "<", "<", "<", "<", "<", "<", "<", "<", "<", "<", "<", "<", "<", "<", "<", "<", "<", "<", "<", "<", "<", "<", "<", "<", "<", "<", "<", "<", "<", "<", "<", "<", "<", "<", "<", "<", "<", "<", "<", "<", "<", "<", "<", "<", "<", "<", "<", "<", "<", "<", "<", "<", "<", "<", "<", "<", "<", "<", "<", "<", "<", "<", "<", "<", "<", "<", "<", "<", "<", "<", "<", "<", "<", "<", "<", "<", "<", "<", "<", "<", "<", "<", "<", "<", "<", "<", "<", "<", "<", "<", "<", "<", "<", "<", "<", "<", "<", "<", "<", "<", "<", "<", "<", "<", "<", "<", "<", "<", "<", "<", "<", "<", "<", "<", "<", "<", "<", "<", "<", "<", "<", "<", "<", "<", "<", "<", "<", "<", "<", "<", "<", "<", "<", "<", "<", "<", "<", "<", "<", "<", "<", "<", "<", "<", "<", "<", "<", "<", "<", "<", "<", "<", "<", "<", "<", "<", "<", "<", "<", "<", "<" ]

statement ok
create or replace view v30(vc0) as (select null)

query T nosort
select json."isvalid"(CAST(v30.vc0 AS JSON)) FROM v30
----
True

statement ok
ROLLBACK

