statement ok
START TRANSACTION

statement ok
CREATE SCHEMA "schema1"

statement ok
CREATE TABLE "schema1"."table1" ("col1" CHAR(32))

statement ok
INSERT INTO "schema1"."table1" VALUES (NULL)

query T rowsort
SELECT * FROM "schema1"."table1"
----
NULL

statement ok
ALTER TABLE "schema1"."table1" ADD "col2" varchar(40)

statement ok
ALTER TABLE "schema1"."table1" ADD "col3" varchar(40)

statement ok
ALTER TABLE "schema1"."table1" ADD "col4" varchar(40)

statement ok
ALTER TABLE "schema1"."table1" ADD "col5" varchar(40)

statement ok
ALTER TABLE "schema1"."table1" DROP "col2"

statement ok
ALTER TABLE "schema1"."table1" DROP "col3"

statement ok
ALTER TABLE "schema1"."table1" ADD "col2" varchar(40)

statement ok
ALTER TABLE "schema1"."table1" ADD "col3" varchar(40)

query TTTTT rowsort
SELECT * FROM "schema1"."table1"
----
NULL
NULL
NULL
NULL
NULL

query ITTI rowsort
SELECT Columns."number", Columns."name", Columns."type", Columns.type_scale FROM sys.columns as Columns
WHERE Columns.table_id = (SELECT Tables."id" FROM sys.tables as Tables
                          WHERE Tables.schema_id = (SELECT "schema"."id" FROM sys.schemas as "schema" WHERE "schema"."name" = 'schema1') AND Tables."name" = 'table1')
ORDER BY Columns."number"
----
0
col1
char
0
1
col4
varchar
0
2
col5
varchar
0
3
col2
varchar
0
4
col3
varchar
0

query TTTTT rowsort
SELECT * FROM "schema1"."table1"
----
NULL
NULL
NULL
NULL
NULL

statement ok
create table "schema1"."table2" (
 "col1" varchar(32),
 "col2" varchar(32),
 "col3" varchar(32),
 "col4" varchar(32),
 "col5" date,
 "col6" char(32),
 "col7" varchar(32),
 "col8" varchar(32),
 "col9" timestamp,
 "col10" varchar(32),
 "col11" varchar(32),
 "col12" timestamp,
 "col13" bigint,
 "col14" timestamp,
 "col15" date,
 "col16" timestamp)

statement ok
insert into "schema1"."table2" values ('1','1','1','1',date '1990-10-01','1','1','1',timestamp '2008-03-01 00:00','1','9',timestamp '2011-04-04 04:04',1,timestamp '2014-07-07 07:07',date '1966-12-31',timestamp '2017-10-10 10:10'),
                                      ('1','1','1','1',date '1890-02-20','1','1','1',timestamp '2009-04-02 01:01','4','4',timestamp '2012-05-05 05:05',2,timestamp '2015-08-08 08:08',date '1978-12-21',timestamp '2018-11-11 11:11'),
                                      ('1','1','1','1',date '1790-03-30','1','1','1',timestamp '2010-05-03 02:02','8','7',timestamp '2013-06-06 06:06',3,timestamp '2016-09-09 09:09',date '1987-12-11',timestamp '2019-12-12 00:00')

query ITTI rowsort
select columns."number", columns."name", columns."type", columns.type_scale from sys."columns" as columns
where columns.table_id = (select tables."id" from sys."tables" as tables
                          where tables.schema_id = (select "schema"."id" from sys."schemas" as "schema" where "schema"."name" = 'schema1') and tables."name" = 'table2') order by columns."number"
----
0
col1
varchar
0
1
col2
varchar
0
10
col11
varchar
0
11
col12
timestamp
0
12
col13
bigint
0
13
col14
timestamp
0
14
col15
date
0
15
col16
timestamp
0
2
col3
varchar
0
3
col4
varchar
0
4
col5
date
0
5
col6
char
0
6
col7
varchar
0
7
col8
varchar
0
8
col9
timestamp
0
9
col10
varchar
0

statement ok
ALTER TABLE "schema1"."table2" ADD COLUMN "col17" varchar(42)

statement ok
UPDATE "schema1"."table2" SET "col17" = CONVERT("col5", varchar(42))

statement ok
ALTER TABLE "schema1"."table2" DROP COLUMN "col5" CASCADE

statement ok
ALTER TABLE "schema1"."table2" RENAME COLUMN "col17" TO "col5"

statement ok
ALTER TABLE "schema1"."table2" ADD "col18" varchar(42)

query ITTI rowsort
select columns."number", columns."name", columns."type", columns.type_scale from sys."columns" as columns
where columns.table_id = (select tables."id" from sys."tables" as tables
                          where tables.schema_id = (select "schema"."id" from sys."schemas" as "schema" where "schema"."name" = 'schema1') and tables."name" = 'table2') order by columns."number"
----
0
col1
varchar
0
1
col2
varchar
0
10
col12
timestamp
0
11
col13
bigint
0
12
col14
timestamp
0
13
col15
date
0
14
col16
timestamp
0
15
col5
varchar
0
16
col18
varchar
0
2
col3
varchar
0
3
col4
varchar
0
4
col6
char
0
5
col7
varchar
0
6
col8
varchar
0
7
col9
timestamp
0
8
col10
varchar
0
9
col11
varchar
0

statement ok
ROLLBACK

statement ok
CREATE SCHEMA "schema1"

statement ok
create table "schema1"."table2" (
 "col1" varchar(32),
 "col2" varchar(32),
 "col3" varchar(32),
 "col4" varchar(32),
 "col5" date,
 "col6" char(32),
 "col7" varchar(32),
 "col8" varchar(32),
 "col9" timestamp,
 "col10" varchar(32),
 "col11" varchar(32),
 "col12" timestamp,
 "col13" bigint,
 "col14" timestamp,
 "col15" date,
 "col16" timestamp)

statement ok
insert into "schema1"."table2" values ('1','1','1','1',date '1990-10-01','1','1','1',timestamp '2008-03-01 00:00','1','9',timestamp '2011-04-04 04:04',1,timestamp '2014-07-07 07:07',date '1966-12-31',timestamp '2017-10-10 10:10'),
                                      ('1','1','1','1',date '1890-02-20','1','1','1',timestamp '2009-04-02 01:01','4','4',timestamp '2012-05-05 05:05',2,timestamp '2015-08-08 08:08',date '1978-12-21',timestamp '2018-11-11 11:11'),
                                      ('1','1','1','1',date '1790-03-30','1','1','1',timestamp '2010-05-03 02:02','8','7',timestamp '2013-06-06 06:06',3,timestamp '2016-09-09 09:09',date '1987-12-11',timestamp '2019-12-12 00:00')

query ITTI rowsort
select columns."number", columns."name", columns."type", columns.type_scale from sys."columns" as columns
where columns.table_id = (select tables."id" from sys."tables" as tables
                          where tables.schema_id = (select "schema"."id" from sys."schemas" as "schema" where "schema"."name" = 'schema1') and tables."name" = 'table2') order by columns."number"
----
0
col1
varchar
0
1
col2
varchar
0
10
col11
varchar
0
11
col12
timestamp
0
12
col13
bigint
0
13
col14
timestamp
0
14
col15
date
0
15
col16
timestamp
0
2
col3
varchar
0
3
col4
varchar
0
4
col5
date
0
5
col6
char
0
6
col7
varchar
0
7
col8
varchar
0
8
col9
timestamp
0
9
col10
varchar
0

statement ok
ALTER TABLE "schema1"."table2" ADD COLUMN "col17" varchar(42)

statement ok
UPDATE "schema1"."table2" SET "col17" = CONVERT("col5", varchar(42))

statement ok
ALTER TABLE "schema1"."table2" DROP COLUMN "col5" CASCADE

statement ok
ALTER TABLE "schema1"."table2" RENAME COLUMN "col17" TO "col5"

statement ok
ALTER TABLE "schema1"."table2" ADD "col18" varchar(42)

query ITTI rowsort
select columns."number", columns."name", columns."type", columns.type_scale from sys."columns" as columns
where columns.table_id = (select tables."id" from sys."tables" as tables
                          where tables.schema_id = (select "schema"."id" from sys."schemas" as "schema" where "schema"."name" = 'schema1') and tables."name" = 'table2') order by columns."number"
----
0
col1
varchar
0
1
col2
varchar
0
10
col12
timestamp
0
11
col13
bigint
0
12
col14
timestamp
0
13
col15
date
0
14
col16
timestamp
0
15
col5
varchar
0
16
col18
varchar
0
2
col3
varchar
0
3
col4
varchar
0
4
col6
char
0
5
col7
varchar
0
6
col8
varchar
0
7
col9
timestamp
0
8
col10
varchar
0
9
col11
varchar
0

statement ok
DROP SCHEMA "schema1" CASCADE

