statement ok
create table updateme (a int, b int)

statement ok
create table other (a int, b int)

statement ok
insert into updateme values (1,1), (2,2), (3,3)

statement ok
update updateme as other set a=3 where b=2

statement ok
update updateme as other set a=2 where other.b=3

statement error
update updateme as other set a=3 where updateme.b=2

statement error
update updateme as other set a=4 from other where other.a=1

query II rowsort
select a, b from updateme
----
1
1
2
3
3
2

statement ok
delete from updateme as other where other.a=3

statement error
delete from updateme where other.b=2

statement error
delete from updateme as other where updateme.b=2

query II rowsort
select a, b from updateme
----
1
1
2
3

statement ok
drop table updateme

statement ok
drop table other

