statement ok
CREATE MERGE TABLE testme (a int, b varchar(32)) PARTITION BY RANGE ON (a)

statement ok
CREATE TABLE subtable1 (a int, b varchar(32))

statement ok
CREATE TABLE subtable2 (a int, b varchar(32))

statement ok
INSERT INTO subtable1 VALUES (1, 'one'), (2, 'two'), (3, 'three')

statement ok
INSERT INTO subtable2 VALUES (11, 'eleven'), (12, 'twelve'), (13, 'thirteen')

statement ok
ALTER TABLE testme ADD TABLE subtable1 AS PARTITION FROM 1 TO 10

statement ok
ALTER TABLE testme ADD TABLE subtable2 AS PARTITION FROM 11 TO 20

query IT rowsort
SELECT a, b FROM testme
----
1
one
11
eleven
12
twelve
13
thirteen
2
two
3
three

query IT rowsort
SELECT a, b FROM subtable1
----
1
one
2
two
3
three

query IT rowsort
SELECT a, b FROM subtable2
----
11
eleven
12
twelve
13
thirteen

statement ok
DELETE FROM testme

query IT rowsort
SELECT a, b FROM testme
----

query IT rowsort
SELECT a, b FROM subtable1
----

query IT rowsort
SELECT a, b FROM subtable2
----

statement ok
INSERT INTO subtable1 VALUES (1, 'one'), (5, 'five'), (9, 'fifteen')

statement ok
INSERT INTO subtable2 VALUES (11, 'eleven'), (12, 'twelve'), (13, 'thirteen')

statement ok
DELETE FROM testme where a > 5

query IT rowsort
SELECT a, b FROM testme
----
1
one
5
five

query IT rowsort
SELECT a, b FROM subtable1
----
1
one
5
five

query IT rowsort
SELECT a, b FROM subtable2
----

statement ok
INSERT INTO subtable1 VALUES (6, 'six')

statement ok
TRUNCATE testme

query IT rowsort
SELECT a, b FROM testme
----

query IT rowsort
SELECT a, b FROM subtable1
----

query IT rowsort
SELECT a, b FROM subtable2
----

statement ok
ALTER TABLE testme DROP TABLE subtable1

statement ok
INSERT INTO subtable1 VALUES (1, 'one'), (2, 'two'), (3, 'three')

statement ok
INSERT INTO subtable2 VALUES (11, 'eleven'), (12, 'twelve'), (13, 'thirteen')

statement ok
TRUNCATE testme

query IT rowsort
SELECT a, b FROM testme
----

query IT rowsort
SELECT a, b FROM subtable1
----
1
one
2
two
3
three

query IT rowsort
SELECT a, b FROM subtable2
----

statement ok
ALTER TABLE testme DROP TABLE subtable2

statement ok
DROP TABLE testme

statement ok
DROP TABLE subtable1

statement ok
DROP TABLE subtable2

