statement ok
CREATE MERGE TABLE table1 (b varchar(32)) PARTITION BY RANGE ON (b)

statement ok
CREATE MERGE TABLE table2 (b varchar(32)) PARTITION BY VALUES ON (b)

statement ok
CREATE TABLE another (b varchar(32))

statement error
ALTER TABLE table1 ADD TABLE another

statement error
ALTER TABLE table2 ADD TABLE another

statement ok
DROP TABLE another

statement ok
DROP TABLE table1

statement ok
DROP TABLE table2

statement ok
CREATE MERGE TABLE table1 (a int) PARTITION BY RANGE ON (a)

statement ok
CREATE TABLE another1 (a int)

statement ok
CREATE TABLE another2 (a int)

statement ok
CREATE TABLE another3 (a int)

statement ok
CREATE TABLE another4 (a int)

statement ok
CREATE TABLE another5 (a int)

statement ok
ALTER TABLE table1 ADD TABLE another1 AS PARTITION FROM RANGE MINVALUE TO RANGE MAXVALUE WITH NULL VALUES

statement ok rowcount 2
INSERT INTO table1 VALUES (1), (NULL)

statement ok rowcount 2
INSERT INTO another1 VALUES (2), (NULL)

query I rowsort
SELECT a FROM table1
----
1
2
NULL
NULL

query I rowsort
SELECT a FROM another1
----
1
2
NULL
NULL

statement error
ALTER TABLE table1 ADD TABLE another2 AS PARTITION FROM RANGE MINVALUE TO RANGE MAXVALUE

statement error
ALTER TABLE table1 ADD TABLE another2 AS PARTITION FROM RANGE MINVALUE TO RANGE MAXVALUE WITH NULL VALUES

statement error
ALTER TABLE table1 ADD TABLE another2 AS PARTITION FROM 1 TO 2

statement error
ALTER TABLE table1 ADD TABLE another2 AS PARTITION FOR NULL VALUES

statement error
ALTER TABLE table1 SET TABLE another1 AS PARTITION FROM 1 TO 2

statement ok
ALTER TABLE table1 SET TABLE another1 AS PARTITION FROM 1 TO 3 WITH NULL VALUES

statement error
ALTER TABLE table1 ADD TABLE another2 AS PARTITION FROM 3 TO 4 WITH NULL VALUES

statement ok
ALTER TABLE table1 ADD TABLE another2 AS PARTITION FROM 3 TO 4

statement ok
ALTER TABLE table1 DROP TABLE another1

statement ok
ALTER TABLE table1 DROP TABLE another2

statement ok rowcount 2
DELETE FROM another1 WHERE a IS NULL

statement ok
ALTER TABLE table1 ADD TABLE another1 AS PARTITION FROM RANGE MINVALUE TO RANGE MAXVALUE

statement error
ALTER TABLE table1 ADD TABLE another2 AS PARTITION FROM 1 TO 2

statement error
ALTER TABLE table1 ADD TABLE another2 AS PARTITION FROM RANGE MINVALUE TO -1

statement error
ALTER TABLE table1 ADD TABLE another2 AS PARTITION FROM 10 TO RANGE MAXVALUE

statement ok
ALTER TABLE table1 ADD TABLE another2 AS PARTITION FOR NULL VALUES

statement ok
TRUNCATE table1

statement ok rowcount 2
INSERT INTO table1 VALUES (2), (NULL)

statement ok rowcount 1
INSERT INTO another1 VALUES (3)

statement error
INSERT INTO another1 VALUES (NULL)

statement error
INSERT INTO another2 VALUES (2)

statement ok rowcount 1
INSERT INTO another2 VALUES (NULL)

query I rowsort
SELECT a FROM table1
----
2
3
NULL
NULL

query I rowsort
SELECT a FROM another1
----
2
3

query I rowsort
SELECT a FROM another2
----
NULL
NULL

statement ok
ALTER TABLE table1 DROP TABLE another1

statement ok
ALTER TABLE table1 DROP TABLE another2

statement ok
ALTER TABLE table1 ADD TABLE another1 AS PARTITION FROM RANGE MINVALUE TO 10

statement ok
ALTER TABLE table1 ADD TABLE another2 AS PARTITION FOR NULL VALUES

query I rowsort
SELECT a FROM table1
----
2
3
NULL
NULL

query I rowsort
SELECT a FROM another1
----
2
3

query I rowsort
SELECT a FROM another2
----
NULL
NULL

statement ok
ALTER TABLE table1 DROP TABLE another1

statement ok
ALTER TABLE table1 DROP TABLE another2

statement ok
ALTER TABLE table1 ADD TABLE another1 AS PARTITION FROM RANGE MINVALUE TO 10 WITH NULL VALUES

statement error
ALTER TABLE table1 ADD TABLE another2 AS PARTITION FROM 0 to 5

query I rowsort
SELECT a FROM table1
----
2
3

query I rowsort
SELECT a FROM another1
----
2
3

query I rowsort
SELECT a FROM another2
----
NULL
NULL

statement ok
ALTER TABLE table1 DROP TABLE another1

statement error
ALTER TABLE table1 DROP TABLE another2

statement ok
ALTER TABLE table1 ADD TABLE another1 AS PARTITION FROM RANGE MINVALUE TO RANGE MAXVALUE

statement error
ALTER TABLE table1 ADD TABLE another2 AS PARTITION FROM 0 to 5

statement error
ALTER TABLE table1 ADD TABLE another2 AS PARTITION FROM RANGE MINVALUE to 2

statement error
ALTER TABLE table1 ADD TABLE another2 AS PARTITION FROM 2 to RANGE MAXVALUE

query I rowsort
SELECT a FROM table1
----
2
3

query I rowsort
SELECT a FROM another1
----
2
3

query I rowsort
SELECT a FROM another2
----
NULL
NULL

statement ok
ALTER TABLE table1 DROP TABLE another1

statement error
ALTER TABLE table1 DROP TABLE another2

statement ok
TRUNCATE another1

statement ok
TRUNCATE another2

statement ok
ALTER TABLE table1 ADD TABLE another1 AS PARTITION FROM RANGE MINVALUE TO 2

statement error
ALTER TABLE table1 ADD TABLE another2 AS PARTITION FROM RANGE MINVALUE TO 1

statement error
ALTER TABLE table1 ADD TABLE another2 AS PARTITION FROM 0 TO 1

statement ok
ALTER TABLE table1 DROP TABLE another1

statement error
ALTER TABLE table1 DROP TABLE another2

statement ok
ALTER TABLE table1 ADD TABLE another1 AS PARTITION FROM 2 TO RANGE MAXVALUE

statement error
ALTER TABLE table1 ADD TABLE another2 AS PARTITION FROM 10 TO RANGE MAXVALUE

statement error
ALTER TABLE table1 ADD TABLE another2 AS PARTITION FROM 1 TO 3

statement ok
ALTER TABLE table1 DROP TABLE another1

statement error
ALTER TABLE table1 DROP TABLE another2

statement ok
ALTER TABLE table1 ADD TABLE another1 AS PARTITION FROM RANGE MINVALUE TO 0

statement ok
ALTER TABLE table1 ADD TABLE another2 AS PARTITION FROM 10 TO RANGE MAXVALUE

statement ok
ALTER TABLE table1 ADD TABLE another3 AS PARTITION FROM 0 TO 10

statement ok
ALTER TABLE table1 ADD TABLE another4 AS PARTITION FOR NULL VALUES

statement error
ALTER TABLE table1 ADD TABLE another5 AS PARTITION FROM -100 TO -1

statement error
ALTER TABLE table1 ADD TABLE another5 AS PARTITION FROM RANGE MINVALUE TO -1

statement error
ALTER TABLE table1 ADD TABLE another5 AS PARTITION FROM RANGE MINVALUE TO 0

statement error
ALTER TABLE table1 ADD TABLE another5 AS PARTITION FROM RANGE MINVALUE TO RANGE MAXVALUE

statement error
ALTER TABLE table1 ADD TABLE another5 AS PARTITION FROM 0 TO 0

statement error
ALTER TABLE table1 ADD TABLE another5 AS PARTITION FROM 10 TO 10

statement error
ALTER TABLE table1 ADD TABLE another5 AS PARTITION FROM 10 TO 11

statement error
ALTER TABLE table1 ADD TABLE another5 AS PARTITION FROM 10 TO RANGE MAXVALUE

statement error
ALTER TABLE table1 ADD TABLE another5 AS PARTITION FROM 20 TO RANGE MAXVALUE

statement error
ALTER TABLE table1 ADD TABLE another5 AS PARTITION FROM 9 TO 10

statement error
ALTER TABLE table1 ADD TABLE another5 AS PARTITION FROM 9 TO 10 WITH NULL VALUES

statement error
ALTER TABLE table1 ADD TABLE another5 AS PARTITION FOR NULL VALUES

statement ok
ALTER TABLE table1 DROP TABLE another1

statement ok
ALTER TABLE table1 DROP TABLE another2

statement ok
ALTER TABLE table1 DROP TABLE another3

statement ok
ALTER TABLE table1 DROP TABLE another4

statement error
ALTER TABLE table1 DROP TABLE another5

statement ok
DROP TABLE another1

statement ok
DROP TABLE another2

statement ok
DROP TABLE another3

statement ok
DROP TABLE another4

statement ok
DROP TABLE another5

statement ok
DROP TABLE table1

