statement ok
CREATE FUNCTION multiplybytwo(a int) RETURNS INT BEGIN RETURN a * 2; END

statement ok
CREATE MERGE TABLE tryupdateme (a int, b varchar(32)) PARTITION BY VALUES USING (multiplybytwo(a) + 5)

statement ok
CREATE TABLE subtable1 (a int, b varchar(32))

statement ok
CREATE TABLE subtable2 (a int, b varchar(32))

statement ok
ALTER TABLE tryupdateme ADD TABLE subtable1 AS PARTITION IN (15, 25, 35)

statement ok
ALTER TABLE tryupdateme ADD TABLE subtable2 AS PARTITION IN (45, 55, 65)

statement ok rowcount 4
INSERT INTO tryupdateme VALUES (5, 'first'), (10, 'first'), (20, 'second'), (25, 'second')

query IT rowsort
SELECT a, b FROM tryupdateme
----
10
first
20
second
25
second
5
first

query IT rowsort
SELECT a, b FROM subtable1
----
10
first
5
first

query IT rowsort
SELECT a, b FROM subtable2
----
20
second
25
second

statement error
UPDATE tryupdateme SET a = 5 WHERE a % 5 = 0

statement error
UPDATE subtable1 SET a = 5 WHERE a % 5 = 0

query IT rowsort
SELECT a, b FROM tryupdateme
----
10
first
20
second
25
second
5
first

query IT rowsort
SELECT a, b FROM subtable1
----
10
first
5
first

query IT rowsort
SELECT a, b FROM subtable2
----
20
second
25
second

statement ok rowcount 4
UPDATE tryupdateme SET b = 'updated' WHERE a % 5 = 0

statement ok rowcount 2
UPDATE subtable2 SET b = 'something' || b || 'else' WHERE a % 5 = 0

query IT rowsort
SELECT a, b FROM tryupdateme
----
10
updated
20
somethingupdatedelse
25
somethingupdatedelse
5
updated

query IT rowsort
SELECT a, b FROM subtable1
----
10
updated
5
updated

query IT rowsort
SELECT a, b FROM subtable2
----
20
somethingupdatedelse
25
somethingupdatedelse

statement ok
ALTER TABLE tryupdateme DROP TABLE subtable1

statement ok
ALTER TABLE tryupdateme DROP TABLE subtable2

statement ok
DROP TABLE subtable1

statement ok
DROP TABLE subtable2

statement ok
DROP TABLE tryupdateme

statement ok
DROP FUNCTION multiplybytwo

