statement ok
create table t1 (id int, name varchar(1024), PRIMARY KEY(id))

statement ok
create table t2 (id int DEFAULT 7, age int, PRIMARY KEY (ID), FOREIGN KEY(id) REFERENCES t1(id) ON DELETE SET DEFAULT)

statement ok
create table t3 (id int DEFAULT 5, num int, FOREIGN KEY(id) REFERENCES t2(id) ON DELETE SET DEFAULT)

statement ok
insert into t1 values(1, 'monetdb'), (2, 'mon'), (3, 'monb'), (4, 'motdb'), (5, 'mob'), (6, 'moetdb'), (7, 'mo')

statement ok
insert into t2 values(1, 23), (2, 24), (3, 25), (4, 26), (5, 27)

statement ok
insert into t3 values(3, 5), (3, 5), (4, 6), (5, 7)

statement error
delete from t1 where id > 2 and id < 5

query IT rowsort
select * from t1 order by id;
----
1
monetdb
2
mon
3
monb
4
motdb
5
mob
6
moetdb
7
mo

query II rowsort
select * from t2 order by id;
----
1
23
2
24
3
25
4
26
5
27

query II rowsort
select * from t3 order by id, num
----
3
5
3
5
4
6
5
7

statement ok
delete from t1 where id = 1

query IT rowsort
select * from t1 order by id
----
2
mon
3
monb
4
motdb
5
mob
6
moetdb
7
mo

query II rowsort
select * from t2 order by id
----
2
24
3
25
4
26
5
27
7
23

query II rowsort
select * from t3 order by id, num
----
3
5
3
5
4
6
5
7

statement ok
delete from t2 where id = 3

query IT rowsort
select * from t1 order by id
----
2
mon
3
monb
4
motdb
5
mob
6
moetdb
7
mo

query II rowsort
select * from t2 order by id
----
2
24
4
26
5
27
7
23

query II rowsort
select * from t3 order by id, num
----
4
6
5
5
5
5
5
7

statement ok
drop table t3

statement ok
drop table t2

statement ok
drop table t1

