statement ok
create table t1 (id int, name varchar(1024), PRIMARY KEY(id))

statement ok
create table t2 (id int, age int, PRIMARY KEY (ID), FOREIGN KEY(id) REFERENCES t1(id) ON UPDATE CASCADE ON DELETE CASCADE)

statement ok
create table t3 (id int, num int, FOREIGN KEY(id) REFERENCES t2(id) ON DELETE CASCADE ON UPDATE CASCADE)

statement ok
insert into t1 values(1, 'monetdb')

statement ok
insert into t1 values(2, 'mon')

statement ok
insert into t1 values(3, 'monb')

statement ok
insert into t1 values(4, 'motdb')

statement ok
insert into t1 values(5, 'mob')

statement ok
insert into t1 values(6, 'moetdb')

statement ok
insert into t1 values(7, 'mo')

statement ok
insert into t2 values(1, 23)

statement ok
insert into t2 values(2, 24)

statement ok
insert into t2 values(3, 25)

statement ok
insert into t2 values(4, 26)

statement ok
insert into t2 values(5, 27)

statement ok
insert into t3 values(3, 5)

statement ok
insert into t3 values(3, 5)

statement ok
insert into t3 values(4, 6)

statement ok
insert into t3 values(5, 7)

statement ok
update t1 set id = 10 where id =1

statement ok
update t1 set id = 11 where id =2

statement ok
update t1 set id = 12 where id =3

statement ok
update t1 set id = 13 where id =4

query IT rowsort
select * from t1
----
10
monetdb
11
mon
12
monb
13
motdb
5
mob
6
moetdb
7
mo

query II rowsort
select * from t2
----
10
23
11
24
12
25
13
26
5
27

query II rowsort
select * from t3
----
12
5
12
5
13
6
5
7

statement ok
delete from t1 where id = 5

query IT rowsort
select * from t1
----
10
monetdb
11
mon
12
monb
13
motdb
6
moetdb
7
mo

query II rowsort
select * from t2
----
10
23
11
24
12
25
13
26

query II rowsort
select * from t3
----
12
5
12
5
13
6

statement ok
drop table t3

statement ok
drop table t2

statement ok
drop table t1

