statement ok
create table t1 (id int, name varchar(1024), PRIMARY KEY(id))

statement ok
create table t2 (id int, age int, PRIMARY KEY (ID), FOREIGN KEY(id) REFERENCES t1(id) ON UPDATE SET NULL)

statement ok
create table t3 (id int, num int, FOREIGN KEY(id) REFERENCES t2(id) ON UPDATE SET NULL)

statement ok
insert into t1 values(1, 'monetdb')

statement ok
insert into t1 values(2, 'mon')

statement ok
insert into t1 values(3, 'monb')

statement ok
insert into t1 values(4, 'motdb')

statement ok
insert into t1 values(5, 'mob')

statement ok
insert into t1 values(6, 'moetdb')

statement ok
insert into t1 values(7, 'mo')

statement ok
insert into t2 values(1, 23)

statement ok
insert into t2 values(2, 24)

statement ok
insert into t2 values(3, 25)

statement ok
insert into t2 values(4, 26)

statement ok
insert into t2 values(5, 27)

statement ok
insert into t2 values(6, 28)

statement ok
insert into t3 values(3, 5)

statement ok
insert into t3 values(3, 5)

statement ok
insert into t3 values(4, 6)

statement ok
insert into t3 values(5, 7)

statement error
update t1 set id = 10 where id =1

query IT rowsort
select * from t1
----
14 values hashing to cc37204d92f3681a185d78887c787824

query II rowsort
select * from t2
----
12 values hashing to 3a64b02234ae9829d2781c60f8c3dc33

query II rowsort
select * from t3
----
3
5
3
5
4
6
5
7

statement ok
update t2 set id = 7  where id =3

query IT rowsort
select * from t1
----
14 values hashing to cc37204d92f3681a185d78887c787824

query II rowsort
select * from t2
----
12 values hashing to 258a05d2ac3a076f8f167deab17b3d75

query II rowsort
select * from t3
----
4
6
5
7
NULL
5
NULL
5

statement ok
drop table t3

statement ok
drop table t2

statement ok
drop table t1


